"","ar_en_DEEPL","MatConf"
"1","91. Acts of torture are prohibited in a number of conventions, notably in article 7 of the International Covenant on Civil and Political Rights, article 2 of the United Nations Convention against Torture and Other Cruel, Inhuman or Degrading Treatment or Punishment and article 5 of the African Charter on Human and Peoples' Rights.",0
"2","The deliberate killing of detained fighters constitutes a war crime.",1
"3","A September 2005 study of foreign-born terrorists who had worked in the United States found that about two thirds had engaged in fraud to enter or remain in the country, and more than one third were later charged with forging a passport or visa or making false statements to an immigration officer.",1
"4","It is impossible in this report to describe all the killings documented by the commission.",1
"5","36. The political responsibility of those who organized the march, despite the ban and the tense atmosphere created by the designation of a âred zoneâ, the mobilization and use of the army and statements by the highest authority of the State, must also be clearly emphasized.",1
"6","Even if attacked civilians are in possession of weapons, this is not necessarily an indication that they are insurgents, and therefore legitimate targets for attacks, or that they are actively participating in hostilities.",1
"7","Indohaadde has a âspecial representativeâ who handles drug farm operations on his behalf, and he uses his militia to guard his drug farms.",1
"8","57. The fact remained, however, that the financing of terrorist acts did not follow any clear pattern, particularly with regard to local cells that mobilized funds to support their own activities.",1
"9","The Assistant Secretary-General for Political Affairs reported an increase in LRA attacks in 2011, and emphasized the serious impact on civilians and the humanitarian situation.",1
"10","(f) Host country(s), as observers, as appropriate.",0
"11","This practice can be considered a form of enforced disappearance and violates the obligations of armed groups under customary international humanitarian law.",1
"12","He added that the Organization for Security and Cooperation in Europe (OSCE) has not yet observed any withdrawal of heavy weapons from the line of control.",1
"13","Improvised and homemade explosives, such as ammonium nitrate and urea nitrate: Car bombs.",1
"14","The procedural order lists the issues to be considered during the oral proceedings as follows:",0
"15","103. It is clear that terrorists will use the most reliable and effective weapons they can obtain.",1
"16","The Security Council urges the Government of the DRC to promptly investigate the November 2012 mass rapes committed by FARDC elements in Minova and bring the perpetrators to justice.",1
"17","JEM noted that the fact that no Arab woman was raped and no Arab village was destroyed was evidence that the government was specifically targeting African tribes.",1
"18","This is also why I have deliberately avoided addressing other topics that some consider necessary when discussing the Middle East, such as the need to resolve the Palestinian-Israeli conflict or the situation in Syria, as we have addressed these issues in other meetings of the Council.",0
"19","Also, although the overall security situation has remained calm and peaceful since Timor-Leste officially assumed full responsibility for security on 20 May, smuggling, illicit trafficking and illegal border crossings should be seen as a cause for concern, as should tensions related to the demonstrations in Dili last July.",0
"20","There are several factors working against them, but if they succeed, the threat of terrorism will increase even more than it already is.",1
"21","The National Commission recommended the establishment of judicial commissions of inquiry to investigate the following allegations: Extrajudicial executions; the seizure by Arab groups of two Fur villages in the Kass region; and incidents of killing and burning of hospitalized wounded in the villages of Boram, Melit and Kulbus.",1
"22","64. Since 1950, the Democratic People's Republic of Korea has been practicing systematic abduction, denial of repatriation and subsequent enforced disappearance from other countries on a large scale and as a matter of State policy.",1
"23","72. The situation in Georgia (October 8, 1992; June 15, 2009).",0
"24","Organization for Security and Cooperation in Europe (OSCE) observers observed ongoing fighting in many locations in the Donetsk and Lugansk regions, with artillery and mortar shelling often hitting residential areas and causing civilian casualties.",1
"25","Cuba once again comes to the Security Council to denounce and strongly condemn the complicity and absolute responsibility of the United States government for the release of this person.",0
"26","On the one hand, humanitarian access has improved markedly with the gradual lifting of restrictions on humanitarian access since last summer.",0
"27","(c) Ill-treatment of Eritrean prisoners of war.",1
"28","It would be remiss of the Council not to use these tools if the need arises.",0
"29","Over the past year, as military operations against armed groups have intensified, MONUSCO has increased its logistical support to the FARDC by 226 percent.",1
"30","âThe Security Council takes note of the communiquÃ© of the African Union Summit in Sirte which requested the Council to impose sanctions on anyone, including Eritrea, providing support to armed groups involved in undermining peace and reconciliation in Somalia and regional stability.",1
"31","For example, the difficulty of policing borders in the Sahel-Saharan region allows AQIM and its affiliates to move freely, raise funds through smuggling, acquire weapons and explosives, and train new recruits in relative safety.",1
"32","2. As I also indicated in the annex to my letter dated August 8, 2005 (para. 2), the slow pace of payments to suppliers is due to the slow processing of authentication documents required for the arrival of goods in Iraq.",0
"33","From June 1 to August 31, nearly 500 small arms, over 189,000 rounds of ammunition, 2,368 grenades and mines and over 225 kilograms of explosives were collected or voluntarily surrendered.",1
"34","On November 25, 2014, regime warplanes fired two bombs on the industrial area of Raqqa city, killing 44 people and wounding 57 others. The bombing destroyed 15 shops and 17 houses.",1
"35","Moreover, the methodological documents do not provide any guidance in this regard.",0
"36","I also wish a Happy New Year to your families and countries, as well as to Your Excellencies who have adopted you here in Côte d'Ivoire.",0
"37","16. The situation in the occupied Arab territories1 (May 4, 1976; July 13, 1998).",0
"38","I therefore call on all stakeholders to ensure that the 2 January 2015 deadline for the completion of the voluntary disarmament of the FDLR remains binding and non-negotiable.",0
"39","Ms. Tagliavini reported that much of the fighting has ceased since the signing of the Minsk documents, but fighting continues in some strategic locations, including on the outskirts of the city in the Black Sea port of Mariupol and around Donetsk airport, without regard to the ceasefire and Minsk agreements.",1
"40","Said Arif is associated with Al-Qaeda or any cell, affiliate, splinter group, derivative, or derivative thereof for âparticipating in the financing, planning, facilitating, preparing, perpetrating, participating with, on behalf of, or in support of [Jabhat al-Nusra for the People of the Levant, also known as Jabhat al-Nusra (QE.A.137.14)] acts or activitiesâ and ârecruiting for itâ.",1
"41","30. In its resolution 1963 (2010), the Security Council encouraged the Executive Directorate to work with Member States to develop comprehensive and integrated national counter-terrorism strategies and implementation mechanisms.",0
"42","It is also time for Belgrade to abandon its negative attitude towards the participation of Kosovo Serbs.",0
"43","When they are arrested or forcibly returned, DPRK officials systematically persecute, torture, and arbitrarily detain them for long periods of time, in some cases using sexual violence, including during intrusive searches.",1
"44","According to a report by an ad hoc committee set up to assess losses and damage during the popular uprising, some 29 people were killed and 625 injured in the protests.",1
"45","In the central regions, unresolved conflicts continue to affect livelihoods and delay recovery processes.",1
"46","As for the requirement that the attack be âsystematicâ, it ârequires that the acts be of an organized nature and that the acts are unlikely to be randomâ.",1
"47","Propaganda, rocket attacks, improvised explosive devices, and occasional suicide bombers may remain the main weapons used by opposition armed forces.",1
"48","Twice-weekly passenger flights from Cyprus to Beirut have also begun.",0
"49","A meeting in Damascus between Mr. Hariri and President Assad on August 26, 2004, seemed to bring the dispute to a head.",1
"50","(c) Destroying or damaging public installations, transportation and communications networks, including information networks, fixed platforms on the continental shelf, power and water plants, medical and other important facilities, or public places and property, with the aim of endangering human life, compromising the integrity of any of the installations, networks or places, or exposing property to the risk of serious damage.",1
"51","Other witness testimonies emphasized summary executions of people who had committed theft in MNCI-controlled areas of CÃ´te d'Ivoire.",1
"52","The state has imposed blatantly discriminatory restrictions on women with the aim of perpetuating the gender stereotype of Korean women as pure and innocent beings.",1
"53","Attacks against civilians, including sexual violence, by foreign and Congolese armed groups and FARDC elements continue.",1
"54","Over the next two days, local Somalis brought in a cannon, which they placed on the upper deck of the Alpha Serengeti.",1
"55","5. The Coordinator conducted three visits to the region (in February, April and May) that coincided with the meetings of the Technical Subcommittee and the Tripartite Commission. On 9 February 2011, he was received by Sheikh Mohammed Sabah Al-Salem Al-Sabah, Deputy Prime Minister and Minister for Foreign Affairs of Kuwait, who noted that the emerging spirit of cooperation between Iraq and Kuwait should be translated into practical, results-oriented steps to resolve the remaining issues, including the files on missing persons and property.",0
"56","Moreover, because production from the field did not commence until August 2, 1990, there was no record of past production from the field on which to base future cash flow projections.",0
"57","On March 17, 2005, Brunei Darussalam joined the United Nations Educational, Scientific and Cultural Organization (UNESCO) as its 191st member.",0
"58","At the 5659th meeting of the Security Council, held on April 12, 2007, in connection with the Council's consideration of the item entitled âThreats to international peace and security caused by terrorist actsâ, the President of the Security Council made the following statement on behalf of the Council:",1
"59","On November 29, 2014, regime warplanes dropped two barrel bombs on Wahid al-Yousef School in Kafr Sajna village in Idlib, completely destroying the school. Places of worship",1
"60","The embargo includes âarms and related materiel of all types, including weapons and ammunition, military vehicles and equipment, paramilitary equipment, and spare parts for the aforementioned.â",1
"61","Al-Shabaka has not been able to fully document these cases because they are banned and persecuted by regime forces and extremist groups.",1
"62","(b) To resolve all outstanding issues as referred to in paragraph 12 above, and recalls in this regard that the implementation of the identification process simultaneously with the cantonment of forces, as set out in the National Programme for Disarmament, Demobilization, Reintegration and Rehabilitation, signed in Yamoussoukro on 14 May 2005, would expedite the creation of conditions for free, fair, open and transparent elections.",0
"63","I therefore have the honor, on behalf of the East African Community, to communicate this common position and furthermore request that it be brought to the attention of the United Nations Security Council for consideration.",0
"64","Follow-up Committee for the National Symposium on Civil Society",0
"65","Eritrea has been organizing and training various categories of criminal gangsters and terrorists and sending them to Ethiopia to wreak havoc in our country and to destabilize the political stability.",1
"66","The regime arrested about 47 individuals believed to have been forcibly recruited into the regime forces.",1
"67","Deeply concerned about the recurrence in many parts of the world of violence against journalists, media professionals and associated personnel in armed conflicts, in particular deliberate attacks against them in violation of international humanitarian law.",1
"68","iii. return of refugees and displaced persons",0
"69","âAt around 8 a.m. the next day in the valley, I was raped for the first time.",1
"70","16. During the reporting period, on some occasions, UNFICYP faced new restrictions on its freedom of movement in its area of operations that in some cases jeopardized the safety and security of United Nations peacekeepers.",1
"71","As the largest port in the Middle East by far, the UAE's Jebel Ali Port takes maritime security and vulnerability seriously, and has developed advanced systems and infrastructure and processes to assess and respond to risks while ensuring the smooth flow of trade.",1
"72","The perspective of the National Police, as explained to the Committee, was to arrest the petitioners and hand them over to the National Police if they were moving from one place to another, and that no arrests were authorized.",1
"73","In the context of possible sanctions for rape and other acts of sexual violence, the Council invited UN missions and relevant UN bodies to share all relevant information with the Security Council Sanctions Committee.",1
"74",":: Cell phone calls made in the area of the explosion: Cell phone calls made in the area of the explosion",0
"75","الحالة في قبرص (انظر S/11185/Add.28 و 29 و 32 و 34 و 49؛ S/11593/Add.7-10 و 23 و 24 و 49؛ S/11935/Add.23, و 24 و 50؛ S/12269/Add.24 و 35-37 و 50؛ S/12520/Add.23 و 45 و 47 و 49؛ S/13033/Add.23 و 49؛ S/13737/Add.23 و 49؛ S/14326/Add.22 و 50؛ S/14840/Add.24 و 50؛ S/15560/Add.24 و 46 و 50؛ S/16270/Add.17 و 18 و 23 و 49؛ S/16880/Add.23 و 37 و 49؛ S/17725/Add.23 و 49؛ S/18570/Add.23 و 50؛ S/19420/Add.24 و 50؛ S/20370/Add.22 و 49؛ S/21100/Add.10 و 23 و 28 و 49 و 50؛ S/22110/Add.23, 40 و 49 و 51؛ S/23370/Add.14 و 23 و 28 و 34 و 47 و 50؛ S/25070/Add.19 و 21 و 23 و 50؛ S/1994/20/Add.9 و 23 و 29 و 50؛ S/1995/40/Add.24 و 50؛ S/1996/15/Add.25 و 51؛ S/1997/40/Add.25 و 51؛ S/1998/44/Add.26 و 51؛ S/1999/25/Add.25 و 49؛ S/2000/40/Add.23 و 49؛ و S/2001/15/Add.24 و 50؛ و S/2002/30/Add.23 و 39 و 47؛ و S/2003/40/Add.14 و 15 و 23 و 47؛ و S/2004/20/Add.13 و 16 و 17 و 23 و 42؛ و S/2005/15/Add.23؛ وانظر أيضا S/2001/15/Add.49؛ و S/2002/30/Add.22 و 46؛ و S/2003/40/Add.22 و 46؛ و S/2004/20/Add.23 و 40؛ و S/2005/15/Add.22).",0
"76","It has set up military training camps in the greater Mogadishu area, including the Lanta Boro and Hilweyne districts, and has sent weapons obtained at the Bakara arms market to these camps.",1
"77","(p) To cooperate with other relevant Security Council sanctions committees, in particular the Committee established pursuant to resolution 1267 (1999).",0
"78","The Security Council frequently discusses humanitarian issues in conflict-affected countries.",0
"79","- The Russian Federation continues to illegally maintain its military base in Gudauta, which operates without the consent of Georgia and contrary to Russia's international obligations.",1
"80","Al-Qaeda and its affiliates use both military components, when obtainable, and civilian components in the manufacture of IEDs.",1
"81","In resolution 1820 (2008), the Council encouraged the Secretary-General, in consultation with women and women-led organizations, to develop effective mechanisms to protect women and girls from violence, including, in particular, sexual and other forms of gender-based violence, in and around refugee and internally displaced persons camps.",0
"82","Turkey is fully aware of the Syrian government's intentions, which have been put into practice through various methods of aggression and provocation, including targeting innocent civilians across the border.",1
"83","B. Standardization of case studies and pending cases",0
"84","Some reports also suggest that foreigners from Chad, the Libyan Arab Jamahiriya and other countries responded to the call and that the government was more than willing to recruit them.",1
"85","The published figures are unconfirmed, but the committee's evidence suggests that nine people were killed and three injured in the shooting.",1
"86","Letter dated 17 May 2004 from the Permanent Representative of Yemen to the United Nations addressed to the President of the Security Council (S/2004/393).",0
"87","The multispectral camera will also allow it to scan large areas up to tens of kilometers.",0
"88","This is evident in groups fighting in Somalia, Yemen, the Syrian Arab Republic and Nigeria.",1
"89","It was darkened by rust, but after wiping the dark color off and exposing it to air, it turned yellow.",0
"90","We are concerned about the lack of political freedoms there.",0
"91","Another election-related challenge is the large number of potential voters who cannot afford the administrative costs of obtaining a national ID card.",0
"92","Urges the international community to provide support and assistance to enable States to fulfill their responsibilities to protect refugees and other persons protected under international humanitarian law.",0
"93","However, the movement's remaining ability to undermine tangible progress in stabilizing Ituri remains a concern, especially given the Transitional Government's inability so far to bring armed group leaders to justice and prevent their movement in and out of Uganda.",1
"94",":: Establishment of a follow-up, monitoring and prevention agency: Establishment of a follow-up, monitoring and prevention agency in this area.",0
"95","Currently, fewer than 100,000 Liberians are registered in the public and private sectors.",0
"96","6. In paragraph 19 of my report of 30 August 2004 (S/2004/703), I noted that âthe process of disarming members of the Popular Defense Forces has begun, with the second Joint Verification Mission attending a disarmament ceremony for approximately 300 soldiers in Western Darfurâ.",1
"97","But he has made progress in advancing the restructuring and reform of these forces.",0
"98","Where applicable, deductions are made for costs saved as a result of incomplete performance.",0
"99","15. Ismail Mohammed Al-Qa'ad, from Nimr, Daraa",0
"100","(c) Facilitate capacity-building for States in the subregion, in collaboration with ESAAMLG, to establish/strengthen financial intelligence units and develop the necessary legislative and operational capacity to freeze funds without delay.",0
"101","13. Encourages the International Criminal Police Organization (INTERPOL) to intensify its efforts regarding the threat posed by foreign terrorist fighters and to recommend or provide additional resources to support and encourage national, regional and international measures to monitor and prevent the transit of foreign terrorist fighters, such as expanding the use of INTERPOL Special Notices to include foreign terrorist fighters.",0
"102","The Committee is concerned that structural issues, including laws and policies that violate the right to adequate food and freedom from hunger, remain in place, which could lead to a resurgence of mass starvation.",1
"103","20. The planned civil service program, which aims to absorb a total of 20,000 ex-combatants and 20,000 at-risk youth, has yet to be launched.",0
"104","Mr. Mazio does not hold this debt against Commander Jerome, but against the transitional government in Kinshasa.",0
"105","- To contribute, as appropriate, to the efforts of the Ivorian authorities to develop the capacity of their police and gendarmerie, in particular through training on riot control, and by re-establishing their presence throughout [the affected country].",0
"106","85. Since the imposition of the Security Council measures on CÃ´te d'Ivoire, the Government has curtailed purchases of arms and ammunition, owing to an extensive procurement program prior to the embargo as well as the limited use of arms and ammunition during the brief period of violent military conflict in 2004.",1
"107","391. The looting of villages and the seizure of livestock, crops, household goods and other personal property of the population by government forces or militias under their control is undoubtedly a war crime.",1
"108","213. Abdel-Al is also notably linked to a large arms cache discovered in south Beirut in July 2005. The Internal Security Forces raided this arms depot on July 26, 2005 and arrested five people with strong ties to the former Al-Mourabitoun militia.",1
"109","The Republic of Macedonia became a party to the European Convention on Extradition of October 26, 1999.",0
"110","This income appears to have been diverted to personal accounts, as was the entirety of the corporate registry income.",0
"111","153. Hamad Mubarak Salem Al-Hajri",0
"112","The military component continues to operate in extremely difficult conditions in the north.",1
"113","Council members noted that all candidates should make every effort to maintain a calm and peaceful environment, exercise restraint, await results to be announced in accordance with national constitutional procedures, and settle their differences peacefully through established legal and mediation mechanisms, including the National Mediation Committee.",0
"114","Prominent journalists have been detained for expressing their views on issues of human rights, the constitution and the rule of law.",1
"115","The demarcation process is expected to last approximately 96 weeks.",0
"116","Tensions remain high, particularly in north-eastern Katanga, where there have been numerous clashes between FARDC units and Mayi-Mayi militia groups. On 10 and 11 August, FARDC exchanged fire with a Mayi-Mayi group near the Lunga gold mine, some 200 kilometers from Kalemie, and took control of the area.",1
"117","46. The situation in Myanmar (September 15, 2006; July 13, 2009).",0
"118","Contrary to persistent rumors, there is no evidence that police officers, including those supplied with weapons and uniforms by the defense forces, participated in the shootings.",1
"119","The company's shareholders must be publicized.",0
"120","There is information that they had effective overall control over military personnel fighting for the rebel groups and therefore knew, or at least should have known, about some of the crimes committed by those military personnel, but did not take any action to stop the atrocities being committed.",1
"121","15. First, cross-border crime and weak border control can weaken state authority.",1
"122","Suspects are deliberately starved and subjected to other inhumane conditions of detention to increase pressure to confess and incriminate others.",1
"123","On behalf of the Chairperson of the Commission, Nkosazana Dlamini-Zuma, I am transmitting herewith the communiquÃ© adopted by the Peace and Security Council at the conclusion of the meeting (see enclosure).",0
"124","Nonprofits manage large budgets and move money across jurisdictions legally and with great ease, so they can provide a relatively secure global framework within which to operate with minimal risk of detection, and the sheer number of beneficiaries of large nonprofits allows them to move money with little risk, especially where nonprofits have semi-autonomous status that allows them to operate outside of regulators and law enforcement authorities.",1
"125","I was then informed that my father and my younger brother had been killed. Four other people were also killed.",1
"126","The project was part of the larger Abu Ghraib project, which covers an area of 10,000 hectares and is located 30 kilometers northwest of Baghdad.",0
"127","S/RES/1863 (2009), OP2",0
"128","That is why we condemn terrorism.",0
"129","Its role in supporting the efforts of these countries is critical.",0
"130","No significant change is expected in the overall security situation, although a slow and steady increase in crime-related incidents is expected.",1
"131","Disarming militias is therefore a priority, especially during the pre-election campaign phase with its potential for politically motivated violence.",0
"132","Many international leaders, including heads of state, UN representatives, and a majority of Security Council members, have denounced the flotillas that have traveled to Gaza over the past year and emphasized the need to move humanitarian supplies to the region only through existing channels.",0
"133","Acting under Chapter VII of the Charter of the United Nations.",0
