"","ar_en_TRANSFORMERS","VerCoop"
"1820","It urges the international community to ensure that adequate and timely funds are made available to meet humanitarian needs in order to provide adequate humanitarian assistance to alleviate the suffering of the civilian population, in particular those living in areas affected by armed conflict or emerging from conflict.",1
"1821","An expanded team of EULEX advisers has been established to provide support and technical advice on police matters.",0
"1822","To be held on Friday, 16 May 2003, at 1.25 p.m.",0
"1823","20. In this regard, the Security Council, in its resolution 1963 (2010), encouraged the Executive Directorate to discuss with Member States, with their consent, the possibility of developing, in accordance with their obligations under international law, comprehensive and integrated national counter-terrorism strategies that pay attention to the factors that lead to terrorist activities, which is also the Council &apos; s emphasis in the same resolution on the importance of the role that regional and subregional organizations can play in combating terrorism, in particular by strengthening the capacity of Member States to fully implement resolution 1373 (2001) and facilitating the provision of technical assistance.",1
"1824","The forces comprising the multinational force will remain committed to acting in accordance with their obligations under international law, including the law of armed conflict.",1
"1825","8. It is recommended that the United Nations take the following specific and urgent steps to facilitate and strengthen the continued presence of AMISOM in Somalia:",0
"1826","It was therefore suggested that international standards should be developed and that the Commission might play a more prominent role.",1
"1827","The Council of the League of Arab States at ministerial level,",0
"1828","National, regional and international federations, organizations and alliances.",0
"1829","He had had numerous discussions with the Moroccan Government, which had first requested, before accepting the resumption of shuttle diplomacy, a meeting to clarify its concerns about the Secretary-General &apos; s latest report (S/2014/258), stressing that Morocco believed that that would allow the process to proceed optimally.",1
"1830","All aspects of police education were consolidated under an independent programme in May, and agreement was reached on the establishment of a large-scale training system for Bosnia and Herzegovina.",1
"1831","Simple tools, such as annotated agendas, have also been introduced with a view to ensuring the smooth functioning of the Council in the discharge of the usual items of its mandate.",0
"1832","It also encourages continued cooperation between Member States, the Office for the Coordination of Humanitarian Affairs, the Department of Political Affairs, the Department of Peacekeeping Operations, the Office of the United Nations High Commissioner for Refugees, the United Nations Relief and Works Agency for Palestine Refugees in the Near East, the Office of the United Nations High Commissioner for Human Rights, the United Nations Development Programme and other relevant United Nations agencies and offices.",1
"1833","In other words, the victims view their attackers as belonging to another hostile group.",0
"1834","Syria calls upon the United Nations and its relevant bodies to combat terrorism and prevent its financing, including the Security Council and its relevant Committee, as well as the Human Rights Council, to deny terrorists and their supporters any cover for their destructive practices in order to preserve the sovereignty and independence of States and to preserve security, peace and stability.",1
"1835","Baykal Makine Sanayi ve Ticaret AS",0
"1836","Concurrently, the clandestine resistance movement expanded across the country and a popular movement was re-established; on 30 August 1999, 78 per cent of the Timorese population voted for liberation from the Indonesian administration at the United Nations-sponsored popular consultation.",0
"1837","Vice-Chairmen: France, Gabon and Russian Federation",0
"1838","10. On 24 July 2008, the Committee held an exchange of views with Mr. Ahmedou Ould Abdallah, Special Representative of the Secretary-General for Somalia, in connection with the request of the Council contained in paragraphs 6 and 7 of resolution 1814 (2008).",1
"1839","Vice-Chairmen: Brazil and Russian Federation",0
"1840","""The Council recalls the respective mandates of the United Nations Organization Stabilization Mission in the Democratic Republic of the Congo (MONUSCO) and the United Nations Mission in the Republic of South Sudan (UNMISS) to assist in the protection of civilians in LRA-affected areas and to support the disarmament, demobilization and reintegration of LRA combatants in their respective countries.",0
"1841","18. The United Nations Global Counter-Terrorism Strategy calls for the promotion of dialogue, tolerance and understanding among civilizations, cultures, peoples and religions and for the development of education and public awareness programmes in these fields.",1
"1842","Urge humanitarian and development organizations to take appropriate action to prevent sexual exploitation and abuse by their personnel, including conducting predeployment and field awareness training, in the case of United Nations actors, and to promote and ensure compliance with the Secretary-General &apos; s bulletin on special measures for protection from sexual exploitation and abuse (ST/SGB/2003/13), including by civilian personnel of United Nations peacekeeping operations and other relevant missions.",1
"1843","Welcoming the increased representation of women in Parliament, commending the [national] authorities, and stressing the need to increase their role in decision-making on conflict prevention and resolution,",1
"1844","9. Decides that the 1540 Committee shall continue to intensify its efforts to promote the full implementation of resolution 1540 (2004) by all States through its programme of work, which includes the collection of information on the status of States &apos; implementation of resolution 1540 (2004) and the overall advocacy, dialogue, assistance and cooperation efforts of States; addresses, in particular, all aspects mentioned in paragraphs 1, 2 and 3 of that resolution, including (a) accountability, (b) physical protection, (c) border controls and law enforcement efforts, (d) national export and trans-shipment controls, including controls on the provision of funds and services such as the financing of such exports and trans-shipments; and includes, as needed, specific priorities for its work, taking into account its annual review of the implementation of resolution 1540 (2004), prepared with the assistance of the Group of Experts before the end of each December;",1
"1845","35. The Executive Directorate proposes three minor modifications to its organization and operational practice to better reflect the change in its proposed new priorities and activities.",1
"1846","The provisions of these Regulations apply irrespective of the quantity and quality of the goods.",0
"1847","No one knew who had attacked the helicopter since the incident had taken place near Benito, where the armed parties were very close to each other.",0
"1848","(a) Adopt and implement comprehensive and consistent national counter-terrorism legal frameworks that incorporate all terrorist offences set forth in the international counter-terrorism instruments and also meet international human rights standards;",0
"1849","The Government of Lebanon also reported that the Lebanese Armed Forces had also increased their presence, established checkpoints and tightened surveillance procedures around the positions of Palestinian armed groups based in the Syrian Arab Republic and in the southern Beirut and Bekaa plain. On 7 October, the Lebanese Armed Forces carried out raids in the Bekaa plain for positions of Palestinian armed groups based in Syria, during which weapons were seized.",1
"1850","Welcoming the outcome of the Consultative Peace Council meeting held on 6 June 2010, at which 1,600 Afghan delegates, representing a wide cross-section of all Afghan ethnic and religious groups, government officials, religious scholars, tribal leaders, civil society and Afghan refugees residing in Iran and Pakistan discussed an end to insecurity and a plan for lasting peace in the country,",1
"1851","The Security Council reiterates its request to the Secretary-General to include in his country-specific reports more comprehensive and detailed information on the protection of civilians in armed conflict.",1
"1852","It therefore not only exacerbates existing threats to international peace and security, but also represents, in itself, a threat to international peace and security.",0
"1853","It was stated that information exchange improves the assessment of business opportunities from a proliferation risk perspective, so information exchange is fully in the interest of all private actors and benefits companies with less resources, such as SMEs.",1
"1854","There is therefore a need to improve the exchange of information and to strengthen cooperation with States of other regions.",1
"1855","That report will cover the period from 1 January to 30 June 2004.",0
"1856","The main criterion governing the gradual drawdown of MONUC should continue to be the reduction of the threat that Congolese and foreign armed groups pose to civilians, the establishment of stronger and more accountable State institutions and the consolidation of democratic practices that reduce the risk of instability.",0
"1857","""The Security Council reiterates the need for increased cooperation among the committees mandated to combat terrorism established pursuant to resolutions 1267 (1999), 1989 (2011), 1988 (2011), 1373 (2001) and 1540 (2004) and their respective expert groups.",1
"1858","For a detailed list of relevant UN-Women circulars, please see answer to question 11.",0
"1859","Requests the Secretary-General to continue to assist the Government of [the country concerned] in the establishment of transitional security institutions, including the [national] police and national security forces, and to continue to support the Government of [the country concerned] in the development of a national security strategy that reflects respect for the rule of law and the protection of human rights and includes disarmament, demobilization and reintegration plans and capacity-building in the areas of justice and corrections, as well as the legal and policy framework governing the operation of its security forces, including management, vetting and oversight mechanisms.",1
"1860","Unlike the regular meetings of the Council of Arab Ministers of the Interior, information on the status of implementation is not shared regularly or institutionalized at the subregional level.",1
"1861","51. The situation in Mali (4 April 2012; 8 October 2014)).",0
"1862","It is therefore important for States not to lose sight of this element of the embargo, and the Committee may wish to remind them of this when the opportunity arises and encourage them to submit the names of those providing technical advice, assistance or training related to military activities in violation of the prohibitions measures for inclusion in the List.",0
"1863","At the invitation of the President of the Economic and Social Council, the President of the Security Council attended a meeting of ad hoc advisory groups on African countries emerging from conflict (Burundi and Guinea-Bissau).",1
"1864","23. Since my Special Representative arrived in Nairobi on 27 May 2005, he has tried to convince subregional leaders and others of the need for a coordinated approach to Somali leaders and to urge them to engage in dialogue and refrain from military actions to resolve differences within the framework of the transitional federal institutions. On 10 June, he met in Kampala with President Yoweri Museveni of Uganda and on 29 June he held talks with President Ismail Omar GuissÃ© of Djibouti with the Secretary-General of IGAD in Djibouti.",1
"1865","They called for more resolute action by the United Nations on factors leading to terrorism in general, such as Islamophobia.",1
"1866",":: Fact-finding mechanisms should be established sufficiently early in the outbreak of crises to enable them to contribute to preventing further violations.",1
"1867","Strengthening the protection of civilians in armed conflict is at the core of the work of the United Nations Security Council on the maintenance of peace and security.",1
"1868","Accounts held abroad by the Central Bank",0
"1869","12. Saffah Abjad Alawih Al-Mutairi",0
"1870","In considering the evolution of the threat of incitement, one must bear in mind that the forms and means of communication have evolved substantially since the adoption of resolution 1624 (2005).",0
"1871","63. The number and scope of terrorist attacks attributed to Al-Qaida shows that the network remains active and continues to have sufficient financial resources to support its activities.",1
"1872","This provision clearly does not apply in this case because the crimes occurred in the Sudan and the alleged perpetrators are Sudanese nationals.",0
"1873","The current strength of the Centre consists of 544 Forces nouvelles and national defence and security personnel, with a maximum authorized strength of 568, including mixed police units.",0
"1874","17. Once received, the updated list is transmitted to the interested party.",0
"1875","This working group facilitated and co-chaired an international conference on national and regional counter-terrorism strategies, at which participants identified a set of principles that Member States and regional organizations should consider when developing their strategies in this regard.",1
"1876","118. The Committee recommends that a further investigation be conducted to establish which of the following men of Major Reinado were present in Fatuahi: Mazes Ramos, Placido Rivero Gonsalves, Diulendo Barros, Antonio Savio, Filomino Soares Menezes, Francisco de Augusto, Gelson JosÃ© Antonio da Silva, Juaninho MarÃ­a GutiÃ©rrez, Joaquim Barrito, JosÃ© GÃ³mez, Natalino Burges Pereira, AndrÃ© da Costa Pinto Martinho Almeida, Alpilio da Costa de Jesus, Francisco Ximenes Alvis, Philesberto Gracia, Dario da Silva Leong, Nelson GalucÃ³ and Nicson GalucÃ³.",1
"1877","The average voter turnout rate for all registered voters throughout the country was about 37 per cent, albeit combined with regional disparities.",0
"1878","However, it appears that financial institutions and other implementing bodies have not yet taken note of this, and the Group recommends that the Commission and States find ways to draw wider attention to this issue.",1
"1879",":: There are 1,700 families in Haza with a total population of 7,310",0
"1880","Indeed, the lack of detail has shown that the INTERPOL-United Nations Security Council Special Notices, which are the main tool for providing information on listed persons to law enforcement agencies, existed for 309 of the 488 names at the beginning of the review; the number now stands at 361 and is likely to increase.",0
"1881","The UNODC maritime crime programme continues to support States in the region that prosecute piracy, including Kenya, Mauritius, Seychelles and the United Republic of Tanzania.",1
"1882","Cost is defined as the nominal value plus or minus any net premium or discount.",0
"1883","In response, the UNMIK Department of Justice established a joint working group with the institution-building component to examine the report and devise ways to implement the recommendations contained therein.",1
"1884","645. The Committee has decided to withhold the names of these persons from the public domain and this decision is based on three main reasons: (a) the importance of the principles of fair trial and respect for the rights of suspects; (b) the fact that the Committee has not been given the authority to investigate or to bring charges; and (c) the vital need to ensure that witnesses are protected from possible harassment or intimidation.",1
"1885","To be held on Wednesday, 21 January 2009, at 3 p.m.",0
"1886","Important security and national reconciliation challenges and issues that, in my view, require the political attention of the Council should not be underestimated.",0
"1887","The team was required to drive 20 kilometres south to obtain an official seal of entry.",0
"1888","Given the urgency of the investigation, we sent a telegram No. 2056 dated 14 February 2005 to the leadership of the Regional Police Unit and to the commanders of the police units requesting them to conduct all necessary investigations within their respective mandates regarding the bodies taken to hospitals in each area in order to enable their relatives to identify them and to inform me of the proper conduct of the investigation so that I can obtain the consent of the relevant authorities to return the bodies to their families.",0
"1889","We look forward to deepening our relationship with the United Nations in the coming period.",1
"1890","Much has been said about the financing of terrorism through drugs, including in international conventions and Security Council resolutions.",1
"1891","These recommendations will build on lessons learned from previous engagements in Haiti, including the need for a balanced approach to strengthening police institutions, the judiciary and corrections institutions in parallel.",1
"1892","Water pumps, purchased between December 1990 and February 1991, were used to operate wells in the event that desalination plants were stopped.",0
"1893","The Partnership aimed to develop a strategy to mainstream child protection into African Union activities and to institutionalize child protection policies and actions in accordance with regional and international standards.",1
"1894","(d) Special alloy (e.g. chromium and nickel);",0
"1895","An adjustment has also been made to take into account the residual value of equipment used in the oil spill collection programme until 31 December 1992.",0
"1896","During the review, Member States provided information that would result in a total of 465 proposed amendments to the List (and changes to 217 narrative summaries of reasons for listing).",1
"1897","Expressing its deep solidarity with the victims of terrorism and their families, stressing the importance of assisting victims of terrorism and providing support to them and their families so that they can overcome their feelings of tragedy and endure their suffering, recognizing and encouraging the important role played by networks of victims and survivors in the fight against terrorism, including by speaking openly and with courage against violent and extremist ideologies,",1
"1898","On 25 May, the Chairman of the Committee established pursuant to resolution 1267 (1999) concerning Al-Qaida and the Taliban, Ambassador Heraldo MuÃ±oz of Chile, presented the first oral report to the Council for a period of 120 days, as requested by paragraph 12 of resolution 1526 (2004), on the work of the Committee and its Analytical Support and Sanctions Monitoring Team.",1
"1899","In his latest report on the protection of civilians in armed conflict (S/2012/376), the Secretary-General noted that ""there has been little change in the deplorable situation of the protection of civilians"" and that there is a clear need to translate normative commitments into concrete improvements in the protection of civilians on the ground.",0
"1900","Much can be achieved through educational institutions as well as through mechanisms such as sports and youth associations.",0
"1901","Two of the meetings attended by the Group resulted in a specific request to the United Nations Office on Drugs and Crime (UNODC) to organize reporting workshops for States from Africa and the Caribbean/Latin America, which are required to report to one or more of the three Security Council committees dealing with counter-terrorism).",1
"1902","S/RES/2109 (2013), op. 10",0
"1903","Report of the Secretary-General on the United Nations Integrated Mission in Timor-Leste (S/2012/43).",0
"1904","No State can combat terrorism. The transnational nature of the terrorist threat requires cooperation and coordination with other States.",1
"1905","""The Security Council reiterates its strong support for the adoption by the General Assembly of the United Nations Global Counter-Terrorism Strategy (A/RES/60/288) on 8 September 2006 and the institutionalization of the Counter-Terrorism Implementation Task Force, in accordance with General Assembly resolution 64/235, in order to ensure overall coordination and coherence in the counter-terrorism efforts of the United Nations system and the full participation of the relevant subsidiary bodies of the Security Council, within their mandates, in the work of the Task Force and its working groups, and welcomes the adoption by the General Assembly of resolution 64/297.",1
"1906","Cooperation with international organizations, including the Security Council Committees established pursuant to resolutions 1267 (1999) and 1373 (2001);",0
"1907","Recognizing the importance of transitional justice in promoting lasting reconciliation among all the people of [the affected country], and welcoming the process of national consultations on the establishment of transitional justice mechanisms...",1
"1908","If that is not the case, we can see more violent divisions that can occur when people claim their rights, as there is no force to force them to abandon them.",0
"1909","Supporting the call of the Envoy for the Syrian Government to implement immediately and clearly all elements of the Envoy &apos; s six-point proposal in its entirety in order to achieve a sustained cessation of armed violence in all its forms by all parties;",1
"1910","In the press area, there is the daily newspaper ""Lunasonal,"" known as its radical positions and xenophobic articles.",0
"1911","Joseph Asoka Nihal de Silva as at 31 December 2010",0
"1912","4. The mission will emphasize that lasting peace, security and stability are essential for all countries in the region.",1
"1913","The position paper explicitly presents some of the difficulties of the situation facing the Government: ""The CÃ´te d'Ivoire army, in self-defence, has responded only to attacks by the aggressors and for the purpose of freeing the territory of CÃ´te d'Ivoire and ensuring the safety of persons and property.",0
"1914","In addition, the process of devolution of responsibilities to municipalities in the administrative and educational systems has also begun.",0
"1915","However, the situation within Kosovo today continues to be of concern to us.",0
"1916","23. On the other hand, the Commission reaffirms its determination to continue to combat the adverse effects of climate change.",1
"1917","10. NATO provided additional troops to ensure a safe and secure environment for the National and Provincial Council elections scheduled for 18 September (see para. 15).",0
"1918","Emphasizing the support of the Personal Envoy of the Secretary-General for Western Sahara, Ambassador Christopher Ross, and his work to facilitate negotiations between the parties, welcoming his ongoing consultations with the parties and the neighbouring States, and looking forward to his visit to the region, including Western Sahara, in the near future, as reflected in the communiquÃ© of the informal meeting on Western Sahara held from 11 to 13 March 2012,",1
"1919","In contrast, Ms. Bangura considered that effective protection of civilians required accountability and access to justice, which would put an end to a culture of denial.",1
"1920","(a) To ensure the effective protection of civilians, including humanitarian personnel and human rights defenders, at high risk of becoming victims of physical violence, in particular violence by any of the parties to the conflict;",1
"1921","The main elements of the statement by the Permanent Representative, as well as the exchange of views among the members of the Working Group, are reflected in the summary contained in the relevant conclusions (S/AC.51/2014/3).",1
"1922","II. Evolution of risks and threats and impact of implementation",0
"1923","35. On 5 September 2011, the Electoral Parties Registration Commission held a workshop on legal reform, during which participants reviewed the mandate of the Commission and recommended, inter alia, revisions to the Political Parties Act 2002 to give the Commission legal authority to enforce the code of conduct for political parties.",1
"1924","The Georgian leadership is firmly committed to the peaceful settlement of the conflict on its territory, recognizing the importance of the integration and integration of ethnic groups and of the protection of human rights and freedom.",1
"1925","'The Security Council urges the Democratic People's Republic of Korea to return immediately to the Six-Party Talks without preconditions, to work for the speedy implementation of the Joint Statement of 19 September 2005, and to abandon all nuclear weapons and existing nuclear programmes.",1
"1926","The Mission &apos; s preliminary study on the cost-effectiveness of using the road/river option indicates that capital investments in fuel trucks will require another two years before this option becomes more cost-effective than the provision of fuel by air.",0
