"","ar_en_DEEPL","VerCoop"
"1904","35. On 5 September 2011, the Electoral Parties Registration Commission held a legal reform workshop, during which participants reviewed the mandate of the Commission and recommended, inter alia, revisions to the 2002 Political Parties Act to provide the Commission with the legal authority to enforce the Code of Conduct for Political Parties.",1
"1905",":: 75 percent of Syrians live in poverty, and more than half of the population lives in extreme poverty.",0
"1906","Recalling its previous resolutions on international terrorism and the threat it poses to Afghanistan, in particular its resolutions 1267 (1999), 1333 (2000), 1363 (2001), 1373 (2001), 1390 (2002), 1452 (2002), 1455 (2003), 1526 (2004), 1566 (2004), 1617 (2005), 1624 (2005), 1699 (2006), 1730 (2006), 1735 (2006), 1822 (2008), 1904 (2009), 1988 (2011), 1989 (2011) and the relevant statements of its President.",1
"1907","The Council intends to vigorously continue to fight impunity by appropriate means and draws attention to the full range of justice and reconciliation mechanisms that should be taken into account, including national, international and `mixed' criminal courts and tribunals and truth and reconciliation commissions.",0
"1908","This deficit severely compromises the organization's ability to operate, especially outside of Monrovia.",0
"1909","G. Duration of the follow-up mission",0
"1910","43. In informal consultations on 2 May, Council members heard a further interim report from the Special Adviser to the Secretary-General on Cyprus, Alvaro de Soto, on the direct talks between the Greek and Turkish Cypriot leaders, which had continued since January pursuant to their agreement of 4 December 2001.",1
"1911","- On December 12, 2014, 200 soldiers belonging to regime forces surrounded the al-Fayyad neighborhood in Jablah city, not allowing anyone to enter or leave the neighborhood.",0
"1912","It is necessary to continue to apply this restriction as long as participation in any such travel results in the obligation to report on substantive matters.",0
"1913","139. While this two-pronged approach -- which uses restrictions applied throughout the Schengen Agreement area to exclude listed persons who do not belong to Schengen area States -- maintains national restrictions to limit the movement of listed aliens within the area, it could serve as an example for other States in existing or developing areas that operate on the basis of free movement and visa-free travel.",1
"1914","4. Furthermore, in accordance with the policy guidance adopted by the Committee on 25 May 2006, the Executive Directorate should also continue to advise the Committee on issues related to international human rights, refugee and humanitarian law in connection with the identification and implementation of effective measures to implement resolution 1373 (2001), as well as ways to ensure that measures taken by Member States to implement the provisions of resolution 1624 (2005) comply with their obligations under international law, in particular international human rights, refugee and humanitarian law.",1
"1915","On May 2, the Under-Secretary-General for Legal Affairs and Legal Counsel, Nicolas Michel, briefed the Council on his recent trip to Lebanon and urged Council members to address the need to fill the vacuum and help establish the Special Tribunal for Lebanon.",1
"1916","Two statements from two employees of the Kuwait Scientific Research Institute were submitted to explain this lack of evidence.",0
"1917","This officer could coordinate subsequent training and reorganization activities.",0
"1918","Support should be provided to the justice sector reform process, in close partnership with the United Nations country team. The establishment and strengthening of accountability mechanisms within the security and defense forces should also be supported.",1
"1919","20. Encourages Member States to promptly exchange information with other Member States, in particular countries of origin, destination and transit, when they detect the travel of individuals on the Al-Qaida Sanctions List.",1
"1920","Urges Member States to ensure increased representation of women at all levels of decision-making in national, regional and international institutions and mechanisms for conflict prevention, management and resolution.",1
"1921","The amendment to Act No. 61/1996 (Act 284/2004 of April 8, 2004, effective as of September 1, 2004 - the new Money Laundering Act) The Financial Analysis Unit can exchange information with foreign authorities with the same powers, within the scope of international treaties or on the basis of reciprocity.",1
"1922","United States of America: Draft resolution",0
"1923","(a) His correct full name.",0
"1924","Another State indicated that it was preparing to establish a national human rights institution.",1
"1925","(ii) Limits on the size of balances, in the case of deposit accounts and client accounts.",0
"1926","Recognizing the valuable contribution of the Special Representative of the Secretary-General for Children and Armed Conflict and the Security Council Working Group on Children and Armed Conflict, including its conclusions and recommendations issued in line with resolution 1612 (2005), and recalling resolution 1882 (2009) aimed at strengthening the protection of children in situations of armed conflict.",1
"1927","70. Within the framework of the Counter-Terrorism Implementation Committee Working Group on Tackling the Financing of Terrorism and its global initiative on protecting non-profit organizations from being used for terrorism, the Directorate organized a regional workshop for Member States from East Africa, held in Nairobi in March 2012. The workshop discussed national practices and identified oversight deficiencies in the non-profit organization sector in relation to specific terrorist financing risks.",1
"1928","âThe Security Council reiterates its strong condemnation of all violations of applicable international law committed against women and girls in armed conflict and post-conflict situations, including rape and other forms of sexual and gender-based violence and killing and maiming contrary to international law.",1
"1929","This committee, which should be chaired by an international member, should be composed of persons of established international reputation, some specialized in law (particularly international law, tort law or commercial law), and some in accounting and settlement of environmental loss and damage.",1
"1930","4. Following the adoption of resolution 1595 (2005), extensive consultations took place on the establishment, staffing and logistical support for the International Independent Investigation Commission. On May 26, 2005, a small advance team headed by Detlev Mehlis arrived in Beirut.",1
"1931","âReaffirms that terrorism in all its forms and manifestations constitutes one of the most serious threats to peace and security, and that any acts of terrorism are criminal and unjustifiable, regardless of their motivation, whenever and by whomsoever committed.",1
"1932","The Chair briefed the Council on the Committee's discussions at its meeting on 3 September, which focused on the midterm report of the Panel of Experts established pursuant to resolution 1874 (2009), issued on 1 August, and the Panel's update of the incident report on the launch of ballistic missiles by the Democratic People's Republic of Korea in June and July 2014, also issued on 1 August.",1
"1933","13 - The transitional government for the Darfur states was formed under the chairmanship of the senior assistant to the president.",0
"1934","This paper was the first joint paper published under this chapter.",0
"1935","241. On the basis of its analysis of other sources and its own investigative work, the Commission found that attacks on villages in Darfur by Government of the Sudan armed forces and Janjaweed occurred throughout the conflict, with certain periods of peak intensity.",0
"1936",":: Maintain the structure of the IEC in accordance with the Pretoria Agreement: Maintaining the structure of the Independent Electoral Commission in accordance with the Pretoria Agreement",0
"1937","Indeed, the attacks were often deliberately directed against civilians and civilian objects.",0
"1938","In the resolution, the Council emphasized that the authorizations provided for in the resolution apply only in relation to the situation in Somalia and do not affect the rights, obligations or responsibilities of Member States under international law, including any rights or obligations under the United Nations Convention on the Law of the Sea, including the general principle of exclusive jurisdiction of the flag State over its vessels on the high seas in any other case, and stressed in particular that this resolution does not constitute the establishment of customary international law, and further noted that these authorizations were granted only at the request of the President of the Federal Republic of Somalia contained in the letter dated October 8",1
"1939","Those meetings will include periodic briefings by the working groups responsible for tracking progress on monitoring and national implementation; assistance; cooperation with international organizations, including the Security Council Committee established pursuant to resolution 1267 (1999) and the Security Council Committee established pursuant to resolution 1373 (2001); and transparency and media outreach.",1
"1940","Reiterating the obligation of Member States to prevent the movement of terrorist groups, including through effective border controls, and, in this context, to exchange information promptly and improve cooperation among competent authorities to prevent the entry into and exit from their territories of terrorists and terrorist groups, the supply of weapons to terrorists and the provision of financing that would support terrorists.",1
"1941","(e) To submit a comprehensive work program to the Committee for its review and approval, as appropriate, detailing the activities, including proposed travel, envisioned by the Monitoring Team in carrying out its responsibilities, in close coordination with the CounterTerrorism Committee Executive Directorate and the 1540 Committee's group of experts, in order to avoid duplication and promote synergies.",1
"1942","Emphasizes the importance of safe and unhindered access of humanitarian personnel to civilians in armed conflict, calls upon relevant parties, including neighbouring States, to cooperate fully with the United Nations Humanitarian Coordinator and United Nations agencies in providing such access, invites States and the Secretary-General to bring to its attention information regarding the deliberate denial of such access in violation of international law and where such denial may constitute a threat to international peace and security, and in this regard expresses its readiness to consider such information and take appropriate steps when necessary.",1
"1943",":: The Convention on the Physical Protection of Nuclear Material: Convention on the Physical Protection of Nuclear Material.",0
"1944","The Commission notes that there is no evidence that the killing of 8 police officers and the wounding of 27 police officers was outside the scope of spontaneous actions by individuals who were never under the orders of the F-FDTL hierarchy.",1
"1945","1. In the statement by its President on September 4, 2008 (PRST/2008/33S/), the Security Council requested the Secretary-General to identify and approach States that could contribute the necessary financial resources, personnel, equipment and services for the establishment of a multinational force for Somalia.",1
"1946","The EU's decision to start negotiations with Serbia and Montenegro on a Stabilization and Association Agreement is an important step in this regard.",1
"1947","Outreach to civil society and private companies has also begun, with a focus on the potential of technical assistance and its role in combating terrorism.",1
"1948","Acting under Chapter VII of the Charter of the United Nations.",0
"1949","On November 15, 2014, regime helicopters dropped a barrel bomb on the Omar Ibn al-Khattab Mosque in Aleppo, causing severe damage.",0
"1950","On November 20, Julie Bishop, Australia's Minister for Foreign Affairs, chaired a briefing on âPeacekeeping Operations: The role of policing in peacekeeping and post-conflict peacebuildingâ. This was the first Council meeting devoted to policing-related issues.",1
"1951","Communities in West Asia and North Africa have been playing an important role in world history for more than a thousand years.",0
"1952","The concept of preparing baseline inventories by conducting a small arms survey in the early stages of project development is now taking hold and has proven to be effective in project development and evaluation.",0
"1953","However, the detainees were subjected to serious assaults on their lives and physical integrity.",0
"1954","In addition, the Monitoring Team travelled twice to Belgium, once to attend the International Civil Aviation Organization symposium and once to meet with representatives of the World Customs Organization; it also travelled to France to attend an expert meeting on targeted financial sanctions organized by the Financial Action Task Force and to attend the third plenary meeting of the Task Force.",1
"1955","Member States are requested to limit their interventions to five minutes.",1
"1956","11. Emphasizes that specialized international and regional organizations play an important role in building understanding of the threat of terrorism and in facilitating international cooperation in the fight against terrorism, in particular through the provision of technical and related assistance, as requested.",1
"1957","They expressed concern about the widespread use of the Internet by Al-Qaida and its associates, the irresponsible coverage of sensitive issues by some media, and the use of satellite phones for terrorist purposes.",0
"1958","VII. Proposed amendments to claim No. 5000350 (Iran) 150",0
"1959","âThe Security Council commends the efforts of the European Union's Operation Atalanta, the North Atlantic Treaty Organization's Allied Protector and Ocean Shield, led by NATO member states, the Combined Maritime Forces Joint Task Force 151, led by Denmark, New Zealand, Pakistan, the Republic of Korea, Singapore, Thailand, Turkey, the United States, and other States acting in their national capacity in cooperation with and between Somali authorities to suppress piracy and protect vulnerable ships transiting waters off the coast of Somalia, and expresses its appreciation for the efforts made in the context of the European Union's Operation Atalanta and the North Atlantic Treaty Organization's Ocean Shield.",1
"1960","9. Decides that the 1540 Committee shall continue to intensify its efforts to advance the full implementation by all States of resolution 1540 (2004) through its program of work, which includes collecting and generally examining information on the status of States' implementation of resolution 1540 (2004) and States' advocacy, dialogue, assistance and cooperation efforts; and addressing, in particular, all aspects mentioned in paragraphs 1, 2 and 3 of that resolution, including (a) accountability (b) physical protection, (c) border controls and law enforcement efforts, and (d) national controls on exports and trans-shipments, including controls on the provision of funds and services such as financing for such exports and trans-shipments; and includes, as needed, specific priorities for its work, taking into account its annual review on the implementation of resolution 1540 (2004) prepared with the assistance of the Group of Experts before the end of each December.",1
"1961","7. Emphasizes the importance of ensuring that the Commission continues to function effectively during the process of transforming its support structure into executive management, and in this regard decides that the Commission should continue to operate using its current support structure until it decides, in consultation with the Secretary-General, that the Committee should continue to operate using its current support structure until it decides, in consultation with the Secretary-General, that executive management is able to function.",1
"1962","Solidaridad Internacional, a non-governmental organization, has installed water systems in all camps with funding from the European Community Humanitarian Office (ECHO) and UNHCR.",0
"1963","The presence and influence of opposition armed forces is low in this area, even as they use transportation routes and rely on shelters in Farah district.",0
"1964","Recalling resolution 1373 (2001) of September 28, 2001, which established the Counter-Terrorism Committee, and recalling also its other resolutions on threats to international peace and security caused by terrorist acts.",0
"1965","âThe Security Council further reaffirms the need to combat by all means, in accordance with the Charter of the United Nations, threats to international peace and security caused by terrorist acts. The Council reminds States that they must ensure that any measures taken to combat terrorism comply with all their obligations under international law, in particular international human rights, refugee and humanitarian law.",1
"1966","Under international law, Israel, as the occupying power, is obligated to protect Palestinian civilians, especially children, and to preserve civilian property.",0
"1967","I have the honour to transmit herewith the report of the Security Council Committee established pursuant to resolution 2048 (2012) concerning Guinea-Bissau, which contains an account of the Committee's activities during the period from 1 January to 31 December 2014.",1
"1968","""At its 92nd meeting, held in private on November 10, 2010, the Security Council considered the item entitled `The situation concerning Iraq'.",0
"1969","He explained that he had had numerous discussions with the Moroccan Government, which, before accepting the resumption of shuttle diplomacy, had first requested a meeting to clarify its concerns about the Secretary-General's latest report (S/2014/258), emphasizing that Morocco believed this would allow the process to move forward in an optimal manner.",1
"1970","Therefore, it was suggested that international standards should be developed and perhaps the Commission could play a more prominent role.",1
"1971","13. The members of the Commission decided that in order to ârecommend measures to ensure accountability for the crimes and serious human rights violations allegedly committed during the above-mentioned period, bearing in mind that the Government of Timor-Leste considers that the domestic judicial system, involving a pool of international judges, prosecutors and defense lawyers, should be the main framework for accountability for these alleged crimes and violationsâ, they had to make a preliminary assessment of the existing domestic judicial system in Timor-Leste.",1
"1972","72. Much has been said about the financing of terrorism through drugs, including in international conventions and Security Council resolutions.",1
"1973","Syria calls on the United Nations and its bodies concerned with combating terrorism and preventing its financing, including the Security Council and its specialized committee, as well as the Human Rights Council, to deny terrorists and those who support them any cover for their destructive practices in order to preserve the sovereignty and independence of States and maintain security, peace and stability.",1
"1974","(a) Ensure the widest possible dissemination of information on international humanitarian, human rights and refugee law.",1
"1975","(c) Transportation and storage of custody and documentation at the site",0
"1976","In closed consultations, the Special Envoy briefed the Council on his priorities, his preliminary consultations and his thoughts on the way forward. He said that the Geneva communiquÃ© of June 30, 2014, remained valid and that it established the general parameters for a future negotiated solution.",1
"1977",":: June 2, 2005, journalist Samir Kassir is killed when his car explodes in East Beirut.",0
"1978","6. Also requests the Committee established pursuant to resolution 1267 (1999) to report to the Security Council on the implementation of this resolution at regular intervals.",1
"1979","We consider Armenia's position to be an open and direct challenge to the conflict settlement process and a serious threat to international and regional peace and security.",0
"1980","The Committee welcomes the Executive Directorate's activities in this area and encourages the Executive Directorate to further develop them, under the guidance of the Committee, by deepening its analytical framework, including through its participation in the Counter-Terrorism Implementation Task Force working group on protecting human rights while countering terrorism.",1
"1981","In conclusion, we would like to express our appreciation to the Head of UNMIT, Ms. Ameerah Haq, and to all UNMIT staff for their professionalism and dedicated efforts.",0
"1982","44. With regard to the reunification of the two forces, the Chiefs of Staff of the Defence and Security Forces and the Forces nouvelles informed the assessment mission that they had prepared a proposal for the formation of a unified transitional army composed of units that would be responsible for providing security for the electoral process.",0
"1983","64. Almost 15 months after the National Assembly enacted legislation authorizing the establishment of the National Human Rights Commission, no progress has been made by the parties.",0
"1984","5. Devesh Monastery, near Srbica",0
"1985","C - Width between 10 and 20 mm.",0
"1986","Decrees issued by the Government of the Republic of Armenia",0
"1987","âThe Security Council reaffirms that Member States must ensure that any measures taken to combat terrorism comply with the Charter of the United Nations and all their other obligations under international law, in particular international human rights, refugee and humanitarian law.",1
"1988","Recognizes the detrimental impact of the proliferation of weapons, in particular small arms, on the security of civilians by fuelling armed conflict, and encourages [the mission] to continue its efforts to assist the Government of [the affected area] in the civilian disarmament process, in particular by strengthening the capacity of local authorities to deter intercommunal conflicts and monitoring forced civilian disarmament initiatives to prevent the occurrence of disarmament processes that could exacerbate insecurity in [the affected area].",0
"1989","Security Council resolution 2100 (2013), preambular paragraph 9",0
"1990","(i) Enhancing the Committee's cooperation with international, regional and subregional organizations and developing ways of working with those organizations on a case-by-case basis, reflecting the varying capacity and mandate of each organization, including operational-level exchanges, briefings by and to the Committee and enhanced information-sharing arrangements.",1
"1991","To be held on Thursday, May 3, 2001, at 10.45 a.m.",0
"1992","Other documentary material also had to be collected and analyzed to identify issues that contributed to the crisis. The Commission will subsequently validate the information contained in these materials and reports and will further investigate the facts by interviewing witnesses, officials and other persons in positions of authority, as well as persons in police custody or in prison, and by visiting places where crimes or other incidents are alleged to have taken place.",0
"1993","Furthermore, the committee will set a schedule of meetings that seeks to achieve its goals efficiently and expeditiously.",1
"1994","II. Developments during the reporting period",0
"1995","4. Ahmad Taher Termanini, from Atmeh, Idlib countryside",0
"1996","On behalf of the Czech Republic, I would like to thank the CTC for its efforts in the fight against international terrorism.",1
"1997","The Commission has provided and will continue to provide the Lebanese authorities with all information related to any criminal case outside the scope of the Commission's investigation.",0
"1998","Welcomes the commitment expressed by States, including during the general debate of the General Assembly from 1 to 5 October 2001, to combat international terrorism, calls upon all States to become parties as soon as possible to the relevant international conventions and protocols relating to international terrorism, and encourages Member States to move forward in this regard.",1
"1999","39. In this context, the Heads of State or Government support the need to review the existing legal texts, in particular the Protocol on the Mechanism for Conflict Prevention, Management, Resolution, Peacekeeping and Security and the Supplementary Protocol on Democracy and Good Governance in order to reflect best practices with regard to presidential terms of office.",1
"2000","10. Invites the Secretary-General to report to the Security Council on opportunities and challenges for cooperation between the United Nations and regional and subregional organizations in the maintenance of international peace and security, and encourages the Secretary-General to explore with international organizations the possibility of concluding agreements to establish a framework for cooperation and contributions by regional organizations to United Nations-led peacekeeping operations, taking due account of previously identified guidelines for cooperation between the United Nations and specific regional organizations.",1
