"","ar_en_DEEPL","MatConf"
"1504","Collaborate on the development and implementation of a gender-sensitive HIV/AIDS policy in the areas of training, codes of conduct, HIV detection, civil-military cooperation, resource information, and best practice materials; integrate an HIV/AIDS policy into the Department of Peacekeeping Operations and strengthen the capacity of peacekeeping operations (including incoming staff) to address HIV/AIDS.",0
"1505","The group's other major success is its survival, but its ranks are dwindling, and over time, its key leaders will be arrested or killed.",1
"1506","The results of the explosion simulation experiment deny what happened at the time of the ship's sinking.",0
"1507","Resource constraints continue to severely hamper the effectiveness of Mali's transnational organized crime units, although a UN police transnational organized crime cell is co-located with Malian counterparts.",1
"1508","While each refugee or IDP's situation is unique, displacement and statelessness exacerbate gender inequalities and exacerbate the discrimination and hardship faced by women and girls.",1
"1509","4. The Financial Intelligence Unit (FIU) became operational in the early 1990s. It was established by legislation enacted to address the growing problem of money-laundering by organized criminal groups, and the legislation was amended in 2002 to address the suppression of terrorist financing. âCash dealersâ are required to disclose the identity of their customers, keep records of customers and customer account activity for at least seven years after account closure, and report to the FIU on large cash transactions (in excess of $7,000), suspicious transactions, and instructions for transferring funds into or out of the country.",0
"1510","France strongly condemns these attacks and calls on all parties to exercise maximum restraint.",0
"1511","Many of the reports relate to the abduction of women.",1
"1512","Led by Ambassador Jorge Voto-Bernales (Peru)",0
"1513","In Indonesia, Jemaah Islamiah appears to have moved from large vehicle-borne improvised explosive devices (VBIEDs) consisting of commercial or conventional explosives (potassium chlorite, sulfur, and aluminum powder mixed with a fuse of a substance such as trinitrotoluene (TNT)) as used in the first bombing in Bali in October 2002, to a more target-oriented approach where individuals carry smaller bombs into the target area, as seen in the second attacks in Bali in October 2005.",1
"1514","Among them was a 15-year-old boy arrested in November 2004 in Nyala, North Darfur, when he was returning home from work.",1
"1515","The first such event took place on July 7, 2001, on the occasion of the opening ceremony of the Mereb River Bridge donated by the government of the Netherlands, and later at a joint Ethiopian-Eritrean press conference held on August 9, also on the Mereb River Bridge.",0
"1516","In most cases, victims attributed acts of sexual violence to the Janjaweed; however, in several incidents, government soldiers allegedly participated with the Janjaweed.",1
"1517","In addition, the rains are blocking road access to various parts of the region.",0
"1518","(i) Losses, damages and claims of subcontractors and suppliers.",0
"1519","Despite tightened legal and practical controls, artisans and family businesses making small arms and light weapons still have a presence throughout the region.",1
"1520","The Monitoring Team notes that in paragraph 5 of resolution 1526 (2004), the Security Council urged States to establish internal requirements and procedures for reporting cross-border currency movements based on applicable thresholds.",0
"1521","344. One eyewitness described the horrors of detention in the area designated by the detainers for women and young girls in Kailek as follows:",1
"1522",":: Import systems and customs data on diamond imports: Import systems and customs data on diamond imports.",0
"1523","29. There are also important positive developments. When the armed conflict ended in 1999, there was an almost complete lack of economic structures and legislation.",1
"1524","The government's armed forces later confiscated the villagers' weapons.",1
"1525","These militias are believed to operate primarily under the cloak of tribal organization.",1
"1526","of the United Kingdom of Great Britain and Northern Ireland addressed to the Secretary-General",0
"1527","The Council calls upon Member States to intensify their international and regional cooperation, based on the principle of common and shared responsibility, as well as their cooperation with the United Nations Office on Drugs and Crime and the International Narcotics Control Board, in order to combat illicit production, demand and trafficking of drugs and to identify emerging trends in drug trafficking.",0
"1528","The Council emphasizes the importance and urgency of re-establishing justice and the rule of law in post-conflict societies, not only to overcome past injustices, but also to promote national reconciliation and help prevent future conflicts.",0
"1529","What distinguishes this category of crimes from war crimes is that it is not concerned with isolated or sporadic violations, but with violations that (a) may occur in time of peace or armed conflict peace or armed conflict and (b) constitute widespread or systematic atrocities (or attacks) against a civilian population.",1
"1530","Attempts to launder money or finance terrorist acts using these new payment methods have already been detected. However, countries are struggling to put in place legislation and regulatory systems that are appropriate for these rapidly evolving payment methods.",1
"1531","The evaluators were unable to examine the impact of the restructuring of the FARDC, which is still ongoing.",0
"1532",":: Attacks on the civilian population or individual civilians not taking direct part in hostilities: Attacks on the civilian population or on individual civilians not taking direct part in hostilities.",1
"1533","Develop a gender action plan in the Department to integrate gender perspectives into conflict prevention, peacekeeping and peacemaking activities.",0
"1534","The victims were buried several days after the attack in the areas surrounding Kalbas.",1
"1535",":: Attacks on buildings, materials, medical units, transportation and personnel using the distinctive emblems described in the Geneva Conventions, consistent with international law Attacks on buildings, materials, medical units, transportation and personnel using the distinctive emblems set forth in the Geneva Conventions, consistent with international law.",1
"1536","The car was not in a completely upright parking position, as evidenced by the force of the blast, which impacted the red Ford that was likely waiting directly in front of the Mitsubishi.",1
"1537","But Eritrea's provocative activities have not been limited to declarations of war.",1
"1538","Flowing from one side of the border to the other were mobile groups of young warriors - regional warriors - who saw the war primarily as an economic opportunity.",1
"1539","On the morning of May 24, eight armed forces soldiers on a surveillance patrol in the hills were attacked and surrounded by a group of armed men from a higher position.",1
"1540","The meeting was called to order at 11:25 a.m.",0
"1541","Speech by Mr. Amr Moussa, Secretary-General of the League of Arab States at the opening session",0
"1542","Without a standardized or agreed upon form for an authenticated end-user certificate, government agencies in transit countries have little means of verifying its authenticity.",0
"1543","That the Commission take into account the final results of the monitoring and assessment process derived from the Saudi Arabia Oil Contaminated Coast Survey when monitoring the use of compensation awarded to fund environmental remediation activities, including compensation awarded under the Commission's claim No. 5000451.",0
"1544","According to some estimates, more than 700 villages were totally or partially destroyed in all three states of Darfur. The Commission also received information that the police had made an estimate of the destruction and recorded the number of villages destroyed at more than 2,000.",1
"1545","In March 2004, the Janjaweed and 150 soldiers reportedly abducted and raped 16 young girls in Kutum, North Darfur.",1
"1546","An additional problem was that the government did not seem to have sufficient military resources, as many of its troops were still in the south and those in Darfur were mainly distributed among the major urban centers.",1
"1547","These include, but are not limited to, the armed forces, the National Security and Intelligence Service, military intelligence, and the security committees in the three Darfur states.",0
"1548","It is unlikely that the listing of these individuals would have made much difference to the level of attention paid to them by government authorities, but as they have shown no change in their written and oral support for Al-Qaida or the Taliban, neither of which is a criterion for listing, States recommended and the Committee agreed to continue listing them.",0
"1549","FARDC elements have reportedly dispersed in South Kivu and their ability to move freely through population centers and attack civilians has been restricted. However, their ability to launch attacks should not be underestimated, especially given FARDC's limited resources, poor military training, lack of discipline by some FARDC units in that area and their occasional collusion with FDLR commanders.",1
"1550","Others have been identified for their possible involvement in planning and/or ordering, or assisting in the commission of international crimes.",1
"1551","2. Allegations of disappearances and detention in MPCI-controlled areas C. Disappearances",1
"1552","The first is that some states do not appear to have done enough to ensure the implementation of the embargo; the second is the different ways in which states interpret their obligations; and the third relates to the scope of the arms embargo and how it relates to ever-changing methodologies for achieving its objectives.",1
"1553","Over time, they will have little influence, but that depends on the success of counter-terrorism and counter-narcotics efforts in Afghanistan.",1
"1554","Moreover, under the ICCPR, the prohibition on the use of torture may not be derogated from even in a state of public emergency.",1
"1555","(b) The failure to impose effective measures to prevent the rape of Ethiopian women and girls.",1
"1556","Some Member States reiterated the need for stronger coordination among UN counter-terrorism entities.",0
"1557","We believe that Somalia faces a challenge similar to that of a marathon runner, because the drafting of the constitution must be completed by April 20 and its adoption completed by May 22.",0
"1558","14. Report of the Special Rapporteur of the Commission on Human Rights on extrajudicial, summary or arbitrary executions on her mission to the Sudan E/CN.4/2005/7/Add.2",1
"1559","(i) Amount realized from the sale of miscellaneous equipment and materials",0
"1560","The mission visited some of these areas and was saddened by the sight of destroyed houses, burned cars and destitute people.",1
"1561","On the other hand, the Eritrea-Ethiopia Claims Commission shows that the mechanisms for paying and enforcing compensation as a result of collective claims adjudicated by a third party can be problematic.",0
"1562","This hampered the investigation, as it became impossible to trace the origin of the explosives, which could have led to the identification of the perpetrators.",0
"1563","- The agreement allocated 12 seats in the National Assembly to the signatory movements.",0
"1564","Mr. Mulet (spoke in French): I thank the members of the Council for the opportunity to update them on the situation in eastern Chad and the north-eastern Central African Republic.",0
"1565","45. The Government of Nepal should ensure that adequate measures are in place to protect child victims and witnesses, and children accused of crimes committed in the context of the conflict, as well as to involve children in any transitional justice activities to ensure that their experiences during the conflict are shared.",0
"1566","The Panel noted that during this period the opposition purchased a number of anti-aircraft weapons and ammunition from the Bakara arms market.",1
"1567","I tried to discuss the case for involving observers but was unsuccessful in getting them involved.",0
"1568","However, the reason for its creation may be described as 'fast-track' rather than 'practical necessity', especially in light of the reality that, according to reports, a hearing for a capital charge may last no more than one hour.",1
"1569","Since January, the United Nations Organization Stabilization Mission in the Democratic Republic of Congo (MONUSCO) has documented more than 100 incidents targeting members of the political opposition, supporters, journalists and human rights defenders.",1
"1570","(a) Review criminal laws in order to ensure that offences are properly criminalized in each of the identified categories, and enact counter-terrorism legislative provisions, as appropriate.",0
"1571","A few countries are unable to implement the measures at all, and this is where terrorists are able to break the ban at will.",1
"1572","To date, 84 self-help groups and 241 income-generating groups have been formed in three regions, covering 7,897 households.",0
"1573","While these cases are linked to brutal attacks by Boko Haram, there are also disturbing allegations of human rights violations by security forces.",1
"1574","However, five defendants, including Karadžić and Mladić, have yet to be arrested.",0
"1575","Some government soldiers were killed without trial.",1
"1576","::: Copies of the passports of Benjamin Yeaten (Annex III) and Ko Ko Dennis (Annex IV) were obtained.",0
"1577","31. Allegations of armed protesters and elements of rebel groups ready to attack security forces or overthrow the President could not be independently verified, as the Commission did not receive any conclusive or credible evidence in this regard.",1
"1578","A total of 179 national police officers (including 59 women) and 93 UNMIT police officers (including 12 women) benefited from the training sessions.",1
"1579","Consequently, these persons can be suspected, on a case-by-case basis and under the principle of joint criminal enterprise, of committing crimes against humanity by killing civilians, forcibly detaining civilians, and forcibly displacing civilians as a war crime by destroying civilian objects.",1
"1580","The State Border Guard Service under the Ministry of the Interior of the Republic of Lithuania checks persons, vehicles and goods for radioactive substances when entering and leaving the country.",0
"1581","14. However, international human rights bodies and others have also raised concerns that some measures to counter incitement may be excessive and overreaching, infringing on human rights, including the right to freedom of expression and the right to non-discrimination. This would be counterproductive as it creates the risk of excluding certain communities from international counter-terrorism efforts.",1
"1582","These operations were sanctioned by the Supreme Leader. The vast majority of the victims were forcibly disappeared so that the state could benefit from their labor and other skills.",1
"1583","6. Recalls that, in resolution 1373 (2001), it decided that all Member States shall ensure that any person who participates in the financing, planning, preparation, perpetration or support of terrorist acts is brought to justice, and decides that all States shall ensure that their domestic laws and regulations criminalize the following acts as offences of sufficient gravity to enable the prosecution and punishment of offenders in a manner that duly reflects the seriousness of the offence:",1
"1584","This strategy focuses on how to direct the state's defenses against terrorism to protect critical infrastructure and citizens, and how the state responds to terrorist attacks to mitigate their effects, assist their victims, and restore public order.",1
"1585","19. Decides to remain seized of the matter.",0
"1586","The Assistant Secretary-General reported that armed groups continued to terrorize the population in areas under their control by committing killings, abductions, torture, ill-treatment and other serious human rights violations, including the destruction of homes and seizure of property, and also reported continuing allegations of human rights violations by some volunteer battalions under government control.",1
"1587","The survivors fled the village in their skins, and their dead were not buried.",1
"1588","We call on all armed groups that are signatories to the Ouagadougou Agreement to disassociate themselves from terrorist groups.",0
"1589","As the Panel has noted before, inadequate restrictions serve no useful purpose: Sanctions cannot be properly applied against those to whom they pertain, unintended members of the public with similar names suffer real consequences, the private sector, border officials and others waste valuable time and effort trying to identify similar names that can never be verified, and the sanctions regime as a whole loses support.",1
"1590","Rape and other crimes of sexual violence have occurred, but they have not been so widespread or systematic as to amount to a crime against humanity.",1
"1591","The fruit loading terminal was also used in June 2005 to unload 22 military-type vehicles from Belarus (see Case Study 2).",1
"1592","Despite this decision, the destruction continues.",1
"1593","Recalling its resolutions on the recruitment and use of children and armed conflict.",1
"1594","(i) Cash and term deposits represent funds held in demand deposit accounts and interest-bearing bank deposits.",0
"1595","Furthermore, the Committee considers that the fact that rape and other forms of sexual violence were perpetrated primarily against three âAfricanâ tribes is evidence of discriminatory intent on the part of the perpetrators.",1
"1596","ISIS and all other parties to the conflict continue to kill and injure people and destroy villages, towns and cities with impunity, she said.",1
"1597","With fuel smugglers making more than 100 percent profit, these smuggling networks have a vested interest in prolonging the conflict.",1
"1598","2. Diamond mining, domestic trade and export.",0
"1599","Turkey will continue to exercise its rights under international law, in full compliance with established rules and regulations, to protect its citizens and national borders.",1
"1600","To ensure the sustainable return of displaced people and viable minority communities, decentralization should be widely implemented.",0
"1601","The Panel also considers compensable forms of evacuation costs.",0
"1602","The group looted homes in the village and reportedly abducted about 44 villagers, fatally shooting two of them.",1
"1603","She also provided photographs of some of the pieces.",0
"1604","115. The current embargo could have a greater impact on the Taliban if this were taken into account and if all non-State actors in Afghanistan were prevented from purchasing arms, with necessary exceptions for humanitarian and other purposes, as authorized by the Government of Afghanistan or the Security Council.",1
"1605","These procedures are the same for both non-profit and for-profit organizations.",0
"1606","36. Threats and intimidation also prevent children from attending school.",0
"1607","The officers responded that âit's the same thing anywayâ and began vandalizing the house.",1
"1608","In the aforementioned letter, the representative of the Israeli regime talks about security, peace and stability in the Middle East.",0
"1609","84. Kimberley Process Certification Scheme (January 28, 2003; January 28, 2003).",0
"1610","Paragraphs 45-49, 53-55; paragraphs 45-48; paragraph 57.",0
"1611","(a) Mamadou CissÃ© (close to the Rassemblement des RÃ©publicains) and Tareen, a sergeant in the navy, since 20 September 2002.",1
"1612","In Iraq, ISIS has committed violations âof such magnitude and gravity that they are likely to constitute international crimes within the jurisdiction of the International Criminal Court,â he said.",1
"1613","Total (three million nine hundred thousand dollars)",0
"1614","In a presidential statement (S/PRST/2004/15) adopted on 14 May, the Council expressed deep concern regarding reports that elements of the Rwandan army had conducted an incursion into the territory of the Democratic Republic of the Congo, reports of increased military activity by FDLR in the eastern part of the Democratic Republic of the Congo and incursions by FDLR into the territory of Rwanda.",1
"1615","412. The abduction of persons during Janjaweed attacks and their detention in camps maintained by the Janjaweed, with the support and complicity of Government military forces, constitute gross violations of human rights and constitute enforced disappearances.",1
"1616","As we saw in Mali, this can leave the country vulnerable to civil conflict.",1
"1617","In November, the unit began construction work to create a unit within the new Timbuktu camp.",0
"1618","150. Table 2 shows revenue totals for cocoa and oil.",0
"1619","It should also be noted that this Russian decision coincides with provocative actions by the separatists and the mobilization of massive military reinforcements.",1
"1620","The situation in Côte d'Ivoire (December 20, 2002; July 30, 2009)",0
"1621","(i) Tungsten and alloys containing tungsten at or above 97% by weight; or",0
"1622","The Special Representative gave a brief account of the fighting that broke out in Bentiu, Unity State, on October 26.",1
"1623","82. In follow-up to Security Council resolutions on children affected by armed conflict, in particular resolution 1612 (2005), a strong partnership was established between the United Nations and the Netherlands Organization for International Development Cooperation-Somalia, a non-governmental organization, to initiate community-based reporting and monitoring on child rights and child protection violations.",0
"1624","During this attack and the subsequent forced confinement of the population, many people were severely tortured to extract information about the rebels, or to punish or intimidate the population.",1
"1625","The Defense Forces kept some records of the weapons distributed to 206 civilians in this way.",1
"1626","Some of those recruited into the Maoist army and militia are under the age of 18.",1
"1627","This categorization is necessary not only to determine whether the crimes amount to genocide, but also to identify the perpetrators.",1
"1628","The situation in the Great Lakes region",0
"1629","Joint criminal enterprise to commit international crimes",1
"1630","Urge humanitarian and development organizations to take appropriate action to prevent sexual exploitation and abuse by their personnel, including, in the case of United Nations actors, conducting predeployment and field awareness training, and promoting and ensuring compliance with the Secretary-General's Bulletin on special measures for protection from sexual exploitation and sexual abuse (ST/SGB/2003/13), including by civilian personnel of United Nations peacekeeping operations and other relevant missions.",0
"1631","60. In its resolution 1783 (2007), the Security Council requested the Secretary-General to continue to take the necessary measures to ensure full compliance within the Mission with the United Nations zero-tolerance policy on sexual exploitation and abuse.",0
"1632","More witnesses came forward as the committee's work progressed.",0
"1633","Recent gains in reclaiming territory from ISIS show that this strategy, which has international military support, is making progress, the special representative said.",1
"1634","89. The security forces are national regular forces whose mission is to look after the internal and external security of the Sudan, monitor related incidents, analyze their significance and danger, and recommend preventive measures.",1
"1635","Through its care and maintenance projects, UNHCR provided supplementary food rations such as fresh food, meat, tea and yeast.",0
"1636","It is necessary to continue to apply this restriction as long as participation in any such travel results in the obligation to report on substantive matters.",1
"1637","For example, Uzbekistan has established internal control rules and penalties for entities that fail to report, and Uzbekistan and Turkmenistan have introduced strict customer verification and record-keeping procedures.",1
"1638","Interior Minister Lobato arrived at the police headquarters wearing a bulletproof vest and in a state of extreme agitation, shouting, âKill them all.â",0
"1639","It also points to the growing problem in Afghanistan and the Afghanistan-Pakistan border region and the continuing threat in North Africa, with no decline in activity elsewhere.",0
"1640","Resolution 1373 (2001), adopted in the wake of the heinous attacks in the United States on September 11, 2001, was a milestone in the efforts in this regard at the United Nations level.",0
"1641","It should be noted that the two movements do not present the issue from a tribal perspective but speak on behalf of all Darfurians and direct their attacks directly at government installations.",1
"1642","Civilians often find themselves in conditions of dire need in places where a peacekeeping operation has not been established. Such situations may require the Council's urgent attention.",1
