"","ar_en_DEEPL","VerCoop"
"1","12. Emphasizes that the Treaty on the Non-Proliferation of Nuclear Weapons recognizes in its article IV the inalienable right of the parties to the Treaty to develop research, production and use of nuclear energy for peaceful purposes without discrimination and in conformity with articles I and II of the Treaty, and recalls in this context article III of the Treaty and article II of the statute of the International Atomic Energy Agency.",1
"2","11. Decides to remain seized of the matter.",0
"3","In Lernib (Timbuktu region), in September, the MAA (preliminary plan) warned in several public meetings that it would punish local populations who provided information to MINUSMA and French forces. On 23 September, the decapitated body of a man was found in the Zouera area, 80 km north of Timbuktu, who was one of five men abducted by AQIM on 16 September and accused of collaborating with international forces, who have since disappeared.",0
"4","Some said the companies should anyway take steps to shut down sites that teach terrorist techniques, such as making explosives or using weapons, that can cause widespread casualties.",1
"5","In most cases, these regulations were limited to issues related to tax status.",0
"6",":: The file should not be closed at the end of UNAMI's mandate: The file will not be closed with the expiration of UNAMI's mandate in the future.",0
"7","The scope and scale of the events related to the conflict in Darfur make establishing the facts and gathering reliable evidence to identify suspected perpetrators difficult tasks that cannot be taken lightly.",1
"8","3. A senior Al-Ittihad commander with full responsibility for the training camps purchased AK-47 assault rifles, PKM machine guns, RPG-7 rocket launchers, F-1 hand grenades, rifle grenades and 60 mm-82 mm mortars at the ErtuÄt market between 7 and 21 November 2004. The same individual purchased 2 PKM assault rifles, 10 SG-43 medium machine guns, 120 TT-33 âTokarevâ pistols and 60 AK-47 assault rifle magazines on November 27, 2004; as well as 16 PKM machine guns and RPG-7 rocket launcher ammunition on January 15, 2005 (S/2005/153, annex II).",0
"9","The Central and Eastern European countries Bulgaria, the Czech Republic, Estonia, Hungary, Latvia, Lithuania, Poland, Romania, the Slovak Republic and Cyprus associated with the European Union and the European Free Trade Association countries members of the European Economic Area align themselves with this declaration.",0
"10","25. Recognizing the particular need to coordinate its work with the Counter-Terrorism Committee Executive Directorate and other relevant bodies in areas where States may feel overwhelmed by Security Council requests for information, the Team has developed a joint strategy with the Executive Directorate and the experts supporting the Committee established pursuant to resolution 1540 (2004) to address the issues faced by States that have not yet submitted the reports requested by the three Committees.",1
"11","The Council emphasizes the need for all parties to respect and maintain the security and civilian character of camps for refugees and internally displaced persons.",1
"12","148. The implementation of border control measures is essential to the practical application of States' counter-terrorism strategies.",0
"13","71. While it is likely to be some time before the treaty enters into force, it could be a useful tool for further progress in the implementation of the 1267 sanctions regime.",1
"14","We are also concerned about the situation of those involved in the reconstruction of the country.",0
"15","Calling upon States to ensure, consistent with international law, in particular international human rights law and international refugee law, that refugee status is not abused by those who commit, organize or facilitate terrorist acts, including foreign terrorist fighters.",1
"16","(a) Promote the adoption of the international counter-terrorism instruments and enact legislation to fully implement the international counter-terrorism instruments throughout the subregion.",1
"17","Alternatives",0
"18","10. Expresses its readiness to respond to situations of armed conflict in which civilians are targeted or humanitarian assistance to civilians is deliberately disrupted, including by considering appropriate measures at the disposal of the Council in accordance with the Charter of the United Nations, and notes in this regard the relevant recommendations contained in the report of the Secretary-General.",1
"19","The centralized location database has been established and data is currently being recorded there.",0
"20","The Defense Forces kept some records of the weapons distributed to 206 civilians in this way.",0
"21","âThe Security Council recognizes the need to regularly monitor and report on progress in the protection of civilians in armed conflict.",1
"22","On February 1, 1999, the new Prime Minister received the confidence of the National Assembly.",0
"23","Governments of Sweden and the United States",0
"24","Reaffirms that all parties to the conflict are obliged to comply with their obligations under international humanitarian law, in particular the Geneva Conventions of 12 August 1949, and that persons who commit or order the commission of grave breaches of the Conventions are individually responsible for such breaches.",1
"25","The team first estimated the profits the company would have made in a no-invasion scenario.",0
"26","INTERPOL commented that the more information contained in the Special Notices, including fingerprints, photos and passport numbers in restricted formats available only to the law enforcement agencies of its member countries, the more useful they will be and the less likely incidents such as the above will occur. INTERPOL also offered to provide guidance to its members on the scope of the sanctions regime. In addition, it proposed the creation of a permanent information point at the United Nations to answer questions and ensure the timely provision of additional relevant information on listed individuals when made available by Member States.",1
"27","United Kingdom of Great Britain and Northern Ireland",0
"28","In order to facilitate the Council's deliberations on the establishment, change or termination of peacekeeping operations and to facilitate due consideration, as appropriate, of issues relating to the protection of civilians, Council members suggested that a note containing a list of issues of importance in this regard be drafted in close cooperation with the Council.",1
"29","7. Requests the Executive Representative of the Secretary-General to facilitate and encourage dialogue among national and international stakeholders, particularly in the context of the upcoming elections, while continuing to support their efforts to maintain peace and stability.",1
"30","A military advisor from the Department of Peacekeeping Operations responded to questions posed by Council members.",1
"31","Accordingly, the guidelines were forwarded to the International Labor Organization (ILO) for review and possible action.",1
"32","The workshop was an important opportunity to explore ways to further facilitate the implementation of the resolution, including aspects related to the submission of reports by all States and fuller implementation.",1
"33","âThe Security Council expresses its deep concern that the continued instability and security vacuum in the Central African Republic continues to negatively affect operations against the LRA and contributes to the strengthening of the LRA's position in the country.",0
"34","78. On 12 and 13 February, UNSOM, together with UNSOA, UNDP and the United Nations Office to the African Union, organized a retreat with the African Union and AMISOM near Addis Ababa.",0
"35","In that context, we remain concerned about the most vulnerable in Timor-Leste: The poor and homeless.",0
"36","The Council invites UN Women to contribute regularly to the Council's work on women, peace and security, and notes the valuable role that UN Women will play in supporting women's role in peacebuilding and preventing sexual violence in conflict, including through the coordination and coherence of policies and programs on women and girls.",1
"37","While 97 percent of households receive their food basket on time in the south and center, only 77 percent of households in the north receive their food basket on time.",0
"38","Council members also look forward to receiving the list of sanctions violators that the Monitoring Team is expected to present in its final report.",1
"39","âThe Security Council reiterates its call upon States to become parties as soon as possible to all relevant international conventions and protocols relating to terrorism and to implement those to which they are parties.",1
"40","However, I regret the cancellation of the seminar in Madeira, Portugal, and urge the parties to continue to explore ways to expand the CBM program.",1
"41","This sets the conditions for a successful country-wide collection of heavy weapons, which currently stands at 94 percent.",0
"42","See also, for example, S/RES/1769 (2007), op.15; see also, for example, S/RES/1769 (2007), op.15; S/RES/1756 (2007), op.2; S/RES/1701 (2006), op.12; S/RES/1590 (2005), op.16; S/RES/1565 (2004), op.4 and op.5 op.5; S/RES/1542 (2004), op.9; S/RES/1528 (2004), op.6; S/RES/1509 (2003), op.3(k); S/RES/1502 (2003), op.5(a); S/RES/1492 (2003), op.25; S/RES/1289 (2000), op.12; S/RES/1270 (1999), op.14.",0
"43","They called for the UN to take firmer action on factors leading to terrorism in general, such as Islamophobia.",1
"44","The Committee will continue to focus on monitoring and encouraging Member States' implementation of resolution 1373 (2001) and on practical measures to enhance States' counter-terrorism capacity, including measures aimed at facilitating technical assistance.",1
"45","36. Djibouti and Eritrea maintained generally good bilateral relations until June 2008.",0
"46","2. The situation in the Middle East.",0
"47","Other than the regular meetings of the Council of Arab Interior Ministers, information on the status of implementation is not regularly or institutionally shared at the sub-regional level.",1
"48","Calls upon States that have not yet done so to consider ratifying the principal instruments of international humanitarian, human rights and refugee law and to take the necessary legislative, judicial and administrative measures for their domestic implementation, drawing, as appropriate, on the technical assistance provided by relevant international organizations, including the International Committee of the Red Cross and United Nations bodies.",1
"49","Nothing is more urgent in Sierra Leone than maintaining peace, security and stability in the country.",1
"50","38. The Team recommends that the Security Council and the Committee encourage States to designate or establish national mechanisms to identify and target individuals and entities for inclusion on the Consolidated List based on clearly identifiable legal authority distinct from the criminal process.",1
"51","Sudan does not target the United Nations as it is a genuine member of the United Nations, committed to the provisions of its Charter and appreciates its efforts to achieve security, stability and development in Sudan, but rather strives to develop this relationship in accordance with the provisions of the UN Charter and the relevant General Assembly and Security Council resolutions.",1
"52","The main elements of his statement as well as the exchange of views among the members of the Working Group are reflected in the summary contained in the relevant conclusions (S/AC.51/2013/3).",1
"53","Since then, the government has repeatedly expressed a preference for direct bilateral support to build the capacity of its security forces.",1
"54","88. In his letter inviting non-permanent members to participate in the wrap-up session, the President of the Security Council encouraged all speakers to make frank and focused assessments of the role of the Council in addressing any or all of the above-mentioned themes to serve as guiding tools for the future work of the Council.",1
"55","Welcoming the establishment of the Office of the Ombudsperson pursuant to resolution 1904 (2009) and the strengthening of the mandate of the Ombudsperson in resolutions 1989 (2011) and 2083 (2012), noting the essential contribution of the Office of the Ombudsperson to providing additional integrity and transparency, and recalling the Security Council's firm commitment to ensure that the Office of the Ombudsperson can continue to play its role effectively in accordance with its mandate.",1
"56","President's visit to the Eritrea-Ethiopia Mission Area",0
"57","âThe Security Council urges Member States to improve bilateral, international, regional and sub-regional cooperation and prevent the travel of foreign terrorist fighters from or through their territories, including by increasing information sharing to identify foreign terrorist fighters, understanding their travel patterns, and sharing practices in evidence-based traveler risk assessment and border screening, noting the need to address the challenges posed by the evasive travel routes used by foreign terrorist fighters.",1
"58","32. The Mission continued its work to raise awareness among staff on the United Nations regulations and rules on the prevention of sexual exploitation and abuse.",1
"59","Authorities regularly patrol the waters of the harbors to prevent unauthorized boarding.",0
"60","âThe Security Council reaffirms the need to combat all forms of terrorism and that no act of terrorism can reverse the path towards peace, democracy and reconstruction in Iraq, which is supported by the Government and people of Iraq and the international community.",1
"61","One country cited a wide-ranging counter-radicalization plan, adopted in 2006, that aims to combat radicalization while also protecting democratic values.",1
"62","We now have a better understanding of the magnitude of the challenges we could only guess at.",0
"63","At its 6863rd meeting, held in private on November 14, 2012, the Security Council considered the item entitled ""The situation in the Middle East, including the Palestinian question"".",0
"64","Here I would like to share with your Council our position on this issue.",0
"65","In terms of medical equipment, GVU observations revealed chronic shortages of pediatric incubators, dialysis machines, ultrasound equipment, X-ray equipment, electrocardiograms, general laboratory equipment and patient monitors.",0
"66","In Samara camp, pre-registration is scheduled to begin in the third week of May 1998.",0
"67","Concerns expressed by the group included the challenge posed by the al-Qaeda insurgency, the use of the Internet by terrorists, the glorification of terrorism through the media, the indeterminate nature of sanctions, the need to support rehabilitation programs, and the sharing of technical and operational intelligence.",0
"68","29. It was recognized that, as part of its activities, the Committee should continue to raise awareness about multilateral treaties whose objective is to prevent the proliferation or eliminate weapons of mass destruction so as to contribute to their universalization.",1
"69","Promoting and strengthening the rule of law in the maintenance of international peace and security",0
"70","The Under-Secretary-General also reported that violence and human rights violations continue on a daily basis. They include the use of torture, murder, rape and enslavement by ISIL, the punishment of civilians by opposition groups, including those designated as terrorist organizations, attacks on civilian services, and aerial attacks by the Government, including barrel bombs, on civilian areas, camps for internally displaced persons and civilian installations.",0
"71","The Council also decided that the overall force levels of the Mission would consist of up to 2,370 personnel and a police component of up to 2,601 personnel, the force levels recommended by the Secretary-General; and invited the Secretary-General to ensure that the force levels of the Mission in the country remained at approximately the levels then in place until his next report to the Council, and to notify in that report any major changes in the situation.",1
"72","77. This section briefly describes the various groups that are active in the ongoing armed conflict in Darfur.",1
"73","36. The Committee continued to consider a media outreach strategy, based on a non-paper prepared by Committee experts. The purpose of the strategy is to systematically and efficiently leverage the resources of the United Nations and the Committee to reach a wider and specific audience, including through the development of specialized contact lists to communicate electronically important updates by the Committee.",0
"74","Other than these operational matters, the Ombudsman treats submissions confidentially as a matter of policy.",1
"75","The parties informed the mission that they were convinced that the Ouagadougou Agreement had ended the armed conflict and that the ongoing political crisis could only be resolved through the holding of elections.",1
"76","4. Requests the Executive Director to submit, within 30 days of taking office, and after consultation with the Secretary-General and his staff, an organizational plan to the Plenary for approval, which shall be consistent with the report of the Commission (S/2004/124) and with the rules and regulations of the United Nations, including its structure, staffing requirements and budgetary requirements with the report of the Commission (S/2004/124) and with the rules and regulations of the United Nations, including its structure, staffing requirements, budgetary requirements, management guidelines and procedures for appointment procedures, recognizing in particular the need for an effective and cooperative management structure for the new body, and a staff of appropriately qualified and experienced personnel, who shall be from the international civil service subject to Article 100 of the Charter, ensuring the highest standards of efficiency, competence and integrity, and giving due regard to the importance of recruiting staff on as wide a geographical basis as possible.",1
"77","In addition, on June 25, the Council of Elders presented the Transitional Government with a roadmap outlining priorities for the successful continuation of the transition process, namely: Public Security, Justice, Elections, Political Governance, and Economic Measures.",1
"78","The Security Council frequently discusses humanitarian issues in conflict-affected countries.",1
"79","Some of these children were recruited into the Maoist army in violation of the Comprehensive Peace Agreement, while others were recruited into CPN (Maoist) affiliated organizations. Approximately 30 per cent of these children were released after a few days with CPN (Maoist), and approximately 20 per cent were later found to be in Maoist army cantonment sites.",0
"80","As of the end of this reporting period, a total of 37% of the DF effluent delivered by the MV Cape Ray on August 30 and 31, 2014 had already been destroyed.",0
"81","To be held on Wednesday, December 19, 2012, at 15:15",0
"82","In response to the events in the Syrian Arab Republic, including the report received by the United Nations High Commissioner for Human Rights, the Under-Secretary-General welcomed the Human Rights Council's recent decision to establish an international commission of inquiry.",1
"83","Cost is defined as the nominal value plus any unamortized premium or minus any unamortized discount.",0
"84","(a) Appointment of UTO personalities to positions at all levels of the executive branch - end of September.",0
"85","However, there was a clear decrease in stunted growth or chronic malnutrition (20.4 percent vs. 26.7 percent).",0
"86","Calls upon parties to armed conflict to make and implement specific time-bound commitments to combat sexual violence, including, inter alia, issuing clear orders across chains of command prohibiting sexual violence and stipulating the prohibition of sexual violence in codes of conduct and military field operations manuals or equivalent, and to make and implement specific commitments to investigate alleged abuses in a timely manner to hold perpetrators accountable.",1
"87","Florence Rita Aryeh until December 31, 2010 Emil Francis Short until December 31, 2010",0
"88","S/AC.29/2004/(3)/6",0
"89","51. The success of the transition will be jeopardized if elections are not held in the Democratic Republic of the Congo no later than 30 June 2006.",0
"90","Noting recent developments and initiatives at the international, regional and subregional levels to prevent and suppress international terrorism, and recognizing the work of the Global Counterterrorism Forum, in particular its recent adoption of a comprehensive set of good practices to address the phenomenon of foreign terrorist fighters and its publication of several other framework documents and good practices, including in the areas of countering violent extremism, criminal justice, prisons, kidnapping for ransom, support for victims of terrorism and community policing, to assist interested States in practical application",0
"91","Reaffirming also the imperative to combat terrorism in all its forms and manifestations and by all means, in accordance with the Charter of the United Nations, and emphasizing also that States must ensure that any measures taken to combat terrorism comply with all their obligations under international law and adopt such measures in accordance with international law, in particular international human rights law, refugee law and humanitarian law.",1
"92","Total cash resources (cash and term deposits and cash pool) amounted to $955.90 million as at 31 December 2009, compared with $1.04 billion as at 31 December 2007, a decrease of 8 per cent.",0
"93","UNRWA also delivered 3,000 polio vaccines for use inside Yarmouk.",0
"94","123. When militias join the armed forces in attack, they can be said to operate under the effective control of the Government, fully consistent with the concept of control (established in 1999 in TadiÄ (Appeal), paras. 98-145).",0
"95","V. Humanitarian situation, recovery and return",0
"96","(Maintenance equipment and stores - USD 703,572",0
"97","(f) To cooperate with other relevant Security Council sanctions committees and the Committee established pursuant to paragraph 6 of its resolution 1373 (2001).",1
"98","The Committee seeks to ensure that the Consolidated List is dynamic and responsive to the changing threat of Al-Qaida and the Taliban.",1
"99","In some recent cases, such as those in CÃ´te d'Ivoire and Libya, the Council welcomed the commissions of inquiry established by the Human Rights Council. This has shown how closely linked concrete actions to promote peace and security are to the protection of human rights.",1
"100","8. The Commission shall commence its activities on a date to be determined by the Secretary-General, which will be formally communicated to the Government of Pakistan.",1
"101","::: Some Security Council members called on Member States that have not yet done so to accede to the counter-terrorism conventions and protocols negotiated under the auspices of the United Nations.",1
"102","25. Reiterates its invitation to the Secretary-General to continue to transmit relevant information and analysis on the protection of civilians to the Council, if he considers that such information or analysis may contribute to the resolution of matters of which it is seized; requests him to continue to include, as appropriate, observations relating to the protection of civilians in armed conflict in his written reports to the Council on matters of which it is seized, and encourages him to continue consultations and to take concrete steps to enhance United Nations capacity in this regard.",1
"103","19. Hexa-aza-iso-wortzatin (CAS 135285-90-4) (CL-20 or HNIW); and CL-20 clarates.",0
"104","One of the strikes targeted Kansafra hospital, destroying its infrastructure and equipment.",0
"105","All provinces and the autonomous city of Buenos Aires became parties to Law 24059.",0
"106","Head office and branch office expenses",0
"107","Expressing its deep solidarity with victims of terrorism and their families, stressing the importance of assisting and supporting victims of terrorism and their families to cope with bereavement and grief, recognizing the important role that networks of victims and survivors play in the fight against terrorism, including by courageously speaking out against violent and extremist ideologies, and in this regard welcoming and encouraging efforts and activities in this field by Member States and the United Nations system, including the Counter-Terrorism Implementation Task Force, in this regard.",1
"108","Calling for a deeper analysis of the common goals of the human rights, development and security communities, the UN system and Member States, the High Commissioner emphasized that human rights violations are often the root cause of armed conflicts, as was the case in Somalia and Bosnia and Herzegovina.",1
"109","37. As part of the Division's efforts to recruit well-qualified experts to serve on sanctions monitoring groups and panels, as is the case every year, a note verbale was sent to all Member States in December requesting them to nominate qualified candidates for inclusion on the Division's roster of experts.",1
"110","The verdict is expected in December 2010.",0
