"","ar_en_TRANSFORMERS","VerCoop"
"643","Urging the Government of the Sudan, the Liberation and Justice Movement and the Mohammed Bashar faction of the Justice and Equality Movement to fulfil the commitments made under the Doha Document for Peace in Darfur, and urging all parties, in particular other armed movements that have not signed the Doha Document, to engage immediately and without preconditions in peace efforts and to do their utmost to achieve a comprehensive peace settlement on the basis of the Doha Document, and to conclude an agreement on a permanent ceasefire without further delay,",1
"644","To be held on Tuesday, 19 November 2013, at 10 a.m.",0
"645","I also propose to the Security Council that it authorize the Secretary-General to provide whatever assistance he deems necessary to the Tripartite Commission established by the sister Governments of Honduras, El Salvador and Nicaragua in order to allow for the resumption of negotiations on and the operationalization of the regime of common sovereignty over the Gulf of Fonseca, with a view to the integrated social, economic and environmental development of the Gulf.",1
"646","The Council supports the idea of establishing within the Secretariat a unit to assist in the establishment of the rule of law and looks forward to receiving the Secretariat &apos; s proposals on the implementation of the recommendations contained in paragraph 65 of the report of the Secretary-General on the rule of law and transitional justice in conflict and post-conflict societies (S/2004/616).",1
"647","Recognizes that, while progress has been made on gender equality, enhanced efforts are needed, including to achieve measurable and practical goals, to ensure the rights of women and girls and to ensure that all women and girls in [the country concerned] are protected from violence and abuse, are protected by law and have equal access to justice, strongly condemns discrimination and violence against women and girls, in particular violence aimed at preventing girls from attending school, stresses the importance of the implementation of Security Council resolutions 1325 (2000), 1820 (2008), 1888 (2009), 1889 (2009) and 1960 (2010), and recalls its commitments to gender mainstreaming and to ensure that women fleeing domestic violence have access to safe and secure havens;",1
"648","The situation in Somalia (17 March 1992; 29 July 2009).",0
"649","28. Uganda remains committed to the Lusaka Peace Agreement and its subsequent agreements, as the Lusaka Framework adequately accommodates the two dimensions of the conflict, namely, the internal issue and the security concerns of the neighbours.",1
"650","95. The situation in Myanmar (15 September 2006; 18 March 2008).",0
"651","S/RES/2121 (2013), pp. 8",0
"652","(f) Welcomed and stressed the importance of the readiness expressed by the Executive Directorate to participate actively in and support all relevant activities within the framework of the United Nations Global Counter-Terrorism Strategy, including within the Counter-Terrorism Implementation Task Force established to ensure overall coordination and coherence in the counter-terrorism efforts of the United Nations system.",1
"653","Rape and other crimes of sexual violence have occurred, but they have not been widespread and have not occurred regularly to the extent that they amount to a crime against humanity.",0
"654","3. In the view of the participants, these events, with their seriousness, serve as a reminder of the need and urgency to speed up the process that would lead to inclusive dialogue among the Malian parties, in a manner that would lay the foundations for genuine reconciliation between Malians and for the consolidation of peace, security and stability in the country.",1
"655","106. The Group consulted the Monitoring Group on Somalia, which stated in its report of 9 March 2005 (S/2005/153) that the arms embargo had been violated by the provision of arms, explosives and related materiel and military training to the Islamic Union, an entity on the Consolidated List.",1
"656","The Team intends to continue its work with the Branch, which should be the selected partner of the United Nations in most of its counter-terrorism capacity-building efforts, in order to avoid duplication of efforts.",1
"657","To be held on Wednesday, 21 November 2012, at 10 a.m.",0
"658","In most cases, such assistance can be provided in a form of aid that can be used to benefit from available commercial transport.",0
"659","The Council stresses the need for an urgent dialogue between the new Government, when constituted, and the international community on ways to assist the Government in using the transition in a constructive manner to achieve the objectives of reconciliation, stability and reconstruction.",1
"660","""The Security Council expresses its deep concern at the tense situation prevailing in Blue Nile and Southern Kordofan States.",0
"661","Recognizing the important contribution of the Council &apos; s arms embargo in combating the illicit transfer of small arms and light weapons, in mitigating conflicts and in creating conditions conducive to the peaceful settlement of situations that threaten to disturb international peace and security, and recognizing also the contribution of the Council &apos; s arms embargo in supporting conflict prevention, post-conflict peace-building, disarmament, demobilization and reintegration and security sector reform,",1
"662","The promotion process was fully ensured by the Government with the support of a committee of five international experts (from Australia, Malaysia, New Zealand, Portugal and Singapore) and technical support from UNMIT police.",1
"663","Abdelaziz Ibrahim Sulaiman Al-Badawi (Sa &apos; di)",0
"664","Content of the Heritage Centre - US$4,553,795",0
"665","In this regard, it should be noted that that development has largely been achieved thanks to Prime Minister GusmÃ£o &apos; s leadership capacity and the cooperation of political parties represented in Parliament, including opposition parties, which have indicated their willingness to assist in addressing such an important national issue.",0
"666","Training of peacekeeping personnel requests the Secretary-General to ensure that technical support is provided, both in the predeployment phase and in the field, to troop- and police-contributing countries in [the mission], including mentoring and training military and police personnel to protect civilians from imminent threats and taking appropriate measures, including in the area of human rights, sexual violence and gender issues.",1
"667","23. One State has made efforts to combat extremism among militant groups and has supported the production by these groups of publications addressing extremist ideologies, which have been distributed, including one condemning Al-Qaida, at the international level, including on Internet sites.",1
"668","To be held on Friday, 11 November 2011, at 10.30 a.m.",0
"669","KPC alleges a loss during the occupation of 1,300 metric tons of crude oil and 222,600 metric tons of refined products owned and stored at KNPC &apos; s installations.",0
"670","It is intended to be a technical process without any substantial change in boundaries.",0
"671","There are four different classes of stone display on the stock exchange.",0
"672","36. During the reporting period, the Mission continued efforts to raise awareness of HIV/AIDS.",0
"673","Joseph Doresa, editor-in-chief of a weekly magazine -- 11 December 2011",0
"674","Interactions with civil society showed that the mandate and capacity of the Mission were not clearly understood by the population, and there was a perception among the local population that only the intervention brigade could take strong action to protect civilians, which was not true.",0
"675","While both the Government and CPN (Maoist) have made efforts to address the problem of payment of allowances to projected party members, no commitment has been made to provide funds or programmes for the recovery and reintegration of children affected by armed conflict, including those released in unofficially large numbers, and the offer of United Nations assistance has been met with little enthusiasm.",0
"676","Stresses the need for improved coordination and increased exchange of information between the Committee established pursuant to resolution 1267 (1999) (hereinafter referred to as ""the Committee"") and the Committee established pursuant to resolution 1373 (2001);",1
"677","Nevertheless, Russian military forces continue to be known as peacekeepers or ""blue helmets,"" as the overall conflict resolution process in the region takes the form of a United Nations-led peace process.",0
"678","On 1 February 1999, the new Prime Minister obtained the confidence of the deputies of the nation.",0
"679","Ethiopia will accept nothing less than the liberation of its territory first and foremost.",0
"680","This could even have a negative impact on future efforts to combat impunity, including efforts to ensure accountability in the cases of the Commission of Inquiry and to establish the rule of law.",0
"681","To be held on Thursday, 15 July 2010, at 10 a.m.",0
"682","Stressing the urgent need for comprehensive security sector reform and the disarmament, demobilization and reintegration, as appropriate, of [national] armed groups and the disarmament, demobilization, repatriation, resettlement and reintegration of foreign armed groups in order to achieve long-term stability in [the country concerned], recognizing the need to create security conditions conducive to sustainable economic development, and stressing the important contribution of international partners in these areas.",0
"683","The members of the Commission decided that, in order to recommend measures to ensure accountability for alleged crimes and serious human rights violations committed during the above-mentioned period, bearing in mind that the Government of Timor-Leste considers the domestic judicial system, involving a range of international judges, prosecutors and defence counsel, should be the main framework for accountability for such crimes and alleged violations, they should undertake a preliminary assessment of the existing domestic judicial system in Timor-Leste.",1
"684","The regime must now listen to and act on those appeals.",0
"685",":: Counterfeiting or counterfeit currency and using counterfeit or counterfeit currency;",0
"686","The Council stresses the importance and urgency of restoring justice and the rule of law in post-conflict societies, not only to overcome past injustices, but also to promote national reconciliation and help prevent future conflicts.",1
"687","For 27 June 1998 read 27 June 1997",0
"688","37. As part of the Division &apos; s efforts to recruit well-qualified experts to serve on sanctions monitoring groups and groups, as every year, a note verbale was sent to all Member States in December requesting them to nominate qualified candidates for inclusion in the Division &apos; s roster of experts.",1
"689","Those instruments, together with the decentralization policy, clarify the roles and responsibilities of local councils, provincial officials, parliamentarians and traditional authorities in the areas of development decision-making; elections and the maintenance of law and order; and the collection and distribution of local revenues.",0
"690","It is not quite clear what equipment has been inspected.",0
"691","We urge all Member States to take immediate steps to comply with the commitment contained in resolution 2036 (2012) to ban trade in Somali charcoal, particularly by those most active in this trade.",0
"692",":: Explore and pursue more effective ways of obtaining missing information",1
"693","Where applicable, discounts are made for costs saved as a result of non-completion of performance.",0
"694","In conclusion, the High Commissioner identified three steps as 'the way forward &apos; to strengthen the working relationship between the Security Council and United Nations human rights bodies.",1
"695","However, it did not provide an English translation of these documents.",0
"696","11. Directs the Committee to cooperate with other relevant Security Council sanctions committees, in particular the Committee established pursuant to resolution 1988 (2011); listing",1
"697","Calling upon States to cooperate fully with the Counter-Terrorism Committee established pursuant to resolution 1373 (2001), including the recently established Counter-Terrorism Committee Executive Directorate, the ""Al-Qaida and Taliban Sanctions Committee"" established pursuant to resolution 1267 (1999), its Analytical Support and Sanctions Monitoring Team and the Committee established pursuant to resolution 1540 (2004), and further calling upon these bodies to enhance cooperation among themselves,",1
"698","To be held on Friday, 24 May 2002, at 1.45 p.m.",0
"699","However, urgent measures are needed to revitalize the brigade, while ensuring a more active contribution from the framework brigades, both with regard to the paralysis of armed groups and the protection of civilians.",1
"700","62. The Counter-Terrorism Committee and its Executive Directorate should (a) work more actively with relevant subregional organizations, including the Eastern and Southern African Anti-Money Laundering Group, the Southern African Development Community and the Southern African Police Chiefs Cooperation Organization, focusing on activities aimed at improving the implementation of the resolution and remedying shortcomings;",1
"701","In that resolution, the Council requested the Secretary-General to establish within the Secretariat (Security Council Subsidiary Organs Branch) an administrative coordinator to receive requests from listed individuals and entities.",1
"702","Recalling the statement of its President of 8 July 1999 (S/PRST/1999/21), and stressing its call for the inclusion, as appropriate, within specific peace agreements and on a case-by-case basis within United Nations peacekeeping mandates, of explicit provisions for the disarmament, demobilization and reintegration of former combatants, including the safe and timely disposal of weapons and ammunition,",1
"703","The Security Council recalls its demand that all parties to an armed conflict comply fully with the obligations applicable to them under international law relating to the protection of civilians in armed conflict, including journalists, media personnel and associated personnel.",0
"704","Preliminary results of the civil service census indicate a decrease of 8.3 per cent in the number of public sector employees.",0
"705","(y) To consult with representatives of relevant international organizations, including the International Air Transport Association, the International Civil Aviation Organization and the World Customs Organization, with a view to promoting awareness of and greater compliance with the travel ban and the arms embargo;",1
"706","Let us speak frankly: these reports from the press, human rights groups and civilians on the ground raise serious concerns about the nature and scope of the conflict.",0
"707","""The Security Council supports the introduction of the indicators contained in the report of the Secretary-General (S/2010/498), including by relevant United Nations entities, to serve as an initial framework for the follow-up to its resolution 1325 in armed conflict, post-conflict and other situations relevant to the implementation of resolution 1325, as appropriate, taking into account the specificity of each country.",1
"708","By paragraph 8 of the same resolution, the Council mandated the Committee to identify individuals and entities: (a) who had participated in or provided support for acts that threatened or threatened the peace, security or stability of Somalia; (b) who had violated the general and complete arms embargo; and (c) who had impeded the delivery of or access to humanitarian assistance to Somalia.",1
"709","Moreover, mobile armed groups that rely on banditry tend to be more brutal in their tactics, as they are less motivated to establish local public support bases.",0
"710","These meetings will also be used to review general issues important to the Committee &apos; s work with a view to promoting a more innovative and dynamic approach to the work of the Executive Directorate and to develop new ideas on how the Organization can respond more effectively to the growing terrorist threat.",1
"711","1. Central Customs and Customs Board",0
"712","In addition to the 12 thematic counter-terrorism conventions), in the absence of a universally agreed definition of terrorism, the List is both a symbol of international resolve and a practical measure to meet the global challenge to international peace and security posed by Al-Qaida, the Taliban and their associates.",1
"713","Somalia was experiencing an unprecedented moment of change and optimism, and it was important to seize that opportunity.",0
"714","22. At its 44th formal meeting, on 1 May 2014, the Working Group discussed the report of the Secretary-General on children and armed conflict in Mali (S/2014/267) covering the period from January 2012 to December 2013.",1
"715","The capacity of national security forces to respond to these threats in remote areas remains limited owing to capacity constraints.",0
"716","Regional cooperation in border management is constantly improving, including through joint patrols, information exchange and regional border control and customs cooperation mechanisms.",0
"717","Council members welcomed the efforts of the Government in the fight against LRA, as well as the African Union Regional Cooperation Initiative for the elimination of LRA, and the appointment of an African Union Special Envoy to coordinate the initiative.",1
"718","In a meeting with the United Nations Office on Drugs and Crime on 5 August, the new Minister of Justice outlined the efforts of the new Government to renew unity to align it with the objectives of the West African Coast Initiative. On 27 October, more than 100 parliamentarians and Government representatives adopted a political declaration reaffirming Guinea-Bissau &apos; s commitment to supporting initiatives to combat transnational organized crime, including drug trafficking, corruption, money-laundering and terrorism, and called for continued United Nations support to strengthen national institutions in this area.",1
"719","S/AC.26/Dec.19 (1994)",0
"720","16. Decides to remain seized of the matter.",0
"721","These changes, in addition to re-establishing the hope of the people of the Republic, have provided the Mission with a new opportunity to improve its consultations with the federal authorities and engage in a constructive dialogue on issues of mutual concern.",1
"722","The Council and the troop- and police-contributing countries heard briefings by the Assistant Secretary-General for Peacekeeping Operations, Edmond Millet, the Deputy Military Adviser, Abhijit Goha, and the Acting Police Adviser, Andrew Carpenter.",1
"723","The Security Council looks forward to hearing further details on the proposals of the Special Representative of the Secretary-General.",0
"724","We cannot risk wasting human and financial investment in the Democratic Republic of the Congo because of the frustration of citizens, which could eventually lead to a renewed crisis.",0
"725","In this regard, the Heads of State and Government identified three main priorities:",0
"726","42. At the request of Working Group II of the Contact Group on Piracy off the Coast of Somalia, the United Nations Interregional Crime and Justice Research Institute, with the support of the Government of Italy, organized two informal expert group meetings in 2013 to draft a set of guidelines, standards and best practices for the use of armed security personnel contracted by private companies on board commercial vessels for use by private companies and interested Governments.",1
"727","'The Security Council expresses its concern that aircraft or other means of transport originating from the territory controlled by ISIL and ANF can be used to transport gold or other valuable items and economic resources for sale on international markets, or for the transport of arms and equipment for use by ISIL and ANF, recalls that individuals or entities who participate in these activities may be entitled to be included on the sanctions list by the 1267 and 1989 Committee; expresses its concern at reports that items of Aryakological, historical, cultural and religious significance are illegally transferred outside the territory controlled by ISIL and ANF, from which the two groups may receive revenue, and calls upon Member States to take appropriate measures to prevent this illegal commercial activity; states in this regard that all States are required to operate so that no funds, financial assets or economic resources are made available, directly or indirectly, to ISIL, ANF and other individuals, groups, undertakings and entities associated with Al-Qaida, in favour of ISIL and ANF, from which ISIL and other individuals, groups, undertakings and entities may receive revenue; and looks forward to the Committee on Al-Qaida Sanctions to consider in depth the relevant recommendations of the ISIL and the Monitoring of such activities pursuant to the resolution, which the ISIL has received such activities.",0
"728","8. The Committee shall commence its activities on a date to be determined by the Secretary-General and shall be formally communicated to the Government of Pakistan.",1
"729","The decision of the European Union to commence negotiations with Serbia and Montenegro on the Stabilization and Association Agreement is an important step in this regard.",1
"730","Northern Darfur: 68 per cent;",0
"731","At the 5798th meeting of the Security Council, held on 11 December 2007, in connection with the Council's consideration of the item entitled ""Threats to international peace and security caused by terrorist acts,"" the President of the Security Council made the following statement on behalf of the Council:",1
"732","The only way to make progress on this issue is to find practical solutions to overcome restricted access, especially with States that often respond in specific cases.",0
"733","In 1980, FACI introduced six Dassault/Dornier Alpha Jet CI light aircraft for attacks and training.",0
"734","Metals are usually marked in the cold way, i.e. by punching, while others are marked in the drill.",0
"735","32. To date, the Council has not requested the Secretary-General to report to it on his efforts, as called for in the presidential statements of 2009 and 2010, to mainstream drug trafficking as a factor influencing conflict prevention strategies, conflict analysis, integrated mission assessment and planning and peacebuilding support.",1
"736","Requests the Secretary-General and relevant United Nations agencies, inter alia, through consultation with women and women-led organizations, to develop, as appropriate, effective mechanisms to ensure the protection of women and girls from violence, including in particular sexual violence, in and around United Nations-run refugee and internally displaced persons camps, in all disarmament, demobilization and reintegration processes and in efforts to reform the justice and security sectors assisted by the United Nations.",1
"737","(a) To become parties, as a matter of urgency, to all relevant international conventions and protocols relating to terrorism, in particular the 1999 International Convention for the Suppression of the Financing of Terrorism, to support all international initiatives to that end and to make full use of the sources of assistance and guidance that are now available;",1
"738","(f) To cooperate with other relevant Security Council sanctions committees and with the Committee established pursuant to paragraph 6 of its resolution 1373 (2001);",1
"739","In conclusion, I would like to make a number of recommendations on which fact-finding mechanism is being established:",1
"740","Emphasizing the central role of the United Nations in the global fight against terrorism and welcoming the adoption by the United Nations General Assembly of the United Nations Global Counter-Terrorism Strategy (A/60/288) on 8 September 2006 and the establishment of the Counter-Terrorism Implementation Task Force to ensure overall coordination and coherence in the counter-terrorism efforts of the United Nations system,",1
"741","However, the Social Democratic Party led by the Deputy Prime Minister announced that he would not withdraw from the coalition in order to prevent the destabilization of the Government.",1
"742","They also called upon the Forces nouvelles to begin the demobilization, disarmament and reintegration process agreed to at the Accra meeting expeditiously and before 15 October without preconditions, and stressed the need for the disarmament of all paramilitary and militia groups as well.",1
"743","This Commission, which should be chaired by an international member, should be composed of persons of established international standing, some of whom specialize in law (in particular international law, law of damage or commercial law), and some in accounting and settlement of environmental losses and damage.",1
"744","Damage to non-commercial natural resources",0
"745","As members of the Security Council know better than anyone, the Arab-Israeli conflict is one of the greatest permanent diplomatic challenges the world has faced since the mid-20th century. At the heart of the Israeli-Palestinian conflict is a conflict between competing and contradictory historical accounts and collective aspirations and identities.",0
