"","ar_en_DEEPL","VerCoop"
"1350","2. Reiterates that the authorities in Bosnia and Herzegovina bear the primary responsibility for further successful implementation of the peace process and that the continued willingness of the international community and major donors to assume the political, military and economic burden of implementation and reconstruction efforts will be determined by the compliance and active participation of all authorities in Bosnia and Herzegovina in implementing the Peace Agreement and rebuilding a civil society, in particular in full cooperation with the ICTY in strengthening common institutions and facilitating returns of refugees and displaced persons.",1
"1351","Reaffirming that continued international efforts to enhance dialogue and broaden understanding among civilizations, to prevent the indiscriminate targeting of different religions and cultures, and to address unresolved regional conflicts and global issues of all kinds, including development issues, will contribute to strengthening the international fight against terrorism.",1
"1352","7. Reaffirms that ending impunity is essential for societies in conflict or recovering from conflict to reconcile with the past abuses committed against civilians affected by armed conflict and to prevent such abuses in the future, draws attention to the full range of justice and reconciliation mechanisms that could be considered, including national, international and âmixedâ criminal tribunals and truth and reconciliation commissions, and notes that these mechanisms can promote not only individual responsibility for serious crimes, but also peace, truth, reconciliation and the rights of victims.",1
"1353",":: Regular coordination between civilian and military components of missions, and between missions and humanitarian actors: Regular coordination between the civilian and military components of missions, and between missions and humanitarian actors, to standardize expertise in the field of protection of civilians.",0
"1354","645. The Commission has decided to withhold the names of these persons from the public domain. This decision is based on three main reasons: (a) the importance of the principles of fair trial and respect for the rights of suspects; (b) the fact that the Commission has not been granted investigative or charging authority; and (c) the vital need to ensure that witnesses are protected from possible harassment or intimidation.",1
"1355","These two menus work best if they are kept separate.",0
"1356","Welcoming the establishment of the Office of the Ombudsperson pursuant to resolution 1904 (2009) and the strengthening of the Ombudsperson's mandate in resolution 1989 (2011), noting the important contribution of the Office of the Ombudsperson to providing additional integrity and transparency, recalling the Security Council's firm commitment to ensuring that the Office of the Ombudsperson can continue to play its role effectively in accordance with its mandate, and recalling also the Security Council's presidential statement of 28 February 2011 (S/PRST/2011/5).",0
"1357","The international community will need the capacity to move this process forward.",1
"1358","34. The transfer of areas subject to land adjustments will take place in six phases.",0
"1359","(Incentive payments to employees (SAR 3,562,429).",0
"1360","Audit certificates are expected to be issued by the auditing organizations of the member states.",0
"1361","113. The Group also believes, based on its overall analysis, that the Council may wish to request all States, in particular arms-exporting countries, to exercise the highest degree of responsibility in small arms and light weapons transactions to prevent the illicit transfer and re-export of arms and related materiel, in violation of the measures set out in the resolutions on Al-Qaida/Taliban.",1
"1362","âThe Security Council urges the DPRK to immediately return to the Six-Party Talks without precondition, work towards the swift implementation of the September 19, 2005 Joint Statement, and abandon all nuclear weapons and existing nuclear programs.",1
"1363","Also in the Bakool region in central Somalia, on June 10 and 11, clashes between militiamen from the Hadamo and Ogaden clans in the Bardi region killed at least four people and injured 10. On June 15, 16 people were killed and 20 injured in fighting between militiamen over land and grazing rights in the same area.",0
"1364","Background 2014 marks the fifteenth anniversary of the Security Council's work on the protection of civilians in armed conflict.",1
"1365","For example, a military unit, under orders from above, proceeds to arrest a number of enemy civilians in violation of international law; however, in the course of the military operation, a soldier kills or tortures one of the civilians in question.",0
"1366","In addition to being held responsible, under the principle of joint criminal enterprise, for crimes committed by other individuals during the attacks, these individuals could be suspected of indiscriminate attacks on civilians, which is a war crime.",0
"1367","See also, for example, S/RES/1325 (2000), op. 6; S/RES/1296 (2000), op. 19.",0
"1368","5. The Coordinator conducted three visits to the region (in February, April and May) that coincided with the meetings of the Technical Subcommittee and the Tripartite Commission. On 9 February 2011, he was received by Sheikh Mohammed Sabah Al-Salem Al-Sabah, Deputy Prime Minister and Minister for Foreign Affairs of Kuwait, who noted that the emerging spirit of cooperation between Iraq and Kuwait should be translated into practical, results-oriented steps to resolve the remaining issues, including the files on missing persons and property.",1
"1369","During the Janjaweed attack on the village of Mbarasa, West Darfur, in November 2003, 20 girls were abducted and taken to Amar camp.",0
"1370","The Security Council reiterates its call on parties to armed conflict [mentioned in the relevant report of the Secretary-General] to prepare, without further delay, if they have not already done so, time-bound and specific action plans to halt the recruitment and use of children in violation of applicable international law and to address all violations and abuses committed against children in close cooperation with [the Special Representative of the Secretary-General for Children and Armed Conflict], as well as with UNICEF and United Nations Country Task Forces on Monitoring and Reporting.",0
"1371","5. Mohammad Ahmad Al-Shteiwi, from Nimr, Daraa",0
"1372","Call for strict compliance by parties to armed conflict with the provisions of international humanitarian, human rights and refugee law, including in relation to the following points:",1
"1373","No license has been granted to import diamonds from Liberia.",0
"1374","8. The situation in Somalia (March 17, 1992; March 20, 2009).",0
"1375","This payment was made by states to their nationals who filed claims identified by the Commission as compensable.",0
"1376","Counter-terrorism legislation has also been adopted, giving judicial and prosecutorial authorities sufficient legal powers to prosecute terrorists.",0
"1377","In particular, consideration should be given to advertising vacancies more widely by targeting professional associations and changing the wording of language requirements.",1
"1378","We have called on the Council on several occasions to take action to compel Israel to cease its military attacks, ensure the protection of the civilian population and stop all illegal punitive measures through which it is causing a humanitarian catastrophe in the Gaza Strip.",0
"1379","At the 6897th meeting of the Security Council, held on December 20, 2012, in connection with the Council's consideration of the item entitled âPost-conflict peacebuildingâ, the President of the Security Council made the following statement on behalf of the Council:",1
"1380",":: An appeal to the Security Council to establish, in agreement with the African Union, an international force to neutralize armed groups and support national reconciliation and the establishment of stable democratic institutions in Libya",1
"1381","In addition, a mobile team visits remote communities, especially minority groups, who may not have access to the two centers.",1
"1382","Expresses its determination to require, where appropriate, parties to the conflict to make special arrangements to meet the protection and assistance needs of children, women and other vulnerable groups, including by promoting âimmunization daysâ and other opportunities for the safe and unhindered implementation of essential services.",1
"1383","Authorities have confirmed that there are no Ivorian refugees or camps in Ghana.",1
"1384","Maternal and child mortality rates remain very high, and overall immunization coverage is low (tuberculosis: 30%; polio: 22%; measles: 24%).",0
"1385","Seven countries have established sufficient jurisdiction to prosecute terrorism-related offenses in their legislation, another five have taken steps in this direction, and nine have insufficient information.",0
"1386","60. In its resolution 1783 (2007), the Security Council requested the Secretary-General to continue to take the necessary measures to ensure full compliance within the Mission with the United Nations zero-tolerance policy on sexual exploitation and abuse.",1
"1387","On 10 November, the Council was briefed in closed consultations by the Deputy Permanent Representative of Luxembourg to the United Nations, Olivier Maes, on behalf of the Chairman of the Security Council Committee established pursuant to resolution 1718 (2006) concerning the Democratic People's Republic of Korea, on the work of the Committee during the period from 5 August to 9 November. The briefing was provided in accordance with paragraph 12 (g) of resolution 1718 (2006).",1
"1388","In other words, residents who survived the attacks on the villages were not just killed in an effort to eradicate the group; they were forced to leave their homes and live together in areas chosen by the government.",0
"1389","I urge all Somali leaders to take the necessary steps to resolve their differences.",1
"1390","The Council and troop- and police-contributing countries heard briefings by Edmond Mulet, Assistant Secretary-General for Peacekeeping Operations, Abhijit Guha, Deputy Military Adviser, and Andrew Carpenter, Acting Police Adviser.",1
"1391","But the grave risk remains that as a result of this decision - which violates the Bonn and Berlin documents - the country will face an explosive situation fraught with new armed resistance and internal divisions in the power structures.",0
"1392","F-FDTL became the armed wing of the National Council of Resistance of Maubere (CNRM). This council included FRETILIN, UDT and other nationalist parties. As a result, FRETILIN lost absolute control over the politics of the resistance.",0
"1393","He posed key questions to guide the discussion on the Council's role in ensuring accountability, including the following: What lessons can be learned and good practices can be identified from the Council's efforts to ensure criminal accountability? What are the challenges for the various fact-finding mechanisms? How can greater importance be given to reparations for accountability? What further steps can the Council take to ensure accountability for violations committed in armed conflict?",1
"1394","The Council is considering the possibility of using the International Fact-Finding Commission established in accordance with Article 90 of Additional Protocol I to the Geneva Conventions.",1
"1395","Decides that [the Mission] shall have the following mandate in the order of prioritization set out below: Protection of civilians (g) To support the Government's efforts with international partners and neighboring countries to create conditions for the safe, voluntary and dignified return of internally displaced persons and refugees, or voluntary local integration or resettlement.",0
"1396","The Council could also explicitly require Member States to prevent listed individuals and entities from accessing, establishing or maintaining military or terrorist training facilities within their borders, thereby extending the scope of the arms embargo to include training and recruitment comprehensively.",1
"1397","There is an element of risk that attention will be diverted from these criteria to focus on the issue of territorial status.",0
"1398",":: Closer cooperation with other subsidiary bodies of the Council, specifically the Committees established pursuant to resolutions 1267 (1999) and 1540 (2004) and their experts: :: Closer cooperation with other subsidiary bodies of the Council, specifically the Committees established pursuant to resolutions 1267 (1999) and 1540 (2004) and their experts, including with regard to the exchange of information, visits and assistance as appropriate.",1
"1399","Encourages troop- and police-contributing countries, in consultation with the Secretary-General, to consider what measures they can take to enhance the awareness and responsiveness of their personnel participating in United Nations peacekeeping operations to protect civilians, including women and children, and to prevent sexual violence against women and girls in conflict and post-conflict situations, including, to the extent possible, deploying a greater proportion of women peacekeepers or police.",1
"1400","On 16 December, the Chairman of the Security Council Committee established pursuant to resolution 1591 (2005) concerning the Sudan and Permanent Representative of Colombia, NÃ©stor Osorio, reported to the Council on 90 days of the Committee's work.",0
"1401","28. Shortly after March 1, 2009:",0
"1402","However, day by day, they are clearly showing a more positive attitude towards the mission.",1
"1403","9. On 25 June 2008, the Committee held informal consultations with the Monitoring Group re-established pursuant to resolution 1811 (2008), and also discussed the Security Council's request in paragraphs 6 and 7 of resolution 1814 (2008) for recommendations on specific measures that the Council might impose on individuals and entities impeding the peace process or violating the arms embargo.",1
"1404","To be held on Thursday, July 7, 2005, at 12.50 p.m.",0
"1405","Additional costs (Iraq): Wages paid without work, rental payments (offices)",0
"1406","There was broad support for efforts to neutralize the threat posed by ADF and other armed groups in the eastern Democratic Republic of the Congo, including FDLR, as mandated in resolution 2147 (2014).",1
"1407","III. Implementation of the June 20, 2011 Agreement",0
"1408","I also condemn Hezbollah's reckless disregard for the wishes of Lebanon's elected government and the interests of the Lebanese people and the wider region.",0
"1409","The blockade must be lifted immediately to allow Gaza's civilian population access to water, work, commerce, medical care and education - access to their basic needs.",0
"1410","The budget for this one-year operation is estimated at $190 million.",0
"1411","11. Expresses its willingness to consider how peacekeeping mandates can better address the negative impact of armed conflict on civilians.",1
"1412","52. Allegations of rape of minors, including very young girls, remain a matter of serious concern. The Mission has regularly participated in the work of regional committees on sexual violence, as a means of strengthening support for child victims of rape.",0
"1413","This experience could be a practical mechanism for paying salaries in the future.",0
"1414","Welcoming and expressing support for the steps taken to conclude nuclear-weapon-free zone treaties, and reaffirming its conviction that the establishment of internationally recognized nuclear-weapon-free zones on the basis of arrangements freely arrived at among the States of the region concerned on a voluntary basis among the States of the region concerned, in accordance with the guidelines established by the United Nations Disarmament Commission in 1999, is supportive of global and regional peace and security, strengthens the non-proliferation regime, and contributes to the realization of nuclear disarmament objectives.",1
"1415","Only two of the three centers have since reopened.",0
"1416","460. In its recommendations, the National Commission proposed administrative and judicial measures, in particular that the causes of the conflict should be studied and that the administrative deficit, which was one of the factors that aggravated the conflict, should be corrected.",1
"1417","On behalf of the Chairperson of the Commission, Nkosazana Dlamini-Zuma, I am transmitting herewith the communiquÃ© adopted by the Peace and Security Council at the conclusion of the meeting (see enclosure).",1
"1418","13. Reports of children abducted during recent attacks on the civilian population illustrate the terrible price Darfur's children are paying in this civil war.",0
"1419","15. Expresses its readiness to consider the appropriateness and feasibility of establishing temporary security zones and safe corridors for the protection of civilians and the delivery of assistance in situations involving the threat of genocide, crimes against humanity and war crimes against civilian populations.",1
"1420","::: Fact-finding mechanisms should be established early enough in a crisis to enable them to contribute to the prevention of further violations.",1
"1421","Countries in this region face a serious transnational terrorist threat that requires concerted and coordinated regional efforts to address.",0
"1422","U.S. Senate records show that he was part of the Contra-Gate operation, receiving paychecks from both U.S. intelligence agencies and the U.S. State Department.",0
"1423","The Security Council also notes the importance of close cooperation within and between all government agencies and with international organizations in combating terrorism and incitement to terrorism.",1
"1424","Commercialization includes possession, as well as selling, importing, or exporting.",0
"1425","Reaffirming also its resolutions 1368 (2001) of 12 September 2001 and 1373 (2001) of 28 September 2001, and reiterating its support for international efforts to eradicate terrorism, in accordance with the Charter of the United Nations.",1
"1426","Council members unanimously expressed concern at the current state of the peace process and expressed the hope that the Group of Friends of the Secretary-General at its next meeting would be able to move the situation forward. Other issues",1
"1427","In terms of further cooperation, he suggested increasing the impact of the INTERPOL network through, for example, regional mechanisms for sharing information with law enforcement officers, as well as strengthening implementation guidance.",1
"1428","Beyond its immediate consequences, the attack on Aru Charo and nearby villages is of serious concern because it may signal the beginning of the militias' deliberate targeting of internally displaced populations and the inability, or unwillingness, of government forces to effectively protect the camps and villages where these displaced people reside.",0
"1429","The review examined 488 names of individuals, groups and entities subject to the Al-Qaida and Taliban sanctions regime in order to update entries or remove them from the List in cases where the Committee determines that they are no longer appropriate to remain on the List.",0
"1430","Letter dated December 22, 2009, from the Chairman of the Security Council Committee established pursuant to resolution 1518 (2003) addressed to the President of the Security Council",0
"1431","47. In addition to the marked increase in arms flows into Somalia, both sides are also very actively distributing arms and ammunition to their respective militias, equipping militiamen with individual combat equipment, securing and stockpiling food, medicine, fuel and other necessities for sustained fighting, organizing themselves into military-style structures, escalating militia recruitment and training and developing strategies and plans to militarily defeat the other side.",0
"1432","From the outset, efforts must be made to ensure coordination with law enforcement and other national authorities; develop appropriate national legal frameworks; and strengthen the capacity of judicial and law enforcement systems.",1
"1433","B. Counting and numbering boats and monitoring their movement from one area to another.",0
"1434","On behalf of the Security Council Committee established pursuant to resolution 751 (1992) concerning Somalia, and in accordance with paragraph 3 (i) of Security Council resolution 1587 (2005), I have the honour to transmit herewith the report of the Monitoring Group on Somalia (see enclosure).",1
"1435","Convinced also that a political settlement of the conflict would help to combat and facilitate the elimination of the scourge of terrorism and related activities that persist in the region.",0
"1436","71. Member States should be invited, in their tracing efforts, to utilize, as appropriate, the INTERPOL Global Police Communications System âI-24/7â and the INTERPOL Electronic Weapons Tracing System.",1
"1437","But urgent measures are needed to revitalize the brigade and at the same time ensure a more active contribution from the framework brigades both in terms of operations to neutralize armed groups and protect civilians.",1
"1438","Article 4, paragraph 1 of the decree prohibits the entry into or transit through Switzerland of the natural persons listed in the annex.",0
"1439","Members expressed their willingness to consider, in due course, updated reports on planning for a smooth transition to the Sustainable Development Assistance Framework by the end of the Bureau's mandate in May 2006.",1
"1440","The answer to this, in my view, is not to reduce spending on hybrid courts, but to direct more effort and funding to national post-conflict justice systems in general.",0
"1441","In addition, a number of Member States have provided material funding, technical expertise and significant assets to the Joint Mission, and several other Member States are expected to confirm their offers.",0
"1442","European Convention on the Suppression of Terrorism, signed on February 13, 1992; ratified by the Czechoslovak Federal Republic on April 15, 1992; entered into force on July 15, 1992.",0
"1443","The University Council at the summit level.",0
"1444",":: Consultation on and finalization of the draft constitution Consultation and finalization of the draft post-transition constitution",0
"1445","69. As inter-Malian peace talks continue in Algiers, facilitated by the Algerian-led mediation team, I call on all parties to negotiate in good faith to reach a comprehensive, sustainable and enforceable peace agreement that addresses the root causes of the conflict.",1
"1446","Recalling the statement made by its President on 8 July 1999 (S/PRST/1999/21), and reiterating its call for the inclusion, as appropriate, within specific peace agreements and on a case-by-case basis within United Nations peacekeeping mandates, of explicit provisions for the disarmament, demobilization and reintegration of former combatants, including the safe and timely disposal of weapons and ammunition.",1
"1447","âThe Security Council reiterates its support for the establishment of a core group with the task of continuously mobilizing the international community and increasing consultation among key stakeholders to enhance the coordination and effectiveness of assistance to Haiti, and to contribute to the definition of a long-term development strategy aimed at promoting lasting peace and stability in that country.",1
"1448","Resolution 1925 (2010), eleventh preambular paragraph",0
"1449","Article 11 of the 1992 Extradition Act states:",0
"1450","In addition, the Commission found that other victims and witnesses identified attackers from all three categories as Janjaweed.",0
"1451","1. Reiterates its concern at the continuing crisis and deterioration of the situation in CÃ´te d'Ivoire, which constitutes a serious threat to peace and stability in the West African region.",0
"1452","2. The situation in Chad, the Central African Republic and the subregion",0
"1453","He knows who is faithful or qualified and who is unfaithful and unqualified.",0
"1454","Reiterating its request to the Office of the United Nations High Commissioner for Refugees (UNHCR) to continue its consideration of a registration process for refugees in the Tindouf refugee camps.",1
"1455","About 50 per cent of these flights represent transit flights of regular scheduled flights by international airlines, such as Emirates Airlines, Kenya Airways and others, while the other 50 per cent are flights to or from destinations in Somalia.",0
"1456","The trial phase of these proceedings began in July 2004.",0
"1457","In this regard, the Security Council commends the support provided by neighboring countries to refugees from the DRC.",1
"1458","âThe Security Council emphasizes the importance of assisting Member States to promote women's full and equal participation in post-conflict electoral processes and constitutional reforms.",1
"1459","18. Gulbuddin Hekmatyar (QI.H.88.03) is essentially a threat to peace and security in Afghanistan.",0
"1460","Develop a gender action plan in the Department to integrate gender perspectives into conflict prevention, peacekeeping and peacemaking activities.",1
