"","ar_en_DEEPL","MatConf"
"819","31. During the presidential retreat referred to in paragraph 2 above, the President identified a comprehensive restructuring of the public sector, particularly the civil service, as one of his main priorities.",0
"820","As outlined above, there are repeated and credible reports showing that these raids increased dramatically on the night of March 23, and then even more dramatically during the nights that followed.",1
"821","Across the border in the Syrian Arab Republic, Jabhat al-Nusra, an affiliate of al-Qaeda in Iraq, has gained influence and is recruiting by fighting in the Syrian Arab Republic's increasingly fierce civil war.",1
"822","3. Decides to remain seized of the matter.",0
"823","Most of these crimes were committed individually in the context of the prevailing security chaos.",1
"824","The Commission incurred administrative expenses of approximately $11 million in 2006. There was a decrease of $20.7 million compared with $31.7 million in 2005.",0
"825","4. Improvised weapons systems can be assembled from various components in order to commit terrorist acts.",1
"826","99. The main terrorist groups in that region include Jemaah Islamiyah, which has been particularly active in Indonesia, Malaysia and Singapore; the Abu Sayyaf Group; insurgent groups in the Philippines; and separatist rebels in southern Thailand.",1
"827","In this context, Council members emphasized the need to draw lessons from the armed confrontation that followed the country's 2010 presidential elections.",1
"828","In his report, the Secretary-General notes some measures of improvement in all of those areas except for the central issue of local government reform, in particular, decentralization, where there is a lack of progress.",0
"829","Commander Da Cruz disarmed members of the Eastern Border Patrol so that he could provide these weapons.",0
"830","In his briefings to the Council in December 2005 and June 2006, Under-Secretary-General Gambari described the serious human rights and humanitarian conditions in Burma, including the detention of over 1,100 political prisoners, as well as the influx of refugees, drugs, HIV/AIDS and other diseases from Burma.",1
"831","Iceland has deposited instruments of ratification or accession to the following international conventions, as appropriate:",0
"832","Tragically, the deputy commander of the guard and a guard were killed in the attack, while the commander and a supervisor were injured.",1
"833","5. In 2014, the Security Council extended the partial suspension of the arms embargo for the development of the security forces of the Federal Government of Somalia on two occasions, first in resolution 2142 (2014) for six months and subsequently in resolution 2182 (2014) until October 30, 2015.",1
"834","It is important to present the image and acceptance of the police in society as the primary law enforcement agency.",0
"835","36. The number of police personnel deployed to UNOCI as at 7 April was 1,182 against the authorized ceiling of 1,200, comprising 434 officers and 748 formed police unit personnel.",1
"836","Witnesses described how a young man had his eye gouged out. When he lost his sight, he was forced to run and then shot dead.",1
"837","In Egypt, we have been calling for an early and peaceful transfer of power to a civilian government.",0
"838","(a) Threatening the peace and national reconciliation process in CÃ´te d'Ivoire, and in particular obstructing the implementation of the peace process referred to in the Ouagadougou Political Agreement.",1
"839","The concept of operations will also help donors decide on further support for AMISOM at the pledging conference expected to be held in Brussels on July 7, 2006.",0
"840","Their terrorist work encompasses a wide range of activities, including: Suicide attacks, including suicide bombings, fatal hostage-taking, bomb-making, terrorist espionage, terrorist training, document forgery, and the provision of a number of means of financial and material support, including the financing and monitoring of a website used to disseminate data and images related to Al-Qaida.",1
"841","A similar operation in Pristina on November 18 resulted in six arrests.",1
"842","Specifically, the recruitment of persons for the purpose of committing terrorist acts is addressed in Law No. 535/2004 on Preventing and Combating Terrorism.",1
"843","42. Although Togo is a member of the International Cocoa Organization, the lack of comprehensive statistics and figures makes it difficult to reliably estimate the amount of cocoa smuggled into the port of LomÃ©.",0
"844","Operating reserves as of December 31, 2005",0
"845","The dead were buried in eight mass graves in the village market area.",1
"846","7. In North Africa and the Sahel-Sahara region, the influence of armed groups with extremist ideologies, including Al-Qaeda in the Islamic Maghreb (AQIM), has increased.",1
"847","(b) Proper scrutiny of end-user certificates by the responsible agencies of Wassenaar Arrangement member States.",0
"848","23. Although the security situation in the north of the country was relatively calm, a member of the Operation's Moroccan contingent was brutally murdered on August 31 in BouakÃ©.",1
"849","29. Therefore, the highest State authorities indicated that even if a decree prohibiting public demonstrations had not been issued, they would not have allowed or condoned the planned march because of the danger to order and public order.",1
"850","""The Security Council expresses deep concern about the tensions in Blue Nile and Southern Kordofan States.",0
"851","She said no one knows who attacked the helicopter as the incident occurred near Bentiu, where the armed parties are very close to each other.",1
"852","(Chartering of vessels (SAR 7,058,710).",0
"853","Accordingly, the deterioration of power plants and the distribution network in 1999 will continue at a low rate until the rehabilitation projects under phases IV and V are implemented and new additional generation capacity is built to augment the existing generation network.",0
"854","It also appears that quite a few logistical needs must be met in order to finalize the handover.",0
"855","As a third speaker pointed out, without the obligation to cooperate between permanent and elected members, the Council would continually find itself at an impasse, as resolutions required nine votes to be adopted.",0
"856","In a meeting with the United Nations Office on Drugs and Crime on 5 August, the new Minister of Justice outlined the efforts of the new Government to renew the Unit in order to align it with the objectives of the West Africa Coast Initiative. On 27 October, more than 100 parliamentary deputies and Government representatives adopted a political declaration in which they affirmed Guinea-Bissau's commitment to support initiatives to combat transnational organized crime, including drug trafficking, corruption, money-laundering and terrorism. They called for continued United Nations support to strengthen national institutions in this area.",0
"857","To be held on Friday, July 18, 2003, at 10.20 a.m.",0
"858","Decides that the measures referred to in paragraph [relevant] above [the travel ban and assets freeze] shall apply to the following individuals and, as appropriate, entities as designated by the Committee: ... (e) Individuals or entities operating in [the relevant country] who commit grave violations involving the targeting of children or women in situations of armed conflict, including killing and maiming, sexual violence, abduction and forced displacement.",1
"859","Thousands were killed, women were raped, villages were burned, homes were destroyed, and property was looted.",1
"860","Most importantly, it urges these authorities to strictly adhere to the deadline of holding democratic elections by November 2015.",0
"861","As the fighting intensified, the armed forces reinforced their positions in the hilly area by sending a navy ship to Tibar Bay.",1
"862","About 3,000 Janjaweed on horseback attacked the village. Some were in vehicles.",1
"863","C. Disbanding and disarming Lebanese and non-Lebanese militias",1
"864","The DPRK also uses propaganda to incite nationalistic hatred toward official enemies of the state, including Japan, the United States, the Republic of Korea, and its citizens.",1
"865","Prohibit attacks on life and person, in particular murder, amputation, cruel treatment and torture; enforced disappearance; outrages upon personal dignity; rape, sexual slavery, enforced prostitution, forced pregnancy, enforced sterilization and any other form of sexual violence.",1
"866","Most governments also appear to be strongly committed to ensuring that law enforcement agencies respect human rights, although in some cases serious concerns have been raised about abuses by security forces.",0
"867","Permanent Mission of Japan to the United Nations",0
"868","The mechanism, funded by the United Kingdom, through its three working groups on maritime strategy, legal framework and fisheries, provides support to anti-piracy focal points in the federal government and in each region.",0
"869","At least 90 countries suffer from IEDs, and al-Qaeda and its affiliates share information and advice on how best to make and use them.",1
"870","Meeting of Experts on the Biological Weapons Convention",1
"871","Chinese channel Shanghai Media Group, editor Bao Gang -- December 19, 2011",0
"872","11. The active presence of ethnic and community-based militias remains a major source of instability, particularly in the western part of the country, which in recent months has been the scene of violent clashes between ethnic groups.",1
"873","248. Many of the ground and air attacks on villages have resulted in the indiscriminate killing of civilians.",1
"874","Building the capacity of states to prevent proliferation and respond to attacks using weapons of mass destruction",0
"875","It shows that donations are still a source of income, albeit a limited one compared to its other sources of revenue.",0
"876","On November 16, 2014, regime warplanes targeted Maarat Misrin city with a missile, killing five people, including a child and a woman, in addition to destroying residential buildings.",1
"877","The total compensation sought is Cyprus pounds 1,001,869.",0
"878","Following the adoption of Security Council resolution 2100 (2013), which established the United Nations Multidimensional Integrated Stabilization Mission in Mali (MINUSMA) and made support for the preservation of cultural heritage part of its mandate, UNESCO has been working with UN partners to include cultural heritage conservation in peacekeeping and recovery efforts.",0
"879","The use of homemade explosives demonstrates the adaptability of al-Qaeda-affiliated terrorists in countries that effectively enforce the arms embargo.",1
"880","283. On the basis of the Commission's investigations, and based on the pattern of air attacks it has established, the Commission is of the view that the military forces bear responsibility for a very large number of indiscriminate air attacks that have claimed the lives of many civilians.",1
"881","She reiterated the Secretary-General's condemnation of any use of chemical weapons by any party to the Syrian conflict, and reiterated his call for the perpetrators of any such acts to be brought to justice.",0
"882","The World Health Organization (WHO), the United Nations Children's Fund (UNICEF), MSF-Netherlands and other partners conducted a successful vaccination campaign across the entire northwest in January, with a particular focus on Hargeisa.",0
"883","The Mouvement populaire ivoirien du Grand Ouest (MPIGO) is centered in the west of the country in the city of Binhoy and the Movement for Justice and Peace (MJP) is centered in the city of Man.",0
"884","5. During the Cold War, UN Secretaries-General drew attention to specific issues of transnational crime complicating conflict situations already on the Security Council's agenda.",1
"885","Al-Shabaab is showing improvement in its ability to conduct complex terrorist attacks, including in the wider region, as most recently demonstrated by its September 2013 attack on the Westgate Mall in Nairobi.",1
"886","âThe Security Council supports the introduction of the indicators contained in the Secretary-General's report (S/2010/498), including by relevant UN entities, to be used as an initial framework to follow up on the implementation of its resolution 1325 in armed conflict, post-conflict and other situations relevant to the implementation of resolution 1325, as appropriate, taking into account the specificity of each country.",0
"887","They can train recruits and innovate in the planning and execution of attacks. Lashkar-e-Taiba (QE.L.118.05) continues to provide advanced terrorist training, including on improvised explosive devices (IEDs). AQAP (QE.A.129.10) remains a major source of technological innovations.",1
"888","17. The weekly quadripartite meetings allowed the two committees, together with UNOMIG and the CIS peacekeeping force, to regularly discuss security-related matters in the conflict zone.",0
"889","17. More than 8,000 people were recorded as killed in Afghanistan in insurgent-involved incidents during 2007 (A/62/722-S/2008/159, para. 17), compared with 6,000 killed by all types of violence in 2006.",1
"890","Develop practical guidelines for integrating a gender perspective into sustainable reconstruction in the post-crisis environment and comprehensive guidelines for field reference; consider gender and land and property governance in post-conflict situations and develop a toolkit as a basis for considering gender issues in relation to governance programs in the post-conflict environment.",0
"891","(a) This type of loss includes an interest component.",0
"892","The 2008/2009 production of wheat and barley is expected to decrease by up to 51 percent compared to last year.",0
"893","Terrorist and other non-state armed groups with access to transnational criminal markets may have little incentive to exit conflict and enter into a political settlement.",1
"894","Statement by witnesses to the Algiers Agreement",0
"895","III. Legal Framework 16-24 16",0
"896","266. It is clear that the issue of proportionality was not raised when there were no armed groups in the village, as the attack targeted only civilians.",1
"897","19. From an analysis of statements made by al-Qaeda leaders, it is clear that their immediate goal is to terrorize the West to drive it out of the Middle East and other Muslim countries, and to convince Muslims that their world is under attack.",1
"898","For example, many people gathered in Dilej after fleeing their villages, following months of attacks on villages in the area.",1
"899","360. It is clear from the information gathered and examined by the Commission that rape or other forms of sexual violence committed by Janjaweed or Government soldiers in Darfur was widespread and systematic, and could therefore amount to a crime against humanity.",1
"900","(d) Adopt a victim-centered and human rights-based approach to human trafficking, including by giving victims the right to reside in the country and have access to legal protection and basic services, such as medical treatment, education and employment, on the same basis as their fellow citizens.",0
"901","To be held on Tuesday, April 24, 2012, at 10:00 a.m.",0
"902","(d) A 34-person logistics unit from Austria.",0
"903","10. The situation in Georgia (October 8, 1992; June 15, 2009).",0
"904","To be held on Tuesday, December 20, 2005, at 1.05 p.m.",0
"905","She serves as Rapporteur of the Independent Commission of Inquiry on Gaza.",0
"906","All commanders must be held accountable for serious violations committed by fighters under their control.",1
"907","33. On 3 September, the Government of India informed the United Nations of its decision not to renew the contract for the deployment of six Mi-17 helicopters to UNMIL beyond 31 October.",1
"908","We invited our people to join the Popular Defense Forces. They responded by joining and started receiving their instructions from the government as part of the state's military apparatus.â",1
"909","Incidents caused by cluster munitions dropped by North Atlantic Treaty Organization (NATO) forces have been significantly reduced as a result of a change in strategy that has greatly accelerated the clearance of easily accessible cluster munitions.",1
"910","In the past, it was common for authorities to send entire families to political prison camps for political offenses committed by a relative (including ancestors up to the third generation) based on the principle of guilt by association.",1
"911","Colonel Reis and his deputy protested to Brigadier General Ruak, who apologized for the shooting.",1
"912","Expresses deep concern at the increase in localized conflicts, criminality and violence and their impact on civilians, in particular the sharp increase in inter-tribal clashes, and calls on all parties to put an urgent end to such clashes and to seek reconciliation and dialogue ...",1
"913","The Economic and Organized Crime Act does not address the issue of ownership.",0
"914","This provision is clear in the spirit of Article 9 of the Nepal Treaty Act.",0
"915","Calls upon all States to take urgent action to implement fully resolution 1373 (2001), and to assist each other in doing so, and emphasizes the obligation of States to deny financial, safe haven and all other forms of support to terrorists and those who support terrorism.",0
"916","Most of those taken away were executed.",1
"917",":: Clarify Iran's announcement of additional enrichment facilities: Clarification of Iran's announcement of additional enrichment facilities.",0
"918","10. Complaint by Cuba (see S/10855/Add.38).",0
"919","Affirms its intention, when establishing or renewing State-specific sanctions regimes, to take into account the appropriateness of targeted and graduated measures against parties to armed conflict that commit rape and other forms of sexual violence against women and girls in situations of armed conflict.",1
"920","(b) Development of a clean drinking water system and relocation to the site.",0
"921",":: June 2, 2005, journalist Samir Kassir is killed when his car explodes in East Beirut.",1
"922","2. The situation in Chad, the Central African Republic and the subregion",0
"923","I also chose Atabou Bodian to chair the Panel of Experts.",0
"924","41. As detailed below, all available evidence suggests that the opening fire and indiscriminate killings on the morning of 25 March were the result of a coordinated action by security forces.",1
"925","About 20,000 people became homeless in Abidjan due to the deliberate destruction of shantytowns.",1
"926","President Lahoud and Brigadier General Ghazaleh were informed about the explosion at the time it occurred [witness statement].",1
"927","I was taken to Shifa Hospital in a private car, because the ambulance was carrying three or four patients.",0
"928","S/RES/2102 (2013), OP 2",0
"929","A number of contacts resulted in mere exchanges of opinions and/or statements of fact.",0
"930","This report was submitted to the Security Council Committee established pursuant to resolution 1267 (1999) concerning Al-Qaida and the Taliban and associated individuals and entities on 31 March 2008, in accordance with Security Council resolution 1735 (2006), and is currently under consideration by the Committee.",0
"931","One important element is that in a number of villages attacked and burned by militias, the attacks avoided wiping out the entire population that did not flee, instead selectively killing groups of young men.",1
"932","68. The killing of two experts from the Commission on Narcotic Drugs and Crime on April 7, 2014, while on a counter-piracy mission in Somalia, was a sobering reminder of the risks faced by the United Nations in its work to improve the lives of others.",1
"933","MINUSMA identified 32 women who had experienced conflict-related sexual violence in Timbuktu region and referred them to non-governmental organizations willing to help them bring their cases to court.",1
"934","During the period under review, the Mission discovered and marked 260 mines and unexploded ordnance and monitored the destruction of 3,693 mines and unexploded ordnance.",1
"935","âThe Security Council stresses that regional and subregional organizations have an important role to play in addressing the illicit trade in small arms and light weapons, and that it is necessary to take into account, as appropriate, regional instruments that enable States to identify and trace illicit small arms and light weapons in the mandates of peacekeeping operations.",0
"936","114. The violence in Rai Kotto on the afternoon of April 28 resulted in the death of one civilian, as described in paragraphs 50 and 51 above.",1
"937","For banking institutions, this obligation is also imposed by Decree No. 1 issued by the Czech National Bank on September 8, 2003.",0
"938","Solidaridad Internacional, a non-governmental organization, has installed water systems in all camps with funding from the European Community Humanitarian Office (ECHO) and UNHCR.",0
"939","25. The abduction of children for military purposes, which characterized the conflict period, declined significantly during the reporting period.",1
"940","The Panel strongly believes that officials use the revenue generated through this route to help pay for their militias and purchase weapons.",1
"941","(a) If the act mentioned in paragraph 1 above results in the death of a person or serious bodily harm to more than one person.",1
"942","UNSMIL has endeavored to visit the sites of these attacks but has been denied access by local leaders.",1
"943","III. Implementation of the mandate of the Office",0
"944","Suspension tools",0
"945","While some reports have indicated a few incidents of destruction of villages and private property by rebel groups, most reports include witness statements indicating that the majority of villages were destroyed during attacks by the Janjaweed, often with the direction, participation and support of the Sudanese government's armed forces.",1
"946","215. All States have enacted legislation regulating the production, sale and transfer of arms and explosives.",0
"947","He now further recommends that, as soon as the Team receives a report of the death of a listed individual, the Team should make every effort, in cooperation with the relevant States, to establish the facts and transmit its findings to the Committee as soon as possible.",0
"948","505. Is the crime of genocide more serious than other international crimes? There is widespread agreement that genocide is the most serious international crime.",1
"949","Any success in this endeavor can only be achieved through a concerted effort.",0
"950","However, UN human rights mechanisms have expressed concern about counter-terrorism legal provisions that restrict certain rights in some states, which could make it difficult to implement international agreements on mutual legal assistance and extradition.",0
"951","Repeated attacks on international diplomats in Benghazi and Tripoli attest to this presence.",1
"952","The chairman of the committee was also the Minister of Finance.",0
"953","65. Complaint by Cuba (September 17, 1973; September 18, 1973).",0
"954","The ship sank in bad weather off the coast of Somalia in July 2013 after a mechanical failure, and pirates have since held the surviving crew members hostage on land.",1
"955","Since the arrival of French troops, gendarmes have not been lynched in BouakÃ©.",1
"956","The verdict is expected in December 2010.",0
"957","Hezbollah's retention of significant and sophisticated military capabilities beyond the control of the Government of Lebanon creates an overtly threatening atmosphere and represents a major challenge to the safety of Lebanese civilians and to the government's exclusive right to the legitimate use of force.",1
"958","(c) Any person who operates a gambling, casino or lottery shop.",0
"959","Depending on the circumstances and under the principle of joint criminal enterprise, these individuals may be held responsible for war crimes committed during these attacks, namely the killing of civilians, destruction of civilian objects, unlawful detention of civilians, and looting.",1
"960","The Mechanism shall have two branches, one for the International Criminal Tribunal for the Former Yugoslavia (ICTY) and one for the International Criminal Tribunal for Rwanda (ICTR), respectively.",0
"961","As members of the Security Council know, the situation at the United Nations Mission in Ethiopia and Eritrea (UNMEE) has deteriorated dramatically.",1
"962","The initial emphasis of the Rule of Law Division was on establishing the institution of the Ombudsman and building the judiciary.",0
"963","The actions of some Arab groups have led to the forced displacement of these non-Arab communities.",1
"964","However, they have yet to provide any significant evidence to support their position on this issue.",0
"965","Military and police operations, along with moves targeting gang leaders, have increased in provinces affected by gang violence.",1
"966","During these attacks, the Janjaweed reportedly destroyed food containers, food preparation equipment, water containers, and other household items necessary for the survival of the population.",1
"967","Jebel Moon, West Darfur, October 2006",0
"968",":: Maintain the structure of the IEC in accordance with the Pretoria Agreement: Maintaining the structure of the Independent Electoral Commission in accordance with the Pretoria Agreement",0
