"","ar_en_TRANSFORMERS","VerCoop"
"1297","Lists containing the names and serial numbers of the weapons have been established, but the recipients have not signed for the weapons.",0
"1298","25. Reiterates its invitation to the Secretary-General to continue to transmit relevant information and analysis on the protection of civilians to the Council, if he considers that such information or analysis may contribute to the resolution of the issues before it, requests him to continue to include, as appropriate, observations on the protection of civilians in armed conflict in his written reports to the Council on matters of which he is seized, and encourages him to continue consultations and to take concrete steps to strengthen the capacities of the United Nations in this regard;",1
"1299","Furthermore, the participants agreed to step up pressure to disarm militias operating in the eastern part of the Democratic Republic of the Congo and to negotiate bilateral treaties for the exchange of criminals from the remaining militia leaders.",1
"1300","""The Security Council takes into account the need to continue to explore with international, regional and subregional organizations and arrangements the exchange of experiences and lessons learned in the areas covered by resolution 1540 (2004) and the availability of programmes that can facilitate the implementation of the resolution and areas in which they can assist, including through the designation of a focal point or coordinator for the implementation of resolution 1540 (2004).",1
"1301","""The Security Council remains deeply concerned about the threats of terrorism and the possibility for non-State actors to acquire, develop, traffic in or use weapons of mass destruction and their means of delivery.",0
"1302","The members of the Council also looked forward to a follow-up meeting of the Ethiopian authorities in The Hague in the near future with a view to determining the modalities for the speedy implementation of the delimitation decision.",1
"1303","A photograph of this marking is contained in appendix F.",0
"1304","Ensure continued dialogue with troop- and police-contributing countries on increasing women &apos; s participation in national contingents, including through the organization of meetings to review best practices in promoting gender balance and gender mainstreaming in the work of uniformed personnel in peacekeeping operations.",1
"1305","At that time, hundreds of thousands of Kosovo Albanians returned to Kosovo and began rebuilding their lives. Most Kosovo Serbs had fled their homes.",0
"1306","The parties shared the contents of the document with their constituencies, including Malian refugees residing in Mauritania and the Niger.",1
"1307","The Government has received revenues in excess of $59,000 from those exports.",0
"1308","They welcomed the courage and commitment of troop- and police-contributing countries to MINUSMA and called for continued bilateral support for the training and equipping of MINUSMA troops and police personnel.",0
"1309","In this regard, in a letter dated 1 August 2008 addressed to the President of the Security Council, the Committee submitted its recommendations to the Security Council on the imposition of measures targeting individuals and entities designated by the Committee.",0
"1310","11. Encourages efforts to ensure the development of peaceful uses of nuclear energy by countries wishing to maintain or develop their capabilities in this area, within a framework that reduces the risk of proliferation of nuclear weapons and adheres to the highest international standards of safeguards, security and safety;",1
"1311","Judgements in the Nchamihigo and Bikindi cases are expected to be delivered in the first half of 2008.",0
"1312","Call upon parties to armed conflict to take appropriate measures to refrain from and prevent acts of sexual violence and to protect all persons from all forms of exposure, including:",1
"1313","The European Union stressed that any Somali national military force should be established within the framework of the national security and stability plan and in line with the statement of the President of the Security Council of 14 July 2005.",1
"1314","Reaffirming also its resolutions 1368 (2001) of 12 September 2001 and 1373 (2001) of 28 September 2001, and reiterating its support for international efforts to eradicate terrorism, in accordance with the Charter of the United Nations,",1
"1315","106. UNOCI also agreed on 21 February 2005 to allow FACI to conduct two ground tests of engines and systems, for one hour on the last Wednesday of each month, of its Mi-24P (TU-VHO) aircraft, which would not be armed and would be outside its hangar at the Abidjan airbase, under the control of UNOCI.",1
"1316","Report of the Secretary-General on the United Nations Stabilization Mission in Haiti (S/2012/128).",0
"1317","Mark Feltmann, director of Daniel Chikron Eastern Europe, used a Lithuanian company to move vehicles from Minsk to the port of Klaipeda in Lithuania.",0
"1318","The Panel has taken note of some of the findings of other panels of Commissioners, as endorsed by the Governing Council, regarding the interpretation of relevant Security Council resolutions and Governing Council decisions.",0
"1319","The international community must assume responsibility for the protection of civilians in Darfur and put an end to the impunity currently prevailing there.",1
"1320","Reaffirming the need to combat by all means, in accordance with the Charter of the United Nations and international law, including applicable international human rights law, refugee law and humanitarian law, threats to international peace and security caused by terrorist acts, and stressing in this regard the important role of the United Nations in leading and coordinating such efforts,",1
"1321","While the measures described in the present report are expected to enhance the Mission &apos; s ability to monitor compliance with the Agreement, the parties have a responsibility to ensure that no violations are committed by their military/security forces.",1
"1322","I have the honour to transmit herewith the concept paper for the meeting of the Security Council on counter-terrorism to be held on 27 September 2010 (see annex).",1
"1323","3. Thoraya McKay El Khader Toto",0
"1324","The UNOCI police component also provides technical support and advice to the integrated command centre on security sector reform.",0
"1325","13. Urges the international community to provide support and assistance to enable States to fulfil their responsibilities with regard to the protection of refugees and other persons protected under international humanitarian law;",1
"1326","Calls upon all parties to the armed conflict in [the country concerned], including elements of [a particular armed group], to issue clear orders prohibiting sexual violence, and also calls upon those parties to make and implement specific commitments to investigate in a timely manner alleged abuses in order to hold perpetrators accountable, consistent with Council resolution 1960 (2010), and to facilitate immediate access to available services for victims of sexual violence;",1
"1327","5. Affirms that the requirements of paragraph 1 (a) above apply to financial and economic resources in all their forms, including, but not limited to, resources used to provide Internet publishing or related services to support those on this list, as well as other individuals, groups, undertakings and entities associated with the Taliban in threatening peace, stability and security in Afghanistan;",1
"1328","(v) Continue dialogue and exchange of information with designated focal points or coordinators on issues related to their contribution to the implementation of resolution 1540 (2004);",1
"1329","(5) The decision of the Supreme Soviet of 5 May 1993 on Ukraine &apos; s participation in the Convention on the Physical Protection of Nuclear Material;",0
"1330","Welcoming and expressing support for the steps taken to conclude nuclear-weapon-free zone treaties, and reaffirming its conviction that the establishment of internationally recognized nuclear-weapon-free zones on the basis of arrangements freely arrived at among the States of the region concerned, in accordance with the guidelines established by the United Nations Disarmament Commission in 1999, supports global and regional peace and security, strengthens the non-proliferation regime and contributes to the achievement of the objectives of nuclear disarmament,",1
"1331","The Counter-Terrorism Committee has received the attached fifth report from Mexico submitted pursuant to paragraph 6 of resolution 1373 (2001), together with an account of the efforts made by Mexico in response to resolution 1624 (2005) (see annex).",0
"1332","20. Sub-condition 43.3 provides that:",0
"1333","130. The trip highlighted the problems faced by countries in the process of establishing legal and institutional frameworks to combat terrorism in an atmosphere of political, social and economic instability.",1
"1334","27. The Karemera et al. trial (para. 12) is particularly complex.",0
"1335","In this regard, the Executive Directorate will continue to align specific priority needs with existing and potential donor and assistance programmes in order to improve the counter-terrorism capacity of Member States and enhance dialogue between donors and recipient States.",1
"1336","Review of indictments pursuant to article 19 of the Statute;",0
"1337","25. Recognizing the particular need to coordinate its work with the Counter-Terrorism Committee Executive Directorate and other relevant bodies in areas where States may feel burdened by the Security Council &apos; s requests for information, the Team has developed a joint strategy with the Executive Directorate and experts supporting the Committee established pursuant to resolution 1540 (2004) to address the problems faced by States that have not yet submitted the reports requested from the three Committees.",1
"1338","However, it can reasonably be assumed that the average number of workers has fallen to about 5,000 to 8,000.",0
"1339","On 18 July 2011, the Council held a private meeting with the troop- and police-contributing countries to UNAMID.",0
"1340","Some members of the Council expressed concern that the circumstances had not yet allowed the investigation of crimes committed by the rebels to commence.",1
"1341","""The Security Council welcomes the establishment of the technical team of the African Union Border Programme to determine once and for all the centre line of the demilitarized zone on the ground, and reiterates that the centre line of the demilitarized zone in no way affects the legal status of the border, either now or in the future, nor the ongoing negotiations on the disputed and claimed areas and the question of demarcation.",1
"1342","As long as we are discussing the development challenges facing Afghanistan, the recent incident justifies the bleak picture of the security situation.",0
"1343","Convention on Offences and Certain Other Acts Committed on Board Aircraft, 1993.",0
"1344","Members of the mission met with the leaders of MPCI in BouakÃ©, leading human rights organizations, civil society and peace organizations, senior religious officials, Christians and Muslims, the United Nations country team, members of the diplomatic community and military personnel.",1
"1345","On behalf of the Czech Republic, I would like to thank the Counter-Terrorism Committee for its efforts to combat international terrorism.",1
"1346","In Kenya, 160 suspected pirates were tried, while 4 others are still on trial.",0
"1347","This certainly cannot be interpreted as support for the militias.",0
"1348","Calls for effective international action to curb the illegal flow of small arms into conflict areas.",1
"1349",":: The existence and work of the International Tribunal for the Former Yugoslavia has encouraged the establishment of national courts in Serbia, Bosnia and Croatia",1
"1350","As a result of the Ebola outbreak, Guinean security institutions have shifted their efforts towards containing the outbreak.",0
"1351","He has held the position of Ambassador Plenipotentiary to President Gyude Berryant since 2003, which is the same post as Charles Taylor.",0
"1352","Meanwhile, UNHCR goods were delivered from Belgrade as usual.",0
"1353","IV. Restoration of State authority",0
"1354","The immunities currently granted to other public officials, such as police officers, for human rights violations should also be abolished.",0
"1355","The remaining 601 points are calculated with one second accuracy of the arc (30 metres).",0
"1356","62. Complaint by Cuba (17 September 1973; 18 September 1973).",0
"1357","(b) To provide the Board with staff with the appropriate qualifications and experience, subject to Article 100 of the Charter of the United Nations, and to ensure the highest standards of efficiency, competence and integrity, bearing in mind the importance of recruiting staff on the widest possible geographical basis.",0
"1358","The requirements for the withdrawal of Syrian troops and military equipment, as well as the holding of free and credible elections, have been met.",0
"1359","The role that MINUSTAH should play was to help Haiti take responsibility for its own security once again, not to carry out that mission indefinitely, and he reiterated that the resolution provided for a responsible reduction of the military component of MINUSTAH over a period of time, based on a comprehensive assessment of the security situation.",1
"1360","Article 215 of the new draft Constitution",0
"1361","83. MONUSCO received information from M23 combatants that there were other graves in the fighting areas; it was reported that there were five new graves, three in Man and two in DananÃ© (72 km from Man).",1
"1362","I urge all Somali leaders to take the necessary steps to resolve their differences.",1
"1363","Peer advice has been identified as an important strategy in this regard.",0
"1364","I. GENERAL PROTECTION CONCERNS RELATING TO CONFLICT-affected populations",0
"1365","Security Council resolution 1318 (2000), operative paragraph VI, stresses the importance for all Member States, in particular those involved in the manufacture or marketing of weapons, to restrict the transfer of arms that may provoke or prolong armed conflicts or exacerbate existing tensions or conflicts...",1
"1366","(c) Remaining values 289 - 292 79",0
"1367","Following its meeting on 8 September 2010, the Working Group adopted its conclusions on children and armed conflict in Colombia (see S/AC.51/2010/3).",1
"1368","They also stressed that the timely election of the new President of Lebanon was a crucial step to ensure the stability of the country.",1
"1369","Recommendations were also made regarding the participation of national actors to ensure adequate access to the social, political and cultural background of the cases, while promoting the growth of the national judicial sector.",1
"1370","I therefore urge you to work towards the implementation of Chapter VII of the Charter of the United Nations in accordance with the Algiers Agreement, which you have signed because Ethiopia has maintained a firm position that it has maintained for almost two years now.",1
"1371","5. Requests the Monitoring Team to report to the Committee established pursuant to resolution 1267 (1999), including through briefings by experts of the Monitoring Mechanism, on the work of the Monitoring Mechanism set out in paragraph 3 above, and also requests the Sanctions Enforcement Support Team to submit at least one report per month to the Monitoring Team;",1
"1372","Enhanced standards implementation will be necessary to deepen confidence in Kosovo Serbs and other minorities, during this period of growing political tension, and it will be necessary to obtain the confidence of the region and the international community.",1
"1373","To increase awareness of and support for refugee women &apos; s rights and legal options.",1
"1374","(a) The Maoist army recruited a large number of children prior to the signing of the Comprehensive Peace Agreement.",0
"1375","Reiterating its full support for the efforts to achieve a comprehensive and inclusive solution to the conflict in Darfur, and taking into account the Darfur Peace Agreement, the need to complete the political process and to end the violence and abuses in Darfur,",1
"1376","The United Nations country team is currently engaged in a dialogue to review the action plan, including the review of 168 projects, and to further institutionalize development planning, including also community-based approaches, such as the reconciliation and peaceful coexistence mechanism and UNDP-led conflict reduction programmes.",1
"1377","""The Security Council stresses the need to bring to justice the perpetrators, organizers, financiers and sponsors of this heinous terrorist act and urges all States to cooperate actively with the Algerian authorities in this regard, in accordance with their obligations under international law and resolution 1373 (2001) and in conformity with resolution 1624 (2005).",1
"1378","16. Expresses its deep solidarity with the victims of terrorism and their families, and encourages the Executive Directorate to take into account the important role that victim and survivor networks can play in the fight against terrorism, in close cooperation with the Counter-Terrorism Implementation Task Force and its relevant working groups;",1
"1379","Report of the Secretary-General on the situation in Abkhazia, Georgia (S/2004/26).",0
"1380","15. Recognizes the important role of the good offices of the Secretary-General in Africa, and encourages the Secretary-General to continue to use mediation to the extent possible to assist in the peaceful settlement of disputes, working in close coordination with the African Union and other subregional organizations in this regard, as appropriate;",1
"1381",":: Management of proliferation risks through corporate governance and internal compliance management",0
"1382",":: Appeal to the Security Council to establish, in agreement with the African Union, an international force to neutralize armed groups and support national reconciliation and the establishment of stable democratic institutions in Libya",1
"1383","Our proactive policy has the long-term objectives of removing Abkhaz society from its isolation, of familiarizing it with the democratic values and principles that recognize the fundamental human rights of internally displaced persons and refugees, primarily the right to return to their homes regardless of their ethnic origin; and of creating an environment of trust and mutual respect.",0
"1384","""The Security Council reaffirms its commitment to the independence, sovereignty, unity and territorial integrity of Iraq and stresses the importance of stability and security in Iraq for its people, for the region and for the international community.",1
"1385","The Council requests the Secretary-General to continue to provide and disseminate guidance on addressing sexual violence to be included in the predeployment and induction training of military and police personnel, to assist missions in developing case-specific procedures for addressing sexual violence at the field level and to ensure that technical support is provided to troop- and police-contributing countries in order to make the guidance on addressing sexual violence part of the predeployment and induction training of military and police personnel.",1
"1386","Stressing that enhanced dialogue and wider understanding among civilizations, in an effort to prevent the indiscriminate targeting of different religions and cultures and to address unresolved regional conflicts and the full range of global issues, including development issues, contribute to the achievement of international cooperation, which is in itself necessary to continue to fight terrorism as widely as possible,",1
"1387","10. Decides that the travel ban imposed by paragraph 1 (b) shall not apply to individuals designated pursuant to paragraph 9 bis above, when the Committee determines, on a case-by-case basis, that such entry or transit is justified, decides further that any such exception approved by the Committee shall be granted only for the period required for any travel to that designated location or locations, directs the Committee to decide on all such requests for exemption, as well as on requests for modification or renewal of previously granted exemptions, or on a request by a Member State to cancel previously granted exemptions, within 10 days of receiving such requests, and affirms that, notwithstanding any exception to the travel ban, listed individuals shall remain subject to other measures provided for in paragraph 1 of this resolution;",0
"1388","At least one person was reportedly killed and 20 injured during clashes between riot control forces and demonstrators, which also led to the suspension of the mobile courts.",0
"1389","They also reiterated their call on all Afghan parties to work together for peace and the establishment of a broad-based, multi-ethnic and representative Government.",1
"1390","Welcoming the establishment of the Office of the Ombudsman pursuant to resolution 1904 (2009) and the role it has played since its establishment, noting the important role of the Ombudsman in improving integrity and transparency, recalling the strong commitment of the Security Council to ensure that the Office of the Ombudsman can continue to play its role effectively in accordance with its mandate, and recalling also the presidential statement of the Security Council of 28 February 2011 (S/PRST/2011/5).",1
"1391","It has been transformed into a body in which representatives of the Federal Government of Somalia and regional anti-piracy authorities discuss with United Nations bodies, the European Union and ""oceans without piracy.""",1
"1392","It also continued to encourage the Monitoring Team to further improve its role in the process of strengthening the capacity of Member States to fully implement the sanctions regime imposed by the Security Council on Al-Qaida and the Taliban and associated individuals and entities, and in this regard encouraged the Committee to cooperate between the Monitoring Group and the Executive Directorate of the Committee established pursuant to resolution 1373 (2001), which is undertaking the task of integrating the systems into capacity-building initiatives within the framework of Security Council sanctions.",1
"1393","The working groups, which to date are composed exclusively of the parties to the Comprehensive Peace Agreement, met on 9 and 10 August and have continued from time to time.",1
"1394","50. Four States have developed strategies and institutional structures to combat terrorism, and their law enforcement agencies are coordinating some of their counter-terrorism activities.",0
"1395","""The Security Council reaffirms that the conflict in Afghanistan cannot be resolved by military means and that the only way to achieve peace and reconciliation is through negotiation to reach a political settlement aimed at establishing a broad-based, multi-ethnic, representative Government acceptable to all Afghans.",1
"1396","He stressed the need for enhanced dialogue within the Transitional Federal Institutions and encouraged his interlocutors to use their influence to that end.",1
"1397","Since 18 September 2014, no combat operations have been carried out to counter an ""imminent and serious threat.""",0
"1398","To be held on Wednesday, 15 June 2011, at 10 a.m.",0
"1399","The proposed amendment is not intended to constitute a trial in absentia but rather to provide adequate guarantees for a fair trial of the accused, including the appointment of counsel by the Trial Chamber during these proceedings.",0
"1400","49. Stresses that no matter shall remain pending before the Committee for more than six months unless the Committee decides, on a case-by-case basis, that exceptional circumstances require additional time to consider certain issues, in accordance with its guidelines;",1
"1401","Reaffirming the statement of the President of the Council adopted at the meeting of the Council at the level of Heads of State and Government on 31 January 1992 (S/23500), including the need for all Member States to fulfil their obligations with regard to arms control and disarmament and the non-proliferation of all weapons of mass destruction in all its aspects,",1
"1402","27. In accordance with paragraph 13 of Security Council resolution 1822 (2008), and in coordination with the designating States, the Team began writing narrative draft summaries of the justification for all listings.",1
"1403","13. Encourages the International Criminal Police Organization (INTERPOL) to intensify its efforts with regard to the threat posed by foreign terrorist fighters and to recommend or provide additional resources to support and encourage national, regional and international measures to monitor and prevent the transit of foreign terrorist fighters, such as extending the use of INTERPOL special bulletins to foreign terrorist fighters;",1
"1404","International crimes such as crimes against humanity and war crimes committed in Darfur may be no less serious and atrocity than genocide.",1
"1405","Just last month, in a statement dated 27 May 2011, Secretary-General Ban Ki-moon expressed his belief that ""assistance and goods destined for Gaza should be transported through legitimate crossings and existing channels,"" and explained that these fleets ""can be a source of violent conflict.""",1
