"en_es_TRANSFORMERS"	"VerCoop"
"La mayoría de los niños anteriormente vinculados con grupos armados en Nepal han dejado a los grupos armados sin medidas para su recuperación y reintegración, o marco para su protección."	0
"Recordando la declaración de su Presidente de 8 de julio de 1999 (S/PRST/1999/21) y destacando su llamamiento para que se incluyan, según proceda, en acuerdos de paz concretos y, caso por caso, en los mandatos de mantenimiento de la paz de las Naciones Unidas, términos claros para el desarme, la desmovilización y la reintegración de los excombatientes, incluida la eliminación segura y oportuna de las armas y municiones,"	1
"Poniendo de relieve que el diálogo entre el Comité establecido en virtud de la resolución 1267 (1999) (\"el Comité\") y los Estados Miembros es fundamental para la plena aplicación de las medidas,"	1
"La adición de esos nombres demuestra además la continua preocupación del Comité por la amenaza que representan los talibanes para la paz y la seguridad internacionales."	0
"Los siguientes son ejemplos de indicadores que entran dentro de este ámbito:"	0
"Fecha de emisión: 18.02.2010"	0
"c) Remitirá del Comité toda la información sobre la decisión que se haya presentado al Ombudsman de conformidad con el párrafo 13 supra."	0
"A medida que se resuelvan otras cuestiones, se podrán añadir al final de las futuras ediciones de este Resumen."	0
"Las medidas adoptadas por los Estados abarcan las actividades prohibidas de agentes no estatales, enumeradas en el párrafo 2 de la resolución 1540 (2004) en relación con las armas nucleares, químicas y biológicas y sus sistemas vectores, y los controles de los materiales conexos, de conformidad con el párrafo 3 de la resolución."	0
"Poniendo de relieve que la intensificación del diálogo y la ampliación del entendimiento entre las civilizaciones, en un esfuerzo por impedir que se ataque indiscriminadamente a diferentes religiones y culturas y hacer frente a los conflictos regionales no resueltos y a toda la gama de cuestiones mundiales, incluidas las cuestiones de desarrollo, contribuirán a la cooperación internacional, que por sí sola es necesaria para sostener la lucha más amplia posible contra el terrorismo,"	1
"El Consejo podría desempeñar un papel importante en el establecimiento de programas de reparación para atender a las necesidades de las víctimas."	0
"Respuestas recibidas de conformidad con el párrafo 20 de la resolución 1596 (2005)"	0
"A este respecto, el Consejo de Seguridad alienta a que se siga incorporando la protección de los niños en las actividades de promoción, las políticas, los programas y la planificación de las misiones de esas organizaciones y arreglos, así como la capacitación del personal y la inclusión del personal de protección de los niños en sus operaciones de mantenimiento de la paz y sobre el terreno y el establecimiento, en sus secretarías, de mecanismos de protección de los niños, incluso mediante el nombramiento de coordinadores de la protección de los niños."	1
"El Grupo esperaba que la homogeneidad con respecto a esta pérdida se repitiera en futuras series."	0
"Tres oficinas regionales, en Nyala, El Geneina y El Fasher, están en funcionamiento, y se espera que a principios de junio se abra una cuarta oficina en Zalingei."	0
"Reitera la condena por el Secretario General de todo uso de armas químicas por cualquier parte en el conflicto sirio y su llamamiento para que los autores de tales actos sean llevados ante la justicia."	0
"9. Exhorta a los Estados Miembros a que exijan que las líneas aéreas que operen en sus territorios proporcionen información anticipada sobre pasajeros a las autoridades nacionales competentes a fin de detectar la salida de sus territorios, o la tentativa de entrada o tránsito por sus territorios, por medio de aeronaves civiles, de personas designadas por el Comité establecido en virtud de las resoluciones 1267 (1999) y 1989 (2011) (\"el Comité\"), y exhorta además a los Estados Miembros a que comuniquen al Comité toda salida de esas personas de sus territorios, o la tentativa de entrada o tránsito por sus territorios, y a que compartan esa información con el Estado de residencia o nacionalidad, según proceda y de conformidad con el derecho interno y las obligaciones internacionales;"	1
"57. El objetivo de la visita era examinar los progresos realizados en la aplicación del plan de acción firmado el 4 de octubre de 2012 por el Gobierno y el equipo de tareas de las Naciones Unidas en el país sobre vigilancia y presentación de informes; examinar las conclusiones sobre los niños y el conflicto armado en la República Democrática del Congo aprobadas el 19 de septiembre de 2014; e interactuar con los ministerios competentes y otros funcionarios gubernamentales, los agentes de protección de la infancia, las ONG y los niños anteriormente vinculados con grupos armados y obtener conocimientos directos de la situación de los niños afectados por el conflicto armado en la República Democrática del Congo, prestando especial atención a las actividades de cumplimiento de las Fuerzas Armadas de la República Democrática del Congo (FARDC) y los problemas pendientes, en particular con respecto a los agentes no estatales enumerados en el informe anual del Secretario General, y evaluar los problemas y las oportunidades para la reintegración de los niños asociados con fuerzas y grupos armados en la República Democrática del Congo."	1
"c) Costos futuros 210 - 213 56"	0
"Además, la asignación forzosa a un lugar de residencia y empleo designado por el Estado se debe en gran medida a la discriminación basada en el canto."	0
"2. La situación en Guinea-Bissau"	0
"Colombia, Chile, el Paraguay y el Perú también han promulgado leyes que otorgan a las autoridades encargadas de hacer cumplir la ley facultades especiales de investigación."	1
"9. Observa el apoyo de las partes en el Acuerdo de Paz a la continuación de la fuerza multinacional de estabilización, enunciado en la declaración de la reunión ministerial de la Conferencia sobre la Aplicación del Acuerdo de Paz celebrada en Madrid el 16 de diciembre de 1998 (S/1999/139, anexo);"	1
"Ambos enfoques serán esenciales para hacer frente al desafío del terrorismo."	1
"El 1o de febrero de 1999, el nuevo Primer Ministro recibió un voto de confianza de los diputados."	0
"Decide que todos los Estados Miembros congelen sin demora todos los fondos, otros activos financieros y recursos económicos que se encuentren en su territorio y que sean de propiedad o estén bajo el control, directo o indirecto, de las personas o entidades enumeradas en [el anexo de la resolución por la que se impongan sanciones] o [designadas por el Comité de Sanciones y que participen o sean cómplices en ordenar, controlar o dirigir de otro modo la comisión de violaciones graves de los derechos humanos contra personas en [el Estado afectado], incluso participando en la planificación, el mando, el orden o la realización de ataques, en violación del derecho internacional, incluidos bombardeos aéreos, contra poblaciones e instalaciones civiles, o por personas o entidades que actúen en su nombre o personas y entidades que actúen en su nombre o en su nombre o bajo su dirección], y decide además que todos los Estados Miembros se aseguren de que sus nacionales o cualquier persona o entidad que se encuentre en su territorio impidan poner fondos, activos financieros o recursos económicos a disposición de las personas o entidades enumeradas en [el anexo de la resolución por la que se impongan sanciones] o de las personas designadas por el Comité."	0
"El Consejo de Seguridad insta a los Gobiernos de la República Democrática del Congo y Rwanda a que respondan sin más demora a los esfuerzos de la MONUC en virtud de su mandato actual de establecer, lo antes posible, un mecanismo conjunto de verificación para su seguridad común, incluida la verificación de los movimientos transfronterizos."	1
"El Consejo de Seguridad subraya que las organizaciones regionales y subregionales desempeñan un papel importante en la lucha contra el tráfico ilícito de armas pequeñas y armas ligeras y la necesidad de tener en cuenta en los mandatos de las operaciones de mantenimiento de la paz, cuando proceda, los instrumentos regionales que permiten a los Estados identificar y rastrear las armas pequeñas y las armas ligeras ilícitas."	1
"317. La Comisión no encontró información ni pruebas que indicaran que los grupos rebeldes son responsables de causar una destrucción generalizada."	0
"El Consejo de Seguridad reitera su firme apoyo a la aprobación por la Asamblea General de la Estrategia global de las Naciones Unidas contra el terrorismo (A/60/288), de 8 de septiembre de 2006, y a la institucionalización del Equipo Especial sobre la Ejecución de la Lucha contra el Terrorismo, de conformidad con la resolución 64/235 de la Asamblea General, a fin de asegurar la coordinación y coherencia generales de las actividades de lucha contra el terrorismo del sistema de las Naciones Unidas, y la plena participación, en el marco de sus mandatos, de los órganos subsidiarios pertinentes del Consejo de Seguridad en la labor del Equipo Especial sobre la Ejecución de la Lucha contra el Terrorismo y sus grupos de trabajo, y acoge con beneplácito la aprobación por la Asamblea General de la resolución 64/297."	1
"Reconociendo la importancia de la justicia de transición para promover una reconciliación duradera entre todo el pueblo de Burundi y acogiendo con beneplácito los progresos realizados en los preparativos de las consultas nacionales sobre el establecimiento de mecanismos de justicia de transición, incluso mediante el establecimiento de un Comité Técnico de Seguimiento y un foro de representantes de la sociedad civil,"	1
"El 24 de julio de 2008, el Comité celebró un intercambio de opiniones con el Representante Especial del Secretario General para Somalia, Sr. Ahmedou Ould-Abdallah, en relación con la solicitud formulada por el Consejo en los párrafos 6 y 7 de la resolución 1814 (2008)."	1
"El Consejo alienta el establecimiento o fortalecimiento, cuando proceda, de mecanismos subregionales o regionales de cooperación, coordinación e intercambio de información, en particular la cooperación aduanera transfronteriza y las redes de intercambio de información, con miras a prevenir, combatir y erradicar el tráfico ilícito de armas pequeñas y armas ligeras a través de las fronteras."	1
"Quisiera expresar mi agradecimiento al Embajador Michael Bell y al Gobierno del Canadá por su eficaz presidencia del Fondo en los dos últimos años."	0
"En la nota del Ministerio de Relaciones Exteriores de Rusia se propone que los Estados miembros del Commonwealth adopten medidas análogas y se retiren del régimen de restricciones contra Abjasia, establecido en 1996."	1
"En particular, debería estudiarse la posibilidad de ampliar la publicidad de los puestos dirigiéndose a las asociaciones profesionales y modificando los requisitos lingüísticos de los puestos."	1
"El Consejo de Seguridad encomia los esfuerzos de la operación de la Unión Europea ATALANTA, las operaciones de la Organización del Tratado del Atlántico del Norte Protector Aliado y Escudo Oceánico comandadas por los Estados miembros de la OTAN, la Fuerza de Tareas Combinada 151 de las Fuerzas Marítimas Combinadas, comandada por Dinamarca, los Estados Unidos, Nueva Zelandia, el Pakistán, la República de Corea, Singapur, Turquía y Tailandia, y otros Estados que actúan en su capacidad nacional en cooperación con las autoridades somalíes y entre sí, para reprimir la piratería y proteger a los buques vulnerables que transitan por las aguas frente a las costas de Somalia, y aprecia los esfuerzos de los Estados Miembros, incluidos China, la Federación de Rusia, la India, el Japón, Malasia y la República de Corea, que han desplegado buques o aeronaves en la región, como se indica en el informe del Secretario General (S/2012/783)."	1
"Informe del Secretario General sobre la Misión de las Naciones Unidas en la República Centroafricana y el Chad (S/2010/409)."	0
"Consejero Paul Ekorong à Dong (Camerún)"	0
"El Equipo encargado de prestar apoyo analítico y vigilar la aplicación de las sanciones establecido en virtud de la resolución 1526 (2004) del Consejo de Seguridad y prorrogado por las resoluciones 1617 (2005) y 1735 (2006) del Consejo de Seguridad relativas a Al-Qaida y los talibanes y personas y entidades asociadas, tiene el honor de transmitirle su séptimo informe, de conformidad con la resolución 1735 (2006)."	1
"Las redes terroristas forjadas en los conflictos de hoy podrían plantear una amenaza en los próximos decenios."	0
"A medida que avanzaba la labor de la Comisión, se presentaron más testigos."	0
"El vuelo se canceló y una crisis se evitó sólo después de que el Comandante de la fuerza Licorne, General Irastorza, llamara al Jefe de Estado Mayor de las FANCI, General Mangou, para decir que dicho vuelo sería considerado como una acción hostil."	0
"El Comité del Consejo de Seguridad establecido en virtud de la resolución 1267 (1999) relativa a Al-Qaida y los talibanes (denominado en adelante \"el Comité\") ha hecho mucho para brindar a los Estados Miembros la oportunidad de expresar sus opiniones, ya sea directamente o por conducto del Equipo."	1
"Si bien algunos son lentos en responder al Comité, un número cada vez mayor está dispuesto a participar en su labor, ya sea presentando nombres o promoviendo ideas para nuevas esferas en las que las sanciones u otras medidas del Consejo de Seguridad podrían ayudar a detener la corriente de reclutas y reducir la probabilidad de nuevos ataques de terroristas relacionados con Al-Qaida y los talibanes."	0
"Que se celebrará el lunes 17 de noviembre de 2003, a las 10.00 horas"	0
"El embalse consta de varios tipos de roca porosa que contienen el aceite y el agua."	0
"El Consejo de Seguridad espera con interés las conclusiones y recomendaciones de la misión."	1
"Aparte de estas cuestiones operacionales, como política general, el Ombudsman tratará las solicitudes presentadas como confidenciales."	1
"Por lo tanto, le insto a que se esfuerce por aplicar el Capítulo VII de la Carta de las Naciones Unidas de conformidad con el Acuerdo de Argel, que fue bendecido con su firma, ya que Etiopía ha mantenido y sigue manteniendo su posición intransigente durante casi dos años."	1
"El apoyo debe estar condicionado a los progresos realizados por las autoridades congoleñas hacia el establecimiento de una cadena de suministro en funcionamiento en las FARDC, lo que debe ir acompañado de esfuerzos para mejorar la rendición de cuentas de las FARDC y su respeto de los derechos humanos."	1
"Condenamos los repetidos ataques terroristas con cohetes contra objetivos civiles israelíes."	0
"El UNIFEM y el UNFPA promueven estrategias en los países que salen de un conflicto para abordar las dimensiones de género de la reconstrucción mediante evaluaciones de las necesidades y mecanismos de transición."	1
"Cada una de esas listas se examinó con referencia a la cuestión de la notificación."	0
"Es nuestro derecho inherente; de hecho, es nuestro deber."	0
"Tareas de protección del complejo común de la Unión Africana y las Naciones Unidas en el Aeropuerto Internacional de Mogadiscio"	0
"Alentando, en este contexto, a las partes a que demuestren una mayor voluntad política hacia una solución, incluso ampliando sus deliberaciones sobre las propuestas de cada una de ellas,"	1
"También se ha instalado un sistema de televisión de circuito cerrado."	0
"También pueden surgir problemas disciplinarios similares en la etapa posterior al conflicto."	0
"El Consejo de Seguridad reitera su llamamiento al Gobierno de la República Centroafricana para que reactive los esfuerzos encaminados a reformar las instituciones del sector de la seguridad, que es un elemento crucial del proceso de consolidación de la paz en la República Centroafricana, y para hacer frente a la impunidad generalizada, promover el estado de derecho y aumentar el respeto de los derechos humanos."	1
"Que se celebrará el viernes 19 de marzo de 2010, a las 10.00 horas"	0
"El Consejo de Seguridad acoge con beneplácito la decisión de la Unión Africana de enviar una Misión de Reconocimiento para preparar el terreno para el despliegue de observadores militares en Somalia, y exhorta a los dirigentes somalíes a que cooperen con esta iniciativa."	1
"f) Acogió con beneplácito e hizo hincapié en la importancia de que la Dirección Ejecutiva estuviera dispuesta a participar activamente en todas las actividades pertinentes de la Estrategia global de las Naciones Unidas contra el terrorismo y a prestarles apoyo, incluso en el marco del Equipo Especial sobre la Ejecución de la Lucha contra el Terrorismo, establecido para asegurar la coordinación y coherencia generales de las actividades de lucha contra el terrorismo del sistema de las Naciones Unidas."	1
"El Consejo subraya la necesidad de que todas las partes respeten y mantengan la seguridad y el carácter civil de los campamentos de refugiados y desplazados internos."	1
"El Servicio Geológico de los Estados Unidos revisó inicialmente la base de datos digital y envió una computadora portátil con la base de datos revisada al Ministerio de Tierras, Minas y Energía en febrero de 2009."	0
"Por esta razón, es importante establecer mecanismos eficaces, duraderos e integrales de colaboración regional en las esferas de la aplicación de la ley, la seguridad fronteriza, la asistencia judicial recíproca y la extradición."	1
"115. El embargo actual podría tener más efectos sobre los talibanes si tuviera esto en cuenta y si se impidiera a todos los agentes no estatales del Afganistán comprar armas, con las exenciones necesarias para fines humanitarios y de otra índole, según lo autorizado por el Gobierno del Afganistán o el Consejo de Seguridad."	0
"8. Apartados a) y b) del párrafo 3"	0
"Terrorismo químico, biológico, radiológico y nuclear"	0
"13. La Misión de Investigación que está estudiando las denuncias de uso de productos químicos tóxicos como armas en la República Árabe Siria continúa su labor."	0
"** Decisión de remisión de Milán Lukić revocada (20-Jul-2007)."	0
"Otro celebró en 2009 un seminario internacional sobre el fortalecimiento de la cooperación y el diálogo en la lucha contra el terrorismo entre los organismos gubernamentales, los medios de comunicación y la sociedad civil."	1
"Para el cumplimiento de la cuarta tarea, la Comisión consideró necesario hacer una evaluación preliminar del grado en que el sistema de justicia penal sudanés ha podido y está dispuesto a enjuiciar y enjuiciar a los presuntos autores de crímenes internacionales perpetrados en Darfur, y luego examinar los diversos mecanismos internacionales existentes."	0
"La Representante Especial lamentó que la situación de los derechos humanos siguiera estando marcada por violaciones constantes, y advirtió que la situación podría empeorar aún más con la aprobación y aplicación de un nuevo proyecto de ley de seguridad."	0
"Podría prever la mejora de las competencias en esferas como la policía, la justicia, la educación, la cultura, los medios de comunicación y la economía, y podría permitir vínculos horizontales entre los municipios mayoritarios serbios de Kosovo."	1
"Subrayando que los refugios seguros proporcionados a los terroristas siguen siendo motivo de gran preocupación y que todos los Estados Miembros deben cooperar plenamente en la lucha contra el terrorismo a fin de encontrar, denegar refugio y llevar ante la justicia, sobre la base del principio de extraditar o juzgar, a toda persona que apoye, facilite, participe o intente participar en la financiación, planificación, preparación o comisión de actos terroristas o proporcione refugios seguros,"	1
"Si bien seguiré dirigiéndome a los Estados que aún no han respondido a mi llamamiento para que aporten contribuciones a una fuerza multinacional y les pediría que sigan prestando asistencia para identificar una posible nación rectora, quisiera presentar al Consejo las propuestas adjuntas sobre opciones alternativas (véase el anexo)."	1
"El porte de armas fuera de las fuerzas armadas oficiales es imposible de conciliar con la participación en el poder y en el gobierno en una democracia."	0
"Las instalaciones y los lugares dentro de las zonas se clasifican en varias categorías, dependiendo de su importancia."	0
"La OTAN completó con éxito su misión militar en Bosnia y Herzegovina el 2 de diciembre en una ceremonia oficial en el campamento de Butmir en Sarajevo."	0
"También se ha restringido la libertad de circulación."	0
"Muchos dirigentes internacionales, incluidos los Jefes de Estado, los representantes de las Naciones Unidas y la mayoría de los miembros del Consejo de Seguridad, se han pronunciado claramente en contra de este tipo de flotillas a Gaza durante el último año, haciendo hincapié en la necesidad de que los suministros humanitarios se transfieran a la zona únicamente por los conductos establecidos."	1
"\"Informe del Secretario General sobre la Operación Híbrida de la Unión Africana y las Naciones Unidas en Darfur (S/2011/244)\"."	0
"Aunque la protección física de los civiles contra la violencia sigue siendo importante, debe prestarse mayor atención a la protección mediante procesos políticos y civiles, esfuerzos de reconciliación a nivel comunitario y el establecimiento de un entorno de protección en estrecha coordinación con el equipo de las Naciones Unidas en el país y otros agentes de protección."	1
"En ocasiones, la FNUOS ha recurrido al uso de carreteras de circunvalación, a las que no se puede acceder de noche."	0
"Recuerda que [el grupo de oposición] tiene la responsabilidad particular de proteger a los repatriados y facilitar el regreso de la población desplazada restante, y pide que se adopten nuevas medidas [por parte de los organismos de las Naciones Unidas] para crear condiciones propicias al regreso de los refugiados y los desplazados internos,... para desarrollar sus aptitudes y aumentar su autosuficiencia, respetando plenamente su derecho inalienable a regresar a sus hogares en condiciones seguras y dignas."	1
"Que se celebrará el martes 30 de agosto de 2005, a las 12.20 horas"	0
"Además de la posibilidad de ser considerados responsables, con arreglo a la doctrina de la empresa delictiva conjunta, de los delitos cometidos por otros durante los ataques, se sospecha que esas personas han llevado a cabo ataques indiscriminados contra civiles, un crimen de guerra."	0
"El Consejo de Seguridad recuerda a los Estados que deben velar por que las medidas que adopten para combatir el terrorismo se ajusten a todas las obligaciones que les incumben en virtud del derecho internacional, en particular las normas internacionales de derechos humanos, el derecho de los refugiados y el derecho humanitario."	1
"\"El Consejo de Seguridad acoge con satisfacción el establecimiento de un mecanismo nacional de supervisión por el Presidente Joseph Kabila de la República Democrática del Congo, tal como se solicita en el Marco PSC y en la Resolución 2098 (2013), y pide al Presidente de la República Democrática del Congo que garantice la transparencia y la inclusión en este mecanismo."	1
"Un Estado citó un amplio plan antiradicalismo, aprobado en 2006, que tiene por objeto combatir la radicalización y proteger al mismo tiempo los valores democráticos."	1
"De cara al futuro, exhorto a las partes en el proceso de paz -- el Gobierno de Malí y los grupos armados representados -- a que hagan uso de esta pausa en las negociaciones para demostrar su liderazgo político y desarrollar las avenencias necesarias para llegar a un acuerdo en Argel."	1
"b) Recibir solicitudes de exención de las medidas indicadas en el apartado b) del párrafo 1 de la presente resolución presentadas por personas incluidas en la Lista y transmitirlas al Comité para que determine, caso por caso, si la entrada o el tránsito están justificados, ordenar al Comité que examine esas solicitudes en consulta con los Estados de tránsito y de destino y cualquier otro Estado pertinente, y decide además que el Comité sólo aceptará exenciones de las medidas previstas en el apartado b) del párrafo 1 de la presente resolución con el acuerdo de los Estados de tránsito y de destino, y también encomienda al Comité que, por conducto del punto focal, notifique a esas personas la decisión del Comité;"	1
"Deplorando el hecho de que los talibanes sigan proporcionando refugio a Osama bin Laden y permitiéndole a él y a otras personas asociadas a él dirigir una red de campamentos de adiestramiento de terroristas desde territorio controlado por los talibanes y utilizar al Afganistán como base para patrocinar operaciones terroristas internacionales,"	0
"El Consejo de Seguridad acoge con beneplácito la conclusión de un proceso de registro pacífico para el referéndum del Sudán Meridional en el Sudán, y alienta a las partes a que continúen este impulso hacia la celebración de referendos pacíficos y creíbles el 9 de enero de 2011 que reflejen la voluntad del pueblo."	1
"Se hundió en mal tiempo cerca de la costa somalí en julio de 2013 tras un fallo mecánico y los miembros sobrevivientes de la tripulación habían sido retenidos en tierra por piratas."	0
