"en_es_TRANSFORMERS"	"VerCoop"
"\"El Consejo de Seguridad subraya la importancia de que las partes en el Acuerdo General de Paz avancen rápidamente en el camino a seguir para el referéndum de Abyei, las cuestiones pendientes del Acuerdo General de Paz, y para resolver las cuestiones críticas posteriores al referéndum de manera pacífica y mutuamente beneficiosa, incluidas la frontera, la seguridad, la ciudadanía, las deudas, los activos, la moneda y los recursos naturales."	1
"9. La situación de los defensores de los derechos humanos en todo el país sigue siendo motivo de grave preocupación, y muchos de ellos son objeto de hostigamiento, detención arbitraria y detención injustificada."	0
"Del 25 de noviembre al 10 de diciembre, mi Representante Especial se sumó a mi campaña anual \"Unidos para poner fin a la violencia contra la mujer\", haciendo especial hincapié en los países en conflicto."	1
"Durante sus visitas, el Equipo se reunió tanto con los órganos nacionales encargados de la supervisión del régimen de sanciones como con los más interesados en hacer frente a la amenaza de los talibanes y Al-Qaida sobre el terreno."	1
"Como se indicó anteriormente, en este período de sesiones se adoptó una decisión con respecto al pago de indemnizaciones."	1
"En la 5898a sesión del Consejo de Seguridad, celebrada el 27 de mayo de 2008, en relación con el examen por el Consejo del tema titulado \"Protección de los civiles en los conflictos armados\", el Presidente del Consejo de Seguridad formuló la siguiente declaración en nombre del Consejo:"	1
"El mayor riesgo es que África se convierta en un campamento de adiestramiento, una base de reclutamiento y un punto de tránsito para terroristas y un centro de movilización de fondos para otras actividades ilegales."	0
"El Consejo condena todos los ataques perpetrados por grupos armados locales y extranjeros que amenazan a la población, así como la paz y la estabilidad de la República Centroafricana y la subregión, incluidos los ataques perpetrados el 19 de julio y el 24 de noviembre por la Convención de Patriotas por la Justicia y la Paz contra Birao."	0
"Se ha negado a arrestar a Ali Kushayb y Ahmad Harun."	0
"Enfoque propuesto para sensibilizar al marco de análisis de conflictos respecto de las cuestiones de género, incluida la elaboración de indicadores apropiados para las cuestiones de género y variables relacionadas con los conflictos."	1
"Sin embargo, el Grupo de Supervisión observa que la falta de un gobierno central establecido en Somalia y la elevada amenaza actual de hostilidades generalizadas han retrasado gravemente, si no dejado en suspenso por el momento, los serios esfuerzos de fomento de la capacidad en todo el país."	0
"El desarrollo ulterior de la situación en esa dirección amenazaría los esfuerzos por restaurar y reconstruir el país, y a largo plazo amenazaría la paz y la estabilidad en toda la región."	0
"h) Siga intensificando los esfuerzos para crear conciencia entre los parlamentarios y otros encargados de adoptar decisiones de alto nivel;"	1
"También hicieron hincapié en que la elección oportuna del nuevo Presidente del Líbano era un paso decisivo para garantizar la estabilidad del país."	1
"El Consejo de Seguridad reafirma las disposiciones pertinentes del Documento Final de la Cumbre Mundial 2005 relativas a la protección de los civiles en los conflictos armados, incluidos sus párrafos 138 y 139, relativos a la responsabilidad de proteger a las poblaciones del genocidio, los crímenes de guerra, la depuración étnica y los crímenes de lesa humanidad."	1
"Justo ayer, el Primer Ministro de Georgia emitió un plan detallado de solución de conflictos en otra región separatista de Georgia, la región de Tskhinvali y la antigua Osetia del Sur."	1
"En algunos casos, sobre la base de su examen de las afirmaciones de los reclamantes y de las pruebas justificativas, el Grupo ha reclasificado la totalidad o parte de las reclamaciones."	0
"Por consiguiente, se sugirió que se establecieran normas internacionales y tal vez un papel más destacado del Comité."	1
"En una sesión plenaria de los nueve magistrados de primera instancia y cinco magistrados de apelación, se examinó detenidamente la cuestión de la indemnización de las víctimas de los trágicos acontecimientos en Rwanda."	1
"Acogiendo con beneplácito la inclusión de mujeres en las misiones de mantenimiento de la paz en las funciones civiles, militares y de policía, y reconociendo que las mujeres y los niños afectados por los conflictos armados pueden sentirse más seguros trabajando con mujeres y denunciando abusos a las mujeres en las misiones de mantenimiento de la paz, y que la presencia de mujeres en las operaciones de mantenimiento de la paz puede alentar a las mujeres locales a participar en las fuerzas armadas y de seguridad nacionales, contribuyendo así a crear un sector de la seguridad accesible y que responda a todos, especialmente las mujeres."	0
"En resumen, la violación es toda invasión física de carácter sexual perpetrada sin el consentimiento de la víctima, es decir, mediante la fuerza o la coacción, como la causada por el temor a la violencia, la coacción, la detención o el aprovechamiento de un entorno coercitivo."	0
"Para lograr un retorno sostenible y comunidades minoritarias viables, será necesario un proceso de descentralización que mejore la capacidad de las comunidades no albanesas de Kosovo para proteger su identidad y sus medios de vida, fomentar su confianza en el futuro y alentarlas a que participen más activamente en las instituciones de gobierno de Kosovo."	0
"p) Cooperar con otros comités de sanciones pertinentes del Consejo de Seguridad, en particular el Comité establecido en virtud de la resolución 1267 (1999)."	1
"El Gobierno ha declarado en repetidas ocasiones que se ha ordenado a los comandantes militares que no bombardeen."	0
"El Consejo de Seguridad reafirma que el terrorismo en todas sus formas y manifestaciones constituye una de las amenazas más graves a la paz y la seguridad y que todo acto de terrorismo es criminal e injustificable, independientemente de su motivación, cuandoquiera y por quienquiera que sea cometido."	1
"La propaganda es utilizada además por la República Popular Democrática de Corea para incitar al odio nacionalista hacia los enemigos oficiales del Estado, incluidos el Japón, los Estados Unidos de América y la República de Corea, y sus nacionales."	0
"Reiterando su profunda preocupación por el hecho de que, pese a su reiterada condena de la violencia contra las mujeres y los niños, incluidas todas las formas de violencia sexual en situaciones de conflicto armado, y pese a los llamamientos que ha dirigido a todas las partes en los conflictos armados para que cesen esos actos con efecto inmediato, esos actos siguen ocurriendo y en algunas situaciones se han hecho sistemáticos o generalizados."	0
"Otras tareas de la Oficina del Ombudsman"	0
"El Comité alienta a la Dirección Ejecutiva a que intensifique su diálogo con los Estados Miembros y las organizaciones regionales, incluso durante las visitas del Comité, sobre la elaboración de estrategias amplias e integradas de lucha contra el terrorismo, el mejoramiento y perfeccionamiento de las estructuras existentes y los mecanismos de aplicación a fin de fortalecer la capacidad de los Estados y las organizaciones para formular estrategias, hacer pleno uso de las visitas a los países para asesorar a los gobiernos sobre la elaboración de esas estrategias y seguir colaborando estrechamente con la Oficina y los grupos de trabajo del Equipo Especial sobre la Ejecución de la Lucha contra el Terrorismo."	1
"Del mismo modo, el Consejo podría exigir explícitamente a los Estados Miembros que impidieran que las personas y entidades incluidas en la Lista tuvieran acceso a instalaciones de adiestramiento militar o terrorista dentro de sus fronteras, o las establecieran o mantuvieran, con lo que se desarrollaría el alcance del embargo de armas para abarcar el adiestramiento y el reclutamiento generales."	1
"16. En 1998 la Asamblea Nacional aprobó el proyecto de ley sobre la propiedad de las tierras rurales."	0
"Los Estados deben velar por que la aplicación de la legislación antiterrorista respete plenamente los derechos humanos."	1
"92. La comisión de investigación recomienda que los Estados y las organizaciones de la sociedad civil promuevan oportunidades para el diálogo entre las personas y el contacto en esferas tales como la cultura, la ciencia, los deportes, la buena gobernanza y el desarrollo económico que brinden a los ciudadanos de la República Popular Democrática de Corea la oportunidad de intercambiar información y estar expuestos a experiencias fuera de su país de origen."	1
"Alexandra Sandles, periodista sueca independiente, 13 de febrero de 2012"	0
"Debido a la falta de infraestructura en el país, podría ser necesario establecer un mecanismo para facilitar la administración y distribución de este apoyo."	1
"Debe prestarse apoyo al proceso de reforma del sector de la justicia, en estrecha colaboración con el equipo de las Naciones Unidas en el país, así como al establecimiento y fortalecimiento de mecanismos de rendición de cuentas dentro de las fuerzas de seguridad y defensa."	1
"36. África y la región de Asia y el Pacífico representaron el 53% de los secuestros registrados en todo el mundo en 2012, lo que representa un aumento con respecto al 18% registrado en 2004. El Oriente Medio representó el 19% de los secuestros registrados en todo el mundo en 2012, lo que representa un aumento con respecto al 4% registrado en 2008."	0
"Expertos Expedición de nuevos documentos de identidad"	0
"La declaración jurada no proporciona detalles además de los ya proporcionados."	0
"Además de servir de base para la labor de los mecanismos de presentación de informes sobre derechos humanos y de archivo seguro para la información proporcionada por los interesados pertinentes, la labor de esa estructura debería facilitar los esfuerzos de las Naciones Unidas por enjuiciar a los más responsables de los crímenes de lesa humanidad o rendir cuentas de cualquier otro modo;"	0
"c) Alentar a los Estados a que aumenten el intercambio de información entre las autoridades regionales de control fronterizo y mejoren la seguridad de las fronteras en los puntos de entrada a fin de impedir el movimiento transfronterizo ilícito de personas, carga y armas/explosivos."	1
"Los miembros del Consejo acogieron con beneplácito los esfuerzos del Gobierno para luchar contra el Ejército de Resistencia del Señor, así como la iniciativa de cooperación regional de la Unión Africana para la eliminación del Ejército de Resistencia del Señor y el nombramiento de un enviado especial de la Unión Africana para coordinar la iniciativa."	1
"El Consejo de Seguridad insta a todas las partes en los conflictos armados, incluidas las partes no estatales, a que pongan fin a esas prácticas."	0
"b) Recomendaciones sobre las medidas que pueden adoptarse para mejorar la respuesta a la amenaza que plantean esos combatientes terroristas extranjeros;"	1
"2. Decide poner fin, con efecto inmediato, a la prohibición de la venta o el suministro a Sierra Leona de petróleo y productos derivados del petróleo a que se hace referencia en el párrafo 6 de la resolución 1132 (1997);"	0
":: Reglamento (CE) No. 2368/2002 del Consejo, de 20 de diciembre de 2002"	0
"Ambos aviones estaban previamente desarmados y se utilizaban como aviones de exhibición, siendo reexportados aparentemente con el mismo propósito, y llegaron a Côte d'Ivoire en 2004."	0
"Para combatir ese flagelo es necesario fortalecer nuestra capacidad de enjuiciamiento penal, nuestro sistema judicial, nuestra policía civil e incluso nuestro sistema penitenciario."	0
":: Peter Maurer, Presidente del Comité Internacional de la Cruz Roja"	0
"Reafirmando su resolución 1373 (2001), de 28 de septiembre de 2001, y reiterando su apoyo a los esfuerzos internacionales por erradicar el terrorismo, de conformidad con la Carta de las Naciones Unidas,"	1
"Documentos de identidad y de viaje: expedición, control y detección de fraudes"	0
"10. Alienta a todos los Estados Miembros a que presenten al Comité establecido en virtud del párrafo 30 infra (\"el Comité\") para su inclusión en la Lista los nombres de las personas, grupos, empresas y entidades que participen, por cualquier medio, en la financiación o el apoyo de los actos o actividades descritos en el párrafo 3 supra;"	1
"Por último, permítaseme decir unas palabras sobre las Naciones Unidas."	0
"La Organización de los Estados Americanos (OEA);"	0
"Todos los restos han sido transferidos a la base militar de Hilversum, donde se está llevando a cabo el proceso de identificación."	0
"Ningún Estado puede combatir el terrorismo por sí solo, porque el carácter transnacional de la amenaza terrorista requiere cooperación y coordinación con otros Estados."	1
"El 14 de julio se iniciaron en Argel negociaciones oficiales de paz entre el Gobierno de Malí y los grupos armados, con la facilitación de un equipo internacional de mediación integrado por las Naciones Unidas, las organizaciones regionales y los países vecinos y dirigido por Argelia, con el fin de preservar la cesación del fuego y encontrar una solución política al conflicto, salvaguardando al mismo tiempo la integridad territorial de Malí; el 24 de julio, el Gobierno de Malí y los grupos armados firmaron un acuerdo preliminar en el que se establecía una hoja de ruta para la continuación de las negociaciones."	1
"El 7 de octubre, la Asesora Especial del Secretario General, Sigrid Kaag, informó al Consejo de Seguridad en consultas privadas sobre la aplicación de la resolución 2118 (2013) y centró su intervención en cuatro temas: el cierre de la Misión Conjunta de la Organización para la Prohibición de las Armas Químicas y las Naciones Unidas el 30 de septiembre; los progresos en la aplicación de los planes para la destrucción de las 12 instalaciones de producción de armas químicas restantes; la cuestión de las discrepancias en la declaración original formulada por la República Árabe Siria; y las denuncias relativas al uso de gas cloro en la República Árabe Siria."	1
"Que se celebrará el miércoles 3 de julio de 2002, a las 19.05 horas"	0
"Cabe esperar que las partes puedan alcanzar un alto nivel de confirmación de sus compromisos de no reanudación de las hostilidades y de regreso seguro y digno de los desplazados internos y los refugiados."	0
"Un orador subrayó que era esencial que las medidas adoptadas por los comités y grupos de trabajo, en particular las relativas a la lucha contra el terrorismo, se mantuvieran y se reafirmaran en las resoluciones del Consejo."	1
"También es importante reconocer que más de la mitad de los refugiados y desplazados internos no viven en campamentos, por lo que en el debate también se abordarán las funciones de liderazgo de las mujeres en entornos distintos de los campamentos en los que tanto los desplazados internos como los refugiados y la prestación de servicios plantean problemas adicionales."	1
"25. Exhorta a todos los Estados a que gestionen responsablemente y reduzcan al mínimo, en la mayor medida posible desde el punto de vista técnico y económico, el uso de uranio muy enriquecido para fines civiles, incluso trabajando para convertir los reactores de investigación y los procesos de producción de radioisótopos en combustibles y objetivos de uranio poco enriquecido;"	1
"Destacando la importancia del Acuerdo de Paz de Arusha para la solución pacífica del conflicto en Rwanda y la necesidad de que todas las partes vuelvan a comprometerse a aplicarlo plenamente,"	1
"v) Resultados básicos del programa de verificación"	0
"Entre los posibles riesgos para llevar a los no signatarios a la mesa de negociaciones figura la insistencia de las partes en condiciones previas poco realistas para las negociaciones; otro riesgo es la intransigencia de las partes con respecto a las negociaciones y durante las negociaciones; esos riesgos pueden mitigarse estableciendo posiciones unificadas entre la comunidad internacional con respecto al proceso de paz y manteniendo un diálogo estrecho con las partes; otro riesgo es el establecimiento de iniciativas paralelas de procesos de paz por parte de asociados regionales o internacionales que socavan este elemento del marco."	0
"Se declara abierta la sesión a las 13.20 horas."	0
"f) Detectar todo intento de utilizar la fuerza para amenazar los procesos de Goma y Nairobi por parte de cualquier grupo armado, extranjero o congoleño, en particular en la parte oriental de la República Democrática del Congo, incluso utilizando tácticas de acordonamiento y búsqueda y llevando a cabo todas las operaciones necesarias para impedir los ataques contra la población civil y perturbar la capacidad militar de los grupos armados ilegales que siguen utilizando la violencia en esa zona;"	0
"En Beni, las autoridades locales y la sociedad civil han pedido una participación más activa de la Fuerza de la MONUSCO en las operaciones militares contra las ADF, incluso mediante la realización de operaciones unilaterales."	1
"Por lo tanto, Tailandia no tiene más remedio que ejercer el derecho inmanente de legítima defensa, según lo dispuesto en el Artículo 51 de la Carta de las Naciones Unidas."	0
"Los muertos fueron: 4 profesores, 1 médico, 1 enfermera, 3 estudiantes universitarios, 1 ingeniero, 1 atleta, 1 abogado, 1 activista de los medios, 1 mujer y 2 personas de la misma familia."	0
"a) Preparar la Misión para operaciones futuras o su liquidación."	0
"Es fundamental que la comunidad internacional se una para apoyar sus esfuerzos."	0
"Miles de personas fueron asesinadas, mujeres violadas, aldeas quemadas, casas destruidas y pertenencias saqueadas."	0
"621. La cuestión de si una comisión de la verdad y la reconciliación sería apropiada para el Sudán, y en qué etapa debería establecerse, es una cuestión que sólo el pueblo sudanés debe decidir mediante un proceso verdaderamente participativo."	0
"El Consejo de Seguridad pide al Representante Especial del Secretario General para Burundi que, en estrecho contacto con el Representante Especial del Secretario General para la República Democrática del Congo, determine los hechos e informe al respecto al Consejo lo antes posible."	1
"Decidida a facilitar en adelante una respuesta eficaz a las amenazas mundiales en la esfera de la no proliferación,"	1
"Observando con preocupación que el terrorismo sigue constituyendo una grave amenaza para la paz y la seguridad internacionales, el disfrute de los derechos humanos, el desarrollo social y económico de todos los Estados Miembros y socava la estabilidad y la prosperidad mundiales, que esta amenaza se ha vuelto más difusa, con el aumento, en diversas regiones del mundo, de los actos terroristas, incluidos los motivados por la intolerancia o el extremismo, expresando su determinación de combatir esa amenaza, y destacando la necesidad de asegurar que la lucha contra el terrorismo siga siendo una prioridad en el programa internacional,"	1
"Se formularon declaraciones de apertura en nombre de la Oficina Federal de Relaciones Exteriores de Alemania, el Presidente del Comité establecido en virtud de la resolución 1540 (2004), la Oficina de Asuntos de Desarme de la Secretaría de las Naciones Unidas, la Comisión Europea, el Departamento de Estado de los Estados Unidos y la Oficina Federal de Asuntos Económicos y Control de las Exportaciones."	1
"Que se celebrará el viernes 14 de diciembre de 2007, a las 10.15 horas"	0
"Preveo que los magistrados de las Salas de Primera Instancia y de Apelaciones sólo comenzarán sus funciones judiciales oficiales en una etapa posterior."	0
"183. Los juicios penales por delitos punibles con más de cinco años de prisión están presididos por un grupo de jueces."	1
"El Consejo de Seguridad recuerda las obligaciones de los Estados de respetar y garantizar el respeto del derecho internacional humanitario, incluidos los cuatro Convenios de Ginebra, y subraya su responsabilidad de poner fin a la impunidad y enjuiciar a los responsables de genocidio, crímenes de lesa humanidad y violaciones graves del derecho humanitario."	1
"Según un testigo, Abdel-Al visitó la oficina de Jamea Jamea la noche de la explosión a las 19.30 horas, en la que ambos hablaron del Sr. Abu Adass."	1
"En este ámbito también mencionaremos la Ley de aplicación de las normas aduaneras europeas de 2004, que es aplicable aquí."	0
"El Equipo ha seguido promoviendo y alentando el intercambio con los expertos nombrados para prestar asistencia al Comité contra el Terrorismo y a la nueva Dirección Ejecutiva del Comité contra el Terrorismo, y ha participado en tres reuniones del Comité en las que se han hecho presentaciones sobre esferas pertinentes a la labor del Equipo."	1
"Se espera que el Gobierno de Reconciliación Nacional proporcione alrededor del 30% de los gastos, el Banco Mundial está considerando la posibilidad de conceder un préstamo de 80 millones de dólares y otros donantes también están proporcionando financiación."	0
"El Consejo de Seguridad reitera también su apoyo al Representante Especial del Secretario General, Sr. Ahmedou Ould-Abdallah, por sus esfuerzos encaminados a promover el proceso político en Somalia."	1
"Dirección de correo electrónico del Grupo de Expertos"	0
"En la reunión del 21 de mayo se hizo referencia específica a la cuestión de las armas que se describe en el párrafo 93."	1
"Véase también, por ejemplo, S/RES/1880 (2009), párr. 27"	0
"3. Los participantes consideraron que, debido a su gravedad, esos acontecimientos ponían de relieve la necesidad y la urgencia de acelerar los preparativos para el diálogo inclusivo entre los malienses, de manera que se sentaran las bases de una auténtica reconciliación entre los malienses y de una paz, seguridad y estabilidad duraderas en el país."	1
"Varias delegaciones pidieron al Gobierno de Malí que investigara las violaciones de los derechos humanos y expresaron su preocupación por la liberación de los autores de delitos graves contra los derechos humanos."	1
"A este respecto, se ha llegado a un acuerdo con las partes sobre la posibilidad de revisar los acuerdos militares a fin de responder mejor a las realidades sobre el terreno."	1
"Utilizar un enfoque de evaluación participativa para asegurar que las mujeres y las niñas que regresan y los desplazados internos influyan en el establecimiento y el contenido de las estrategias y los programas de reintegración; perfeccionar los parámetros de reintegración que tengan en cuenta las cuestiones de género en cuestiones como la reforma constitucional y los procesos electorales; desglosar los indicadores por sexo."	1
"Que se celebrará el viernes 15 de febrero de 2013, a las 14.45 horas"	0
"Los observadores militares de la UNOMIG siguieron desempeñando las tareas que se les habían encomendado realizando patrullas terrestres diarias y enlaces con las autoridades locales y coordinando con la fuerza colectiva de mantenimiento de la paz de la Comunidad de Estados Independientes (CEI), así como con los organismos encargados de hacer cumplir la ley de ambas partes."	0
"Exhorto a las autoridades libanesas a que desplieguen todos los esfuerzos posibles para detener a los responsables de este intento de asesinato y llevarlos ante la justicia."	1
"En estrecha cooperación con el Comité establecido en virtud de las resoluciones 1267 (1999) y 1540 (2004) y de conformidad con su mandato, el Comité prestará especial atención a los Estados respecto de los cuales no se disponga de información sobre la aplicación de la resolución 1373 (2001) y examinará la mejor manera de abordar la cuestión."	1
"El Comité procurará que haya un intercambio completo de informes nacionales, informes de visitas y otra información pertinente entre los respectivos comités y grupos de expertos, incluso en relación con las visitas a los Estados y otros viajes oficiales y la asistencia técnica."	1
"139. Las recomendaciones prioritarias son las siguientes: a) Alentar la adopción de medidas para mejorar la capacidad de congelar sin demora los fondos y activos vinculados al terrorismo en la mayoría de los Estados y proteger a su sector sin fines de lucro del uso indebido de la financiación del terrorismo;"	1
"c) Promover la adopción de controles nacionales más estrictos de las armas y los explosivos."	1
"El primer lote de 2.000 milicianos se registró en Guiglo en junio de 2006 y 981 de ellos fueron posteriormente desarmados y recibieron una prestación en concepto de red de seguridad en efectivo."	0
"Un orador atribuyó esto a un sentimiento de frustración y desapego de muchos Estados Miembros hacia la labor del Consejo."	0
"La situación humanitaria en Somalia sigue siendo motivo de gran preocupación."	0
"Durante mi reunión con las autoridades congoleñas al más alto nivel, incluido el Presidente Kabila, les presenté cuestiones relacionadas con el debido proceso en los juicios y el uso de la pena de muerte."	1
"También se iniciaron actividades de divulgación dirigidas a la sociedad civil y las empresas privadas, centrándose en la posible asistencia técnica y su función en la lucha contra el terrorismo."	1
