"","en_es_GOOGLE","MatConf"
"1444","Aproximadamente 2 kilómetros después del puesto de control, unos 20 soldados vestidos con uniformes de camuflaje se acercaron al grupo de mujeres y les ordenaron que se detuvieran, mientras disparaban algunos tiros.",1
"1445","64. La misión preguntó al personal militar del Gobierno acerca de los informes de que unas 70 personas, en su mayoría musulmanes, habían sido asesinadas por soldados del Gobierno después de que retomaran la ciudad.",1
"1446","La situación humanitaria en Somalia sigue siendo motivo de gran preocupación.",0
"1447","Una vez hecho esto, obtuvo la confirmación de la Asamblea Nacional de la República Srpska el 29 de noviembre.",0
"1448","5. Mientras los maoístas se preparaban para trasladar sus fuerzas al acantonamiento, emprendieron una campaña de reclutamiento que alcanzó su punto máximo en noviembre de 2006.",1
"1449","6. El vínculo entre la delincuencia transfronteriza y el terrorismo comenzó a ponerse de relieve tras los atentados con bombas perpetrados por Al-Qaida contra las embajadas estadounidenses en la República Unida de Tanzanía y Kenya en 1998.",1
"1450","4. Si bien tanto el Acuerdo General de Paz como el Acuerdo de Vigilancia de la Gestión de Armas y Ejércitos contenían disposiciones para disolver las milicias vinculadas al ejército maoísta, ninguno de ellos presentaba planes detallados a este respecto.",0
"1451","39. El sistema judicial sigue adoleciendo de graves deficiencias técnicas que socavan la confianza del público.",0
"1452","Por ejemplo, a los Estados de la región del Sahara les ha resultado difícil hacer frente a los campos móviles de entrenamiento terrorista dirigidos por Al-Qaida en el Magreb Islámico (QE.T.14.01.).",1
"1453","1. Ley de extranjería, de 13 de junio de 2003 (Boletín Oficial de 2003, núm. 128, artículo 1175)",0
"1454","En la República Árabe Siria, el posible nexo entre un gran número de combatientes extranjeros afiliados a Al-Qaida y Jabhat-al-Nusrah que crean asociaciones basadas en un lenguaje común podría dar lugar al surgimiento de nuevas redes panárabes y paneuropeas de extremistas.",1
"1455","Damos formación básica (por ejemplo, sobre uso de armas, disciplina,...) que puede durar unas dos semanas, dependiendo de cada persona.",1
"1456","Sin embargo, la información disponible no presenta una imagen clara de la implementación de las medidas de seguridad aérea, marítima o de carga, los controles fronterizos o los programas de aplicación de la ley establecidos para garantizar que las armas pequeñas no caigan en manos de personas no autorizadas.",0
"1457","El examen examinó 488 nombres de personas, grupos y entidades sujetos al régimen de sanciones contra Al-Qaida y los talibanes a fin de actualizar sus entradas o eliminarlos de la Lista cuando el Comité decidió que ya no era apropiado incluirlos.",0
"1458","Declaración del Presidente del Consejo de Seguridad",0
"1459","27. Con el inicio de las lluvias se ha producido una disminución general de la violencia entre tribus, en particular los robos de ganado y los conflictos por el agua y las zonas de pastoreo.",1
"1460","Desde Dubái, el dinero se envía a Somalia mediante transferencias hawala desconocidas.",0
"1461","a) El ejército maoísta reclutó a un número considerable de niños justo antes de la firma del Acuerdo General de Paz.",1
"1462","Aunque la situación de cada refugiado y desplazado interno es única, el desplazamiento y la apatridia exacerban las desigualdades de género existentes, amplificando la discriminación y las dificultades que enfrentan las mujeres y las niñas.",1
"1463","En cada incidente, las mujeres fueron obligadas a desnudarse a punta de pistola, violadas por Janjaweed y luego dejadas desnudas en la carretera.",1
"1464","Reclamación por propiedad tangible ajustada por falta de reparación/reemplazo inexplicable.",0
"1465","S/RES/1591 (2005), op.3(c)",0
"1466","Los Países Bajos reservaron más de 400 millones de euros para apoyar un plan de acción de cuatro años, iniciado en 2007, para prevenir la radicalización.",0
"1467","d) Líderes políticos y militares que operan en la República Democrática del Congo y reclutan o utilizan a niños en conflictos armados en violación del derecho internacional aplicable;",1
"1468","Transmisión del caso 20 al Comité",0
"1469","23. Alcance del embargo de armas. El Comité solicita al Equipo de Vigilancia que trabaje en un documento que recopile las experiencias de los Estados al enfrentar la amenaza de los explosivos civiles e improvisados.",0
"1470","De manera similar, el Consejo podría exigir explícitamente a los Estados miembros que impidan que las personas y entidades incluidas en la lista tengan acceso, establezcan o mantengan instalaciones de entrenamiento militar o terrorista dentro de sus fronteras, ampliando así el alcance del embargo de armas para cubrir el entrenamiento y el reclutamiento de manera integral.",0
"1471","Mientras tanto, los aeropuertos de Jowhar y Kismayo están abiertos y es posible que el personal de las Naciones Unidas realice misiones diurnas.",0
"1472","13. La Dirección Ejecutiva del Comité contra el Terrorismo seguirá fortaleciendo su función de facilitar asistencia técnica para la aplicación de la resolución 1373 (2001) encaminada a aumentar la capacidad de los Estados Miembros y las regiones en la lucha contra el terrorismo atendiendo a sus necesidades en materia de lucha contra el terrorismo. , en estrecha cooperación con el Equipo Especial sobre la Ejecución de la Lucha contra el Terrorismo, otros órganos de las Naciones Unidas y proveedores de asistencia bilateral y multilateral, y seguirá adoptando un enfoque centrado y regional para esta labor.",0
"1473","Posteriormente, los rebeldes capturaron a un comandante de la fuerza aérea y lo detuvieron durante unos tres meses.",1
"1474","El Coordinador Especial informó de que continuaba la calma general en el Líbano meridional, aunque se habían producido algunos incidentes de seguridad durante el período que abarcaba el informe, incluido el lanzamiento de cohetes hacia Israel desde el Líbano meridional durante el conflicto relacionado con Gaza en julio y agosto y dos incidentes de seguridad graves en la zona de las granjas de Shab&#39;a (sector oriental).",1
"1475","a) Hubo un estado de caos en la escena del crimen no sólo durante las primeras horas después de la explosión, durante las cuales la atención se centró en extinguir el fuego, salvar a los heridos y buscar a los desaparecidos, sino que, lamentablemente e innecesariamente, durante mucho tiempo mas tiempo.",1
"1476","Cinco Estados tienen medidas adecuadas para la represión del reclutamiento de terroristas, mientras que cuatro no tienen ninguna.",0
"1477","Además, los dirigentes albanokosovares han percibido la victoria del Presidente Kostunica como una amenaza a sus aspiraciones de independencia de la provincia.",0
"1478","Tomando nota del informe del Secretario General sobre la protección de los civiles de 29 de mayo de 2009 (S/2009/277) y su anexo sobre las limitaciones al acceso humanitario, en el que se identifican los principales desafíos para la protección efectiva de los civiles, a saber, mejorar el cumplimiento con el derecho internacional; mejorar el cumplimiento por parte de los grupos armados no estatales de sus obligaciones en virtud del derecho internacional; mejorar la protección mediante misiones de mantenimiento de la paz de las Naciones Unidas y otras misiones pertinentes más eficaces y con mejores recursos; mejorar el acceso humanitario; y mejorar la rendición de cuentas por las violaciones,",0
"1479","Entrenamiento y reclutamiento militar como parte del embargo de armas.",1
"1480","Reafirmando su resolución 1373 (2001), de 28 de septiembre de 2001, y reiterando su apoyo a los esfuerzos internacionales para erradicar el terrorismo, de conformidad con la Carta de las Naciones Unidas,",0
"1481","Además, los ataques de Al-Shabaab y grupos afiliados en Uganda y Kenya han demostrado su alcance y capacidad de reclutamiento en las comunidades somalíes de esos países.",1
"1482","Reservas operativas al 30 de junio de 2007",0
"1483","E. Pérdida de gastos generales y beneficios de la oficina central",0
"1484","14. En general, disminuyó el número de operaciones militares de las FARDC apoyadas por la MONUSCO. Entre el 6 y el 15 de febrero, la MONUSCO apoyó la operación Mapema Mupya (Nuevo Amanecer) de las FARDC en la zona de Kanyabayonga, en Kivu del Norte, cuyo objetivo era disuadir las actividades de los grupos armados y mejorar la protección de los civiles.",1
"1485","En Nyakunde se registraron más de 2.000 asesinatos y la población huyó al bosque.",1
"1486","La visita a Bouaké se produjo un día después del enfrentamiento entre los rebeldes y la fuerza francesa de vigilancia del alto el fuego en Duékoué.",1
"1487","En el presente informe se analizan diversos aspectos de la cuestión de las armas pequeñas, haciendo hincapié en los efectos negativos que las armas pequeñas ilícitas tienen en la seguridad, los derechos humanos y el desarrollo social y económico, en particular en zonas de crisis y en situaciones posteriores a conflictos.",1
"1488","372. Un detenido presentaba algunas cicatrices en la espalda y el brazo, producto de golpes.",1
"1489","Desde entonces, se han producido dos acontecimientos importantes: el traslado, el 31 de octubre de 2009, de los ocho presos condenados hasta la fecha por la Corte a Ruanda, donde cumplirán sus penas, y el traslado, el 16 de noviembre de 2009, de los centros de detención de la Corte a la Gobierno de Sierra Leona.",0
"1490","Parece más probable que el cambio real provenga de protestas populares que de actos encubiertos de violencia.",1
"1491","Es razonable suponer que la presencia policial se debe más a razones políticas que a cualquier forma de protección.",1
"1492","En ese caso, se plantea el problema de si los participantes en el grupo distintos de aquel que cometió el delito, que no había sido planeado o previsto previamente, también tienen responsabilidad penal por ese delito.",1
"1493","Como en ocasiones anteriores, el Asesor Especial advirtió sobre las acciones de &quot;saboteadores&quot; que estaban socavando la transición del Yemen y amenazando su paz, seguridad y estabilidad. Dijo que el país se encontraba en un momento crítico. Describió el avance de las milicias hutíes, que invadieron Saná y ocuparon varios edificios públicos. Además, informó de un aumento de los ataques de AlQaida en la Península Arábiga, algunos de ellos relacionados con la situación política y de seguridad general, y expresó preocupación por la situación en el sur del país.",1
"1494","Durante el período que abarca el informe, varios miembros de partidos de oposición en el Níger fueron detenidos y posteriormente puestos en libertad bajo fianza.",1
"1495","b) No hubo coordinación entre todos los órganos de seguridad presentes en el lugar del crimen.",1
"1496","Sigo preocupado porque la combinación de desconfianza entre las partes y la presencia continua de milicias pueda generar tensiones y una posible inseguridad e inestabilidad en el Líbano y más allá.",1
"1497","Nombramiento de un Fiscal y un Fiscal Adjunto",0
"1498","Cabe señalar que los dos movimientos no defendieron sus argumentos desde un punto de vista tribal, sino que hablaron en nombre de todos los habitantes de Darfur y dirigieron principalmente sus ataques contra instalaciones gubernamentales.",1
"1499","17. El 7 de enero de 2003, el Tribunal Militar dictó sentencias de muerte contra 30 de las 150 personas inicialmente acusadas de complicidad o participación en el asesinato del difunto Presidente Laurent Desiré Kabila.",1
"1500","En particular, insto a la parte abjasia a que cumpla sus compromisos anteriores y permita la apertura de una suboficina de derechos humanos en Gali, permita la enseñanza de los jóvenes locales en su idioma nativo georgiano y acepte el despliegue de agentes de policía de la UNOMIG en Gali. distrito.",0
"1501","Si bien el impacto operacional de los dirigentes centrales de Al-Qaida ha disminuido con la muerte de Usama bin Laden y varios otros dirigentes clave, las redes de Al-Qaida siguen evolucionando hacia fenómenos más complejos, con una gama internacionalmente diversa de partidarios y combatientes activos.",1
"1502","El Gobierno del Sudán presentó a la Comisión un documento en el que se enumeraban los ataques a convoyes humanitarios.",1
"1503","La perspectiva de la PNTL expresada a la Comisión fue que los peticionarios debían ser arrestados y entregados a la PNTL sólo si estaban en movimiento, y que no se autorizaban operaciones para capturar a los peticionarios.",1
"1504","S/RES/1494 (2003), op. 15",0
"1505","17. Creemos que, en conjunto, las medidas anteriores proporcionan la base para un enfoque estratégico para fortalecer las fuerzas en favor de la paz en Somalia. Este enfoque complementaría las medidas ya adoptadas por el Consejo para contener el conflicto.",0
"1506","La adopción de una declaración presidencial en la que se pide, entre otras cosas, la reafirmación de la solidaridad internacional en la lucha contra el terrorismo y se insta a los Estados Miembros a realizar esfuerzos antiterroristas más enérgicos.",0
"1507","El Comité también siguió alentando al Equipo de Vigilancia a seguir intensificando su papel en el fortalecimiento de la capacidad de los Estados Miembros para aplicar plenamente el régimen de sanciones del Consejo de Seguridad contra Al-Qaida y las personas y entidades asociadas. A este respecto, el Comité alentó la cooperación entre el Equipo de Vigilancia y la Dirección Ejecutiva del Comité establecido en virtud de la resolución 1373 (2001) relativa a la lucha contra el terrorismo, que sirve como integrador de sistemas para iniciativas de creación de capacidad dentro del marco de sanciones del Consejo.",0
"1508","Luego, este producto es transportado por porteadores a pie y luego en motocicleta a través del bosque hasta la carretera principal, donde se comercializa, se consolida en cargas de 2.000 kg y se transporta en avión a Goma.",0
"1509","564. De conformidad con el comentario hecho anteriormente sobre la estructura de los grupos rebeldes, la Comisión ha reunido suficiente material confiable para señalar a cuatro personas que ocupan puestos de importancia dentro de los diferentes grupos rebeldes y que pueden ser sospechosas de ser responsables de no haber evitado a sabiendas o reprimir la perpetración de crímenes por parte de los rebeldes.",0
"1510","20. Nigeria también fue testigo de una escalada de ataques y bombardeos, particularmente en los estados nororientales de Borno, Yobe y Adamawa.",1
"1511","34. El Gobierno de Nepal ha logrado algunos avances en el cumplimiento de sus obligaciones en virtud del Acuerdo General de Paz de prever la rehabilitación de los niños anteriormente asociados con fuerzas y grupos armados.",0
"1512","La situación en Burundi (25 de octubre de 1993; 14 de mayo de 2014)",0
"1513","Para profundizar la participación de las Naciones Unidas en esta esfera, el Consejo debería solicitar a sus principales órganos de lucha contra el terrorismo (la Dirección Ejecutiva del Comité contra el Terrorismo y el Equipo de Apoyo Analítico y Vigilancia de las Sanciones) que se centren en la amenaza de los combatientes terroristas extranjeros, incluso evaluando esfuerzos nacionales para aplicar las obligaciones jurídicas internacionales existentes contra esta amenaza.",1
"1514","Posteriormente, los soldados allanaron casas, arrestaron a jóvenes y los subieron a autobuses militares.",1
"1515",":: Otro aspecto muy importante del seguimiento es la reparación a las víctimas de violaciones.",1
"1516","120. En octubre de 2002, el Presidente de la República pidió que se pusiera fin a la destrucción de las barriadas.",1
"1517","S/RES/1979 (2011) El Consejo de Seguridad,",0
"1518","La actividad es parte de un diálogo continuo entre el Programa de Seguridad y Estado de Derecho de las Naciones Unidas y el Gobierno Federal de Transición sobre cuestiones relacionadas con las minas y el apoyo a los procesos que garantizarán que conozca los instrumentos jurídicos internacionales pertinentes y pueda considerar participar en ellos. .",0
"1519","Se hicieron listas de nombres y números de serie correspondientes de armas, pero los destinatarios no firmaron por las armas.",1
"1520","Corporación Naviera de Europa del Este 112102 Awala House, Nassau, Bahamas",0
"1521","En cada situación, se están restringiendo los derechos fundamentales (a la propiedad y a la circulación), y hay muchas posibilidades de que esto se deba a la continuación inadecuada de las medidas de sanciones del Consejo.",1
"1522","El alcance de la contaminación por municiones en racimo es cada vez más evidente a medida que avanza el trabajo de Landmine Action.",0
"1523","d) Apoyar de otro modo actos o actividades de las personas designadas y de otras personas, grupos, empresas y entidades asociadas con los talibanes que constituyan una amenaza a la paz, la estabilidad y la seguridad del Afganistán;",1
"1524","En el Iraq y el Afganistán, Al-Qaida, los talibanes y los grupos asociados seguirán utilizando material de grado militar para construir artefactos explosivos improvisados mientras se agoten los suministros y sea posible adquirirlos.",1
"1525","Se cerraron las escuelas que se negaron a registrarse o que tenían vínculos con organizaciones terroristas proscritas.",0
"1526","Para lograr avances más concretos, la comunidad internacional debe actuar de manera más concertada y con mayor determinación para establecer el marco básico.",0
"1527","El Ministro afirmó que una vez que el Gobierno recibe información de que hay rebeldes en una determinada aldea, &quot;ya no es una localidad civil, sino que se convierte en un objetivo militar&quot;.",1
"1528","En Egipto, seguimos instando a una pronta y pacífica transferencia del poder a un gobierno civil.",0
"1529","16. Durante el período que abarca el informe, en algunas ocasiones la FPNUL volvió a enfrentar restricciones a su libertad de circulación en su zona de operaciones, que en algunos casos han puesto en peligro la seguridad del personal de mantenimiento de la paz de las Naciones Unidas.",1
"1530","Solicita al Secretario General y a los organismos pertinentes de las Naciones Unidas, entre otras cosas, mediante consultas con mujeres y organizaciones dirigidas por mujeres, según corresponda, que desarrollen mecanismos eficaces para brindar protección contra la violencia, incluida en particular la violencia sexual, a las mujeres y las niñas en las Naciones Unidas y sus alrededores. gestionaba campamentos de refugiados y desplazados internos, así como en todos los procesos de desarme, desmovilización y reintegración, y en las iniciativas de reforma del sector de la justicia y la seguridad con asistencia de las Naciones Unidas.",0
"1531","173. El Grupo observó con satisfacción que varios países habían suspendido o bloqueado la exportación de bienes y servicios militares a Côte d&#39;Ivoire.",1
"1532","Los miembros del Consejo dijeron que las Naciones Unidas deberían desempeñar un papel de liderazgo en la respuesta internacional a las necesidades de Libia después del conflicto.",0
"1533","8. Ministros y Viceministros actuales y anteriores;",0
"1534","Cuando los coches abandonaban el lugar, dos de los agentes desarmados de la UIR se cayeron o fueron sacados de uno de los vehículos. Ambos fueron apuñalados por miembros de la multitud.",1
"1535","162. El equipo forense holandés contó con la ayuda de muchas personas para llevar a cabo la investigación de la escena del crimen, por ejemplo, agentes de policía forense de las ISF, un equipo de buzos británicos, un experto francés en explosivos, un científico forense de Irlanda del Norte, un ingeniero eléctrico alemán especializado en dispositivos de interferencia, un equipo de investigadores japoneses de la escena del crimen, un experto en automóviles alemán, un experto en automóviles holandés y varios especialistas libaneses.",0
"1536","El personal penitenciario y las fuerzas de seguridad de Puntlandia lucharon valientemente contra los atacantes y pudieron evitar que la prisión fuera tomada y la posible fuga de agentes de Al-Shabaab, entre ellos un experto en artefactos explosivos improvisados y un coordinador de bombas suicidas, los piratas encarcelados y otras personas.",1
"1537","Solicita al Secretario General que garantice (a) un seguimiento y presentación de informes continuos, como parte de los informes mencionados en el [párrafo pertinente] anterior, de la situación de los niños, incluida una estrecha cooperación con los actores de protección infantil y (b) un diálogo continuo con las partes. al conflicto hacia el desarrollo e implementación de planes de acción con plazos determinados para poner fin al reclutamiento y uso de niños soldados y otras violaciones del derecho internacional humanitario y de los derechos humanos contra los niños;",0
"1538","Embajador Jean-Marc de la Sablière (Francia)",0
"1539","La prohibición de la privación arbitraria de la libertad; el castigo corporal; castigo colectivo; y la imposición de sentencias y la ejecución de ejecuciones sin sentencia previa pronunciada por un tribunal regularmente constituido, que ofrezca todas las garantías judiciales generalmente reconocidas como indispensables.",1
"1540","Algunas agencias se fusionarían, otras se disolverían.",0
"1541","Actuando en virtud del Capítulo VII de la Carta de las Naciones Unidas,",0
"1542","Como se dijo anteriormente, en Darfur existe un conflicto armado prolongado, no de carácter internacional, entre las autoridades gubernamentales y grupos armados organizados.",1
"1543","Sin embargo, en 2007, después de que se emitiera la orden de arresto contra Harun y Kushayb, el presidente AlBashir se negó públicamente a implementarlas, cuestionó la autoridad del Consejo de Seguridad y afirmó que Harun había hecho lo que se le había ordenado.",0
"1544","La lista completa de productos autorizados figura en el Decreto del Gobierno Nº 112/1990 (XII.23).",0
"1545","105. Ningún Estado informó al Comité de ningún intento de violar el embargo de armas, pero el Equipo ha observado varias situaciones en las que la aplicación efectiva del embargo de armas se ve complicada por factores como la presencia de entidades asociadas con Al-Qaida en una situación posterior a la guerra. región de conflicto o en áreas fuera del control gubernamental, por ejemplo en Somalia y Afganistán.",1
"1546","3. Los sistemas comerciales de doble uso se producen con fines civiles, pero también pueden utilizarse en ataques terroristas.",1
"1547","Es imposible describir en este informe todos los incidentes de asesinatos que la Comisión ha documentado.",1
"1548","17. La situación en los territorios árabes ocupados.",0
"1549","Otro Estado señaló que no había adoptado medidas nacionales específicas en materia de diálogo y entendimiento porque no había conflictos ni odios significativos entre sus diferentes grupos étnicos y sociales.",0
"1550","Según un alto comandante de las fuerzas armadas, los soldados de Borders Intelligence son reclutados directamente en el ejército de la misma manera que los soldados regulares.",1
"1551","Las fuerzas gubernamentales intervinieron tarde en el curso de los acontecimientos disparando desde el interior de su propio campamento, pero sus esfuerzos llegaron demasiado tarde y fueron inadecuados para salvar vidas o propiedades.",1
"1552","Fue especialmente preocupante la pauta de presuntas faltas graves de conducta de agentes de la Policía Nacional de Haití, incluida su presunta participación en la ejecución sumaria de al menos nueve personas el 20 de agosto en un partido de fútbol en la zona de Martissant, en Puerto Príncipe.",1
"1553","Las interacciones con la sociedad civil ilustraron que la población no entendía claramente el mandato y la capacidad de la MONUSCO. Entre las poblaciones locales existía la percepción de que sólo la brigada de intervención podía tomar medidas enérgicas para proteger a los civiles, lo cual no es exacto.",1
"1554","I. Preocupaciones generales en materia de protección de la población afectada por el conflicto",0
"1555","Los camiones transportaban fuerzas armadas del Gobierno y luego se utilizaron para transportar propiedades saqueadas de la aldea.",0
"1556",":: Una finca privada, en la que los inspectores entraron con el consentimiento del propietario;",0
"1557","Destacando que el diálogo entre el Comité establecido en virtud de la resolución 1267 (1999) (&quot;el Comité&quot;) y los Estados Miembros es vital para la plena aplicación de las medidas,",0
"1558","Expresa su profunda preocupación por el aumento de los conflictos localizados, el aumento de la criminalidad y la violencia y sus efectos sobre los civiles, y en particular por el fuerte aumento de los enfrentamientos entre tribus, y pide a todas las partes que pongan fin urgentemente a esos enfrentamientos y busquen la reconciliación y el diálogo. ..",1
"1559","232. El número estimado de poblaciones afectadas por el conflicto en Darfur, combinado con los refugiados en el Chad (1,65 millones de desplazados internos, 627.000 personas afectadas por el conflicto y 203.051 refugiados) alcanza la asombrosa cifra de casi 2,5 millones de personas afectadas de una manera o otro, la gran mayoría al ser desplazados de sus hogares.",1
"1560","Según informes de testigos, durante el ataque se atacaron civiles, entre ellos mujeres, niños y ancianos.",1
