"en_es_TRANSFORMERS"	"VerCoop"
"No cabe duda de que los presuntos crímenes documentados en Darfur cumplen los umbrales del Estatuto de Roma definidos en los artículos 7 1), 8 1) y 8 2) f)."	0
"38. Reafirma que el Equipo de Vigilancia debe distribuir al Comité cada seis meses una lista de las personas incluidas en la Lista relativa a las sanciones contra Al-Qaida que presuntamente hayan fallecido, junto con una evaluación de la información pertinente, como la certificación del fallecimiento y, en la medida de lo posible, el estado y la ubicación de los activos congelados y los nombres de las personas o entidades que estén en condiciones de recibir activos no congelados, encomienda al Comité que examine esas listas para decidir si siguen siendo apropiadas, y exhorta al Comité a que elimine las listas de personas fallecidas, cuando se disponga de información fidedigna sobre el fallecimiento;"	1
"El Representante Permanente del Afganistán ante las Naciones Unidas, Embajador Zahir Tanin, subrayó el consenso internacional que estaba surgiendo sobre una estrategia de transición y pidió más apoyo internacional a las fuerzas de seguridad afganas."	1
"A juicio del Coordinador, compartido por sus interlocutores, podría convertirse en el centro de atención de un mecanismo funcional eficaz que fijaría parámetros claros para lograr progresos en la búsqueda de las personas desaparecidas, a que se hace referencia en mi informe amplio (S/2009/190, párr. 16)."	1
"Por el contrario, está en su claro interés unirse a ella."	0
"121. Los Janjaweed a los que se refiere la mayoría de las víctimas en el conflicto actual son milicias árabes que asaltan las aldeas de esas víctimas, montadas en caballos o camellos, y matan, saquean, queman y violan."	0
"El Consejo de Seguridad subraya la necesidad de llevar ante la justicia a los autores, organizadores, financiadores y patrocinadores de este censurable acto de terrorismo, e insta a todos los Estados a que, de conformidad con las obligaciones que les incumben en virtud del derecho internacional y la resolución 1373 (2001) y con arreglo a la resolución 1624 (2005), cooperen activamente con las autoridades argelinas a este respecto."	1
"Observamos que las organizaciones de la sociedad civil han expresado su profunda preocupación a este respecto."	0
"143. En segundo lugar, el Gobierno y los dirigentes rebeldes deben hacer hincapié en los esfuerzos por prevenir los excesos, proteger a las personas en situación de riesgo y llevar ante la justicia a los responsables de los excesos."	0
"c) Hacer responsables a las personas o entidades jurídicas de los delitos relacionados con la financiación del terrorismo;"	0
"Recordando el derecho a la libertad de expresión consagrado en el Artículo 19 de la Declaración Universal de Derechos Humanos, aprobada por la Asamblea General en 1948 (\"la Declaración Universal\"), y recordando también el derecho a la libertad de expresión enunciado en el Artículo 19 del Pacto Internacional de Derechos Civiles y Políticos, aprobado por la Asamblea General en 1966 (\"PIDCP\"), y que toda restricción al respecto sólo será tal que esté prevista por la ley y sea necesaria por los motivos enunciados en el párrafo 3 del artículo 19 del Pacto,"	1
"Las reuniones incluirán información periódica de los grupos de trabajo encargados de hacer un seguimiento de los progresos en materia de supervisión y aplicación nacional; asistencia; cooperación con organizaciones internacionales, incluidos los comités del Consejo de Seguridad establecidos en virtud de las resoluciones 1267 (1999) y 1373 (2001); y transparencia y divulgación en los medios de comunicación."	1
"El Comité también se enteró de los progresos realizados en la posible designación de facilitadores regionales para otras organizaciones regionales, en particular la Comunidad de Estados Independientes y la Asociación de Naciones del Asia Sudoriental (ASEAN)."	1
"El crecimiento relativamente lento de la economía haitiana se debió en parte a la limitada capacidad de absorción."	0
"Por lo tanto, es importante que los Estados no pierdan de vista este elemento del embargo, y el Comité tal vez desee recordarlo a medida que se presente la oportunidad, alentándolos a que presenten para su inclusión los nombres de quienes prestan \"asesoramiento técnico, asistencia o adiestramiento en relación con actividades militares\" (apartado c) del párrafo 1 de la resolución 1617 (2005)) en violación de las medidas."	0
"Elaborar un conjunto de políticas, directrices y procedimientos para la planificación, ejecución y supervisión de los programas de desarme, desmovilización y reintegración, conocidos como normas integradas de desarme, desmovilización y reintegración, e integrar las perspectivas de género."	0
"\"Informe del Secretario General sobre la Operación Híbrida de la Unión Africana y las Naciones Unidas en Darfur (S/2013/22)\"."	0
"No quedó claro a los testigos que les dispararon: las fuerzas paralelas, la policía o la gendarmería."	0
"28. Varios Estados de la región de África subrayaron su determinación de velar por que las medidas destinadas a proteger al público de los actos terroristas se adoptaran en el marco de la ley y de conformidad con sus obligaciones en virtud del derecho internacional."	1
"En Darfur meridional, según testigos, los rebeldes atacaron y saquearon una comisaría de policía y oficinas gubernamentales en Yassin en enero de 2004."	0
"Para asegurar que los posibles peticionarios tengan una clara comprensión del proceso y sean conscientes de las medidas que deben adoptarse y para salvaguardar la coherencia en la aplicación, se han desarrollado prácticas y procedimientos, y se ha difundido información sobre ellos, a fin de concretar aún más el proceso."	1
"El seminario fue una oportunidad importante para estudiar los medios de facilitar aún más la aplicación de la resolución, incluso en lo que respecta a la presentación universal de informes y una aplicación más completa."	1
"El Consejo de Seguridad reitera que la amenaza cada vez mayor que plantean los combatientes terroristas extranjeros forma parte de las nuevas cuestiones, tendencias y acontecimientos relacionados con las resoluciones 1373 (2001) y 1624 (2005), y alienta al Comité contra el Terrorismo a que celebre reuniones especiales en 2015 con la participación de los Estados Miembros y las organizaciones internacionales y regionales pertinentes para examinar formas de detener la corriente de combatientes terroristas extranjeros e impedir que los terroristas exploten Internet y las redes sociales para reclutar e incitar actos terroristas, respetando al mismo tiempo los derechos humanos y las libertades fundamentales, y en cumplimiento de otras obligaciones contraídas en virtud del derecho internacional; y, a este respecto, señala la importancia de que el Comité celebre reuniones en las regiones afectadas sobre cuestiones relacionadas con el mandato del Comité."	0
"c) Los indicados en el documento S/2006/815, excepto el suministro, la venta o la transferencia de artículos comprendidos en el artículo 19.A.3 de la categoría II;"	0
"El Consejo de Seguridad exhorta a las autoridades de Burundi y de la República Democrática del Congo a que cooperen activamente para que los autores y los responsables de esos crímenes sean llevados ante la justicia sin demora."	1
"Al concluir esta cuarta ronda de conversaciones, las partes reiteraron su compromiso de continuar las negociaciones en Manhasset en una fecha que se determinará de común acuerdo."	1
"He continuado mi diálogo con las autoridades libanesas sobre la cuestión y espero con interés el pronto cumplimiento de esas obligaciones."	1
"Lashkar-e-Tayyiba (QE.L.118.05) sigue proporcionando entrenamiento terrorista avanzado, incluso sobre artefactos explosivos improvisados. Al-Qaida en la Península Arábiga (AQAP) (QE.A.129.10) sigue siendo una importante fuente de innovación tecnológica."	0
"Este grupo sigue siendo uno de los grupos armados extremistas más capaces del Iraq."	0
"En numerosas ocasiones, los miembros del Comité han destacado las funciones complementarias del Comité, el Comité establecido en virtud de la resolución 1373 (2001) relativa a la lucha contra el terrorismo y el Comité establecido en virtud de la resolución 1540 (2004) en la lucha contra el terrorismo internacional, así como la necesidad de coordinar las actividades e intercambiar información entre ellos."	1
"11. Reafirma su resolución 1373 (2001) y, en particular, sus decisiones de que todos los Estados deben prevenir y reprimir la financiación de actos terroristas y abstenerse de prestar cualquier tipo de apoyo, activo o pasivo, a las entidades o personas que participen en actos terroristas, incluso reprimiendo el reclutamiento de miembros de grupos terroristas y eliminando el suministro de armas a terroristas;"	1
"El Comité espera con interés la continuación de este apoyo altamente profesional."	1
":: El Comité asignará gran importancia a la coordinación con expertos de otros órganos subsidiarios del Consejo de Seguridad relacionados con la lucha contra el terrorismo en la preparación de visitas y la racionalización de la presentación de informes."	1
"La malnutrición crónica en los campamentos de refugiados es un importante problema de salud y el ACNUR y el PMA se proponen adoptar medidas correctivas, incluida la alimentación complementaria de los grupos vulnerables."	1
"6. Exige que todos los Estados y partes en los conflictos armados apliquen plenamente todas las decisiones pertinentes del Consejo de Seguridad y, a este respecto, cooperen plenamente con las misiones de mantenimiento de la paz de las Naciones Unidas y los equipos en los países en el seguimiento y la aplicación de esas resoluciones;"	1
"Este período de sesiones no es una oportunidad para examinar las particularidades de una situación o situaciones concretas."	0
"El Consejo de Seguridad subraya que un arreglo político inclusivo y el despliegue con éxito de la UNAMID son esenciales para restablecer la paz y la estabilidad en Darfur."	0
"VII. Equipo mixto de inspección de la UNMOVIC en Mosul"	0
"El 16 de agosto, el Secretario de Estado para la Juventud y el Deporte inauguró el Parlamento de la Juventud (véase S/2010/85, párr. 105), integrado por 130 jóvenes (incluidas 66 niñas) de entre 12 y 17 años de edad que recibirán dos años de capacitación en liderazgo y capacidad de representación, así como oportunidades de entablar un diálogo sobre cuestiones de política que afectan a los jóvenes."	1
"El equipo de mediación mantuvo conversaciones bilaterales con el Gobierno y la Coordinación, integrados por el Movimiento Nacional para la Liberación de la Azawad (MNLA), el Alto Consejo para la Unidad de la Azawad (HCUA) y el Movimiento Árabe de la Azawad (MAA), a los que se sumaron personas de la Coordinación de Movimientos y Frentes Patrióticos de Resistencia II (CMFPR-II) y una facción de la Coalición del Pueblo de la Azawad (CPA) por un lado, y con el Gobierno y los grupos armados de la Plataforma integrados por el CMFPR-I, el CPA y la otra facción del MAA, así como personas del Grupo de Autodefensa Touareg Imghad y Alliés (GATIA) invitados por la Plataforma, por el otro."	1
"La UNODC organizará un taller nacional sobre cooperación internacional en asuntos penales relacionados con el terrorismo, la delincuencia organizada transnacional y la corrupción para Namibia en marzo de 2014."	1
"El resultado de este diálogo fortalecería el clima de estabilidad."	1
"Ambos países fueron declarados libres de transmisión del ébola los días 17 y 20 de octubre, respectivamente."	0
"2. La situación en Côte d'Ivoire."	0
"Subraya la necesidad de un compromiso sin reservas con el proceso de integración de las fuerzas armadas, en el espíritu del Acuerdo global e inclusivo."	1
"16. Reitera a todos los Estados la importancia de proponer al Comité que incluya en la lista del Comité los nombres de los miembros de la organización Al-Qaida y los talibanes o asociados con Osama bin Laden y otras personas, grupos, empresas y entidades asociados con ellos, a menos que ello comprometa las investigaciones o las medidas coercitivas;"	1
"Destaca la importancia de garantizar el acceso de las organizaciones pertinentes, según proceda, a todas las prisiones y lugares de detención en [el país afectado], y pide que se respete plenamente el derecho internacional pertinente, incluido el derecho humanitario y las normas de derechos humanos..."	1
"14. Solicita al Grupo de Expertos que siga investigando la financiación y el papel de los grupos armados, militares y políticos en los ataques contra el personal de la UNAMID en Darfur, y observa que las personas y entidades que planifican, patrocinan o participan en esos ataques constituyen una amenaza para la estabilidad de Darfur y, por consiguiente, pueden cumplir los criterios de designación establecidos en el apartado c) del párrafo 3 de la resolución 1591 (2005);"	0
"El Consejo hizo hincapié en que la reforma de los sectores de la defensa y la seguridad, la lucha contra la impunidad y la lucha contra el tráfico ilícito de drogas seguían siendo sectores prioritarios para la consolidación de la paz en Guinea-Bissau, e instó a las fuerzas armadas de Guinea-Bissau a que respetaran el gobierno y la supervisión civiles."	1
"También se ha informado de que 18 mujeres fueron violadas durante el ataque contra Adwa, en Darfur meridional, a principios de diciembre de 2004."	0
"Expresó su preocupación por el aumento de la demolición de edificios en Palestina, el riesgo de traslado forzoso de la comunidad beduina de Um al-Kheir y las actividades de asentamiento en curso de Israel, que, dijo, constituían una violación del derecho internacional."	0
"Aumento de los costos: costos de cambio de ruta (vuelos de Asseman Air)"	0
":: Destacar las buenas prácticas para hacer frente a los riesgos específicos y responder a las necesidades, capacidades y prioridades de las mujeres y niñas refugiadas, desplazadas internamente y apátridas que huyen, durante el desplazamiento y a su regreso, incluidas las necesidades particulares de los diferentes grupos de mujeres y niñas que son objeto de formas múltiples e interrelacionadas de discriminación, en consulta con las organizaciones locales de la sociedad civil y las propias mujeres y niñas"	0
"En su 47a sesión oficial, celebrada el 20 de junio de 2014, el Grupo de Trabajo recibió información del Fiscal de la Corte Penal Internacional sobre la labor de la Corte en relación con los niños y los conflictos armados."	1
"El Directorio está concebido para servir de fuente de información sobre las mejores prácticas relacionadas con la lucha contra el terrorismo, las leyes modelo y los programas de asistencia disponibles."	1
"La perspectiva gubernamental más coherente sobre el conflicto fue presentada por un comité establecido por el Ministro del Interior en su calidad de representante del Presidente en Darfur."	1
"Es poco probable que la inclusión de esas personas en la lista haya influido mucho en el nivel de atención que les han prestado las autoridades estatales, pero debido a que no han mostrado ningún cambio en su apoyo escrito y oral a Al-Qaida o los talibanes, ninguno de los cuales es un criterio para la inclusión en la lista, los Estados han recomendado que se sigan incluyendo en la lista y el Comité ha estado de acuerdo."	1
"12. Exhorta a los Estados Miembros a que adopten medidas enérgicas y decisivas para reducir las corrientes de fondos y otros activos financieros y recursos económicos hacia las personas y entidades incluidas en la Lista relativa a las sanciones contra Al-Qaida, como se exige en el apartado a) del párrafo 1, y teniendo en cuenta las recomendaciones pertinentes del GAFI y las normas internacionales destinadas a prevenir el uso indebido de organizaciones sin fines de lucro, los sistemas de envío de remesas no oficiales o alternativos y el movimiento físico transfronterizo de divisas, procurando al mismo tiempo mitigar los efectos en las actividades legítimas por esos medios;"	1
"La situación en Guinea-Bissau (6 de noviembre de 1998; 21 de diciembre de 2011)"	0
"Cuatro Estados han tipificado adecuadamente el reclutamiento de terroristas, mientras que los demás lo han hecho parcialmente o no lo han hecho en absoluto."	1
"62. El Comité contra el Terrorismo y su Dirección Ejecutiva deberían: a) colaborar más activamente con las organizaciones subregionales pertinentes, entre ellas el Grupo de África Oriental y Meridional contra el blanqueo de dinero, la SADC y la Organización de Cooperación de Jefes de Policía de África Meridional, a fin de centrarse en las actividades encaminadas a superar las deficiencias y mejorar la aplicación de la resolución;"	1
"Que se tengan en cuenta los resultados finales de la vigilancia y evaluación recibidos del estudio de la costa oleosa de la Arabia Saudita cuando la Comisión supervise el uso de indemnizaciones por actividades de rehabilitación ambiental, incluida la indemnización por la reclamación No 5000451 de la Comisión."	1
"Consideraron enfoques holísticos para abordar los factores que propiciaban la propagación del extremismo y el terrorismo en la región y la mejor forma en que las entidades de las Naciones Unidas podían ayudar a hacer frente al fenómeno y sus efectos en la paz, la seguridad y la estabilidad."	1
"En su décimo informe, el Equipo recomendó que, a fin de aumentar la exactitud de la Lista y los efectos de la inclusión en ella, al ponerse en contacto con el Estado de residencia en el contexto del examen, el Comité solicitara toda la información sobre el paradero de la parte, sus circunstancias y actividades, junto con una nota sobre las medidas adicionales que hubiera adoptado para impedir su apoyo al terrorismo (S/2009/502, párr. 24)."	1
"Dijeron `por qué os quedáis aquí, esclavos'."	0
"Los nuevos yacimientos de diamantes descubiertos en los condados de Gbarpolu y Nimba dieron lugar recientemente al traslado de un número considerable de especuladores a esas zonas."	0
"El Equipo también siguió desempeñando un papel activo en la elaboración de medidas para combatir la financiación del terrorismo mediante su participación en las reuniones plenarias del GAFI y en las reuniones de los órganos regionales similares al GAFI."	0
"34. Destaca la importancia de las consultas y la cooperación entre las Naciones Unidas, el Comité Internacional de la Cruz Roja y otras organizaciones pertinentes, incluidas las organizaciones regionales, para mejorar la protección de los civiles en los conflictos armados;"	1
"El levantamiento progresivo de la línea verde sigue basándose en una evaluación amplia de las amenazas; las consultas con el centro de mando integrado; y el mejoramiento de la situación general de seguridad, en particular la escasa probabilidad de enfrentamiento militar entre los antiguos beligerantes."	1
"Que se celebrará el lunes 30 de diciembre de 2002, a las 12.05 horas"	0
":: Deberían establecerse mecanismos de determinación de los hechos lo suficientemente pronto como para poder contribuir a la prevención de nuevas violaciones."	1
"No obstante, instamos a que se hagan mayores esfuerzos para dar seguimiento a la información obtenida de los Estados Miembros como parte de la lucha contra el terrorismo."	0
"3. Los miembros de los escuadrones de la muerte deben ser identificados y llevados ante la justicia;"	0
"Una campaña pública más enérgica habría evitado, entre otras cosas, las ideas erróneas del público sobre la zona de zonificación especial que rodea el monasterio de Deçan/Dečani."	0
"Reiterando además la obligación de los Estados Miembros de impedir la circulación de grupos terroristas mediante, entre otras cosas, controles fronterizos eficaces y, en este contexto, de intercambiar información sin demora, mejorar la cooperación entre las autoridades competentes para impedir la circulación de terroristas y grupos terroristas hacia y desde sus territorios, el suministro de armas para terroristas y la financiación en apoyo de los terroristas,"	1
"A pesar de los progresos realizados hasta la fecha, es imperativo que las partes en el Acuerdo y todas las autoridades competentes redoblen sus esfuerzos para asegurar que cumplan con éxito el plazo."	1
"El Consejo de Seguridad reconoce los importantes logros alcanzados en la lucha contra el terrorismo y reconoce también que siguen existiendo lagunas en la lucha general contra este flagelo, insta a todos los Estados Miembros y al sistema de las Naciones Unidas a que los aborden, y subraya la necesidad de velar por que la lucha contra el terrorismo siga siendo una prioridad en la agenda internacional."	1
"Del 11 al 19 de agosto también se llevó a cabo una campaña de sensibilización pública sobre la violencia sexual y por razón de género y los derechos del niño en los emplazamientos de desplazados internos en la región de Dar Sila."	1
"36. El Presidente también desempeñó un papel importante durante las reuniones del Comité al alentar a los miembros a que explicaran su posición sobre las listas cuando éstas se opusieran a las de otros Estados, y al tomar la iniciativa de proponer la supresión de nombres de las listas para las personas consideradas muertas o entradas de la Lista que carecían de identificadores."	1
"Después de haber llevado a cabo todos los análisis y discusiones de los hechos que hemos recopilado, llegamos a la conclusión de que lo más probable es que fuera una explosión sobre el terreno."	0
"En la Estrategia global de las Naciones Unidas contra el terrorismo se pide que se promueva el diálogo, la tolerancia y la comprensión entre civilizaciones, culturas, pueblos y religiones y que se establezcan programas de educación y sensibilización del público pertinentes."	1
"El Consejo de Seguridad reitera su enérgica condena de todas las violaciones del derecho internacional aplicable cometidas contra las mujeres y las niñas en situaciones de conflicto armado y posteriores a un conflicto, incluidas las violaciones, otras formas de violencia sexual y basada en el género y los asesinatos y mutilaciones que contravienen el derecho internacional."	1
"A ello siguieron las conversaciones celebradas el 14 de mayo de 2000 en Mwanza entre los Presidentes de Rwanda y Uganda, que también acordaron la desmilitarización."	1
"... destacando la importancia de investigar [los presuntos abusos de los derechos humanos y violaciones del derecho internacional humanitario], incluidos los que se produjeron durante la crisis..., cometidos por todas las partes, independientemente de su condición o afiliación política, reafirmando que los responsables de esas violaciones deben rendir cuentas y comparecer ante la justicia independientemente de su afiliación política, respetando al mismo tiempo los derechos de los detenidos..., instando al Gobierno a que intensifique y acelere sus esfuerzos para combatir la impunidad,"	1
"Según muchos relatos y testimonios, este respaldo a las fuerzas paralelas proviene del interior del palacio presidencial."	0
"El Grupo también visitó el puesto de control policial de Niangoloko e inspeccionó el \"registro de movimientos\", pero no observó irregularidades; se habían confiscado algunas escopetas y pistolas artesanales."	1
"c) Medidas que garanticen la protección y el respeto de los derechos humanos de las mujeres y las niñas, en particular en lo que se refiere a la Constitución, el sistema electoral, la policía y el poder judicial."	0
"El Comité reafirma su responsabilidad de incluir la aplicación de la resolución 1624 (2005) del Consejo en su diálogo con los Estados Miembros y ayudar a crear capacidad a este respecto, incluso mediante la difusión de las mejores prácticas jurídicas y la promoción del intercambio de información."	1
"Incluso si se denuncian incidentes a la policía u otros funcionarios del Gobierno, se adoptan pocas o ninguna medida para detener a los autores."	0
"134. Hamoud Muhareb Ali Al-Shamry"	0
"Los participantes en el foro iniciaron un proceso de determinación de los elementos de una estrategia nacional sobre la participación de la mujer en la solución de conflictos."	1
"Habiendo determinado que la situación en Somalia sigue constituyendo una amenaza para la paz y la seguridad internacionales en la región,"	0
":: Declaración jurada de datos personales y/o comerciales;"	0
"El Comité también hace suya la recomendación de que las solicitudes de información se dirijan con mayor precisión a los Estados en que opera o trata de operar una persona o entidad incluida en la Lista, sin imponer a esos Estados una carga excesiva de presentación de informes."	1
":: Estrecha cooperación con los demás órganos subsidiarios pertinentes del Consejo, en particular los Comités del Consejo de Seguridad establecidos en virtud de las resoluciones 1267 (1999) y 1540 (2004), y sus expertos, incluso en materia de intercambio de información, visitas y asistencia técnica, según proceda."	1
"MPIGO se concentra en el oeste del país, centrado en Binhouye, y el MJP en Man."	0
"Los Estados de la subregión están atentos a su vulnerabilidad al tráfico de armas y han elaborado marcos legislativos para tipificar como delito el tráfico ilícito y controlar la producción, venta y transferencia de armas y explosivos."	0
