"","en_es_GOOGLE","MatConf"
"1","IV. DRAGADO INTERNACIONAL NV 43 - 58 19",0
"2","El informe fue presentado al Comité del Consejo de Seguridad establecido en virtud de la resolución 1267 (1999) relativa a Al-Qaida y los talibanes y personas y entidades asociadas el 31 de marzo de 2008, de conformidad con la resolución 1735 (2006) del Consejo de Seguridad, y actualmente está siendo examinado por el Comité.",0
"3","5. Durante la guerra fría, los Secretarios Generales de las Naciones Unidas llamaron la atención sobre cuestiones específicas de delincuencia transfronteriza que complicaban situaciones de conflicto que ya figuraban en el programa del Consejo de Seguridad.",1
"4","También vale la pena señalar que esta decisión de Rusia coincide con los actos de provocación de los separatistas y su intenso fortalecimiento militar.",1
"5","También visitaron comisarías y la fiscalía para obtener información sobre los casos de violación ya registrados.",0
"6","Sin embargo, sólo 20 Estados han adoptado medidas prácticas y una estrategia nacional para reprimir el reclutamiento por parte de grupos terroristas.",0
"7","En San Pedro, se informa que el alcalde ha comenzado a destruir otros barrios marginales.",1
"8","30. Dado que se ha suspendido la financiación multilateral, el Gobierno de Côte d&#39;Ivoire depende de la cosecha de cacao para mantener su solvencia y poder pagar a sus funcionarios públicos, incluidos los militares. El cacao desempeña un papel importante al proporcionar fondos para las actividades de adquisiciones militares extrapresupuestarias y extrapresupuestarias del Gobierno y, aunque la cantidad de ingresos procedentes del cacao ha disminuido, el porcentaje que se deduce de lo disponible sigue siendo alto.",1
"9","Se dice que muchas aldeas fueron atacadas más de una vez, hasta quedar completamente destruidas.",1
"10","Además, las instalaciones eran básicas, sin &quot;espacios adaptados a los niños&quot;.",0
"11","6. Decide seguir ocupándose del asunto.",0
"12","Las Secciones de Servicios Generales han identificado espacio de oficinas apropiado para el personal del Mecanismo Residual y están brindando servicios de viajes, visas, correo y transporte.",0
"13","d) El enfrentamiento armado entre soldados de las F-FDTL y oficiales de la PNTL en el cuartel general de la PNTL el 25 de mayo, que provocó numerosos heridos y la muerte de un soldado de las F-FDTL, Bure.",0
"14","&quot;El Consejo de Seguridad condena la muerte de civiles inocentes y los abusos contra los derechos humanos en el este de la República Democrática del Congo y pide que tales incidentes sean investigados exhaustivamente.",0
"15","El Consejo de Seguridad reitera su exigencia a las fuerzas armadas de que se sometan plenamente al control civil.",0
"16","9. La situación de los defensores de los derechos humanos en todo el país es otro motivo más de grave preocupación. Muchos de ellos son objeto de acoso, detención arbitraria y detención injustificada.",1
"17","Dos sospechosos del ataque están detenidos en la prisión construida en el marco del Programa contra Delitos Marítimos de la ONUDD.",1
"18","Se declara abierta la sesión a las 10.15 horas.",0
"19","Turquía ha lanzado el Proyecto de Unidad Nacional para abordar las desigualdades sociales y económicas en la sociedad turca que supuestamente alimentan la disidencia kurda y el reclutamiento del Partido de los Trabajadores Kurdos (PKK).",0
"20","Incorporación de la perspectiva de género en respuestas coordinadas para prevenir y responder a conflictos armados y emergencias humanitarias.",0
"21","Es significativo señalar que el 22 de mayo de 2005, aproximadamente una semana antes de la segunda batalla de Baidoa, llegó a BAM un cargamento muy grande de armas desde Yemen, a través de las redes de comercio de armas.",1
"22","Cuando son detenidos o repatriados por la fuerza, los funcionarios de la República Popular Democrática de Corea los someten sistemáticamente a persecución, tortura, detención arbitraria prolongada y, en algunos casos, a violencia sexual, incluso durante registros corporales invasivos.",1
"23","Según el Banco Mundial, nada socava tanto el clima de inversión como la inseguridad armada.",1
"24","El régimen arrestó a aproximadamente 47 personas que se cree que fueron reclutadas por la fuerza para unirse a las fuerzas del régimen.",1
"25","Por lo tanto, el conflicto no se reduce simplemente a una situación de disturbios y tensiones internas, disturbios o actos de violencia aislados y esporádicos. Más bien, los requisitos de (a) existencia de grupos armados organizados que luchan contra las autoridades centrales, (b) control por parte de los rebeldes sobre parte del territorio y (c) combates prolongados, para que esta situación se considere un conflicto armado interno según el artículo 3 comunes a los Convenios de Ginebra.",1
"26","A pesar del anuncio radial del ex Presidente Compaoré, más tarde ese mismo día, de retirar el proyecto de ley y establecer el estado de emergencia, las protestas violentas se intensificaron en Uagadugú y se extendieron más allá de la capital.",1
"27","Según los testimonios, miles de miembros de las fuerzas de seguridad podrían haber estado en acción esos días en Abiyán.",1
"28","También está en vigor un Tratado bilateral de asistencia jurídica mutua (MLAT) con los Estados Unidos de América.",0
"29","o El 16 de noviembre de 2014, las fuerzas del régimen lanzaron granadas de mortero contra la mezquita de Madera, en Rif Dimashq, hiriendo a cuatro civiles y dañando gravemente la mezquita.",1
"30","Después de un largo enfrentamiento con la multitud, el subcomandante Babo desarmó a seis oficiales de la UIR del este y les quitó los chalecos antibalas. Fueron escoltados a vehículos que los esperaban.",1
"31","70. En el marco del Grupo de Trabajo sobre la lucha contra la financiación del terrorismo del Equipo Especial sobre la Ejecución de la Lucha contra el Terrorismo y su iniciativa mundial para proteger a las organizaciones sin fines de lucro contra los abusos terroristas, la Dirección organizó un taller regional para los Estados Miembros de África Oriental, que se celebró en marzo de 2012 en Nairobi. El taller discutió las prácticas nacionales e identificó deficiencias en la supervisión del sector de organizaciones sin fines de lucro con respecto a riesgos específicos de financiamiento del terrorismo.",0
"32","28. Poco después del 1 de marzo de 2009:",0
"33","Recuerda la prohibición del desplazamiento forzoso de civiles en situaciones de conflicto armado en circunstancias que violen las obligaciones de las partes en virtud del derecho internacional humanitario.",1
"34","20. Desde mi informe (véase S/2007/619, párr. 25), el Real Ejército de Marruecos ha seguido denunciando un gran número de presuntas violaciones del acuerdo militar Nº 1 por parte del Frente Polisario en relación con la presencia de personas y vehículos en la franja de protección.",0
"35","Amenaza no convencional: química, biológica, radiológica, nuclear y explosiva, Asia",1
"36","Desde entonces sólo dos de estos centros han reabierto.",0
"37","577. Los tribunales mixtos establecidos en otros conflictos han seguido dos modelos similares pero distintos.",0
"38","Un tribunal internacional no se considera apropiado dado que los crímenes bajo consideración contravienen el derecho interno.",1
"39","Las armas fueron confiscadas por el oficial de armas del buque estadounidense y posteriormente entregadas a las autoridades yemeníes.",1
"40","Este fue el caso de Jamal Suliman Mohamad Shayeb en la aldea de Halouf en relación con el asesinato de 24 personas, algunas de ellas mujeres y niños, el saqueo de propiedades y el incendio de la aldea.",1
"41","La situación interétnica en Kosovo sigue siendo relativamente tranquila, pero inestable.",1
"42","Puede que ya haya llegado el momento de hacerlo, pero más vale tarde que nunca.",0
"43","Aumento (disminución) de los intereses devengados por pagar",0
"44","Gobiernos de Suecia y Estados Unidos de América",0
"45","4. Decide seguir ocupándose del asunto.",0
"46",":: Incrementar la cooperación y la coordinación con el Comité contra el Terrorismo y su Dirección Ejecutiva, el Comité establecido en virtud de la resolución 1540 (2004) y todos los organismos u organizaciones internacionales que hayan acumulado experiencia y conocimientos especializados en la lucha contra el terrorismo.",0
"47","Entre ellas figuraban emboscadas, así como ataques asimétricos y con cohetes contra los bienes y el personal de la Misión Multidimensional Integrada de Estabilización de las Naciones Unidas en Malí (MINUSMA).",1
"48","Servicios públicos y horas extraordinarias (5.357.643 riyals)",0
"49","Redadas, registros y arrestos sin orden judicial",1
"50","En marzo de 2005 se produjeron allí descargas clandestinas de barcos con matrícula griega y panameña, sin declaración previa a la aduana ni a la policía.",1
"51","Declaró que los campamentos de desplazados internos se utilizaban ahora como lugares desde donde lanzar ataques contra el Gobierno.",1
"52","La aldea de Nurei, cercana a la ciudad de Mornei, en Darfur occidental, fue atacada por los Janjaweed y las fuerzas gubernamentales en diciembre de 2003.",1
"53","Instando a todos los Estados, organismos internacionales y organizaciones regionales a que asignen recursos suficientes, incluso mediante alianzas internacionales, para hacer frente a la amenaza directa y actual que plantean Al-Qaida, Usama bin Laden y los talibanes, y las personas, grupos, empresas y entidades asociados con a ellos,",0
"54","Sudáfrica destaca que, dada la magnitud de esos desafíos, se requiere una estrategia integral que incorpore la seguridad, los esfuerzos humanitarios, la buena gobernanza y el desarrollo socioeconómico.",0
"55","Dicha estrategia se centra en cómo pueden dirigirse las defensas del Estado contra el terrorismo para proteger las infraestructuras críticas y a los ciudadanos, y cómo respondería el Estado a un ataque terrorista con miras a mitigar los efectos de tal incidente, ayudar a las víctimas y restablecer el orden público. .",1
"56","ACNUR brindó capacitación a funcionarios relevantes de Bielorrusia y Ucrania con el objetivo de garantizar la implementación efectiva y justa de las disposiciones sobre la determinación del estatus de refugiado establecidas en la Convención de 1951.",0
"57","El conflicto ha durado más de medio siglo y no puede abordarse de la noche a la mañana.",1
"58","Durante estas detenciones, las víctimas fueron a menudo maltratadas, les robaron sus pertenencias, sus casas fueron destrozadas y, en algunos casos, fueron ejecutadas sumariamente.",1
"59","Al final de la cuarta ronda de negociaciones a finales de noviembre, las posiciones de las partes sobre cuestiones clave permanecían sin cambios.",0
"60","El Plan de Acción Humanitaria de Emergencia para Costa de Marfil y sus cuatro vecinos (Benin, Ghana, Guinea y Togo) tampoco cuenta con fondos suficientes.",0
"61","En Darfur meridional, según testigos, los rebeldes atacaron y saquearon una comisaría de policía y oficinas gubernamentales en Yassin en enero de 2004.",1
"62","Varias operaciones de paz recientes han incorporado el análisis de la delincuencia transfronteriza en la planificación de sus misiones y en sus estructuras conjuntas de análisis de misiones, en particular la MINUSMA.",1
"63","S/RES/1923 (2010), op. 4",0
"64","16. La situación en los territorios árabes ocupados1 (4 de mayo de 1976; 13 de julio de 1998).",0
"65","El Consejo de nivel ministerial de la Liga de los Estados Árabes,",0
"66","En septiembre de 2005, tras una intensa presión pública e internacional, tres oficiales del ejército de Nepal fueron sometidos a un consejo de guerra y condenados a seis meses de prisión por no seguir los procedimientos adecuados al deshacerse del cuerpo de Maina Sunuwar.",1
"67","Más tarde, ese mismo día, una acción militar en la base aérea de la FACI en el aeropuerto internacional de Abidján tuvo como resultado la destrucción de los otros dos Su-25, dos helicópteros Mi-24V y un UAV.",1
"68","Para obtener una lista detallada de las respectivas circulares de BaFin, cf. pregunta 11.",0
"69","Para designar a determinadas personas como presuntos autores, es necesario definir los crímenes internacionales de los que pueden ser considerados responsables.",1
"70","▪ Dirigir ataques contra la población civil o contra civiles individuales que no participan directamente en las hostilidades;",1
"71","42. La MINURCAT siguió desempeñando todas las tareas operacionales que le habían encomendado, incluida la preparación para reaccionar rápidamente, las tareas de protección de la fuerza y el conocimiento de la situación en las proximidades de sus acantonamientos.",1
"72","H. Otras pérdidas 94 - 112 19",0
"73","195. Esta lectura de la información por parte de algunas fuentes ha dado una dimensión adicional al conflicto.",0
"74","7. Expresa su firme determinación de considerar la posibilidad de incluir en la lista, de conformidad con la resolución 2161 (2014), a personas, grupos, empresas y entidades asociadas con Al-Qaida que financian, arman, planifican o reclutan para ellos, o apoyan de otro modo sus actos o actividades, incluidos a través de tecnologías de la información y las comunicaciones, como internet, redes sociales o cualquier otro medio;",1
"75","Al menos 70 miembros clave del Congreso Popular se encuentran actualmente detenidos sin cargos ni juicio, y varios de ellos han huido del Sudán al exilio.",1
"76","23. Decide seguir ocupándose del asunto.",0
"77","Tres días después, los Jaleele compraron 25 rifles de asalto AK-47, 2 cañones antiaéreos, 6 ametralladoras PKM, 4 RPG-2 y municiones.",1
"78","(iii) Proporcionar apoyo logístico y aéreo.",0
"79","&quot;El Consejo de Seguridad acoge calurosamente la decisión del Secretario General de hacer que el trabajo de las Naciones Unidas para fortalecer el estado de derecho y la justicia de transición en las sociedades en conflicto y posconflicto sea una prioridad durante el resto de su mandato.",0
"80","De los 17 acusados en relación con el ataque contra el Primer Ministro, 13 fueron condenados a penas de prisión de nueve años y cuatro meses, mientras que un acusado fue condenado a 10 años y ocho meses. El 14 de junio, el Tribunal de Apelación confirmó las sentencias.",1
"81","107. Una segunda categoría incluye las milicias organizadas en estructuras paramilitares y en paralelo a las fuerzas regulares, incluidos los grupos conocidos como &quot;la fuerza de ataque&quot;, los muyahidines o los fursan (los jinetes).",1
"82","Estas tropas están ligeramente armadas, tienen poca movilidad terrestre, carecen de capacidad aérea y reciben un apoyo logístico y financiero mínimo.",1
"83","6. La aplicación del embargo de armas se reforzó en la resolución 1945 (2010), cuando el Consejo aclaró las exenciones a esa medida y supeditó la venta o el suministro de armas y material conexo al Sudán no prohibido por el embargo al fin necesario. documentación del usuario.",1
"84","Durante la semana del 19 al 26 de junio en la región de Bay, unas 10 personas murieron y otras 9 resultaron heridas en enfrentamientos entre los subclanes Digil-Mirifle de la zona, incluidos los Leysan, Luway y Yantar.",1
"85","184. La mayoría de los informes señalan una pauta de ataques indiscriminados contra civiles en aldeas y comunidades de los tres estados de Darfur que comenzaron a principios de 2003.",1
"86","452. Según el artículo 31 de la Ley de Seguridad Nacional, en virtud de una orden emitida por el Director General, un agente de seguridad puede llevar a cabo un arresto, un registro o detener e investigar a una persona. Dispone de tres días para comunicar al detenido los motivos de su arresto y detención.",1
"87","El Gobierno del Líbano me ha informado de que las Fuerzas Armadas Libanesas también detuvieron y deportaron a varios infiltrados de origen palestino que portaban documentos de identificación sirios.",1
"88","Dos años de conflicto habían agudizado las diferencias políticas y profundizado las ya graves condiciones sociales y económicas de la gran mayoría de la población.",1
"89","Llamamos a nuestra gente a unirse al PDF. Ellos respondieron incorporándose y comenzaron a recibir órdenes del Gobierno como parte del aparato militar estatal&quot;.",1
"90","Se alega que Ibrahim Mohamed K. había asistido a campos de entrenamiento de Al-Qaida hasta noviembre de 2001 y luego permaneció en el Afganistán durante más de un año luchando contra las tropas de los Estados Unidos, tiempo durante el cual tuvo contacto con miembros de alto rango de Al-Qaida. Lo persuadieron de regresar a Europa, donde su documento de viaje alemán le dio una considerable libertad de movimiento para reclutar atacantes suicidas.",1
"91","Según los informes, el ejército nacional mantiene actualmente el bosque bajo vigilancia.",1
"92","42. Antes de que las fuerzas de seguridad comenzaran su acción, quienes lograron salir a las calles vieron que nadie había comenzado aún a marchar ni se comportaba de manera amenazadora o provocativa.",1
"93","Los expertos del OIEA indicaron al Equipo que es mucho más probable que los terroristas obtengan ilícitamente un dispositivo militar que construyan uno improvisado.",1
"94","6. En Malí, los terroristas estuvieron a punto de destruir la estructura básica del Estado, afectando así la estabilidad de un país y de toda una región. Al-Qaida en el Magreb Islámico, el Movimiento para la Unidad y la Jihad en África Occidental y Ansar Eddine continúan sus actividades en el norte de Malí con efectos colaterales en los países vecinos. Ponen en riesgo la presencia y las actividades de la Misión Multidimensional Integrada de Estabilización de las Naciones Unidas en Malí (MINUSMA).",1
"95","La orden también prohíbe la venta o suministro por parte de personas estadounidenses o de los Estados Unidos o utilizando embarcaciones o aeronaves registradas en los Estados Unidos, de: (i) cualquier equipo utilizado en la minería; (ii) vehículos motorizados o embarcaciones y sus partes; o (iii) servicios de minería o servicios de transporte terrestre o acuático, todos independientemente de su origen, al territorio de Angola, excepto a través de un punto de entrada específico.",0
"96","Sin embargo, la falta de leyes antiterroristas específicas limita la eficacia de esos mecanismos.",0
"97","El componente militar sigue prestando servicio en el norte en condiciones extremadamente difíciles.",1
"98","En el caso de peligro público (artículo 179 del Código Penal), también es delito preparar tales actos (por ejemplo, obtener componentes y construir un artefacto explosivo con el propósito de un ataque según el artículo 2, párrafo 1 del Convenio). ), incluso si el delincuente aún no ha intentado cometer el acto.",1
"99","Por ejemplo, la Comisión descubrió que mujeres que iban al mercado o buscaban agua en Tarne, Darfur septentrional, fueron secuestradas, retenidas durante dos o tres días y violadas por miembros del ejército alrededor de marzo de 2003.",1
"100","Oficina Ejecutiva del Secretario General",0
"101","a) Solicitar a la UA que mantenga tropas de la AMISOM en Somalia después de la partida de las fuerzas etíopes y ofrecer la asistencia que se indica a continuación para apoyar el refuerzo de la Misión;",0
"102","En una declaración presidencial (S/PRST/2004/15) aprobada el 14 de mayo, el Consejo expresó seria preocupación por los informes de una incursión en la República Democrática del Congo por parte de elementos del ejército rwandés y los informes de una mayor actividad militar por parte de las Fuerzas Democráticas de Liberación de Ruanda en la parte oriental de la República Democrática del Congo y sus incursiones en el territorio de Ruanda.",1
"103","89. Las fuerzas de seguridad nacional son fuerzas regulares cuya misión es supervisar la seguridad interna y externa del Sudán, monitorear los acontecimientos relevantes, analizar la importancia y los peligros de los mismos y recomendar medidas de protección.",1
"104","60. Es particularmente importante desarrollar intercambios prácticos entre el Consejo de Seguridad y la Asamblea General sobre cómo detener los flujos ilícitos de armas y municiones hacia zonas de crisis y conflicto.",1
"105","Según su declaración, se encontraba en su oficina cuando fue alertado de la explosión.",1
"106","Si bien están fuera del mandato de UNMISET, los recientes fallos de un tribunal de apelaciones en Indonesia, al revocar cuatro condenas del Tribunal Ad Hoc de Derechos Humanos, impactan directamente en la cuestión más amplia de lograr la rendición de cuentas.",0
"107","Sin embargo, a menudo faltan una detección y prevención eficaces en la frontera debido a la aplicación insuficiente de indicadores de riesgo y criterios de selección; la falta de intercambio de información y cooperación entre los funcionarios de aduanas, los departamentos de aplicación de la ley y de inmigración y las unidades de inteligencia financiera; y la falta de recursos humanos y materiales dedicados.",0
"108","Otros instrumentos jurídicos internacionales, incluido el Convenio para la Prevención del Terrorismo del Consejo de Europa, han comenzado a considerar cuestiones relacionadas, como la incitación al terrorismo, el reclutamiento y el entrenamiento.",0
"109","Creemos que Somalia se enfrenta a un desafío similar al de un corredor de maratón, ya que la redacción de la constitución debe finalizar antes del 20 de abril y su aprobación debe completarse el 22 de mayo.",0
"110","8. La Comisión iniciará sus actividades en la fecha que determinará el Secretario General, que será comunicada oficialmente al Gobierno de Pakistán.",0
"111","408. En lo que respecta al derecho internacional humanitario, el artículo 3 común a los Convenios de Ginebra prohíbe los actos de violencia contra la vida y las personas, incluidos los tratos crueles y la tortura, la toma de rehenes y los atentados contra la dignidad personal, en particular los tratos humillantes y degradantes.",1
"112","36. En otros casos, las misiones políticas especiales del Consejo han desempeñado un papel importante al ayudar a los Estados a reducir el espacio estratégico otorgado a los grupos terroristas mediante su participación en la delincuencia transfronteriza.",0
"113","Informe del Secretario General sobre la situación en Abjasia (Georgia) (S/2004/26).",0
"114","El Consejo de Gobernadores también celebró su undécimo período extraordinario de sesiones el 11 de marzo de 2003 para elegir un nuevo Presidente y un nuevo Vicepresidente del Consejo. Alemania y Angola fueron elegidos por aclamación Presidente y Vicepresidente del Consejo, respectivamente.",0
"115","En octubre de 2003, el Gobierno chino también promulgó y puso en vigor la Ley de la República Popular China sobre la Prevención de la Contaminación Radiológica.",0
"116","285. La Comisión también ha constatado que los rebeldes han matado a civiles, aunque los incidentes y el número de muertes han sido pocos.",1
"117","63. Siguen existiendo importantes preocupaciones respecto de las restricciones a la libertad de expresión.",1
"118","Se impone deliberadamente a los sospechosos hambre y otras condiciones de detención inhumanas para aumentar la presión sobre ellos para que confiesen e incriminen a otras personas.",1
"119","C. Seguridad de los refugiados, los desplazados internos, los civiles y los trabajadores humanitarios con respecto a las normas internacionales de derechos humanos",0
"120","Actualmente, se cree que unos 47 grupos armados no estatales &quot;han tenido o están teniendo&quot; sistemas portátiles de defensa aérea.",1
"121","Tratado de Prohibición Completa de los Ensayos Nucleares (TPCE) ratificado",0
"122","La situación en Timor Oriental (véanse S/11593/Add.50 y 51; S/11935/Add.15 y 16; S/1999/25/Add.17, 22, 25, 30, 33 a 36, 42 y 50 ; S/2000/40/Add.4, 11, 16, 20, 25, 29, 30, 34, 35, 37, 38, 40, 46, 47 y 48; 5)",0
"123","Una organización denunció métodos crueles e inhumanos de matar, como dos casos de asesinato por crucifixión.",1
"124","El primero era una camioneta blanca que transportaba a tres hombres uniformados y armados con armas M16. El segundo era un camión rojo que transportaba entre 15 y 20 hombres armados, algunos uniformados y otros vestidos de civil.",1
"125","Varios detenidos bajo custodia de las autoridades marroquíes iniciaron una huelga de hambre desde principios de agosto hasta el 29 de septiembre.",1
"126","Me preocupa que la votación parlamentaria y el estancamiento puedan alterar los laboriosos avances que han logrado las partes interesadas somalíes y sus socios.",0
"127","34. La situación en Sierra Leona (27 de noviembre de 1995; 21 de diciembre de 2007).",0
"128","Uso de formulaciones descriptivas de los temas del programa para evitar tener varios temas separados sobre el mismo tema.",0
"129","Martín Pérez también fue el organizador de otro intento de asesinato, abortado, que tendría lugar durante la Cumbre del CARIFORUM en la República Dominicana en agosto de 1998.",0
"130","El general de brigada solicitó que cesaran los disparos para permitir que sus hijos fueran evacuados de la casa.",1
"131","La expedición de esos visados habría ahorrado un tiempo considerable de espera para la expedición de los visados de entrada única de un mes de duración, que los miembros del Grupo recibían en Addis Abeba cada vez que expiraban sus visados.",0
"132","b) Miembro de la Asamblea Nacional del distrito de Al-Waha;",0
