"","en_es_GOOGLE","MatConf"
"741","Confirmó que un helicóptero ruso había sido derribado y que una junta de investigación de las Naciones Unidas, que había estado en el país la semana anterior, presentaría un informe a principios de noviembre.",1
"742","Se desconoce la identidad del autor o autores;",0
"743","Además, las restricciones impuestas por Eritrea afectan dramáticamente la seguridad del personal de mantenimiento de la paz de las Naciones Unidas y sus operaciones, hasta el punto de que la continua ocupación de pequeños puestos en lugares aislados, que constituyen 18 de 40 lugares, se ha vuelto insostenible y ya no es operativamente viable.",1
"744","Programa de trabajo del Comité del Consejo de Seguridad establecido en virtud de la resolución 1540 (2004) para el período comprendido entre el 1 de junio de 2013 y el 31 de mayo de 2014",0
"745","Profundamente preocupada, a este respecto, por los ejemplos recientes de grupos terroristas, incluidos aquellos que se benefician de la delincuencia organizada transnacional, que atacan al personal de las Naciones Unidas,",1
"746","77. Todas las pruebas disponibles sugieren que los tiroteos iniciales de la mañana del 25 de marzo que provocaron la explosión fueron el resultado de una acción coordinada de las fuerzas de seguridad que tuvo como resultado la muerte de más de 100 civiles.",1
"747","424. El hecho de que los Janjaweed dominen a la policía es una tendencia que comenzó incluso antes de la crisis actual y podría detectarse a partir de la información proporcionada por el propio Gobierno.",1
"748","Además de examinar la Lista, el Equipo examina la implementación de las tres medidas de sanciones: la congelación de activos, la prohibición de viajar y el embargo de armas.",1
"749","Otros soldados empezaron a golpear a las otras cuatro mujeres, incluida la testigo.",1
"750","El elemento de intereses asciende a 430.912 dólares de los EE.UU. (283.540 dinares jordanos).",0
"751","51. Sigo firmemente comprometido con la aplicación de la resolución 1559 (2004) en aras de la paz y la estabilidad regionales, en un momento particularmente difícil y desafiante.",0
"752","Aún se desconoce quién estuvo detrás del ataque.",1
"753","Este es el único mecanismo establecido por la resolución mediante el cual podría ser posible divulgar parte de la información fáctica y las conclusiones de un caso fuera de la Oficina del Defensor del Pueblo y el Comité.",0
"754","También pueden estar utilizando oro y materias primas preciosas como medio de transferencia.",0
"755","3. La situación en Chipre (27 de diciembre de 1963; 14 de diciembre de 2010).",0
"756","Quisiera hacer tres observaciones sobre esas cuestiones.",0
"757","El informe incluía una descripción sombría de la situación en la región, caracterizada por más actos de violencia y terrorismo.",1
"758","3. Un dirigente principal de Al-Itihaad a cargo general de los campos de entrenamiento compró fusiles de asalto AK-47, ametralladoras PKM, lanzacohetes RPG-7, granadas de mano F1, granadas de fusil y granadas de mortero en el mercado de armas de Irtogte entre el 7 y el 21 de noviembre de 2004. La misma persona compró 2 ametralladoras PKM, 10 ametralladoras medianas SG-43, 120 pistolas TT-33 Tokarev y 60 cargadores para rifles de asalto AK-47 el 27 de noviembre de 2004, así como 16 ametralladoras PKM y municiones. para lanzacohetes RPG-7 el 15 de enero de 2005 (S/2005/153, anexo II).",1
"759","2. La situación en Sierra Leona.",0
"760","(v) Resultados básicos del programa de verificación",0
"761","El uso de componentes militares para funciones críticas puede aumentar la confiabilidad de sistemas completos, por ejemplo, el uso de explosivos militares y detonadores en artefactos explosivos improvisados.",1
"762","Destaca en particular la urgente necesidad de proporcionar una mejor protección física a las poblaciones desplazadas, así como a otros grupos vulnerables, en particular las mujeres y los niños. Los esfuerzos deben centrarse en las zonas donde estas poblaciones y grupos corren mayor riesgo.",1
"763","Muchas víctimas de ataques en la misma zona, que identificaron a sus atacantes como Janjaweed, describieron a la Comisión que los atacantes vestían los mismos uniformes, utilizaron el mismo despliegue durante el ataque y utilizaron las mismas armas que las empleadas por las fuerzas locales de las PDF.",1
"764","En marzo de 2004, en la aldea de Dobo, en el norte de Darfur: &quot;Comenzaron a quemarlo todo y a robar nuestras pertenencias.",1
"765","134. Siete de los ocho Estados de Asia central y el Cáucaso han ratificado 12 de los instrumentos jurídicos internacionales de lucha contra el terrorismo, y Kirguistán está considerando activamente la posibilidad de adherirse a los seis instrumentos en los que aún no es parte.",0
"766","Por lo tanto, al examinar la responsabilidad por las violaciones de derechos humanos perpetradas durante los acontecimientos del 25 y 26 de marzo, también habría que tener en cuenta las repercusiones del decreto presidencial del 22 de marzo y de las instrucciones dadas a los jefes de las fuerzas armadas nacionales. durante la reunión del 24 de marzo.",1
"767","A esto le seguiría inmediatamente un registro a nivel nacional de los aproximadamente 2,7 millones de votantes potenciales del país.",0
"768","Si bien ningún aldeano denunció ningún caso de violación al equipo de investigación de la UNAMID, las fuerzas armadas sudanesas y el personal de inteligencia militar estuvieron presentes en la aldea durante la investigación de la UNAMID.",0
"769","20. La comunidad internacional ha dedicado enormes esfuerzos a tratar de resolver el problema de la presencia de grupos armados en la República Democrática del Congo.",0
"770","Los hombres de estos vehículos y los soldados en la calle dispararon contra los vehículos policiales e hirieron a un oficial de la PNTL en las piernas.",1
"771","Añadió que los principios de mantenimiento de la paz de las Naciones Unidas, a saber, el consentimiento de las partes, la imparcialidad y el no uso de la fuerza excepto en defensa propia y defensa del mandato, tal vez no siempre se apliquen contra los grupos criminales armados en las misiones contemporáneas, y que su aplicación podría revisarse y ajustarse a las amenazas contemporáneas y al contexto de violencia que enfrentan los civiles inocentes y el personal de mantenimiento de la paz en las zonas de conflicto.",0
"772","Aunque la amenaza de las milicias ilegales en el oeste seguirá siendo baja, en comparación con la mayor parte de Afganistán, estas fuerzas siguen representando el segundo mayor riesgo para la seguridad regional, detrás de las amenazas criminales y relacionadas con las drogas.",1
"773","Aparte de las reuniones periódicas del Consejo de Ministros Árabes del Interior, no se produce ningún intercambio regular e institucionalizado de información operativa a nivel subregional.",0
"774","Los casos de cólera también han aumentado en la región de Diffa, en el sur de Níger.",0
"775","En los distritos afectados por la violencia de las pandillas se han incrementado las operaciones militares y policiales, junto con medidas selectivas contra los líderes de las pandillas.",1
"776","B. Dispersión de grupos de milicias en Ituri",1
"777","Condenamos los repetidos ataques terroristas con cohetes contra objetivos civiles israelíes.",0
"778","(i) Los depósitos en efectivo y a plazo representan fondos en cuentas de depósito a la vista y depósitos bancarios que devengan intereses;",0
"779","Sin embargo, la información proporcionada por Shartai y Omdas que acompañaron a la Comisión Nacional, y las pruebas disponibles, indican que todas las partes fueron responsables, en las circunstancias del conflicto encarnizado, del incendio de las aldeas.",1
"780","A la fecha de corte de este informe, un total del 37% del efluente del DF, que fue entregado por el MV Cape Ray los días 30 y 31 de agosto de 2014, ya había sido destruido.",1
"781","Esta clasificación es necesaria no sólo para determinar si esos crímenes constituyen genocidio sino también para el proceso de identificación de los perpetradores.",1
"782","Esto incluye la necesidad de poner a disposición más capacidad judicial para evitar un creciente atraso dentro del sistema de justicia.",0
"783","La República Popular Democrática de Corea rechaza categóricamente la resolución de derechos humanos contra la RPDC, fabricada sobre la base de complots, mentiras y desinformación y forzada por los Estados Unidos y otros países hostiles de manera prepotente y arbitraria.",0
"784","22. De conformidad con el párrafo 11 de la resolución 1963 (2010), el Comité, con la asistencia de su Dirección Ejecutiva, celebró una reunión especial el 28 de septiembre de 2011 para conmemorar el décimo aniversario de la aprobación de la resolución 1373 (2001) y el establecimiento de el Comité.",0
"785","También se produjeron enfrentamientos entre grupos armados afiliados al Gobierno de Malí y grupos armados representados en las conversaciones de Argel, a pesar de los compromisos de alto el fuego de las distintas partes. El 9 de octubre, un convoy que transportaba armas, morteros y armamento antiaéreo que avanzaba por el norte de Níger hacia Malí fue interceptado y destruido por fuerzas francesas y nigerianas. Según los informes, las armas estaban siendo entregadas a Ansar Dine. El 12 de octubre, las fuerzas de seguridad mauritanas detuvieron en la ciudad minera de Zouerat, en el norte del país, a cuatro personas sospechosas de establecer contactos con yihadistas y reclutar para el Estado Islámico en Irak y el Levante (ISIS).",1
"786","Seguirá supervisando la evolución de la situación de seguridad a lo largo de las fronteras entre la República Centroafricana, el Camerún y el Chad, pero también entre el Sudán y la República Democrática del Congo, a fin de evitar que se desborden situaciones de conflicto grave o crisis humanitarias. de un país a otro.",0
"787","He solicitado que la BINUCA continúe sus esfuerzos para apoyar al Gobierno en su esfuerzo por obtener asistencia bilateral para el desarrollo de capacidades para sus fuerzas nacionales.",0
"788","Por ejemplo, en el caso de genocidio, una persona que intenta asesinar a un conjunto de personas pertenecientes a un grupo protegido, con la intención específica de destruir el grupo (en su totalidad o en parte), puede estar motivada por el deseo de apropiarse de los bienes. pertenecer a ese grupo o conjunto de personas o por el impulso de vengarse de ataques anteriores por parte de miembros de ese grupo o por el deseo de complacer a sus superiores que desprecian a ese grupo.",1
"789","En una escala más amplia, Internet ha permitido a Al-Qaida y sus afiliados difundir propaganda a una audiencia mundial y así poner a posibles reclutas al alcance de su adoctrinamiento, en parte atrayéndolos a sitios web relacionados con Al-Qaida.",1
"790","La policía lanzó gases lacrimógenos para dispersar a los partidarios de ambos partidos que lanzaban piedras en las calles.",1
"791","Hecho en Kampala el 22 de noviembre de 2002.",0
"792","20. Surgieron otras dos cuestiones relacionadas con las operaciones aéreas.",0
"793","El ataque obligó a muchos civiles a buscar refugio fuera de la ciudad, las Fuerzas Armadas Sudanesas sufrieron decenas de bajas y el SLM/A se llevó grandes cantidades de armas, municiones, combustible y otros suministros. El 29 de septiembre se produjo otro ataque contra la propia ciudad de Tawilla, cuando la policía gubernamental y unidades de las Fuerzas Armadas Sudanesas entraron en la ciudad y, más tarde, en el campamento adyacente de Dali para desplazados internos, disparando contra civiles de forma indiscriminada y sin provocación.",1
"794","&quot;El Consejo de Seguridad insta a los Estados del Sahel y del Magreb a mejorar la cooperación y la coordinación interregionales a fin de desarrollar estrategias inclusivas y eficaces para combatir de manera amplia e integrada las actividades de los grupos terroristas, en particular Al-Qaida en el Magreb Islámico (AQMI), &quot; Mouvement pour l&#39;Unicité et le Jihad en Afrique de l&#39;Ouest&quot; (MUJAO) y Ansar Eddine, e impedir la expansión de esos grupos, así como reprimir la proliferación de todas las armas y luchar contra la delincuencia organizada transnacional, incluido el tráfico de drogas y , toma nota a este respecto de los resultados de la Conferencia organizada por la CTED y la CTITF en Rabat sobre la cooperación en materia de control de fronteras en el Sahel y el Magreb, así como de los resultados de la reunión ministerial sobre el refuerzo de la cooperación en materia de seguridad y la puesta en funcionamiento de la Arquitectura Africana de Paz y Seguridad en la región sahelosahariana celebrada en Nouakchott.",0
"795","Estos proyectos también ayudan a rehabilitar bienes comunitarios como carreteras, mercados, escuelas, pozos, captaciones de agua y canales de riego.",0
"796","Varios Estados aún no han aplicado procedimientos para identificar y congelar los activos terroristas sin demora.",1
"797","Según su declaración, estaba en su oficina cuando escuchó la explosión, pero pensó que el ruido era el resultado de que los aviones de combate israelíes atravesaran la barrera del sonido.",1
"798","Un problema adicional era el hecho de que el Gobierno aparentemente no poseía suficientes recursos militares, ya que muchas de sus fuerzas todavía estaban ubicadas en el sur y las presentes en Darfur estaban ubicadas principalmente en los principales centros urbanos.",1
"799","Todas las provincias y la ciudad autónoma de Buenos Aires han pasado a ser partes de la Ley N° 24.059.",0
"800","Que se celebrará el lunes 25 de junio de 2007, a las 10.20 horas",0
"801","Las autoridades pertinentes han solicitado que el plazo del 31 de octubre de 2005 para la solicitud formal de enmiendas por parte del Gobierno del Iraq se traslade al 31 de diciembre de 2005 a fin de tener plenamente en cuenta los problemas de comunicación entre las autoridades pertinentes y los proveedores para las prórrogas del envío. fecha y validez de las cartas de crédito.",0
"802","Esa restricción deberá permanecer vigente mientras la participación en dicho viaje genere la obligación de informar sobre asuntos sustantivos.",1
"803","(véanse S/2001/Add.20; véanse también S/2000/40/Add.50; S/2001/15/Add.4, 7, 10, 13, 26, 38, 45 y 51; S/2002/ 30/Add.2, 8, 12, 18, 20, 27, 38, 48 y 49; y S/2003/40/Add.4, 12, 18, 28, 30, 34, 37 y 51).",0
"804","Actuando en virtud del Capítulo VII de la Carta de las Naciones Unidas,",0
"805","Estas recomendaciones se examinarán más a fondo a la luz del examen por el Comité de la cuestión transversal del uso indebido delictivo de Internet (párr. 110).",0
"806","En 2006, más de 324 niños fueron secuestrados en 136 incidentes de secuestro en grupo; más de 210 fueron secuestrados en noviembre de 2006 y el resto entre mayo y diciembre de 2006.",1
"807","145. Sin embargo, el Grupo de Supervisión recibió una respuesta sustantiva del Gobierno del Yemen (anexo XVI), de fecha 30 de septiembre de 2006.",0
"808","Durante su última visita a Damasco, del 10 al 15 de diciembre de 2014, el Equipo de Evaluación de la Declaración continuó entrevistándose con las principales personas del programa sirio de armas químicas, celebró reuniones técnicas con la Autoridad Nacional de la República Árabe Siria y visitó dos sitios.",0
"809","La Misión está examinando con algunos líderes combatientes rwandeses y con el Gobierno de Transición las modalidades técnicas de repatriación, y ha hecho pública la decisión adoptada por el Gobierno de Ruanda de no enjuiciar a ningún combatiente que regresara y tuviera 14 años o menos en el momento del genocidio de 1994. .",0
"810","3. Las tensiones políticas en torno a las elecciones de 2012 aumentaron durante el período que abarca el informe. El 9 de septiembre de 2011, un convoy que transportaba al brigadier Julius Maada Bio (Rtd), candidato presidencial del SLPP, fue atacado por partidarios del APC en Bo, en la región meridional, resultando herido.",1
"811","Este caso ilustra no sólo los asesinatos en masa de civiles, sino también los confinamientos injustos acompañados de ejecuciones sumarias, violaciones y otros abusos.",1
"812","En segundo lugar, se ha producido una destrucción en gran escala de aldeas en los tres estados de Darfur.",1
"813","La Comisión Nacional tenía pruebas de que las fuerzas armadas bombardearon determinadas zonas en las que algunos miembros de la oposición buscaron refugio. Como resultado de ese bombardeo, algunos civiles murieron.",1
"814","La recién formada FDTL pasó a llamarse FALINTIL-FDTL (F-FDTL) en un intento de vincular la futura fuerza de defensa con la historia del FRETILIN y superar la retirada de FALINTIL del FRETILIN en 1987 por parte de Xanana Gusmão.",0
"815","En Lerneb (región de Tombuctú), en septiembre, MAA (Plataforma) advirtió en varias reuniones públicas que castigaría a los miembros de la población local que proporcionaran información a la MINUSMA y a las fuerzas francesas. El 23 de septiembre se encontró el cuerpo de un hombre decapitado en la zona de Zouera, 80 kilómetros al norte de Tombuctú. Fue uno de los cinco hombres secuestrados el 16 de septiembre por AQMI y acusados por esa organización de colaboración con fuerzas internacionales, que desde entonces han desaparecido.",1
"816","En muchos Estados, las deficiencias en las capacidades institucionales y los recursos limitados dificultan la priorización de las iniciativas de lucha contra el terrorismo.",0
"817","3. El 27 de diciembre de 2007, partidarios del sargento Ibrahim Coulibaly, alias IB, que había sido miembro de las Forces nouvelles, fueron acusados de atacar a personal de las Forces nouvelles en Bouaké. El ataque provocó varias muertes y la detención de varias personas.",1
"818","&quot;Armas de destrucción masiva y no proliferación como mejor práctica empresarial&quot;, seguido de un ejercicio",1
"819","Proporcionó detalles sobre las violaciones y abusos cometidos contra niños en Yemen.",1
"820","El Comité seguirá centrándose en supervisar y promover la aplicación por los Estados miembros de la resolución 1373 (2001) y en adoptar medidas prácticas para mejorar la capacidad antiterrorista de los Estados, incluidas medidas destinadas a facilitar la asistencia técnica.",0
"821","(a) necesarios para gastos básicos, incluidos pagos de alimentos, alquiler o hipoteca, medicamentos y tratamientos médicos, impuestos, primas de seguros y cargos por servicios públicos, o exclusivamente para el pago de honorarios profesionales razonables y el reembolso de gastos incurridos asociados con la prestación de servicios jurídicos, u honorarios o cargos por servicios por la tenencia o mantenimiento rutinario de fondos congelados u otros activos financieros o recursos económicos, previa notificación por el Estado o los Estados pertinentes al Comité establecido de conformidad con la resolución 1267 (1999) (en adelante denominado &quot; Comité&quot;) de la intención de autorizar, cuando corresponda, el acceso a dichos fondos, activos o recursos y en ausencia de una decisión negativa del Comité dentro de las 48 horas siguientes a dicha notificación;",0
"822","94. A pesar de los recientes avances, las limitaciones logísticas, políticas y de seguridad harán extremadamente difícil la desmovilización y reintegración previstas de 180.000 excombatientes antes de que finalice el período del Acuerdo General de Paz.",1
"823","Esto en sí mismo presenta una nueva serie de desafíos, como idear nuevos enfoques para contrarrestar la incitación y el extremismo violento y tener en cuenta la relación entre seguridad y desarrollo.",0
"824","Los agentes de la UIR del este se vieron obligados a refugiarse en el edificio de la administración del distrito. Luego el edificio fue rodeado por la multitud. Armados con cuchillos, palos, machetes y piedras, la multitud comenzó a gritar amenazas de muerte contra los agentes de la UIR oriental.",1
"825","11. Se llevó a cabo formación periódica sobre la base del plan anual. El 11 de agosto los bomberos franceses de la Brigada Multinacional del Nordeste impartieron formación en primeros auxilios en Mitrovica. El 30 de agosto, la Brigada Multinacional Este llevó a cabo un seminario para comandantes de zonas de recogida en Tradoc. El propósito era presentar el Programa de Desarrollo de Oficiales en detalle para garantizar que los comandantes entendieran sus responsabilidades y aseguraran el apoyo al programa. Conclusión 12. La situación general en Kosovo sigue siendo relativamente tranquila, con tensiones subyacentes que continuarán en el futuro previsible.",0
"826","Las implicaciones de la muerte de Khalil Ibrahim para el proceso de paz de Darfur sólo quedarán claras con el tiempo.",1
"827","Esferas de evaluación 25. Todos los Estados visitados han promulgado leyes que confieren a sus autoridades judiciales, fiscales y policiales las competencias necesarias para luchar contra el terrorismo.",0
"828","En general, se acepta que la escalada coincidió con la intensificación del conflicto armado interno entre el Gobierno y los dos movimientos rebeldes, el Movimiento/Ejército de Liberación del Sudán y el Movimiento Justicia e Igualdad.",1
"829","para la recepción por dicha persona o cualquier otra de un pago o la adquisición por dicha persona o cualquier otra de un bien, fuera de la República; o",0
"830","Las personas que son repatriadas por la fuerza desde China suelen ser sometidas a tortura, detención arbitraria, ejecución sumaria, aborto forzado y otras formas de violencia sexual.",1
"831","2. Gastos en servicios públicos 468 93",0
"832","Insta a los signatarios del [acuerdo de paz] a trabajar por una solución sostenible para el retorno voluntario, la reinstalación, la reintegración y la seguridad de las personas desplazadas, incluso abordando las cuestiones de tenencia de la tierra, con el apoyo del sistema de las Naciones Unidas, y a cumplir en este considerar sus compromisos de conformidad con el... Acuerdo Político y sus obligaciones bajo el derecho internacional.",0
"833","Tanto la resolución como el Convenio establecen que para que exista el delito de financiación del terrorismo, los fondos destinados a financiar el acto terrorista no necesitan ser producto del delito, y que el acto terrorista que los fondos estaban destinados a financiar en realidad no necesita haber tenido lugar o incluso haber sido intentado.",1
"834","Organizará reuniones con el Equipo de Vigilancia y los expertos del Comité del Consejo de Seguridad establecido en virtud de la resolución 1540 (2004) para examinar cuestiones de interés común y garantizar una coordinación adecuada de nuestra labor.",0
"835","Mientras tanto, los bienes del ACNUR desde Belgrado se entregaron como de costumbre.",0
"836","Otro testimonio destacó las ejecuciones sumarias de personas que supuestamente habían cometido robos en zonas controladas por el MPCI.",1
"837","&quot;El Consejo de Seguridad condena las violaciones del derecho internacional humanitario y de los derechos humanos cometidas por miembros de las FARDC, incluidas las violaciones masivas cometidas en Minova el 24 de noviembre de 2012, y pide al gobierno de la República Democrática del Congo que detenga rápidamente, lleve ante la justicia y exigir responsabilidades a los responsables de tales violaciones, independientemente de su rango militar.",1
"838","206. Los Estados de la subregión son muy conscientes de la amenaza que representa la financiación del terrorismo y están alerta ante los riesgos asociados.",1
"839","El Consorcio MIE no aportó justificante del pago de los costes del vuelo de noviembre.",0
"840","&quot;El Consejo de Seguridad reitera sus resoluciones y declaraciones presidenciales anteriores sobre Somalia, en particular su resolución 1872, que reafirmó el Acuerdo de Djibouti como base para una solución del conflicto en Somalia.",0
"841","Retamos a cualquiera a decir que ahora hay un solo brote de violencia o batalla en cualquier parte del Sudán.",0
"842","Este presupuesto incluye recortes significativos a los costos operativos y de capital, e incluye recortes de algunas asignaciones.",0
"843","El artículo 3 común a los Convenios de Ginebra y al Protocolo adicional II establece el requisito previo de un conflicto armado no internacional.",0
"844","23. La situación de seguridad en la mayor parte del país siguió siendo frágil pero en general estable y se denunciaron pocos incidentes.",1
"845","62. Con respecto a las tareas relacionadas con la matriz, el acuerdo por parte del Comité sobre un nuevo formato fue un importante paso adelante.",0
"846","La UNMOVIC incurrió en gastos administrativos por unos 11 millones de dólares en 2006. Hubo una disminución de 20,7 millones de dólares en comparación con 31,7 millones de dólares en 2005.",0
"847","Según la jurisprudencia internacional, planificación implica que una o varias personas contemplan diseñar la comisión de un delito tanto en la fase preparatoria como en la de ejecución.",0
