"","en_es_GOOGLE","MatConf"
"2288","Al mismo tiempo, el Consejo reconoce que el Representante Especial del Secretario General, asistido por asesores civiles, podría desempeñar un papel clave de coordinación en la prestación de asistencia humanitaria, el restablecimiento del orden público, el funcionamiento de las instituciones públicas, así como como la rehabilitación, la reconstrucción y la consolidación de la paz, que conducen al desarrollo sostenible a largo plazo.",0
"2289","Los sitios van desde los creados para promover a personas concretas, como Shamil Basayev en Chechenia, o grupos, como Lashkar-E-Tayyiba en el Pakistán, hasta aquellos que pretenden justificar el terrorismo relacionado con Al-Qaida en general, como Voice of Jihad, u ofrecer entrenamiento terrorista, como Al-Battar.",1
"2290","&quot;El Consejo de Seguridad reconoce la intención expresada por representantes de ambas organizaciones de cooperar en una amplia agenda de interés mutuo, formulando respuestas conjuntas adecuadas, cuando corresponda, a las crisis humanitarias, promoviendo los derechos humanos, la libertad de expresión, la seguridad alimentaria, la protección del medio ambiente y la lucha contra el terrorismo y el tráfico ilícito de drogas y armas, al tiempo que reitera la necesidad de garantizar que todos los esfuerzos de las Naciones Unidas para restablecer la paz y la seguridad también respeten y promuevan el Estado de derecho.",0
"2291","Australia, Dinamarca, Francia, los Países Bajos, Nueva Zelanda, Noruega, el Reino Unido y los Estados Unidos tienen departamentos, dependencias y/o territorios de ultramar, cada uno de los cuales tiene un grado diferente de autonomía y capacidad para determinar su propio marco legislativo para contraterrorismo.",0
"2292","Las disputas étnicas y fronterizas no resueltas han dado lugar a conflictos que socavan los esfuerzos por desarrollar una respuesta antiterrorista regional cohesiva.",0
"2293","El informe señala que un número considerable de niños fueron reclutados por el Partido Comunista de Nepal-Maoísta (CPN-M) antes de la firma del acuerdo de alto el fuego y trasladados a acantonamientos.",1
"2294","101. Desde noviembre de 2004, el Gobierno de Côte d&#39;Ivoire ha tratado de reparar, mantener y reconstruir la FACI como una declaración política de que el poder aéreo proporciona al Gobierno una ventaja militar que las FN no tienen.",1
"2295","El infractor será castigado con prisión de tres a diez años o con el decomiso de bienes,",1
"2296","Además, cuando el uso de la violencia armada se convierte en un medio arraigado para resolver agravios y conflictos individuales y grupales, los mecanismos legales y pacíficos de resolución de disputas se erosionan y no se puede defender el estado de derecho.",1
"2297","Lo que todo el mundo debe hacer es rechazar las voces extremistas que encuentran consuelo en las viejas costumbres y que creen que es imposible para serbios y albaneses normalizar sus relaciones alcanzando un compromiso histórico.",0
"2298","El Estado ha impuesto restricciones descaradamente discriminatorias a las mujeres en un intento de mantener el estereotipo de género de la mujer coreana pura e inocente.",1
"2299","Según fuentes oficiales australianas, el entrenamiento incluye técnicas de fabricación de bombas y de atentados suicidas.",1
"2300","La ausencia de autoridad estatal también ha llevado a la creación de grupos comunitarios de autodefensa para proteger a las comunidades de los grupos armados, que a menudo se han convertido en ellos mismos una fuente de conflicto.",1
"2301","d) Fuerzas Democráticas de Liberación de Rwanda;",0
"2302","Sólo en cinco Estados se han adoptado parcialmente medidas para impedir el abuso de los procedimientos de asilo.",0
"2303","La Comisión recibió información creíble de que dichas personas fueron torturadas y sometidas a tratos crueles, inhumanos y degradantes.",1
"2304","(5) Decisión del Soviético Supremo de 5 de mayo de 1993 sobre la participación de Ucrania en la Convención sobre la protección física de los materiales nucleares;",0
"2305","En septiembre se produjeron brechas por ambas partes, ataques y contraataques, venganzas y represalias.",1
"2306","La tortura, la violación y otras crueldades arbitrarias a manos de guardias y compañeros de prisión son prácticas generalizadas y se cometen con impunidad.",1
"2307","Sin embargo, Irak todavía se enfrenta a fuerzas terroristas que incorporan elementos extranjeros que llevan a cabo ataques horribles y actos terroristas en un intento de frustrar el desarrollo político y económico en Irak.",1
"2308","Malta no tiene legislación sobre intermediación.",0
"2309","Además, los miembros de los movimientos rebeldes procedían principalmente de grupos de defensa de las aldeas locales de determinadas tribus, que se habían formado como respuesta al aumento de los ataques de otras tribus.",1
"2310","117. Los actos de terrorismo e incitación son manifestaciones complejas de conducta delictiva.",1
"2311","En el gráfico I se muestran los ingresos y gastos comparativos de los ejercicios económicos 2004/2005, 2006/2007 y 2008/2009.",0
"2312","Algunos artículos han sido traducidos al sueco, polaco, ruso, alemán y lituano.",0
"2313","No existe una política de defensa que oriente el desarrollo de la FFDTL.",0
"2314","45. El Gobierno de Nepal debería velar por que existan medidas de protección adecuadas para los niños víctimas y testigos y para los niños acusados de crímenes en el contexto del conflicto, así como incluir la participación de los niños en cualquier actividad de justicia de transición para asegurar que sus experiencias de Se escucha el conflicto.",0
"2315","Esto incluye a aquellos identificados como fundamentales para el adoctrinamiento y reclutamiento de terroristas suicidas.",1
"2316","33. La amenaza que representan los antiguos militares disminuyó durante el período que abarca el informe, tras la muerte, el 9 de abril, del autoproclamado dirigente Ravix Rémissainthe (véase S/2005/313, párr. 16).",1
"2317","Reconoce que, a pesar de los avances logrados en materia de igualdad de género, es necesario intensificar los esfuerzos, incluidos objetivos mensurables y orientados a la acción, para garantizar los derechos de las mujeres y las niñas y garantizar que todas las mujeres y las niñas en [el país afectado] estén protegidas de la violencia y el abuso, disfrutar de igual protección ante la ley y de igual acceso a la justicia, condena enérgicamente la discriminación y la violencia contra las mujeres y las niñas, en particular la violencia dirigida a impedir que las niñas asistan a la escuela, destaca la importancia de aplicar las resoluciones del Consejo de Seguridad 1325 (2000), 1820 (2008) , 1888 (2009), 1889 (2009) y 1960 (2010), señala los compromisos de integración introducidos en ellos y de garantizar que las mujeres que huyen de la violencia doméstica puedan encontrar un refugio seguro;",0
"2318","No se reportaron heridos, pero el helicóptero sufrió varios impactos de bala. Nuevamente, el 31 de enero de 2005, una patrulla de la AMIS que investigaba violaciones del alto el fuego en la zona de Shangil Tobai fue atacada con disparos cerca de cráteres que parecían confirmar denuncias de bombardeos.",1
"2319","El 14 de abril de 2012, el Consejo de Seguridad adoptó la resolución 2042 (2012), en la que se destacó el compromiso del Gobierno sirio de aplicar la propuesta de seis puntos del Enviado Especial de las Naciones Unidas, Sr. Annan; pidió la implementación urgente, integral e inmediata de todos los elementos de la propuesta; pidió a todas las partes en Siria, incluida la oposición, que cesen inmediatamente toda violencia armada en todas sus formas; y expresó su intención de establecer inmediatamente, después de consultas entre el Secretario General y el Gobierno sirio, una misión de supervisión de las Naciones Unidas en Siria para vigilar el cese de la violencia armada en todas sus formas por parte de todas las partes.",0
"2320","Ambas partes aún no habían retirado sus fuerzas de la zona, contraviniendo el acuerdo de 20 de junio de 2011.",1
"2321","Por último, se necesita urgentemente un liderazgo afgano para hacer frente a los narcóticos.",0
"2322","En una encuesta realizada en el campamento de Mornei, en Darfur occidental, los equipos médicos trataron a unas 20 víctimas de violencia sexual entre abril y junio de 2004.",0
"2323","En cuanto al equipo médico, las observaciones de la Unidad revelaron que persiste la escasez de incubadoras infantiles, máquinas de diálisis, equipos de ultrasonidos y rayos X, electrocardiógrafos, equipos generales de laboratorio y monitores de pacientes.",0
"2324","68. El asesinato de dos expertos de la UNODC el 7 de abril de 2014, mientras se encontraban en una misión de lucha contra la piratería en Somalia, fue un recordatorio aleccionador de los riesgos que enfrenta el personal de las Naciones Unidas en su trabajo para mejorar las vidas de otros.",1
"2325","Las tasas de mortalidad materna e infantil siguen siendo muy altas y la cobertura general de vacunación es baja (tuberculosis: 30 por ciento; polio: 22 por ciento; sarampión: 24 por ciento).",0
"2326","Sin embargo, el régimen de sanciones no apunta explícitamente a este aspecto crucial de la capacidad militar, a pesar de que está ampliamente cubierto por las regulaciones existentes de control y exportación de armas adoptadas por los Estados miembros y las instituciones multilaterales.",1
"2327","Muchos Estados también seguirán enfrentándose a cuestiones como la radicalización, el extremismo violento y el movimiento de terroristas a través de las fronteras.",1
"2328","Atacaron y mataron a 54 personas, hirieron a otras 24 e incendiaron casas antes de retirarse con ganado y propiedades familiares saqueadas.",1
"2329","Sin embargo, los parlamentarios del SLPP y del PMDC boicotearon la apertura estatal del Parlamento, protestando, entre otras cosas, contra la prohibición de procesiones y mítines políticos impuesta por la policía tras la violencia política del 9 de septiembre en Bo.",1
"2330","o El 29 de noviembre de 2014, aviones de combate del régimen lanzaron dos misiles contra la mezquita Nawawi en la ciudad de Raqqa, matando a 11 personas, entre ellas un niño, e hiriendo a otras 16.",1
"2331","A pesar de una reciente escalada en el número y la gravedad de sus ataques, el futuro de los talibanes es incierto.",1
"2332","También se informó de nuevas deserciones de antiguos elementos integrados del CNDP, así como de negativas de elementos de grupos armados integrados a aceptar el redespliegue.",1
"2333","Por supuesto, no siempre prevaleció la unanimidad, pero siempre hubo un esfuerzo serio para dar cabida a las opiniones de los 15 miembros y encontrar puntos en común.",0
"2334","En tercer lugar, los talibanes han sufrido la muerte o el arresto de muchos líderes de nivel medio y algunos de alto nivel, y si bien hay muchos que pueden ocupar su lugar, los nuevos comandantes son más jóvenes y tienen menos vínculos con Quetta Shura, que por lo tanto tiene menos control. sobre sus acciones y un trabajo más duro para afirmar su autoridad sobre el movimiento en su conjunto.",1
"2335","Que se celebrará el viernes 16 de marzo de 2001, a las 18.40 horas",0
"2336","El ataque que el régimen etíope lanzó hoy constituye una respuesta maliciosa a las súplicas de Eritrea.",1
"2337","Sin duda, soldados de ambos bandos murieron en los combates y, con toda probabilidad, primero las fuerzas rebeldes y luego las fuerzas gubernamentales tomaron represalias.",1
"2338","15. En los casos en que el Ombudsman recomiende que el Comité considere la posibilidad de eliminarlo de la lista, el requisito de que los Estados adopten las medidas descritas en el párrafo 1 de esta resolución terminará con respecto a esa persona, grupo, empresa o entidad 60 días después de que el Comité complete el examen de la lista. un Informe Integral del Ombudsman, de conformidad con este anexo II, incluido el párrafo 7 (h), a menos que el Comité decida por consenso antes del final de ese período de 60 días que el requisito permanecerá vigente con respecto a ese individuo, grupo , empresa o entidad; siempre que, en los casos en que no exista consenso, el Presidente, a petición de un miembro del Comité, someterá la cuestión de si se debe eliminar de la lista a esa persona, grupo, empresa o entidad al Consejo de Seguridad para que éste adopte una decisión en un plazo de 60 días. días; y siempre que, en caso de tal solicitud, el requisito de que los Estados adopten las medidas descritas en el párrafo 1 de esta resolución permanecerá en vigor durante ese período con respecto a esa persona, grupo, empresa o entidad hasta que se resuelva la cuestión. decidido por el Consejo de Seguridad.",0
"2339","De manera similar, se ha adoptado legislación antiterrorista que otorga a las autoridades judiciales y fiscales facultades jurídicas adecuadas para llevar a los terroristas ante la justicia.",0
"2340","A través de una parte del bloque del motor, encontrada y recogida en la escena del crimen, se ha concluido que el motor proviene de un vehículo Mitsubishi robado el 12 de octubre de 2004 en la ciudad de Sagamihara, Japón.",1
"2341","El regreso de Benazir Bhutto a Pakistán",0
"2342","Actuando por estos motivos en virtud del Capítulo VII de la Carta de las Naciones Unidas,",0
"2343","Durante el período que abarca el informe se registraron 1 tiroteo, 14 robos, 3 secuestros y 1 manifestación. El 9 de julio, un vehículo de la UNOMIG resultó dañado por una piedra lanzada por un residente local en la ciudad de Zugdidi.",1
"2344","34. La transparencia es un principio esencial que guía la labor y las actividades del Comité y ayuda a aumentar la confianza, fomentar una mayor cooperación y sensibilizar a los Estados, las organizaciones internacionales, regionales y subregionales pertinentes, la sociedad civil y el sector privado respecto de las cuestiones pertinentes para la resolución. 1540 (2004), que facilita la implementación de la resolución por parte de los Estados. 35. La transparencia y la divulgación en los medios de comunicación están estrechamente interconectados.",0
"2345","El Sr. Sidikou destacó que, incluso si Al-Shabaab hubiera sufrido reveses militares, el grupo todavía conservaba un número apreciable de sus combatientes y equipo, principalmente en las zonas rurales, y consideró que esto probablemente estaba destinado a mantener una lucha asimétrica prolongada.",1
"2346","Tampoco ha habido pruebas de que el Gobierno haya detenido a los autores de los ataques contra civiles de conformidad con el comunicado conjunto y la resolución 1556 (2004).",1
"2347","En sus respuestas, los miembros del Consejo expresaron su reconocimiento del carácter selectivo de las sanciones del Consejo y de su amplia aplicación a una serie de amenazas a la paz y la seguridad internacionales, que entrañan, entre otras cosas, asistencia a los Estados para recuperar la estabilidad y protección de las poblaciones civiles en conflicto. y luchar contra el terrorismo y la proliferación de armas de destrucción masiva.",0
"2348","Uganda sigue preocupada por la situación humanitaria en Darfur.",0
"2349","188. Los relatos de testigos presenciales de muchos incidentes publicados en estos informes mencionan que las fuerzas agresoras iban uniformadas, pero hacen una distinción entre los uniformes usados por el ejército regular y los Janjaweed.",1
"2350","(b) Lucro cesante 143 - 163",0
"2351",":: Oficina de Coordinación de Asuntos Humanitarios, &quot;Quedarse y cumplir: buenas prácticas para el personal humanitario en entornos de seguridad complejos&quot; (2011). Este informe establece el entorno operativo cada vez más difícil para los trabajadores humanitarios, recomendaciones sobre respuestas políticas y referencias a documentos legales relevantes.",0
"2352","El Consejo condena todas las acciones unilaterales destinadas a crear hechos sobre el terreno que perjudicarían el resultado de las negociaciones.",0
"2353","En ese contexto, reiteramos nuestra repetida afirmación de que la mayor amenaza a la investigación reside en el hecho de que ciertas partes dentro y fuera de nuestra región la están explotando para politizar conclusiones que no tienen ninguna relación con la investigación y que no se basan en bases firmes. evidencia.",0
"2354","II. VENTA DE PETRÓLEO Y PRODUCTOS PETRÓLEOS",0
"2355","También informó que la Fuerza de las Naciones Unidas de Observación de la Separación (FNUOS) seguía observando intensos enfrentamientos entre las fuerzas armadas sirias y miembros armados de la oposición, así como ataques aéreos de las fuerzas armadas sirias, dentro de la zona de separación y la zona de limitación.",1
"2356","En ningún momento el Gobierno de la República de Uganda o sus fuerzas armadas han hecho ningún intento abierto o encubierto de entrar en el territorio de la República Democrática del Congo para atacar a los terroristas del LRA.",0
"2357","Se informó que se infligía sistemáticamente a los detenidos sufrimientos físicos y mentales como castigo por su presunta afiliación o apoyo a los rebeldes, y con el fin de obtener información o confesiones.",1
"2358","El Servicio Estatal de Guardia de Fronteras, dependiente del Ministerio del Interior de la República de Lituania, realiza controles radiológicos de personas, vehículos y mercancías que entran y salen del país.",0
"2359","También se ha informado de que 18 mujeres fueron violadas durante el ataque a Adwa, en Darfur Meridional, a principios de diciembre de 2004.",1
"2360","Las fuerzas libanesas intervinieron en algunas ocasiones para controlar las manifestaciones e impedir que los manifestantes se acercaran a la Línea Azul.",1
"2361","En el este de la República Democrática del Congo, las amenazas a la seguridad derivadas de los enfrentamientos armados y los violentos disturbios civiles, a menudo exacerbados por la tensión política, siguen siendo motivo de preocupación.",1
"2362","Unos 230.000 nómadas fueron registrados por equipos de registro especializados.",0
"2363","Que se celebrará el jueves 15 de septiembre de 2011, a las 18.30 horas",0
"2364","48. La situación en Myanmar (15 de septiembre de 2006; 2 de mayo de 2008).",0
"2365","2. Aprobar excepciones a las medidas establecidas en el apartado 3 (a) caso por caso:",0
"2366","Las atrocidades indescriptibles que se están cometiendo contra los reclusos de los campos de prisioneros políticos de kwanliso se parecen a los horrores de los campos que los Estados totalitarios establecieron durante el siglo XX.",1
"2367","Sra. Savannah de Tessières (Francia) (armas: armas pequeñas y ligeras);",0
"2368","Los primeros indicios apuntan a que la explosión se produjo en la caravana del primer ministro Hariri, pero aún no se conoce el resultado.",1
"2369","71. En sus esfuerzos de búsqueda, se debería pedir a los Estados Miembros que utilicen, según sea necesario, el sistema mundial de comunicaciones policiales &quot;I-24/7&quot; de INTERPOL y el Sistema electrónico de rastreo de armas de INTERPOL.",0
"2370","Al mismo tiempo, el Presidente Al-Bashir amenaza a la comunidad internacional con represalias y aún más crímenes.",0
"2371","Por esta razón, los rebeldes dirigieron sus ataques contra instalaciones gubernamentales y evitaron deliberadamente atacar a las tribus árabes.",1
"2372","El régimen fue modificado en las resoluciones 1333 (2000) y 1390 (2002) para imponer tres medidas específicas (congelación de activos, prohibición de viajar y embargo de armas) contra personas y entidades asociadas con los talibanes y Al-Qaida.",1
"2373","Por lo tanto, volveré al Consejo sobre este asunto a su debido tiempo.",0
"2374","Dará voz a los jóvenes al servir como foro que garantice la coherencia de las políticas y promueva el interés de los jóvenes en las políticas gubernamentales.",0
"2375","Un Estado citó un amplio plan antiradicalismo, adoptado en 2006, cuyo objetivo es combatir la radicalización y al mismo tiempo proteger los valores democráticos.",0
"2376","Además, los menores no siempre están separados de los adultos y algunos presos todavía son sometidos a largos períodos de prisión preventiva, que a veces duran hasta 10 años.",1
"2377","Están experimentando presión contra elementos importantes de esta identidad, como su lengua, cultura y herencia religiosa, así como su supervivencia económica.",1
"2378","El PCN-M con frecuencia atacó y reclutó a muchas niñas, muchas de las cuales se unieron para escapar de las restricciones tradicionales sobre sus vidas.",1
"2379","Miembros de diferentes partidos eran miembros del Gobierno.",0
"2380","Bienes objeto de contrato recibidos por la SCOP: 1.134.470 GBP",0
"2381","Las fuerzas de oposición, de Mohamed Ibrahim Habsade, tomaron el control de Baidoa alrededor del 26 o 27 de marzo, derrotando a las milicias del presidente Yusuf y del jeque Madobe.",1
"2382","Daño o agotamiento de los recursos forestales;",0
"2383","15. Una amenaza particular ha surgido del uso cada vez mayor por parte de grupos y personas terroristas de nuevas tecnologías de la información y las comunicaciones para el reclutamiento, la incitación y la recaudación de fondos, a menudo a través de fronteras internacionales.",0
"2384","El F-FDTL también está en posesión de un Minimi, un calibre .38 Special, una Browning de 9 mm, dos rifles semiautomáticos G3, un rifle M16 A1 y un arma de fuego M2 calibre .50, cuya procedencia no se explica.",1
"2385","El 23 de agosto, como parte de una exposición informativa del Departamento de Asuntos Políticos, el Secretario General Adjunto de Asuntos Políticos dijo que personal de la Oficina de Coordinación de Asuntos Humanitarios estaba llevando a cabo una misión de evaluación en la República Árabe Siria y mencionó a la declaración del Secretario General según la cual, a pesar de su promesa, el Presidente Al-Assad no había puesto fin al uso de la fuerza contra civiles.",1
"2386",":: Malik Madeen al-Rajih, 19 años",0
"2387","Sin embargo, el potencial restante del MRC para socavar avances tangibles en la estabilización de Ituri sigue siendo motivo de preocupación, particularmente dada la incapacidad del Gobierno de Transición hasta el momento para llevar ante la justicia a los líderes de los grupos armados e impedir su entrada y salida de Uganda.",1
"2388","429. El Gobierno citó también su reconocimiento de tres casos de atentados con bombas por error. Afirmó que indemnizó a las víctimas de Habila, Umm Gozin y Tulo.",1
"2389","Posteriormente afirmó que el general Assef Shawkat había obligado al Sr. Abu Adass a grabar la cinta en Damasco aproximadamente 15 días antes del asesinato.",1
"2390","Gestión de riesgos biológicos y resolución 1540 (2004) del Consejo de Seguridad",0
"2391","5. Solicitud de Certificado de Control de Entrega",0
"2392","Expresó su preocupación por el aumento de la demolición de edificios en Palestina, el riesgo de traslado forzoso de la comunidad beduina de Um al-Kheir y las actuales actividades de asentamiento de Israel, que, según dijo, constituían una violación del derecho internacional.",1
"2393","8. Una pintura de una escena rural holandesa del período clásico.",0
"2394","6. Los conflictos armados contemporáneos son la principal causa de que las personas abandonen sus hogares y ahora son la causa más común de inseguridad alimentaria.",1
"2395","23. Más de 500 millones de contenedores marítimos circulan por todo el mundo cada año, lo que representa el 90 por ciento del comercio internacional. Sin embargo, sólo el 2 por ciento de estos contenedores son inspeccionados.",0
"2396","Diarios como Fraternité Matin y Notre Voie, cercanos al partido político Frente Popular Marfileño, publican mensajes nacionalistas e incitaciones a la guerra total.",1
"2397","Que se celebrará el jueves 30 de julio de 1998, a las 13.35 horas",0
"2398","2. En el caso de detonadores, la cantidad, grado, marca y demás datos identificativos de cada artículo.",0
"2399","No podemos enviar el mensaje de que los terroristas serán inmunes y nos contentaremos con condenas rutinarias.",0
"2400","Excepto en los casos en que se sorprenda a una persona cometiendo un delito, los funcionarios encargados de hacer cumplir la ley deben presentar una orden judicial para arrestar o detener a una persona.",1
"2401","El porte de armas fuera de las fuerzas armadas oficiales es imposible de conciliar con la participación en el poder y en el gobierno en una democracia.",1
"2402","Había que prestar especial atención al gran número de elecciones previstas hasta 2013 en la región, que, si bien eran un acontecimiento positivo, podían aumentar las tensiones y provocar una nueva violencia e inestabilidad.",1
"2403","De igual manera, la Comisión encontró evidencia suficiente de que se continuaron perpetrando violaciones y violencia sexual sistemáticamente contra las mujeres durante su desplazamiento, de modo que se perpetúe entre ellas el sentimiento de inseguridad y el temor de abandonar los sitios para las personas desplazadas.",1
"2404","6. La primera Cumbre de Jefes de Estado y de Gobierno de la Conferencia Internacional sobre la Región de los Grandes Lagos, que tuvo lugar en Dar-es-Salaam los días 19 y 20 de noviembre de 2004, marcó el final de la primera fase del proceso de la Conferencia.",0
