"es_en_DEEP"	"MatCoop"
"During these considerations, the Chinese delegation has always stressed its view that the Darfur issue involves a political process, the deployment of peacekeepers, economic development, humanitarian assistance and justice. It is very complex and requires enormous political wisdom to find a global solution that guarantees the achievement of peace and justice."	0
"In the case of Africa, the Council addressed the serious situation on the border between Rwanda and the Democratic Republic of the Congo, reviewed the persistent political stalemate between Ethiopia and Eritrea, assessed the implementation of the arms embargo on Somalia, and made renewed efforts to revive the political process in CÃ´te d'Ivoire."	1
"The counter-terrorism measures that the international community has taken at the national and regional levels in accordance with relevant United Nations initiatives will lay the foundation for a global system to counter emerging problems and dangers under the auspices of the United Nations."	1
"In accordance with the Committee's policy guidance on human rights, the Executive Directorate will continue to take into account the human rights aspects of Security Council resolutions 1373 (2001) and 1624 (2005) in its work."	1
"The Office for Disarmament Affairs has sought to raise awareness among potential donors to mobilize their support for the regional seminars and workshops it organizes."	1
"The level of ratification of international instruments has been maintained since 2009 and varies greatly."	1
"d) With input from the Committee's working group on assistance and its working group on cooperation with international organizations, including Security Council committees established pursuant to resolutions 1267 (1999) and 1373 (2001), where appropriate , will continue to organize and participate in outreach activities at the international, regional and subregional levels; be willing to emphasize and engage in assistance programmes, promote the exchange of experiences, lessons learned and effective practices, and be willing to facilitate offers or requests for assistance;"	1
"However, flows of immigrants and refugees in the region, from conflict zones in the Middle East and Africa, continue to represent a problem for immigration authorities."	0
"In order to neutralize armed groups, it is essential to offer sustainable alternatives to ex-combatants."	1
"Police and security services should be allowed to use special techniques, with due respect for human rights, during investigations related to terrorism, as well as when collecting evidence."	1
"Vice Presidents: Portugal and South Africa"	0
"One State had established in 2010 a multidimensional diversity and social cohesion program aimed at promoting mutual respect and a sense of belonging for all, as well as building community resilience."	1
"This reference cannot be serious from any point of view."	0
"This reduction has generally occurred due to the death of a portion of these people due to natural causes. Is it intended to claim that this is a positive trend and wait until all those people have died before their return begins?"	0
"b) Continue to improve border security at entry points and along permeable borders to prevent and suppress the cross-border movement of terrorists, cargo, weapons and explosives, as well as money and bearer negotiable instruments, and implement the best international codes and standards established by specialized agencies, such as ICAO, IMO and WCO;"	1
"Beyond its immediate consequences, the attack on Aro Sharow and nearby villages is a cause for serious concern because it may indicate that the militias are beginning to deliberately target their attacks against the internally displaced population and that Government forces are not in a position to provide effective protection to the camps and villages where the displaced reside, or are unwilling to do so."	0
"The Executive Directorate has adopted a multimedia approach to reach intended recipients, using communication tools and channels such as the Committee's website, a Twitter account and an electronic newsletter, as well as news services provided by the Department of Public Information ."	0
"From 24 to 28 October 2011, the KFOR Civil and Military Advisory Division and the Kosovo Security Force jointly completed the harmonization phase of their fourth joint assessment."	1
"Central Asian States have strengthened law enforcement measures since the previous report by expanding inter-agency cooperation and information sharing, and creating and using crime and other databases, both nationally and internationally, to support to efforts to enforce anti-terrorism laws."	1
"The Center has prepared an exit strategy for the transfer to the relevant departments of the Joint Interim Administrative Structure of functions that include the continuous removal of any residual threat, mine danger information and assistance to victims."	1
"In a limited number of cases, benefit payments may have induced commanders to re-recruit children they had already released."	0
"3. Other tangible assets: US$26,946,528"	0
"There was no indication that the production of feedstock for centrifuge enrichment (UF6) moved beyond laboratory experimentation;"	0
"However, international human rights mechanisms have raised concerns about violations allegedly committed by intelligence agencies and law enforcement agencies in the course of their investigations and interrogations."	0
":: Conducting reviews and making proposals on how to update the reporting regime, taking into account the recommendation contained in the 2005 World Summit Outcome on consolidating reporting obligations (see resolution 60 /1 of the General Assembly) in cooperation with the other subsidiary bodies of the Security Council related to the fight against terrorism."	1
"Malta has no laws on the arms trade."	0
"The Committee will collaborate with experts to carry out the following procedures when requests for technical assistance are received:"	0
"Numerous resources and databases that are accessible through the Internet offer simple and quick checks of telephone numbers and addresses of entities that may be suspected of forming fictitious companies."	0
"In some cases, women were raped in public and were sometimes insulted and called \"slaves\" or torabora."	0
"Recalls, in particular, the obligation to make a distinction between the civilian population and combatants, and the prohibition of attacking indiscriminately and attacking civilians and civilian objects, as well as the prohibition of using chemical weapons and using weapons, projectiles , materials and methods of waging war of such a nature as to cause superfluous evil or unnecessary suffering."	1
"On May 14, Parliament adjourned its first legislative session of 2012."	0
"On several occasions, I have expressed my firm conviction that the best way to achieve the disarmament of Hizbullah and other militias is through a political process led by the Lebanese themselves, leading to the ultimate goal of ending the existence of weapons or armed forces in Lebanon other than those of the Lebanese State."	1
"Creation of a standardized management and monitoring system for cases of gender-based violence; preparation of a checklist for senior managers; reporting on the High Commissioner's five commitments to refugee women."	1
"The Government repeatedly stated that military commanders had been instructed not to bomb."	1
"States must also prevent those who finance, plan, facilitate or commit acts of terrorism from using their territory for these purposes, against other States or their citizens (para. 2 (d))."	1
"Noting that not all States are parties to the Rome Statute,"	0
"Those early phases of the investigation revealed that no one reported seeing the slightest indication that anything was happening near Mr. Hariri that could have posed a danger to his life."	1
"States and many international bodies welcomed the open nature of the comprehensive review process and urged the 1540 Committee to maintain that approach and increase its already useful efforts to achieve transparency and inclusivity."	0
"Regional and international organizations: Caribbean Community secretariat, European Commission, European External Action Service, Organization for Security and Cooperation in Europe, Organization for the Prohibition of Chemical Weapons, Group of Experts of the Security Council Committee established pursuant to resolution 1737 (2006), Office for Disarmament Affairs of the United Nations Secretariat, Security Council Committee established pursuant to resolution 1540 (2004) and its Group of Experts, International Criminal Police Organization, World Customs Organization."	1
"Not all States have included in their domestic law the principle aut dedere aut judicare (extradite or prosecute) in accordance with international instruments to combat terrorism."	1
"In addition, other persons and entities have been added to the list in Annex II of Council Common Position 2007/140/CFSP."	0
"Furthermore, the disappearance of Mr. Abu Adass on January 16, 2005 has not been explained in a manner consistent with the concept of him becoming a suicide bomber a month later."	0
"This could also help promote regional cooperation in the fight against terrorism."	0
"West African Economic and Monetary Union and Central Bank of West African States"	0
"In situations of armed conflict, international humanitarian law dictates that the primary responsibility for protecting civilians and addressing their needs lies with the party under whose control the population is."	1
"a) Describe the mandate of the Group and its methodology;"	0
"SAW. Priorities for a new mission"	0
"In Northern Darfur, the state with the lowest numbers of the three Darfur states, the conflict is estimated to have affected 685,200 people, 403,000 of them displaced within the region."	0
"Theodor Meron (United States of America)"	0
"These recommendations, on which the parties and troop-contributing countries have been consulted, are intended to strengthen the capacity of the military component to monitor the ceasefire and military agreements, without exceeding available resources."	1
"Persistent rumors had also circulated that Ivorian helicopters were stationed in Guinea and that the helicopters destroyed by French forces in November 2004 had been loaned by Guinea."	1
"At the conclusion of the debate, a presidential statement (S/PRST/2004/16) was adopted, calling on Member States to provide political support and to provide and facilitate civilian and military personnel so that the multiple operations could begin again. in the best possible way and fulfill their respective mandates effectively."	1
"In this context, I would also like to highlight that President Abbas has referred to the request of the Palestinian Authority to establish a Palestinian diplomatic mission in Beirut, which would contribute to formalizing relations between the Lebanese and Palestinian peoples."	1
"UNIFEM, UNFPA In post-conflict countries, promoting strategies to address the gender dimensions of reconstruction through needs assessment and transition mechanisms."	0
"NATO has provided additional forces to ensure a secure environment for the holding of elections for the National Assembly and Provincial Councils, scheduled for 18 September (see paragraph 15)."	1
"These instruments cover all items listed on the list of assets of the Nuclear Suppliers Group, as well as assets controlled by the Missile Technology Control Regime."	0
"Where a delegation provides the Secretariat with fewer than 200 copies of its statement, those copies will be placed outside the Council Chamber at the end of the session."	0
"The remarkable level of collaboration between the Committee and other Member States during the review indicated that a broad group of States continue to share the Security Council's concern about the desirability of a coordinated international response to the threat posed by Al-Qaida and the Taliban. ."	1
"The Ivorian economy continues to suffer the adverse consequences of the crisis."	0
"Chapter III of Law No. 535/2004 is dedicated to measures to prevent the financing of acts of terrorism."	1
"Despite the delays, I am encouraged to see that all concerned have reached an agreement to resume the exchange of family visits, which could enable thousands of people in the Territory and in the camps around Tindouf to benefit from this humanitarian programme."	1
"(a) Ensure that customs officials have the necessary practical measures and resources to detect and prevent cross-border movements of cash and bearer negotiable instruments, as well as to detect and prevent arms smuggling;"	1
"The Commission's investigation team was headed by a chief investigator and comprised four investigators, two investigators specialized in violence against women, four forensic experts and two military analysts."	1
"The program requires ex-combatants to return openly, surrender their weapons, commit to respecting the legitimacy of the Government and the rule of law, and submit to a community oversight mechanism, along with other measures to be agreed upon depending on the circumstances of the case. ."	1
"The Committee continued its consideration of three waiver requests: the first concerned a proposal for technical assistance to the Islamic Republic of Iran submitted by a specialized agency of the United Nations; the second was a request from the Mine Action Center of the Islamic Republic of Iran received by a State, proposing cooperation with that State on mines; and the third related to a request for technical training for the Iranian armed forces sent by the Islamic Republic of Iran to a State."	1
"With regard to military agreements Nos. 2 and 3, the parties have continued to provide a high level of cooperation with MINURSO in the marking and disposal of mines and unexploded ordnance."	1
"They will also lay the foundation for an effective firearms control mechanism that will help aid authorities control gun ownership."	1
":: Narmeen Madeen al-Rajih, 4 years old"	0
"We cannot run the risk that the financial and human effort made so far in the Democratic Republic of the Congo will be lost in the face of citizen frustration and, eventually, the crisis and conflict will re-emerge."	0
"The Under-Secretary-General noted that 69 humanitarian workers had lost their lives since the start of the conflict, and that sexual violence had been used as a form of torture, to cause injury, to degrade and intimidate and as a form of punishment."	0
"The Executive Directorate will increase its cooperation with relevant United Nations bodies, including the Security Council Committee Monitoring Team established pursuant to resolution 1267 (1999) and the Security Council Committee Group of Experts established pursuant of resolution 1540 (2004), as well as with various international, regional and subregional organizations, especially in the framework of the Committee's visits to Member States."	1
":: Provide a comprehensive perspective on security and development and ensure that national security and development efforts are aimed at addressing the root causes of conflicts"	1
"Peace, security and stability in that nation require, first of all, the elimination of poverty and underdevelopment."	0
"Fortunately, the options before the people of Iraq are neither black and white nor zero-sum. There is a middle range of compromise that can accommodate the essential concerns of all participants in the political process."	0
"First, as the Security Council has recognized on several occasions, under international law, when acts of gross violations of international human rights standards and serious violations of international humanitarian law are committed that may constitute crimes under international law, Internationally, States have the obligation to investigate and, if there is sufficient evidence, prosecute the person allegedly responsible for violations."	1
"The Council could play an important role in ensuring the establishment of reparation programs to address the needs of victims;"	1
"iii) Cooperation with international organizations, including the Security Council Committees established pursuant to resolutions 1267 (1999) and 1373 (2001);"	1
"2. The situation in Timor-Leste"	0
"Which will be held on Wednesday, December 19, 2012, at 3:20 p.m."	0
"In the absence of a medical referral center in Bamako, MINUSMA has taken immediate steps to ensure that United Nations personnel have adequate medical capacity by establishing a United Nations level II clinic to replace services previously provided by the Pasteur Clinic."	1
"In many ways, it was therefore limited to an exercise in legislation."	0
"Therefore, it deals largely with aspects of the social contexts that can foster the spread of terrorism."	0
"The Acting Assistant Secretary-General reported on developments in the political situation in Ukraine, in particular the holding of parliamentary elections on 26 October and the elections held by rebels in Donetsk and Luhansk on 2 November, which the Secretary-General and many actors in the international community had deplored."	0
"Withholding that level of funding would render any government useless, and even more so an authority in occupied territory. If funds are not immediately unlocked, it will jeopardize the achievements of state-building, including greater good governance that would benefit the Palestinian people and the development of security forces that uphold law and order in the West Bank."	0
"The Public Order Act 1972 contains several articles relating to incitement."	0
"Among them are the right to life; the prohibition of torture or cruel, inhuman or degrading punishment; the prohibition of slavery, the slave trade and servitude; and freedom of thought, conscience and religion."	1
"a) If the act described in paragraph 1 causes serious injury to at least two people or death; either"	0
"During the attacks, the Janjaweed were reported to have destroyed household items, utensils used to prepare food, water containers and other items essential to the subsistence of the inhabitants."	0
"Intensified enforcement will be critical to building the confidence of Kosovo Serbs and other minorities during a period of heightened political tension, and will be essential to building the trust of the region and the international community."	0
"The Algiers Agreement obliges both parties, according to Article 1, paragraph 1, to \"refrain from the use or threat of force.\""	0
"65. Complaint by Cuba (September 17, 1973; September 18, 1973)."	0
"C. Legal obstacles to sanctions 50. The Team is aware of 15 lawsuits filed around the world challenging the implementation of some aspects of United Nations sanctions against Al-Qaida and the Taliban by Member States."	0
"Sudan has also ratified International Labor Organization Convention 182 on the Prohibition of the Worst Forms of Child Labor and Immediate Action for its Elimination, which prohibits the forced or compulsory recruitment of children for use in armed conflict."	1
"Name of the person examined: Hassan Surname of the person examined: Ezhaq Hawilla"	0
"On 14 December 2004, talks between the Government of the Sudan and a delegation of the MNRD, mediated by Chad, began in N'Djamena. On December 17, the parties signed two protocols, one related to humanitarian access and the other related to security in the war zone."	1
"These exports brought $369,793.33 into the Liberian treasury (Annex IV)."	0
"The provision of technical assistance aimed at strengthening the counter-terrorism capacity of States seeking to implement their obligation to implement the provisions of Security Council resolution 1373 (2001), but lacking the capacity to do so, continues being one of the fundamental objectives of the Counter-Terrorism Committee."	1
"It is necessary to have such a mechanism to fully clarify the fate of missing persons."	1
"Other investigations have been undertaken or planned by the Government or other public institutions, including an investigation by a parliamentary commission, another by the Ministry of Human Rights and another by the Ministry of Justice, through a national commission that will be established soon."	1
"After the weapons collection process began, six more United Nations vehicles arrived carrying UNPOL officers, including Mr. Malik."	1
"The Representative of the Central African Republic:"	0
"All reporting States believe they have effective protection against the acquisition of weapons by listed individuals or entities, but only 38 Member States have indicated that they have amended existing laws and regulations to introduce measures relating to arms embargo; 106 States did not refer to the consolidated list when describing their regulatory processes."	1
"(i) Facilitating research in the areas of the three resolutions requiring further consideration, including the analysis of trends and methodologies related to terrorism at the global and regional levels and the analysis of counter-terrorism measures;"	1
"The Monitoring Team is also responsible for a Task Force project to produce documentaries that expose the true nature of terrorism as seen from the perspective of its perpetrators and victims."	0
"During the conflict, the Maoist militia performed mobilization and propaganda functions, served as an irregular army and applied various means to \"enforce the law\" in areas under the control of the CPN-Maoist. When the Maoist militia was disbanded, many of the members reportedly joined the CPN-Maoist Youth Communist League, which was re-established in December 2006."	0
"b) The General Assembly and the Human Rights Council should expand the monitoring and reporting mechanisms on human rights in the Democratic People's Republic of Korea that predate the establishment of the commission; Included here are the periodic reports of the Secretary-General and the United Nations High Commissioner for Human Rights as well as the mandate of the Special Rapporteur on the situation of human rights in the Democratic People's Republic of Korea."	1
"His Excellency Dr. Bashar Al-Assad, President of the Syrian Arab Republic"	0
"Lebanese security teams (police and military) worked closely with the Commission's security team to ensure the safety and security of its staff and premises."	1
"6. Further confirms that the provisions of paragraph 1 a) shall also apply to the payment of ransoms to listed individuals, groups, companies or entities;"	1
"104. Elizabeth Palmer, from the American channel CBS News, on January 11."	0
"The first payment did not have to be made at a specific time but rather when the works had been completed in a certain proportion (50% for the first payment)."	0
"Internal instability would make defining and implementing a viable future status even more difficult."	0
"The Heads of State committed to join forces to fight Boko Haram, to complete the establishment of the headquarters of the joint multinational task force in Nigeria, no later than 20 November, and to deploy, within national borders, each contingent of 700 troops."	1
"Exemptions to the arms embargo are set out in paragraph 54 of resolution 2127 (2013) and may be granted for the following: supplies intended solely for the support or use of the Peacebuilding Mission in the Central African Republic, the Mission African-led Central African Republic Support International, the United Nations Integrated Peacebuilding Office in the Central African Republic and its guard unit, the African Union Regional Task Force and the French forces deployed in the Central African Republic (para. 54 a)); supplies of non-lethal military equipment for exclusively humanitarian or protective purposes, and related technical assistance or training (para. 54 (b)); protective clothing, including flak vests and military helmets, temporarily exported to the Central African Republic by United Nations personnel, media representatives and humanitarian and development workers and associated personnel, exclusively for their personal use (para. . 54 c)); supplies of small arms and other related equipment intended exclusively for use in international patrols providing security services in the Sangha River Trinational Protected Area to prevent poaching, ivory and weapons smuggling and other illegal activities national status of the Central African Republic or its international legal obligations (para. 54 d)); supplies of weapons and other related deadly equipment to the security forces of the Central African Republic for the sole purpose of supporting or using the country's security sector reform process, subject to approval by the Committee (para. 54 e) ); or other sales or supplies of arms and related materiel, or the provision of assistance or personnel (para. 54 f))."	1
"The Executive Directorate is also leading a three-year global initiative on behalf of the Counter-Terrorism Implementation Task Force's Task Force on Countering the Financing of Terrorism, which is supported by several States and donor organizations, The purpose of which is to achieve a common understanding of the practices that are effective in combating the financing of terrorism within this sector."	1
"10. The situation in Georgia (October 8, 1992; June 15, 2009)."	0
"On 20 July, the Council held a public debate (4174th session) to consider its role in preventing armed conflict."	1
"The conclusions were published under documents S/AC.51/2010/1 and S/AC.51/2010/2, respectively."	0
"ii) Disarm by whatever means necessary all armed groups and militias in the east of the Democratic Republic of the Congo;"	1
"He added that he was encouraged by the renewed determination of the countries of the subregion to collaborate to address these threats."	0
