"es_en_DEEP"	"MatCoop"
"Despite these advances, several of the Committee's visits and working meetings in the region reveal that it is necessary to further strengthen regional cooperation in the fight against terrorism."	1
"Developing the capacity of States to prevent the proliferation of weapons of mass destruction and respond to attacks carried out with them"	1
"At the same time, once these courts become operational, they lack their own enforcement mechanisms and require the Council's continued involvement and support."	1
"Overall, strengthening international cooperation and information exchange and comprehensive and integrated national responses can be among the most effective ways to combat and prevent incitement."	1
"During this period the team carried out investigations in specific prearranged locations, such as internally displaced persons camps and destroyed villages, and maintained contacts with the SLA and government officials."	1
"The Commission will serve as a forum for youth to express themselves and ensure political coherence by promoting youth interests in Government policies."	1
"Report of the Secretary-General on the African Union-United Nations Hybrid Operation in Darfur (S/2013/420)\"."	0
"[R]eiterates its call to parties to armed conflicts [indicated in the relevant report of the Secretary-General] who have not yet done so to prepare and implement, without further delay, concrete and time-bound plans of action for implementation end the recruitment and use of children in contravention of applicable international law, and to address all violations and abuses against children in close cooperation with [the Special Representative of the Secretary-General for Children and Armed Conflict], as well as as well as with UNICEF and United Nations country task forces responsible for monitoring and reporting."	1
"I gave them a list with the names of the three senior military commanders of the RCD-Goma reported and pointed out that two of them had been promoted."	1
"This was made clear by recent incidents of DIS indiscipline, namely the alleged murder of a civilian by a DIS commander in Farchana on 22 March."	0
"Laws granting special investigative powers to law enforcement agencies have also been enacted in Colombia, Chile, Paraguay and Peru."	0
"Some States in the region implement the European Union Strategy to Combat Radicalization and Recruitment of Terrorists, 2005, which aims to disrupt the activities of networks and individuals that lead to terrorism; ensure that majority opinion discourse prevails over extremism; \"promote with greater intensity security, justice, democracy and opportunities for all.\""	1
"S/RES/1296 (2000), para. 18"	0
"The international community is increasingly aware of the problems posed by the use of the Internet for terrorist purposes and discussions have begun on possible measures to resolve them."	1
"They are available on the Interpol website and can be printed and distributed, along with other police information, to border posts that do not have Internet connections."	1
"From Dubai, money is sent to Somalia via hawala transfers from unknown senders."	0
"As the Team has previously noted, poor entries serve no purpose: they cannot reasonably lead to sanctions, uninvolved persons with names similar to those on the List suffer unintended consequences, the private sector and government officials Border control and other services waste time and energy trying to identify people whose details cannot be confirmed, and the sanctions regime as a whole loses support."	0
"If it is decided to prosecute all the people who received weapons for illegal possession, the Commission has reports in which these people are identified."	0
"As regime airstrikes rage on civilian areas, the Syrian armed forces have laid siege to entire cities."	0
"All but one State has legislation to regulate non-profit organizations, but only one has enacted and effectively enforces legal provisions to prevent the financing of terrorist activities through such organizations."	1
"If the medical report corroborated the allegations made, the case was sent to the police for further investigation."	1
"Furthermore, Mijek Military Region 3 has largely fulfilled its obligations in this regard, with the exception of four violations."	1
"Neither side was willing to compromise on the basic issue of sovereignty."	0
"In this perspective, the role of regional organizations is of particular importance."	0
"Much progress has been made in implementing measures to prevent terrorists from making improper use of asylum and refugee status procedures."	1
":: Highlight good practices to address specific risks and respond to the needs, capacities and priorities of refugee, displaced and stateless women and girls during flight, displacement and return, including the particular needs of different groups of women and girls who are subject to multiple and intersecting forms of discrimination, in consultation with local civil society organizations and women and girls themselves."	1
"The Security Council reaffirms the need to fight all forms of terrorism and that no terrorist act will succeed in setting Iraq back on its path towards peace, democracy and reconstruction, a path in which it has the support of its people , the Government of Iraq and the international community."	0
"Therefore, troop- and police-contributing countries should ensure that the personnel they assign to the Mission have received training for the protection of civilians, including through a self-certification process."	1
"The most serious and bloody incident was the unprovoked attack by tribal militias on the Aro Sharow IDP camp and the villages of Gosmino and Ardja in the Kulbus area of ââWestern Darfur, near the border with Chad. , on September 28."	0
"B. Demining in the buffer zone"	0
"The Council requests the Secretary-General of the United Nations to continue to use his good offices and explore, where appropriate, other high-level diplomatic mechanisms to facilitate better dialogue between relevant parties, including the underlying causes of the conflict."	1
"Independent candidates won 35 seats in total, while the remaining seats were distributed among smaller parties and coalitions."	0
"While the nature of the consultations will ultimately be determined by the stakeholders themselves, it is expected that they will involve conferences at the locality and state levels throughout Darfur, culminating in a major Darfur-wide conference."	1
"In its resolution 733 (1992), the Security Council imposed a general and comprehensive arms embargo against Somalia, and in its resolution 751 (1992) established a Committee to monitor the implementation of the embargo."	0
"The police force must be trained in a politically impartial environment, and this appears to be happening."	0
"There appears to have been excessive reliance on the military and police experience of certain individuals."	1
"On election day, the National Electoral Watch, a coalition of 14 civic and non-governmental organizations, deployed 1,437 accredited observers."	0
"Preventing the movement of terrorists across borders also requires the use of technology and equipment, such as readers and scanners, at border control posts to collect information on travelers in real time and verify this data in criminal and criminal databases. international and national alerts."	1
"5. Furthermore, we respectfully submit that there are other, more expeditious and simpler methods that would ensure that fair compensation is provided to victims of criminal acts in Rwanda."	1
"18. Reiterates that United Nations peacekeeping operations and special political missions may, if mandated by the Council, assist host Governments upon request to develop the capacity necessary to fulfill their commitments under the existing global and regional instruments and to address the illicit trade in small arms and light weapons, including through weapons collection and disarmament, demobilization and reintegration programmes, improving physical security and stockpile management practices, record-keeping and tracing capacity, the creation of national export and import control systems, increasing border security and strengthening judicial institutions, police and other security bodies;"	1
"The Group has confirmed that Ipedex received 656,064 FF in relation to the employees who were assigned to the project."	0
"In the private consultations that followed, the Special Representative and the Special Envoy addressed some issues related to security sector reform and the creation of a rapid reaction force within the FARDC, the electoral process and the elections general."	1
":: Provide information to Member States and international organizations upon request to assist them in submitting more effective offers or requests for assistance, as appropriate, towards the implementation of relevant obligations under resolutions 1540 (2004), 1673 ( 2006) and 1810 (2008), using the matrix as a reference instrument to facilitate technical assistance"	1
"In mid-November there was an intensification of armed clashes between Serbian security forces and the self-proclaimed Liberation Army of Presevo, Medvedja and Bujanovac (UCPMB) in the land security zone."	0
"While free movement zones, such as the Economic Community of West African States (ECOWAS), support economic growth and opportunity, the absence of systematic checkpoints allows listed individuals to move through them with little or without any restrictions."	1
"a) Appointment of OTU personalities to positions at all levels of the executive branch: end of September;"	0
"1. Decides to extend until 31 December 2009 the arrangements established in paragraph 20 of resolution 1483 (2003) for the deposit into the Development Fund for Iraq of proceeds from export sales of petroleum, petroleum products, oil and natural gas, and the arrangements referred to in paragraph 12 of resolution 1483 (2003) and paragraph 24 of resolution 1546 (2004) for the supervision of the Development Fund for Iraq by the International Board of Advisory and Monitoring, and further decides that, subject to the proviso set forth in paragraph 27 of resolution 1546 (2004), the provisions of paragraph 22 of resolution 1483 (2003) remain in force until that date, even with regarding the funds and financial assets and economic resources described in paragraph 23 of that resolution;"	1
"Council members expressed deep concern at reports that hostilities had resumed and at the humanitarian consequences of this."	0
"Which will be held on Wednesday, May 28, 2014, at 3:00 p.m."	0
"The Department of Civil Security and Emergency Preparedness was officially established in November under UNMIK regulation No. 2000/61."	1
"In addition to the renewed hope they have brought to the people of the Republic, these changes have given UNMIK a new opportunity to improve its consultation mechanisms with federal authorities and engage in constructive dialogue on issues of common interest."	0
"- Art. 80.5 of the Argentine Penal Code. (Attempted use)"	0
"The ranks of the petitioners and their supporters increased considerably beginning on the second day of the protest, particularly with the arrival of members of the group known as Colimau 2000."	0
"As of April 12, 2012:"	0
"According to his statement, he was in his office when he heard the explosion, but thought the noise was due to Israeli military planes passing through the sound barrier."	0
"On 25 May, the Chairman of the Committee established pursuant to resolution 1267 (1999) concerning Al-Qaida and the Taliban, Ambassador Heraldo MuÃ±oz (Chile), presented to the Council his first oral report covering a 120-day period on the work of the Committee and the team responsible for providing analytical support and monitoring the implementation of sanctions, as provided for in paragraph 12 of resolution 1526 (2004)."	0
"Furthermore, it obliges both parties to immediately release and reintegrate children associated with the armed forces."	1
"In order to continue to inform the Security Council and potential bilateral partners about security threats in the Vakaga region, I have deployed a team to review the current security situation and assess risks, and will communicate its main conclusions to the Council."	1
"As I noted previously (see S/2010/85, para. 176), the reconfiguration of the UNMIT police should be approached cautiously, taking into account, among other factors, the need to maintain a sufficient presence in all districts and units to carry out monitoring, advisory, training and guidance activities, as well as to provide the necessary support to continue building the capacity and institutional development of the national police."	1
"It is expected that no such shortfalls will occur during the later stages of program completion."	0
"Mr. Å imonoviÄ considered it imperative that the whereabouts of the missing persons be clarified and that those responsible be held accountable for their actions."	1
"Progress on other issues has been slow."	0
"The recent exchange of high-level visits between Iraqi and Kuwaiti officials created a favourable environment for the Coordinator's contacts with representatives of both countries, as well as with other members of the Tripartite Commission and its Technical Subcommittee, which remains the main body dealing with the issue of missing persons since the Gulf War in 1990-1991."	1
"The agency participates in interagency task forces established to investigate money laundering offenses and predicate crimes, including terrorist financing."	1
"23. He decides to continue addressing the issue."	0
"In other words, the National Commission was fully aware of the serious allegations of crimes committed in Darfur."	0
"The Security Council also expresses concern about rising tensions in the Ituri region and calls on all parties to exercise restraint."	0
"In 2003, the Trial Chambers sat for a total of 498 days. In 2002, the three Trial Chambers sat for a total of 414 days, and in 2001 they sat for a total of 340 days."	0
"Passenger traffic from Somalia at Wilson Airport is low."	0
"c) Proceeds of Crime Act (Cap. 143)"	0
"II. SALE OF OIL AND OIL PRODUCTS"	0
"According to official Australian sources, the training includes bomb making and techniques for committing suicide attacks."	0
"Here we also perceived reactions that seemed to justify our concerns."	0
"The technical investigation concluded, among other things, that the damage observed in the forward section of the aircraft appears to indicate that it was penetrated by a large number of high-energy objects from outside the aircraft."	1
"a) Lost profits 144 - 153 37"	0
"(i) The urgent establishment of a United Nations radio station and the enhancement of United Nations information, media, education and training activities in CÃ´te d'Ivoire, especially on human rights issues, in order to foster a climate of mutual respect and tolerance among all communities in the country;"	1
"This equipment consists primarily of field fortification material (such as gabions and serpentine fencing)."	0
"The FN provides fighters daily to guard the area adjacent to the diamond mines."	1
"Other international instruments, such as the Council of Europe Convention on the Prevention of Terrorism, have begun to examine related issues such as instigation of terrorism, recruitment and training."	1
"6. Other losses: US$3,891,254"	0
":: Precise guidelines be developed on what missions can do to protect civilians, including practical protection measures such as more intense and systematic patrolling of potentially unstable areas, joint protection teams or early warning cells."	1
":: Conclusions and results of the activities carried out by the Lebanese authorities at the crime scene and adjacent areas"	1
"This affects the Mission's ability to rapidly deploy uniformed personnel to protect civilians in danger in the west of the country if the situation demands, as well as to support the overall activity of the United Nations country team."	1
"In the view of another State, any comprehensive State response to combat extremism must take into account the communities themselves as an integral part of the national security framework."	1
"Therefore, most of the human rights violations that took place during those two days can be described as a massacre in which units of the security forces and parallel forces acting in coordination or collusion with them repeatedly carried out summary executions, torture , disappearances and arbitrary arrests."	0
"With support from UNDP and funding from the United Nations Peacebuilding Fund, the Anti-Corruption Commission established a secretariat to manage the implementation of the national anti-corruption strategy."	1
"These States are aware of the importance of cooperation, information exchange and coordination between the various agencies, as well as between the regional and national levels."	1
"The UNMIK Police has focused on activities to ensure that all its students, as well as those of the Kosovo Police Service, have practical knowledge of international human rights standards for law enforcement officers."	1
"Acting under Chapter VII of the Charter of the United Nations,"	0
"States have developed regional mechanisms to ensure that legal and institutional capacity is consistently fostered in the control of financial systems, law enforcement and border control, ensuring cooperation and respect for human rights and preventing duplication of activities."	1
"In CÃ´te d'Ivoire, the Group established close links with the political, police and military branches of UNOCI."	1
"Inclusion criteria related to violations of international human rights law and international humanitarian law, and in particular involvement in violations of the rights of children and women, are incorporated into 5 of the 12 Security Council sanctions regimes. in conflict situations."	1
"As discussed above, the Commission has gathered substantial and credible evidence tending to indicate cases of systematic killing of civilians belonging to certain tribes, causing serious and large-scale injury to the physical or mental integrity of members of the population. belonging to certain tribes and that they were subjected, in a massive and deliberate manner, to conditions of existence that would lead to their total or partial physical destruction (through the systematic destruction of their villages and crops, the expulsion from their homes and the theft of their livestock, for example)."	0
"It is not considered appropriate for trials to be processed before an international court since the crimes committed constitute a violation of national laws."	0
"217. For example, the Commission would recommend the establishment of a national compensation programme, which would not simply amount to monetary compensation but should consider all measures necessary for this purpose, including recognition of fault, compensation for tangible economic damages , the public and complete dissemination of the facts in question (including through the publication of this report), the establishment of rehabilitation programs and administrative sanctions against the people of the responsible institutions."	0
"Few reporting States have provided information on measures in place to prevent abuse of charities or other non-profit organizations, although 63 States require them to obtain authorization or register."	1
"A helicopter, on board which 10 inspectors were traveling, took off from the Al-Rashid Base airport and arrived at the Basra Refinery, dependent on the Ministry of Petroleum."	0
"A system has been created under which victims of sexual exploitation and abuse would be referred, on a case-by-case basis, to a non-governmental organization to provide the necessary support."	1
"3.4 Accounts opened by professional intermediaries"	0
"11. Paragraph 109 states:"	0
"15. On December 2, NATO concluded its military mission in Bosnia and Herzegovina with an official ceremony at Camp Butmir, Sarajevo."	1
"Reaffirming the need to combat by all means, in accordance with the Charter of the United Nations and international law, including applicable human rights law, refugee law and humanitarian law, threats to peace and security that constitute terrorist acts, underlining in this regard the important role played by the United Nations in directing and coordinating this effort,"	1
"Some of them are suspected of committing various crimes simultaneously."	0
"All States have enacted laws to regulate the production, sale and transfer of weapons and explosives."	1
"b) Provide training to public officials, members of the armed forces and armed groups, associated personnel of the armed forces, civil police and law enforcement personnel and judicial and legal professionals; and raise awareness among society and civilians about the relevant provisions of international humanitarian law, human rights law and refugee law, as well as the protection, special needs and human rights of women and children in conflict situations, with a view to achieving their full and effective compliance;"	1
"The Security Council calls upon ECOWAS and its Member States, as well as their international partners, to continue to support ECOMIB in this regard and to coordinate further international initiatives in support of peace, stability, the rule of law and the fight against impunity in Guinea-Bissau."	1
"Photo 27: Painted in Juhor Al-Dik: \"Blood = Life ---> And life is good...\""	0
"Clarifications of the terms \"Janjaweed\" and \"Tora Bora\""	0
"Strengthening Haiti's rule of law institutions, including the reform of the Haitian National Police, is essential for the effective maintenance of internal stability and the extension of State authority."	1
"Naturally, this causes growing concern among the population and causes some to question the excessive dependence on the military option."	0
"He decided to return immediately to Timor-Leste. She attended a meeting held at the Prime Minister's residence at around 4pm on 29 April 2006 with everyone who had been present at the meeting the previous day. The decision was made to withdraw F-FDTL contingents from the city outside Dili, but to continue joint Military Police and PNTL patrols within the city."	1
"We are deeply concerned that violence in the Middle East continues to be perpetrated by one party against the other, despite the fact that the international community and the Security Council have clearly expressed their abhorrence of that situation."	0
"Acting under Chapter VII of the Charter of the United Nations,"	0
"b) By a public official in the performance of his official duties;"	0
"Although it is known that the majority of States in the subregion have created units responsible for the repression of terrorism, only three States have established adequate institutional structures and the necessary inter-institutional coordination to address issues of the fight against terrorism."	1
"It was also noted that incidents involving the use of rocket-propelled grenades, a relatively heavy form of artillery for pirates, had declined from 43 in 2011 to 3 in 2013."	1
"Equipment for weapons detection and surveillance has been installed at Azerbaijan's international border crossings."	1
"He also trained Central Bank officials in risk-based anti-money laundering and terrorist financing supervision."	1
"Report of the Secretary-General on the situation in the Central African Republic (S/2014/857)"	0
"In August, pursuant to an agreement signed by the Government and the armed opposition group Mouvement pour la dÃ©mocratie et la justice au Chad in early 2010, 58 children, including 10 girls, were reunited with their families."	1
"Although a national arrest warrant was issued against him that same day, it could not be applied because the President of the National Assembly had fled the country."	0
"The Committee received 11 notifications from Member States that supplied military equipment to the authorities of the Democratic Republic of the Congo, and sent an equal number of letters acknowledging receipt."	1
"The members of the Council also considered the report of the Secretary-General (S/2000/632) which indicated that significant progress had been made in the political and military fields, but that the Government of Guinea - Bissau continued to face numerous problems in re-establishing lasting peace, stability and sustainable development."	1
"Consequently, there is no name to present."	0
"There are no conditions for hawala."	0
"Following the adoption of resolution 2100 (2013), in which the Security Council established MINUSMA and supported the preservation of cultural heritage as part of its mandate, UNESCO has continued to collaborate with United Nations partners to integrate the safeguarding of cultural heritage into the peacekeeping operation and recovery work."	1
"B. Property losses 27 - 32 15"	0
"Which will be held on Tuesday, December 18, 2012, at 3:10 p.m."	0
"According to jurisprudence, in case of doubt it should also be established whether a) a group of people is considered and in fact treated as part of one of the protected groups, and, in addition, b) they consider themselves part of one of said groups. groups."	1
"Although the Government has not set a reference price, it is negotiating with national businessmen to purchase cashew nuts at a price between 200 and 230 CFA francs per kilo."	0
