"es_en_DEEP"	"MatCoop"
"Audit certificates were to be submitted by the officials responsible for auditing the public accounts of the relevant Member States."	0
"The victim heard other young women screaming and thought they were also being raped."	0
"While the HD and DF were neutralized on the Cape Ray, a group of four OPCW inspectors were permanently on board that ship."	0
"1. Freezing of funds and financial assets"	0
"Clan elders, as well as Kenyan authorities, intervened in mid-August to help resolve the dispute."	1
"It is worth distinguishing universal criteria and individual (detailed) criteria."	0
"A workshop for Member States of the Caribbean Community will be held in July 2009 to draft responses to the three Security Council Committees dealing with counter-terrorism."	1
"This would not affect the Commission's conclusion that the Government of Sudan has not pursued a policy of genocide in Darfur."	0
"At the same time, the Secretariat continues to explore all options to increase and strengthen the current operational capacity of the Mission in the difficult environment of northern Mali."	1
"Furthermore, many modern state institutions were created during the UNTAET period, including the National Parliament, the Council of Ministers, local government structures, the police service and the defense force."	1
"The Central Bank of Malaysia issued these guidelines for the insurance sector on April 25, 2001."	0
"Report of the Secretary-General submitted pursuant to paragraph 6 of resolution 1936 (2010) (S/2010/606)"	0
"The activities carried out in these areas, complemented by the work of the working groups established to implement the agreements concluded between the Presidents of the Russian Federation and Georgia in Sochi in March 2003 (see S/2003/412, para. 5), were aimed at resolving pressing problems for the parties and thereby promoting confidence between them, with the ultimate goal of holding negotiations aimed at a comprehensive political settlement of the conflict on the basis of the document entitled \"Basic principles of the distribution of competences between Tbilisi and Sukhumi\" and its transmittal letter (see S/2002/88, para. 3)."	1
"The Team continued to actively participate in the development of measures to combat the financing of terrorism, taking part in plenary meetings of the FATF and in meetings of its regional bodies."	1
"According to data from a survey carried out in the Mornei camp in Western Darfur, medical teams treated approximately 20 victims of sexual violence between April and June 2004."	1
"1. The equipment included in article 11.A includes the following:"	0
"The Security Council calls on Member States to cooperate without delay in resolving all outstanding issues regarding the adoption of the draft comprehensive convention on international terrorism."	1
"o) Develop and implement, in close consultation with [national] authorities... a joint multi-year United Nations justice support program to develop the criminal justice chain, the police, the judiciary and the system penitentiary in conflict-affected areas and provide strategic programmatic support at the central level...;"	1
"UNOCI continued to promote gender among United Nations military forces, police and civilian personnel, including through the issuance of weekly awareness-raising messages on various gender-related issues."	1
"Since the establishment of the Counter-Terrorism Trust Fund, the Executive Directorate has been more efficient in managing voluntary contributions to support its activities."	0
"I am particularly concerned about the unstable present that could deteriorate further if the political situation does not change and if the socioeconomic situation continues without being properly addressed."	0
"2. Question of India-Pakistan (S/628)."	0
"At the multilateral level, the Republic of Guinea is a party to Convention A/P.1/7 1992, of the Organization of African Unity, on mutual assistance in judicial matters."	0
"We could continue mentioning the widespread poverty, the problems of natural resource management, the thousands of refugees and internally displaced persons, to which we must add thousands of ex-combatants waiting to be reintegrated, the weak and unreformed security sectors, massive human rights violations and many other threats that could instigate a new conflict."	0
"We note the security concerns that Israel claims compel it to continue these flights, in particular alleged violations of the arms embargo established pursuant to resolution 1701 (2006)."	0
"17. The situation in the Great Lakes region (November 1, 1996; November 9, 2009)."	0
"He also referred to dangerous outbreaks of violence in Lebanon between the Lebanese Armed Forces and Fatah al-Islam gunmen around Palestinian refugee camps."	0
"In general terms, the policy of attacking, killing or forcibly displacing members of some tribes does not necessarily imply the specific intention of annihilating all or part of a group for racial, ethnic, national or religious reasons."	0
"As highlighted in the final communiqué of the London Conference, specialized Somali courts would respond to this need."	0
"Measures have been put in place in eight States to prevent the illegal cross-border movement of people, and nine States effectively monitor and control the import and export of arms and explosives."	1
"Acts committed by some Arab groups had caused the forced displacement of those non-Arab groups."	0
"The Council of the League, meeting at the summit level,"	0
"Both defendants were transferred to The Hague."	0
"With this strategy, the United Nations system implements joint programming initiatives with good results, although there is a need to strengthen the links between the different programs and the Government's efforts to stabilize the country."	1
"Law enforcement specialists will be concentrated in a specialized and autonomous task force."	1
"At the end of the session, the Committee adopted a final document for the future in which it urged all Member States to implement a policy of zero tolerance towards terrorism and to take urgent measures to prevent and combat this problem in all its forms. and demonstrations through the full and effective application of the resolution."	1
"On 12 November, the Council unanimously adopted resolution 2184 (2014), extending for another 12 months the authorization granted to States and regional organizations to combat piracy off the coast of Somalia. The resolution underlined the need for a comprehensive response to piracy, including by addressing its underlying causes; It called for the immediate and unconditional release of all hostages held by Somali pirates; and States were urged to ensure that anti-piracy activities take into account the need to protect women and girls from exploitation."	1
"The livestock sector is the basis of subsistence for the Somali people and a source of income for local and central administrations."	0
"Under the UNIPSIL non-state actor project, the Political Parties Registration Commission continued to play a key role in implementing capacity-building programs of political parties, including their women and youth sections, to mitigate and resolve conflicts."	1
"We are extremely concerned about this course of action, as it runs the serious risk of undermining the integrity of United Nations operations."	0
"Since then it has been bombed three more times."	0
"From a law enforcement perspective, there are complex jurisdictional issues as well as technical challenges related to investigation and prosecution when criminal activity spans multiple States."	0
"However, many have only just begun to develop special counter-terrorism capabilities."	1
"Among them would be the police, gendarmerie, intelligence, security, special services and even, in some States, the military corps."	0
"China Youth Daily, Chinese newspaper, December 19, 2011"	0
"Conducting research to determine the drivers of gender differences in early warning mechanisms and developing corresponding indicators."	1
"10. The situation in Georgia (October 8, 1992; June 15, 2009)."	0
"States should strengthen their legal frameworks to criminalize the illicit manufacture, possession and trafficking of small arms and explosives."	1
"The States of the subregion remain alert to the terrorist threats that loom over them and have invested significant resources in expanding regulatory frameworks, establishing and improving institutions to combat terrorism, and in efforts to increase the capabilities of law enforcement agencies and intelligence services."	1
"i) Contribute to the protection of civilians in danger, particularly refugees and displaced persons;"	1
"Habsade received financial and military support from Atto, Muse Sudi, Sheikh Yusuf Indohaadde and others."	1
"Resolution 1884 (2009) of August 27, 2009"	0
"The West Darfur team consisted of two investigators and a military analyst, and was supported by one or two forensic experts, as needed."	1
"Some of these League recruits from the Maoist army and militia are under 18 years of age."	0
"At least 1,000 kilos of military explosives were used to cause the explosion."	0
"In this resolution, the Security Council also requested that I establish the design of the medal and present to it in due course the modalities for determining how the recipients would be nominated and chosen based on the criteria outlined in the resolution."	1
":: Establishment of media monitoring mechanisms to ensure effective monitoring, documentation and reporting of all incidents, sources and contents of media messages intended to incite hate."	0
"Which will be held on Monday, August 4, 2003, at 12:10"	0
"The Council reiterates the importance of addressing the needs of women in peacebuilding and ensuring their participation in the development and implementation of post-conflict strategies."	0
"This knowledge facilitates the production of the global implementation report, a document that is increasingly detailed and coherent for all regions of the world and, therefore, more useful for practitioners and analysts, both those working for governments and those who don't. It should be noted that improved knowledge also helps the Executive Directorate to determine priorities for its activities at the regional and subregional levels and for the provision of technical assistance."	0
"He added that it would be unrealistic, and even irresponsible, to expect or anticipate a quick departure."	0
"Furthermore, the Small Arms Action Coordination has decided to initiate the development of international standards for small arms control, similar to those developed for mine clearance and disarmament, demobilization and reintegration. ."	1
"e) Allow the establishment of newspapers and other independent media; allow citizens free access to the Internet, social media, international communications, foreign broadcasts and publications, including popular culture from other countries, and end compulsory participation in mass organizations and indoctrination sessions."	1
"Rather than encouraging progress, unrealistic expectations could reinforce a sense of stagnation in society."	0
"S/1994/230, of February 28, 1994"	0
"Adopted statements by the President on children and armed conflict (S/PRST/2002/12), East Timor (S/PRST/2002/13), the elections in Sierra Leone (S/PRST/2002/14), the admission of new members (S/PRST/2002/15), Kosovo (S/PRST/2002/16), the Democratic Republic of the Congo (S/PRST/2002/17) and UNDOF (S/PRST/2002/18 )."	1
"The percentage of minority representatives in the Service is 17% and female representation is 22%."	1
"The sentence is expected to be handed down in December 2010."	0
"1. Ingots or bars having a size of 100 mm or more in each dimension;"	0
"Entities affiliated with Al-Qaida are evolving, often autonomously, with evident changes of a generational, geographic, ethnic, structural and operational nature."	0
"The provisions of the Law also apply to foreigners."	0
"50. Recalls its decision that when the proposing State submits a request for exclusion, the obligation on States to take the measures described in paragraph 1 of the present resolution shall be waived with respect to the person, group, enterprise or entity of which is dealt with after 60 days unless the Committee decides by consensus, before the end of that 60-day period, that the measures remain in force with respect to that person, group, company or entity, it being understood that, in cases where If there is no consensus, the President, at the request of a Member of the Committee, will submit to the Security Council the question of whether the name of that person, group, company or entity should be excluded from the List, for a decision on the matter. a period of 60 days, and it is also understood that, in this case, the obligation for States to adopt the measures described in paragraph 1 of this resolution will continue during that period in relation to the person, group, company or entity of to be dealt with until the Security Council takes a decision on the matter;"	1
"Pacific did not respond to the official Article 15 notification."	0
"Decides to establish an international court with the exclusive purpose of prosecuting those allegedly responsible for serious violations of international humanitarian law committed in the territory of [affected State] between [dates]."	1
"The other two States enacted counter-terrorism laws more than five years ago, but do not report on related investigations or trials."	1
"Council members encouraged the Burundi authorities to continue their efforts to create the necessary conditions for holding inclusive elections through constructive dialogue, an open political space, an end to politically motivated violence and the fight against impunity, in accordance with resolution 2137 (2014)."	1
"Which will be held on Wednesday, October 26, 2011, at 10:00 a.m."	0
"It defined different measures to be adopted and applied by Member States and established the Counter-Terrorism Committee to verify their application."	1
"22. The situation in Guinea-Bissau (November 6, 1998; December 21, 2011)."	0
"The President noted the continuing concern of some countries regarding the extent of the high-risk zone."	0
"The Counter-Terrorism Committee Executive Directorate will continue to strengthen its role in facilitating technical assistance to implement resolution 1373 (2001) to enhance the capacity of Member States and regions to combat terrorism by addressing their counter-terrorism needs. , in close cooperation with the Counter-Terrorism Implementation Task Force, other United Nations bodies and bilateral and multilateral assistance providers, and will continue to apply the targeted and regional approach to its work."	1
"For his part, Prosecutor Serge Brammertz informed the Working Group about the three main trials (Karadžić, Mladić and Hadžić) and the planned timetable."	0
"Increased accountability for human rights violations, including cases of gender-based violence; creation of legal instruments that take gender issues into account. G.5 Formulation and implementation of gender-sensitive victim support programmes, including legal aid and witness protection programmes."	1
"Cash and time deposits and joint account at the end of the period"	0
"7. The situation in Liberia (January 22, 1991; March 16, 2011)."	0
"IV. Restoration of State authority"	0
"I also take this opportunity to highlight my concern about the issues surrounding the federal and gubernatorial elections to be held in Nigeria in February 2015, and the serious risks of violence resulting from attacks by Boko Haram or challenges to the election results."	0
"25. Again invites the Secretary-General to continue to provide relevant information and analysis on the protection of civilians when he considers that such information or analysis may contribute to the resolution of the issues before him, and requests him to continue to include in the reports submit to the Council on matters before it, where appropriate, comments relating to the protection of civilians in armed conflict, and encourages it to continue to consult and take concrete measures to strengthen the capacity of the United Nations in this regard;"	0
"The Commission also received credible evidence that the ranks of the Janjaweed militias included fighters from neighboring countries, mainly Chad and the Libyan Arab Jamahiriya."	1
"Furthermore, in principle, the establishment of a hierarchical relationship between the Office of the Ombudsman and the Secretariat on substantive matters represents a direct and significant interference with the independence of the Office, in theory and in practice."	0
"Furthermore, according to the ICRC, the cases of 3,476 missing persons from Kosovo remain pending, of whom around 600 are ethnic Serbs and Roma."	0
"According to the Mine Action Service, improvised explosive devices are a particularly dangerous weapon system due to their versatility, adaptability and method of use."	1
"The two parties stressed the importance of embarking on this new phase in collaboration with regional and international partners, whom they invited to endorse and support the initiatives undertaken in line with the objectives established by the international community to preserve the territorial integrity and sovereignty of Mali. and strengthen its national unity."	0
"Currently, expenses for goods and services are lower than what would be expected at this time of year."	0
"That a set of customary norms that regulate internal armed conflicts has evolved in this way in the international community is confirmed by several elements."	1
"The Office has already started dealing with at least seven cases."	1
"There have been reports that women and girls continue to be victims of sexual violence in attacks on their villages, for example during the recent Hamada attack on 13 January 2005, in which several women were raped."	0
"4. Provide services to her; either"	0
"23. Decides that all Member States that have:"	0
"Notes that a series of measures are necessary for the international community to share the burden borne by African States hosting refugees and to contribute to their efforts towards the security and civil and humanitarian character of refugee camps and settlements , including in the areas of law enforcement, the disarmament of armed elements, the suppression of arms trafficking in refugee camps and settlements, the separation between refugees and other persons who are not entitled to the international protection that is granted to refugees or do not need international protection for other reasons, and the demobilization and reintegration of ex-combatants."	1
":: The Committee should ensure that measures taken by States to combat terrorism are in line with their obligations under international law, in particular human rights, refugee and humanitarian law. ."	1
"Beginning on February 1, 2005, customs officials in Abidjan were frequently prevented from boarding ships arriving at port for inspection."	0
"Zefirzada, Russian radio and television channel; Fedor Ivanich, journalist, January 23, 2012"	0
"All States in the subregion have launched financial intelligence units, although some are still working to increase their capabilities."	1
"Article 21, paragraph 2, of the annex to Security Council resolution 1757 (2007) states that if the Special Court has not completed its activities at the end of its current mandate, \"the Agreement shall be extended to enable it to complete its work.\" within the period or periods determined by the Secretary-General in consultation with the Government [of Lebanon] and the Security Council.\""	0
"b) Usable in the systems included in article 1.A or 19.A.1."	0
"In November, the All Sources Fusion Unit began construction work to establish a subunit in the new Timbuktu camp."	1
"The issue of the full deployment of the civilian police component of UNOMIG, in accordance with the decision taken by the Security Council, remains unresolved."	1
"However, it is no surprise to anyone that this issue has a history with which we are all well acquainted."	0
"2. India-Pakistan Question (see S/7382)."	0
"Together, we will work to ensure that one day Iraqi forces can assume full responsibility for maintaining security and stability in Iraq."	1
"For example, the sensitive issue of population identification is a long-term process that will continue after the elections, as will the reintegration of ex-combatants, security sector reform, land tenure issues, the promotion of appropriate economic governance, the protection of human rights, recovery from the trauma of the conflict and addressing the root causes of the crisis."	1
"Progress can be hampered if international actors have divergent objectives, parallel initiatives emerge, and countries in the region support non-signatory movements, thereby undermining attempts to persuade movements to join the peace process."	0
"The newly established Mine Action Coordination Center seeks to improve information on and response to mine contamination, increase the safety of United Nations personnel in the field and provide technical and material support to programs of mine-related activities carried out in Western Sahara."	1
"They said they were interahamwes."	0
"In 45 countries in sub-Saharan Africa, UNESCO produced an overview map of existing policies and resources to describe how a culture of peace is fostered."	1
"They called upon Member States to contribute to the United Nations unified call for Somalia and all parties and armed groups in Somalia to ensure full, secure and unlimited access for the prompt delivery of humanitarian assistance."	1
"The United Nations Joint Human Rights Office continues to investigate alleged violations of human rights and international humanitarian law by both armed groups and national security forces."	1
"The execrable terrorist plan was completed on the morning of March 18 with another bomb attack in Aleppo. Takfiri terrorists, and those who back them, support them and openly supply them with money and weapons, continue to carry out terrorist operations as part of the conspiracy directed against the Syrian Arab Republic, its people and its institutions."	0
":: States are encouraged to compare the fingerprints of restricted versions of broadcasts with their police database to check whether they match those in their own system (section VI.C, para. 80)"	1
"A pilot demobilization project is expected to begin in January 2001."	0
"The effective functioning of the Tribunal is an essential requirement to end the climate of impunity that continues to prevail in Darfur."	1
"It is unacceptable and also contravenes the publicly declared ban on landmines by anti-government forces."	0
"All States are parties to the Convention on the Financing of Terrorism, have enacted laws relating to money laundering and combating the financing of terrorism and have established financial intelligence units registered with the Egmont Group."	1
"The Council should integrate emerging good practices in countering violent extremism at the heart of its response to the threat posed by foreign terrorist fighters and encourage the dedication of resources to such efforts."	1
"Good proof of this is the Committee in charge of the implementation of the agreement, which cannot yet establish its headquarters in Bujumbura for this reason."	0
"2. Southern region: 119 air raids were carried out, at speeds of 720 to 780 kilometers per hour and at an altitude of 9,000 to 13,000 meters, as specified below:"	0
"Document: investigation order issued by the first investigative judge of the Beirut Military Court No. 23/2005, dated February 14, 2005."	1
"In the joint statement, the Government committed to lifting access restrictions for all humanitarian work in Darfur and to removing various obstacles that prevented it from being carried out."	1
"Resolution 32/2003, CITMA, Article 32 f"	0
"Within the military, reports and other communications flow up and down the chain of command, as they do in most conventional armed forces."	1
"Mr. AurÃ©lien Llorca, France (armed groups);"	0
"The European Union is deeply concerned about the cycle of vicious violence currently taking place in Israel and the occupied territories."	0
"Now that the logistical and organizational aspects of the search for missing persons have apparently been determined, the goal of finding and identifying the victims and ultimately closing their cases becomes an imperative task."	1
"Also condemning in the strongest terms the incitement to commit acts of terrorism and repudiating attempts to justify or glorify (apology) acts of terrorism that may incite the commission of new acts of terrorism,"	0
"Approximately 15 months after the National Assembly enacted the legislative framework, the parties have not made any progress in establishing the National Human Rights Commission."	0
"Law Enforcement Agencies: Establishment of Counter-Terrorism Units"	1
"In resolution 1425 (2002), it established a Group of Experts on Somalia, which was followed by the Monitoring Group established pursuant to resolution 1519 (2003)."	1
":: Individualize limited and suspicious operations, carried out or to be carried out, as well as the financing sources used by the client for such operations;"	0
"The indication they give to their followers is to attack where they can and when they can."	0
"Although in most cases the PNTL files identify the last known person who indicated with his or her signature that he or she received each of these weapons, the custom of transferring weapons without written orders or chain of custody documentation makes this impossible. determine where the weapons are currently located."	0
