"es_en_DEEP"	"MatCoop"
"States that participated in the review subsequently had three months to provide any identifying or other information related to the listing, such as updates on the operational status of listed entities or transfer, imprisonment or death. of the people included in the List, as well as the new charges brought against them in relation to terrorist acts."	1
"Despite strict legal and operational controls, artisans and family businesses manufacturing small arms and light weapons continue to exist throughout the region."	0
"In order to recognize the specific need to coordinate its work with that of the Counter-Terrorism Committee Executive Directorate and other relevant bodies in areas where States may be overwhelmed by requests for information from the Security Council, the Team developed a common strategy with the Executive Directorate and the experts supporting the Committee established pursuant to resolution 1540 (2004), with the objective of resolving the problems of States that have not yet submitted the reports requested by the three Committees."	0
"Since then, two important events have occurred, namely the transfer, on October 31, 2009, of the eight detainees sentenced to date by the Tribunal to Rwanda, where they will serve their sentences, and the transfer, on November 16, 2009 , from the administration of the Tribunal's detention facilities to the Government of Sierra Leone."	1
"Next, he verified the seals of the machinery subject to the permanent surveillance and verification regime."	0
"The Register has therefore become an instrument directly relevant to the work of the Security Council and the General Assembly on small arms and light weapons."	1
"Yemen has ratified nine international instruments, namely:"	0
"Office of the Wali of Western Darfur"	0
"The Security Council encourages relevant United Nations bodies, in particular the Counter-Terrorism Committee Executive Directorate, to focus further attention on towards resolution 1624 (2005) in its dialogue with Member States to develop, in accordance with their obligations under international law, strategies that include measures against incitement to commit acts of terrorism motivated by extremism and intolerance, and in providing technical assistance for their implementation."	0
"Examining the pattern of damage it is evident that it was a charge of high explosives."	1
"In its long history, Ethiopia has never invaded any country to annex other people's territories."	0
"The secretariat was composed of criminal investigators, human rights observers, legal advisers, a political adviser, a military sector reform expert, a police sector reform expert, a data management officer, security officers and other administrative support staff."	1
"In view of the prevailing situation, I believe that MINURSO continues to play an important role in stabilizing and monitoring the ceasefire on the ground, and I recommend that its mandate be extended for a further period of six months, until April 30. of 2006."	0
"1540 Committee experts held discussions with the United Nations Interregional Crime and Justice Research Institute (UNICRI) and the United Nations Disarmament Research Institute (UNIDIR) on possible programs and activities to support effective implementation of resolution 1540 (2004)."	0
"The trucks carrying the Government soldiers were later used to transport loot looted in the village."	1
"3. Emphasizes the need to strengthen coordination and exchange of information between the Committee established pursuant to resolution 1267 (1999) (hereinafter referred to as \"the Committee\") and the Committee established pursuant to resolution 1373 (2001). );"	0
"1.16 India is issuing new identity cards."	0
"THEY INDICATE THE MATTERS SUBMITTED TO THE SECURITY COUNCIL"	0
"The Deputy Foreign Minister of Afghanistan said it had been a year of important milestones, but the achievements had come at a cost, highlighting that terrorism remained a serious threat."	0
"Significant progress was also made in establishing operational municipal assemblies. On November 11, more than 800 members of the new assemblies were sworn in."	1
"This fragmented control of the Somali maritime environment has created or promoted three important sources of income for local administrations: a) the commercial export from Somalia of a large quantity of charcoal, among other products, b) unimpeded access by foreign fishing vessels to Somali marine and fishing resources and c) widespread acts of piracy. Charcoal"	0
"Although the training of FARDC and PNC units remains essential, any training program for the FARDC should be linked to the establishment of an army supply chain to ensure the sustainability of the efforts and investments made."	1
"The Group investigated the supply chain for the delivery of these vehicles to establish whether participants had prior knowledge that the end user would be the Ivorian Ministry of Defence."	1
"1. Expresses its determination to take appropriate measures to further develop cooperation between the United Nations and regional and subregional organizations in the maintenance of international peace and security, in accordance with Chapter VIII of the Charter of the United Nations, and invites regional and subregional organizations with conflict prevention or peacekeeping capabilities to incorporate these capabilities into the United Nations system of standby forces, services and equipment;"	1
"Application for visas and other travel documents"	0
"Access to the Abyei area will be significantly obstructed during the upcoming rainy season as both the Wan to Abyei and Kadugli to Abyei routes are routinely closed due to heavy seasonal rains."	0
"5. Also requests the Secretary-General, in accordance with paragraph 6 of resolution 1980 (2011), to keep you informed, no later than 30 June 2011, in the final report referred to in paragraph 2 of the present resolution and subsequently in its subsequent reports relating to ONUCI and UNMIL, of the developments, measures taken and the coordination work between ONUCI and UNMIL carried out in order to assist the Governments of CÃ´te d'Ivoire and Liberia, respectively , to monitor its border and surrounding areas, including how redeployed military personnel and equipment contribute to this, paying particular attention to any movement of combatants or transfers of weapons across the border, and, In this regard, encourages UNOCI and UNMIL, within their respective mandates, capacities and areas of deployment, to assist, in collaboration with the Governments of CÃ´te d'Ivoire and Liberia respectively, to disarm those who endanger danger to national reconciliation and peacebuilding;"	1
"The Group also estimated that GPIC could have saved variable production costs of $276,340 (based on variable costs of $17.73 per ton) for ammonia and $16,124 (based on variable costs of $20.08 per ton) for methanol."	0
"The creation of mixed courts, which have the possibility of recourse to the national legal system, would cause serious problems, in particular with respect to the Sudanese criminal procedure code of 1991."	1
"The Mitsubishi Canter pickup truck used to transport the bomb entered Lebanon from Syria via the Bekaa border, using a lane reserved for military traffic, on 21 January 2005 at 13:20. It was driven by a Syrian colonel from the 10th Army Division."	0
"The effectiveness of counter-crime units continues to be significantly hampered by resource constraints, despite the co-location of a United Nations Transnational Organized Crime Police Cell with its counterparts in Mali."	0
"The mechanism concluded that one of the effects of the sanctions applied to the diamond trade is the production of more complex forged or fraudulent documents to hide the origin of the diamonds."	0
"The Afghan authorities and the international community must clearly state that such behavior is unacceptable."	0
"Effectively responding to the problems faced by refugee and internally displaced women requires a holistic approach that combines prevention strategies, responses and solutions."	1
"First, although Sierra Leone is the most advanced member of the West African Coast Initiative, the slow pace of progress elsewhere is impeding data sharing and early warning."	0
"Furthermore, the Council itself has set important precedents, notably the establishment of commissions of inquiry on Bosnia, Rwanda and Darfur, which paved the way for the international tribunals for the former Yugoslavia and Rwanda in 1993 and 1994, respectively, and the referral of the situation in Darfur to the International Criminal Court in 2005."	1
"Under the overall guidance of Mission Headquarters, the heads of MONUC regional offices are responsible for developing and implementing regional action plans to prevent sexual exploitation and abuse in their respective areas."	1
"A Group of Experts established pursuant to resolution 1929 (2010) operates under the direction of the Committee and helps it fulfill its mandate."	1
"Negotiations are underway with other countries to sign a memorandum of understanding, including Canada, Colombia, Japan, Malaysia and Panama."	0
"It demands that Israel, the occupying Power, comply with all the rules of international law and the provisions of the Geneva Conventions and international humanitarian law, in addition to the relevant resolutions of the Security Council and the General Assembly."	0
"Underlining the need to intensify the fight against terrorism at the national level and to strengthen, under the auspices of the United Nations, effective international cooperation in this field based on respect for the principles of the Charter of the United Nations and the norms of international law, including respect for international humanitarian and human rights law,"	1
"- On December 12, 2014, 200 troops of the regime forces surrounded the Fayd neighborhood located in the city of Jabla and prohibited all entries and exits."	0
"As called for in the current programme of work, the work to advance universal reporting continued at the bilateral level, with the missions in New York of States that have not yet submitted a report to the Committee, and within the framework of regional opportunities and other events."	1
"In paragraph 19 of my report of 30 August 2004 (A/2004/703), I noted that \"the disarmament of members of the People's Defense Forces had already begun. The second joint verification mission observed a demobilization ceremony of some 300 soldiers in Western Darfur."	0
"Depending on the case, the subjective element required by international law is knowledge (that crimes are being committed or are going to be committed) and intention (the desire or will not to intervene) or, at a minimum, recklessness (the awareness that if the actions of subordinates are not prevented, certain harmful consequences may occur and, even so, dismiss that risk)."	0
":: Amendment to the Convention on the Physical Protection of Nuclear Materials (Vienna, 2005)"	0
"Four States have established specialized counter-terrorism units and three have adopted measures to that end."	0
"Once the Committee approves the revised plan, the Directorate will have as its priority the task of initiating the new structure of the groups and units and beginning the task of establishing criteria and harmonizing judgments throughout the scope of the Directorate's work."	1
"The Security Council recognizes the need for systematic monitoring and reporting on progress made in the protection of civilians in armed conflict."	0
"Any tendency towards radicalization in educational institutions would be the responsibility of the Ministry of Education."	1
"In an effort to contain the Ebola outbreak, some West African countries closed their borders and suspended commercial flights to the three most affected states: Guinea, Liberia and Sierra Leone. CÃ´te d'Ivoire restricted flights to and from the three States on 10 August, followed by a closure of land borders on 22 August."	1
"5. The situation in Timor-Leste (December 15, 1975; February 24, 2011)."	0
"Progress on President Kabila's request for the Mission to assist in the training, equipping and quartering of 20 police units, or the equipping of 3 military police battalions, is limited due to the lack of complementary support from donors to provide the necessary basic equipment (see my report of 30 March 2010 (S/2010/164))."	1
"Complex criminal investigations are being carried out regarding piracy and criminal networks involved in piracy activities, focusing in particular on the leaders, financiers and organizers of such activities."	1
"In contexts where national judicial systems lack capacity and are still undermined by conflict, ad hoc quasi-judicial mechanisms appear to be an appropriate, if not necessary, solution to impartially address an influx of conflict-related claims and provide people access to certain forms of compensation."	1
"UNODC and the Organization for Security and Cooperation in Europe (OSCE) jointly organized a regional expert seminar on the implementation of universal legal instruments against terrorism as a means of enhancing cooperation in combating terrorism in the basin. Mediterranean, which was held in Malaga (Spain) in September 2013."	1
"Acting under Chapter VII of the Charter of the United Nations,"	0
"The Team reports on the progress made by the international community to limit the movement of terrorists and their supporters, including the recent joint initiative by Interpol and the Security Council that resulted in the issuance of an international advisory, with identity data, descriptions, photographs and fingerprints of the people included in the consolidated list."	1
"It is clear that the Commission may not be in a position to carry out these functions if it has not previously determined a) whether the transgressions constitute international crimes and, if so, b) to what categories of crimes they correspond (war crimes, crimes against humanity , genocide or other crimes)."	0
"Rwanda Democratic Liberation Forces"	0
"UNIFIL's freedom of movement and the security of its personnel are essential to the effective implementation of the Force's mandate."	1
"Furthermore, article 75 (3) provides that the Court, before making a reparation decision, will take into account the observations made by the convicted person, the victims, other persons or States that have an interest, or those made on their behalf."	1
"In July 2010, Angola passed laws to establish preventive and restrictive measures against money laundering and terrorist financing. Furthermore, on April 15, 2010, it formally requested to join the Eastern and Southern Africa Anti-Money Laundering Group."	1
"A separate website for the Office of the Ombudsman was created (www.un.org/en/sc/ombudsperson). The site contains essential information on the operations of the Office, including a description of the procedure followed for considering delisting requests and general information on the content of requests submitted to the Ombudsman."	1
"B. Preservation of the crime scene"	1
"2. The situation in the Middle East."	0
"In its resolution 2128 (2013), the Council modified the notification requirements related to the arms embargo, deciding that the primary responsibility would be placed on the Liberian authorities to notify the Committee at least five days in advance of any shipment of supplies of deadly weapons and related material, and any provision of assistance, advice or training related to military or other security sector activities to the Government of Liberia."	1
"Criminal use of the Internet."	0
"Welcoming the adoption by the General Assembly of the United Nations Global Counter-Terrorism Strategy (A/RES/60/288) on 8 September 2006 and the establishment of the Counter-Terrorism Implementation Task Force to ensure overall coordination and coherence of counter-terrorism activities of the United Nations system,"	1
"It states that this documentation was transported from the project site in Al-Kazak to Baghdad, which is a distance of about 400 km."	0
"Reaffirms that all parties to the conflict have the obligation to observe international humanitarian law and, in particular, the Geneva Conventions of 12 August 1949, and that persons who commit or order serious breaches of the Conventions are responsible for such individual violations."	0
"The advantage of the Team is the possibility of collaborating with governments around the world and contacting external specialists, to make an integrated assessment of the threat posed by Al-Qaida and its affiliated groups, and to promote a targeted sanctions regime. efficient and fair."	1
"As of January 17, the Ministry had analyzed and validated 128 of a total of 140 municipal budgets."	0
"That State stated that cooperation between government and civil society was an essential part of efforts to prevent people from resorting to terrorism and noted that it was increasing its efforts to detect and investigate hate speech on the Internet."	1
"In accordance with paragraph 32 of this resolution, the Monitoring Team will work under the direction of the Committee established pursuant to resolution 1267 (1999) and will perform the following functions:"	1
"Although the Comprehensive Peace Agreement and the Agreement on Supervision of the Management of Arms and Armies contained provisions for the dissolution of the militia linked to the Maoist army, neither of them proposed detailed plans in this regard."	1
"h) Submit, through the Committee, a mid-term report within 90 days following its establishment;"	0
"Idlib :: On November 6, 2014, Syrian regime warplanes attacked the town of Mouqa with a missile, killing five people, including a girl and two women, and damaging residential buildings."	0
"He issued letters rogatory and stipulated the measures to be taken, especially to preserve the scene of the crime."	1
"Governments play the primary role in ensuring the security of military arsenals or preventing leaks from official procurement channels."	1
"The bill, which will be presented to Parliament, establishes that a minimum of 30% of parliamentary seats must be reserved for women; that one district in each constituency at the local council level should be awarded to female candidates and that political parties should allocate \"safe\" seats for female candidates."	1
"Attempts continued to have minorities generally represented on the staff of administrative departments."	1
"A. Overview Listed Al-Qaida and Taliban-linked groups continue to raise funds through legal means, such as donations and legitimate business activities, as well as illegally through ransom kidnappings, extortion, trafficking of drugs and the imposition of illegal taxes."	0
"a Approximate schematic plan of the cascade process pavilion located at the uranium enrichment centrifuge facility (Building 4) in Yongbyon, as of November 12, 2010."	0
"I have the honour to inform you that, in your capacity as President of the Security Council for the month of August, the United Kingdom has planned to hold a briefing on 19 August, World Humanitarian Day. The meeting will focus on the protection of humanitarian workers, under the agenda item on the protection of civilians in armed conflict."	0
"The Mission has reassessed its operational commitments in light of the limited reinforcements authorized by the resolution."	0
"All evidence confirms Luberef's claim that payments had been made."	0
"I welcome the efforts made by Governments to contain the virus."	0
"Both Niger and Guinea deposited their instruments of ratification, bringing the number of West African countries to five that have ratified the instrument."	0
"As the Secretary-General observed, in many conflicts, the lack of accountability and, even worse, the fact that in many cases it is not even expected to happen, is what largely allows them to multiply. human rights violations."	0
"Progress has also been made in the exchange of information on such individuals - especially through the International Criminal Police Organization (INTERPOL) - as well as in cooperation on border security."	1
"2. The goals of the study program for each school subject;"	0
"b) Continue to work in close coordination and cooperation with INTERPOL and States and donor organizations to provide technical assistance to develop the capacities of law enforcement agencies and provide equipment and facilities to States in need;"	1
"In its resolution 1783 (2007), the Security Council requested the Secretary-General to continue taking the necessary measures to ensure that MINURSO fully implements the United Nations policy of zero tolerance for sexual exploitation and abuse."	0
"2. For the second time, when it is not a minor;"	0
"Which will be held on Friday, February 15, 2013, at 2:45 p.m."	0
":: Measures to ensure the protection and respect of the human rights of women and girls, particularly in relation to the constitution, the electoral system, the police and the judicial system."	1
"2. Decides that the Counter-Terrorism Committee Executive Directorate will continue to function as a special political mission, with the policy guidance of the Counter-Terrorism Committee, for the period ending 31 December 2017, and also decides to conduct an interim review before from December 31, 2015;"	1
"1. Unequivocally condemns all terrorist acts, methods and practices as criminal and unjustifiable, regardless of their motivation and wherever and by whomever they are committed, in all their forms and manifestations, in particular those that may represent a threat to peace and international security;"	0
"There had been numerous contacts with the Government of Morocco, which, before agreeing to the resumption of shuttle diplomacy activities, had requested a meeting to clarify issues relating to the Secretary-General's most recent report (S/2014/258) and believed that this would allow the process to move forward in the best possible way."	0
"In order to facilitate the mobilization and coordination of financial assistance in support of the implementation of the processes envisaged in the Ouagadougou Agreement, the United Nations Development Program has established two trust funds: the first, in support of the recovery programs, has received contributions worth $8.4 million and has pledged another $12.4 million."	1
"Furthermore, provisions suspending obligations under the Covenant must not entail any discrimination based on race, color, sex, language, religion, or social origin."	1
"In their interventions, Member States noted that terrorism was one of the most serious threats to international peace and security and that a coordinated and sustained effort was needed to defeat it."	0
"In accordance with the Commission's mandate, the report sets out the facts and circumstances related to the incidents that occurred on April 28 and 29, and May 23, 24 and 25, as well as other related events or problems that led to the crisis; Responsibility for such events is clarified and accountability measures are recommended."	1
"Welcoming the establishment of the Office of the Ombudsman pursuant to resolution 1904 (2009) and the extension of its mandate by resolution 1989 (2011), noting the important contribution made by the Office of the Ombudsman to ensuring greater impartiality and transparency, recalling the strong commitment of the Security Council to ensuring that the Office of the Ombudsman can continue to perform its role effectively, in accordance with its mandate, and recalling also the statement of its President (S/PRST/2011/5) of 28 February 2011,"	1
"c) Encourage States to adopt appropriate measures to protect non-profit organizations from being used for the financing of terrorism."	1
"From July 3 to 8, MINUSTAH organized a training course on \"Women and Leadership\" for potential candidates for the upcoming elections. On August 25, MINUSTAH, in collaboration with a local non-governmental organization, began broadcasting a weekly radio program aimed at raising awareness among both female candidates and voters."	1
"Promotional activities have also been carried out with civil society and private companies, emphasizing the role it plays in the fight against terrorism, as well as the possible provision of technical assistance."	0
"The prison has been built to provide humane and safe detention conditions in line with international human rights standards."	1
"Tajikistan established the Department of Financial Supervision (its financial intelligence unit) in October 2009 and prepared a new draft law against money laundering and terrorist financing in November 2010."	1
"However, the country continues to face challenges in its quest for stability and development, including the security situation, worsening humanitarian situation, challenges in the areas of rule of law and human rights. human rights and the incessant violence that has caused the death of civilians, which continues to increase."	0
"For the purposes of the fourth task, the Commission considered it necessary to make a preliminary determination of the extent to which the Sudanese criminal justice system had been able and willing to pursue and bring to justice alleged perpetrators of international crimes committed in Darfur. to this, to then examine the various international mechanisms that exist."	1
